timestamp,views,likes,retweets,replies,hasImages,keywords,tweetUrl,text,translated_text
2026-07-03T01:19:31.000+08:00,1512,17,2,1,yes,"denza performing; d9 looks; z9gt remains; sedan sales; competitive spaces","https://x.com/tphuang/status/2072731909382107579","Individual models show that Denza is performing well among some of the most lucrative & competitive spaces.  D9 looks to have regained its position bw NEV MPVs while Z9GT remains to be luxury GT & sedan sales champion 3 months in a row.  Even N8L & N9 are doing quite well in ASP","Individual models show that Denza is performing well among some of the most lucrative & competitive spaces.  D9 looks to have regained its position bw NEV MPVs while Z9GT remains to be luxury GT & sedan sales champion 3 months in a row.  Even N8L & N9 are doing quite well in ASP"
2026-07-02T21:57:46.000+08:00,1477,17,,,yes,"intel; mkt bev; priced competitively; flash charging; car size; phev models","https://x.com/tphuang/status/2072681137521004613","I think it's priced very competitively for a car of this size & spec. It leads the mkt in BEV range & both BEV/PHEV models have flash charging support.  Also come out w/ DidiClaw for AI cockpit & intelligent button/control, very spacious, double layer glass for NVM & AEB","I think it's priced very competitively for a car of this size & spec. It leads the mkt in BEV range & both BEV/PHEV models have flash charging support.  Also come out w/ DidiClaw for AI cockpit & intelligent button/control, very spacious, double layer glass for NVM & AEB"
2026-07-02T18:39:56.000+08:00,3698,37,6,1,yes,"byd sales; family yuan; px war; 47624 dolphin; seagull smaller","https://x.com/tphuang/status/2072631349551210732","BYD Sales breakdown & News in 2026/6: Best selling family was Yuan @ 72546, followed by Song @ 53653. Sea lion 47624 & Dolphin 34528  As BYD has not participated in px war as much, you can see its Qin, Seagull & smaller Seal sales really drop. It is doing much better w/ higher","BYD Sales breakdown & News in 2026/6: Best selling family was Yuan @ 72546, followed by Song @ 53653. Sea lion 47624 & Dolphin 34528  As BYD has not participated in px war as much, you can see its Qin, Seagull & smaller Seal sales really drop. It is doing much better w/ higher"
2026-07-02T18:34:10.000+08:00,7694,49,10,1,yes,"intel; transport ship; inland electric; 12 lithium; 98m long","https://x.com/tphuang/status/2072629898796061013","World's 1st inland electric transport ship 葛洲坝 has completed intelligent functionality testing.  129.98m long, 22m wide & 7.7m deep w/ 13700t displacement. it Uses 12 Lithium battery containers for 24 MWh of battery. Can save 617.5t oil/yr & achieve 500km range. Each swap","World's 1st inland electric transport ship 葛洲坝 has completed intelligent functionality testing.  129.98m long, 22m wide & 7.7m deep w/ 13700t displacement. it Uses 12 Lithium battery containers for 24 MWh of battery. Can save 617.5t oil/yr & achieve 500km range. Each swap"
2026-07-02T06:45:37.000+08:00,20240,109,20,3,yes,"supply chain; chinese producers; pcbs advancement; dielectric class; road electronic; nikkei article","https://x.com/tphuang/status/2072451587981615143","Nikkei has an article about Chinese producers making in-road w/ electronic grade/low-dielectric class used in high end PCBs & also advancement in CCL. Note that the entire high-end PCB supply chain right now is seeing a lot of investment due to this AI gravy train.  Japan has","Nikkei has an article about Chinese producers making in-road w/ electronic grade/low-dielectric class used in high end PCBs & also advancement in CCL. Note that the entire high-end PCB supply chain right now is seeing a lot of investment due to this AI gravy train.  Japan has"
2026-07-02T09:47:04.000+08:00,6456,52,12,1,yes,"glass pcb; m10 needs; produce quartz; fiber china","https://x.com/tphuang/status/2072497249280548908","Also, the next step up from low-dielectric glass for PCB is electronic-grade Q-glass. I think this is what M10 needs  Feilihua is the big player here in China. They are the 1st to mass produce Quartz fiber in China. Other players getting in a Yishitong & Tongling Quartz.  But as","Also, the next step up from low-dielectric glass for PCB is electronic-grade Q-glass. I think this is what M10 needs  Feilihua is the big player here in China. They are the 1st to mass produce Quartz fiber in China. Other players getting in a Yishitong & Tongling Quartz.  But as"
2026-07-02T08:43:11.000+08:00,4641,25,,3,yes,"pros vcsel; inp laser; 850nm wavelength","https://x.com/tphuang/status/2072481174417473798","Pros of VCSEL: Low cost, less power & Uses mature GaA tech (so no InP laser iirc) Cons: This 1.6 SR8 product by FiberHome has just 30m range @ 200G. There are limitations to this tech & the 850nm wavelength. Industry is looking to expand this to 100m, but who knows how long that","Pros of VCSEL: Low cost, less power & Uses mature GaA tech (so no InP laser iirc) Cons: This 1.6 SR8 product by FiberHome has just 30m range @ 200G. There are limitations to this tech & the 850nm wavelength. Industry is looking to expand this to 100m, but who knows how long that"
2026-07-02T06:45:38.000+08:00,2322,20,2,2,yes,"ccls shengyi; recently nanya; m7 possibly; used pcbs","https://x.com/tphuang/status/2072451593572593782","Recently, Nanya just announced another huge expansion for M7 & possibly M8/9 grade CCLs. They & Shengyi are the leaders in China for high end CCL used in PCBs.  The story is like this across the board where Chinese suppliers are improving fast, but still have low mkt share due to","Recently, Nanya just announced another huge expansion for M7 & possibly M8/9 grade CCLs. They & Shengyi are the leaders in China for high end CCL used in PCBs.  The story is like this across the board where Chinese suppliers are improving fast, but still have low mkt share due to"
2026-07-02T06:45:39.000+08:00,1875,20,4,,no,"supply chain; photoresist china; export krf; japanese stopping","https://x.com/tphuang/status/2072451597502726272","But of all the supply chain risks, the biggest one might be photoresist. Many stories online now of Japanese stopping export of Krf/Arf photoresist to China. Remains to be seen how much this affects things. I will have to explore photoresist at a later point.","But of all the supply chain risks, the biggest one might be photoresist. Many stories online now of Japanese stopping export of Krf/Arf photoresist to China. Remains to be seen how much this affects things. I will have to explore photoresist at a later point."
2026-07-02T04:40:17.000+08:00,3411,39,6,1,yes,"nev sales; record yr; table june; 103k leapmotor; climb byd","https://x.com/tphuang/status/2072420046496842148","NEV sales table for June & 1st half of the yr: BYD @ top w/ 397k followed by Geely 161k, Chery 103k, Leapmotor 93k, HIMA 50.6k, NIO 40.6k & XPeng 40k.  You can see the climb from BYD in this 1st to now being above its 2025 sales levels. Should set a new record this yr after a","NEV sales table for June & 1st half of the yr: BYD @ top w/ 397k followed by Geely 161k, Chery 103k, Leapmotor 93k, HIMA 50.6k, NIO 40.6k & XPeng 40k.  You can see the climb from BYD in this 1st to now being above its 2025 sales levels. Should set a new record this yr after a"
2026-07-01T06:47:34.000+08:00,8516,63,10,3,yes,"swe tasks; glm; generate test; data code; errors prompting","https://x.com/tphuang/status/2072089692661535057","This is why I like GLM's approach. For SWE tasks, it gives me step by step explanation of what it's doing, it does compiling for me and do test runs and generate test data so that its code has a good chance of working straight out of the box.  I get more errors when prompting","This is why I like GLM's approach. For SWE tasks, it gives me step by step explanation of what it's doing, it does compiling for me and do test runs and generate test data so that its code has a good chance of working straight out of the box.  I get more errors when prompting"
2026-07-02T01:22:13.000+08:00,1982,13,1,,no,"zcode glm; edit file; open editor; devs option; use tokens","https://x.com/tphuang/status/2072370202046542249","I'm a big fan of ZCode & GLM overall, but  @Zai_org  , can you at least give devs the option to edit the file rather than open up another editor to do so? Sometimes, I just need to change something really simple. I don't want to use tokens for that.","I'm a big fan of ZCode & GLM overall, but  @Zai_org  , can you at least give devs the option to edit the file rather than open up another editor to do so? Sometimes, I just need to change something really simple. I don't want to use tokens for that."
2026-07-02T01:19:23.000+08:00,3050,38,2,2,yes,"leapmotor actually; growing china; sales figures; 50624 z7","https://x.com/tphuang/status/2072369490617127146","More June sales figures: Leapmotor hit all time high of 83376, up 95% YoY HIMA is up to 50624 (w/ Z7 going over 10k), accumulated up 18.6% YoY XPeng was 40126 & Li Auto 30895  It seems like Leapmotor is the only one actually growing in China & they are doing that thru some very","More June sales figures: Leapmotor hit all time high of 83376, up 95% YoY HIMA is up to 50624 (w/ Z7 going over 10k), accumulated up 18.6% YoY XPeng was 40126 & Li Auto 30895  It seems like Leapmotor is the only one actually growing in China & they are doing that thru some very"
2026-07-01T23:03:36.000+08:00,8263,106,13,12,yes,"turkey plant; byd eu; countries reduce; factory plans; burners decide","https://x.com/tphuang/status/2072335316514410948","Update on BYD's EU factory plans: As expected, Turkey plant is in the back burners while they decide bw France & Spain. I said back in 2023 that they should've picked at least 1 of 4 big EU countries to reduce political pressure, but they went ahead w/ Hungary & then Turkey.  At","Update on BYD's EU factory plans: As expected, Turkey plant is in the back burners while they decide bw France & Spain. I said back in 2023 that they should've picked at least 1 of 4 big EU countries to reduce political pressure, but they went ahead w/ Hungary & then Turkey.  At"
2026-07-01T21:02:25.000+08:00,3302,40,4,2,yes,"sales geely; 191k export; chery; 102k galaxy","https://x.com/tphuang/status/2072304819495133386","Chery & Geely also reported on their June sales.  Both up slightly. Chery continues to do well with 191k export, making up most of its 256k sales. Geely is more dependent on its domestic sales, but also saw huge growth in export from 40k to 102k. Galaxy continues to grow while","Chery & Geely also reported on their June sales.  Both up slightly. Chery continues to do well with 191k export, making up most of its 256k sales. Geely is more dependent on its domestic sales, but also saw huge growth in export from 40k to 102k. Galaxy continues to grow while"
2026-07-01T19:24:55.000+08:00,4463,62,8,4,yes,"byd sold; yangwang fcb; denza 20352; flash charging; 3607 deliveries","https://x.com/tphuang/status/2072280285090054310","BYD sold > 400k in June including 397k passenger vehicles. (up 5.5% YoY) Higher end brand continue to do better with FangChengBao seeing 3607 deliveries & Denza 20352 + 470 for YangWang  FCB is most interesting. Its head reported that Tai-3 flash charging version has finally","BYD sold > 400k in June including 397k passenger vehicles. (up 5.5% YoY) Higher end brand continue to do better with FangChengBao seeing 3607 deliveries & Denza 20352 + 470 for YangWang  FCB is most interesting. Its head reported that Tai-3 flash charging version has finally"
2026-07-01T18:17:50.000+08:00,4102,46,6,1,yes,"aito xiaomi; zeekr 30k; favor m6; delivery range; yoy increases","https://x.com/tphuang/status/2072263401632313739","AITO, Xiaomi, NIO & Zeekr were all over 30k in June.  Zeekr & NIO did the best in YoY increases. AITO delivery profile continues to favor M6 as HIMA family have targeted other brands for new models. NIO hit new high this yr in sales Xiaomi continues steady 30-40k delivery range.","AITO, Xiaomi, NIO & Zeekr were all over 30k in June.  Zeekr & NIO did the best in YoY increases. AITO delivery profile continues to favor M6 as HIMA family have targeted other brands for new models. NIO hit new high this yr in sales Xiaomi continues steady 30-40k delivery range."
2026-06-30T18:33:05.000+08:00,70617,199,43,17,yes,"u1 bionic; robots sale; 8k rmb; proprietary emotional; interactive data","https://x.com/tphuang/status/2071904851437486150","Oh boy, UBTech's U1 bionic robots now on sale. Low end goes for 119.8k RMB & high end version are 880k & 990k RMB.  Uses RK3588 SoC & proprietary emotional AI model trained on Ascend framework. All interactive data encrypted & stored locally.   Will be launched on JD on 7/2 &","Oh boy, UBTech's U1 bionic robots now on sale. Low end goes for 119.8k RMB & high end version are 880k & 990k RMB.  Uses RK3588 SoC & proprietary emotional AI model trained on Ascend framework. All interactive data encrypted & stored locally.   Will be launched on JD on 7/2 &"
2026-07-01T09:19:48.000+08:00,201865,365,33,10,yes,"chip; cpu; tpu; llm; ai chip; tpu cpu; pflops compute; just 600w; cluster 896","https://x.com/tphuang/status/2072127999739089301","中昊芯英 unveils next gen TPU AI chip as part of 泰则 2.0 compute cluster that will have 896 TFLOPS compute per chip (1792 TOPS INT8). Each chip uses just 600W of power.  In a 8 TPU + 2 CPU setup, box will have 7.168 PFLOPS of compute. Natively supports PyTorch, vLLM, SGLang &","中昊芯英 unveils next gen TPU AI chip as part of 泰则 2.0 compute cluster that will have 896 TFLOPS compute per chip (1792 TOPS INT8). Each chip uses just 600W of power.  In a 8 TPU + 2 CPU setup, box will have 7.168 PFLOPS of compute. Natively supports PyTorch, vLLM, SGLang &"
2026-07-01T05:38:38.000+08:00,2831,23,4,,yes,"08 ev; power efficiency; better su; range seal; models smaller","https://x.com/tphuang/status/2072072344680423768","H/T Gemini-Mini comparing power efficiency of Sedans in the 200-300k RMB range.  Seal 08 EV is the new king @ just 11.1kWh per 100km, even better than Su-7 & some other models that are smaller than it. EVs are just continuing to get more efficient. Unbelievable stuff.","H/T Gemini-Mini comparing power efficiency of Sedans in the 200-300k RMB range.  Seal 08 EV is the new king @ just 11.1kWh per 100km, even better than Su-7 & some other models that are smaller than it. EVs are just continuing to get more efficient. Unbelievable stuff."
2026-07-01T04:32:16.000+08:00,4775,40,3,1,yes,"csi 300; china index; 300 stocks; maybe msci","https://x.com/tphuang/status/2072055641804255284","Since it started in 2009, CSI 300 is up from 2140 to 4979 today.  Maybe MSCI China Index should just pick CSI 300 stocks.","Since it started in 2009, CSI 300 is up from 2140 to 4979 today.  Maybe MSCI China Index should just pick CSI 300 stocks."
2026-07-01T04:26:09.000+08:00,17704,55,7,5,yes,"supply chain; ascend atlas; hw does; security makes; non complete","https://x.com/tphuang/status/2072054102910017640","This is a non-complete Ascend/Atlas supply chain that I put together. Important to note is that HW does not use the best suppliers globally. it prioritizes supply chain security & makes sure it can produce a large qty of them so it can assure supply security to customers.  Not","This is a non-complete Ascend/Atlas supply chain that I put together. Important to note is that HW does not use the best suppliers globally. it prioritizes supply chain security & makes sure it can produce a large qty of them so it can assure supply security to customers.  Not"
2026-07-01T02:18:53.000+08:00,2920,32,5,2,yes,"shanghai port; green fuel; bonded lng; centers certification; group building","https://x.com/tphuang/status/2072022072797356436","Shanghai port group is building the green maritime fuel 3 centers: certification, trading & bunkering as it seeks to compete w/ Rotterdam & Singapore on green fuel pricing, certification, volume & trade settlement.  It now has the ability for bonded LNG & green methanol","Shanghai port group is building the green maritime fuel 3 centers: certification, trading & bunkering as it seeks to compete w/ Rotterdam & Singapore on green fuel pricing, certification, volume & trade settlement.  It now has the ability for bonded LNG & green methanol"
2026-07-01T02:06:45.000+08:00,4242,57,10,3,yes,"asteroid defense; ground integrated; cnsa details; warning response","https://x.com/tphuang/status/2072019021340274884","CNSA w/ more details on China's Asteroid Defense System: Space-Ground integrated Monitoring Operational Near-Earth Asteroid Risk Warning System Response techniques: instantaneous (kinetic impactors) & sustained (laser, beams, gravity tractors)","CNSA w/ more details on China's Asteroid Defense System: Space-Ground integrated Monitoring Operational Near-Earth Asteroid Risk Warning System Response techniques: instantaneous (kinetic impactors) & sustained (laser, beams, gravity tractors)"
2026-06-30T22:31:52.000+08:00,7910,164,34,3,yes,"trucks exports; china electrifying; electric dump; 600 kwh","https://x.com/tphuang/status/2071964943444783538","China is electrifying the trucks that it exports. Recently, an Indonesian customer ordered another 100 electric dump trucks after it received the 1st 150.  Each 8x4 truck has 600 kWh battery pack & lowers fuel cost by 48% vs diesel trucks & maintenance cost by 75% per yr.  Huge","China is electrifying the trucks that it exports. Recently, an Indonesian customer ordered another 100 electric dump trucks after it received the 1st 150.  Each 8x4 truck has 600 kWh battery pack & lowers fuel cost by 48% vs diesel trucks & maintenance cost by 75% per yr.  Huge"
2026-06-30T22:06:56.000+08:00,3931,40,4,,yes,"铜一时代 proprietary; produce cu; rolling composite; ppb defect; al","https://x.com/tphuang/status/2071958669822984572","铜一时代 has a proprietary Copper-Aluminum/Cu-Al semi-molten rolling composite process  to produce Cu-Al composite used in battery cells.  Its large customers are CATL, BYD & CALB. Has seen shipment grow from 2000t in 2019 to expected 22kt this yr. 0 PPB defect rate across 3.8B","铜一时代 has a proprietary Copper-Aluminum/Cu-Al semi-molten rolling composite process  to produce Cu-Al composite used in battery cells.  Its large customers are CATL, BYD & CALB. Has seen shipment grow from 2000t in 2019 to expected 22kt this yr. 0 PPB defect rate across 3.8B"
2026-06-30T21:32:29.000+08:00,30075,115,11,13,yes,"glm deepseek; cheaply zai; model swe; pro ds; aug release","https://x.com/tphuang/status/2071949998313312721","Compare GLM-5.2 to DeepSeek V4-Pro: DS has been overly concerned about cost control in the past yr & how it can serve models cheaply. Zai has focused on developing the best model for SWE & users clearly don't mind spending extra for that.  If the Zai Aug release is another big","Compare GLM-5.2 to DeepSeek V4-Pro: DS has been overly concerned about cost control in the past yr & how it can serve models cheaply. Zai has focused on developing the best model for SWE & users clearly don't mind spending extra for that.  If the Zai Aug release is another big"
2026-06-30T21:37:25.000+08:00,11237,25,1,1,no,"k3 depressing; released july; forward moonshot; v4; deepseek work","https://x.com/tphuang/status/2071951243056947492","Not sure if what gets released in July is K3, but it's depressing for a fan of DeepSeek's work that I'm far more looking forward to the next Moonshot release than the full version of V4.","Not sure if what gets released in July is K3, but it's depressing for a fan of DeepSeek's work that I'm far more looking forward to the next Moonshot release than the full version of V4."
2026-06-30T02:44:04.000+08:00,12647,113,22,,yes,"nand; micron; ymtc hugely; underestimated kimi","https://x.com/tphuang/status/2071666023720157583","YMTC has been hugely underestimated. Here is Kimi accumulating last 5 years of quarterly global NAND market size. 2026Q1 was $46. At 13% share, YMTC would've generated $6B in revenue. Q2 was a huge jump over Q1 based on Micron report.  As YMTC marches toward 500k wpm, it will","YMTC has been hugely underestimated. Here is Kimi accumulating last 5 years of quarterly global NAND market size. 2026Q1 was $46. At 13% share, YMTC would've generated $6B in revenue. Q2 was a huge jump over Q1 based on Micron report.  As YMTC marches toward 500k wpm, it will"
2026-06-30T08:15:06.000+08:00,3956,38,3,1,yes,"supply chain; hg tech; jv bomin; related pcb; optical engine; substrate needed","https://x.com/tphuang/status/2071749333360275736","As demand for high power, high speed AI-related PCB continue to increase, supply chain is securing access to cutting edge material capacity.  HG Tech signed 3-yr JV w/ Bomin Electronic for high end PCB & Ceramic substrate, which is needed for optical engine surmount & MicroTEC.","As demand for high power, high speed AI-related PCB continue to increase, supply chain is securing access to cutting edge material capacity.  HG Tech signed 3-yr JV w/ Bomin Electronic for high end PCB & Ceramic substrate, which is needed for optical engine surmount & MicroTEC."
2026-06-30T06:00:36.000+08:00,10021,89,15,1,yes,"llm; 950 superpods; large llms; ai asic; train 6t; concerns atlas","https://x.com/tphuang/status/2071715483879948453","Regardless of who produced this AI ASIC, we now have a Leading-ish lab train 1.6T model using 35T tokens on a cluster of 50-60K.  This put to rest any concerns of Atlas-950 SuperPoDs unable to train large LLMs for Zai & DeepSeek. Especially as latter already trained base model","Regardless of who produced this AI ASIC, we now have a Leading-ish lab train 1.6T model using 35T tokens on a cluster of 50-60K.  This put to rest any concerns of Atlas-950 SuperPoDs unable to train large LLMs for Zai & DeepSeek. Especially as latter already trained base model"
2026-06-30T06:01:28.000+08:00,4011,35,3,1,no,"supply chain; china ai; hw developed","https://x.com/tphuang/status/2071715703502131469","HW has developed a full supply chain for its SuperPoD inside China. Now that DS & Zai both said they will use it, the supply chain is complete end-to-end. If China's AI stack gains mkt share, it's only bc US AI buildout is so wasteful & high cost","HW has developed a full supply chain for its SuperPoD inside China. Now that DS & Zai both said they will use it, the supply chain is complete end-to-end. If China's AI stack gains mkt share, it's only bc US AI buildout is so wasteful & high cost"
2026-06-30T07:04:55.000+08:00,2516,26,2,1,no,"server; open src; anthropic servers; ip confidential; keeping coding","https://x.com/tphuang/status/2071731670743413042","This is by far the most logical reason to use open src. I've been shocked w/ how many companies that are most obsessed w/ keeping their coding IP confidential who have allowed it to go thru Anthropic servers. Now, they don't have to.","This is by far the most logical reason to use open src. I've been shocked w/ how many companies that are most obsessed w/ keeping their coding IP confidential who have allowed it to go thru Anthropic servers. Now, they don't have to."
2026-06-30T01:11:46.000+08:00,5579,79,16,3,yes,"storage; shortage; helium strategic; cas china; underground storage; gsg collaborating","https://x.com/tphuang/status/2071642794569896439","China is building a helium strategic reserve.  广钢气体/GSG is collaborating w/ CAS in China's 1st small-molecule helium deep underground storage project.  In the midst of SoH closure, Helium supply shortage became a huge issue in Asia","China is building a helium strategic reserve.  广钢气体/GSG is collaborating w/ CAS in China's 1st small-molecule helium deep underground storage project.  In the midst of SoH closure, Helium supply shortage became a huge issue in Asia"
2026-06-30T01:04:38.000+08:00,3191,52,14,,yes,"china dump; mkt nev; electric hybrids; biggest players","https://x.com/tphuang/status/2071640999495864538","China's dump truck mkt & NEV penetration for the past yr. After peaking in Dec @ 65% share, we saw it decline in Q1 b4 coming back to 58.72% in May.  96% are pure electric & 4% are hybrids. Biggest players are Sinotruk, XCMG & Sany","China's dump truck mkt & NEV penetration for the past yr. After peaking in Dec @ 65% share, we saw it decline in Q1 b4 coming back to 58.72% in May.  96% are pure electric & 4% are hybrids. Biggest players are Sinotruk, XCMG & Sany"
2026-06-29T22:28:33.000+08:00,3930,50,6,1,yes,"byd dynasty; stores china; charging models; select flash; according carfans","https://x.com/tphuang/status/2071601722196119722","BYD Dynasty series head reports that for every 10 customers that arrive in store, 7+ select flash charging models & 4+ select Da Tang. Dynasty series has 1800+ stores in China (in 1st 72 hrs, each had 50-60 orders according to Carfans)  Next anticipated model is Seal 08 for Ocean","BYD Dynasty series head reports that for every 10 customers that arrive in store, 7+ select flash charging models & 4+ select Da Tang. Dynasty series has 1800+ stores in China (in 1st 72 hrs, each had 50-60 orders according to Carfans)  Next anticipated model is Seal 08 for Ocean"
2026-06-29T22:01:18.000+08:00,3480,48,8,,yes,"chip; afe battery; developed bf8916; mgmt analog; milestone byd; delivery bms","https://x.com/tphuang/status/2071594863242404148","Big milestone for BYD Semi as it hits its 100m delivery of BMS AFE/Battery mgmt system Analog Front End chips.  1st delivery w/ BF8915A-1 in 2021 & has since also developed BF8916, 8922A, 8510A & 8610A.  Next-gen AFE solution will feature support for higher number of cells per","Big milestone for BYD Semi as it hits its 100m delivery of BMS AFE/Battery mgmt system Analog Front End chips.  1st delivery w/ BF8915A-1 in 2021 & has since also developed BF8916, 8922A, 8510A & 8610A.  Next-gen AFE solution will feature support for higher number of cells per"
