timestamp,views,likes,retweets,replies,hasImages,keywords,tweetUrl,text,translated_text
2026-07-21T05:46:15.000+08:00,333,2,,1,yes,"projects china; just deepseek; quoted iflytek; http ai","https://x.com/tphuang/status/2079322016876806359","I don't know which project this one is referring to, but  http:// Z.ai has projects around China just as DeepSeek is also getting into it. This one I quoted is w/ iFlyTek was awarded on 3/25. Keep in mind that things cost less in China, so it likely has numerous such","I don't know which project this one is referring to, but  http:// Z.ai has projects around China just as DeepSeek is also getting into it. This one I quoted is w/ iFlyTek was awarded on 3/25. Keep in mind that things cost less in China, so it likely has numerous such"
2026-07-21T05:08:39.000+08:00,1162,8,3,1,yes,"yagen hydro; battery ess; sdic catl; station total","https://x.com/tphuang/status/2079312552853426182","SDIC & CATL signed JV to invest in Yagen-2 hydro station w/ total 33.39B RMB. This is the 3rd level hydro station in a set of 7 level stations, 2.4GW capacity & 8.645 TWh electricity/yr.  This project expects to fully enter usage in 2036. Battery/ESS makers are now partnering","SDIC & CATL signed JV to invest in Yagen-2 hydro station w/ total 33.39B RMB. This is the 3rd level hydro station in a set of 7 level stations, 2.4GW capacity & 8.645 TWh electricity/yr.  This project expects to fully enter usage in 2036. Battery/ESS makers are now partnering"
2026-07-21T01:57:19.000+08:00,2204,24,5,2,yes,"fab; arena rankings; kimi k3; agent iirc; level fable; security prowess","https://x.com/tphuang/status/2079264404311335312","Kimi K3 continue to do well on arena rankings, especially relevant is the agent one, which iirc is super good measure in real world tasks (Sol, Sonnet-5 & Opus-4.8 level, behind only Fable).  More Real World report of its Cyber Security prowess. It's just really good at SWE stuff","Kimi K3 continue to do well on arena rankings, especially relevant is the agent one, which iirc is super good measure in real world tasks (Sol, Sonnet-5 & Opus-4.8 level, behind only Fable).  More Real World report of its Cyber Security prowess. It's just really good at SWE stuff"
2026-07-21T01:57:21.000+08:00,1079,4,2,2,yes,"arena qwen; k3 release; max preview; pt improvements","https://x.com/tphuang/status/2079264410678280380","For Qwen team, 3.8-Max-Preview is still doing check pt & improvements. Let's wait until full version. K3 release puts a lot of pressure on how good Qwen-3.8 needs to be.  Qwen team also released Audio-3.0-TTS, which now ranks 1st in speech Arena. Qwen is embodied AI monster.","For Qwen team, 3.8-Max-Preview is still doing check pt & improvements. Let's wait until full version. K3 release puts a lot of pressure on how good Qwen-3.8 needs to be.  Qwen team also released Audio-3.0-TTS, which now ranks 1st in speech Arena. Qwen is embodied AI monster."
2026-07-21T01:57:21.000+08:00,813,3,2,1,no,"k3 ban; rsi roadmap; chinese ai; data deficit","https://x.com/tphuang/status/2079264412590846234","Not sure what to make of news of possible K3 ban. I will just concentrate on what's available. Chinese AI labs have clearly hit RSI roadmap. For areas where they are behind in, it's likely due to data deficit which will get resolved w/ time & money, likely this yr.","Not sure what to make of news of possible K3 ban. I will just concentrate on what's available. Chinese AI labs have clearly hit RSI roadmap. For areas where they are behind in, it's likely due to data deficit which will get resolved w/ time & money, likely this yr."
2026-07-20T23:02:55.000+08:00,4458,70,14,6,yes,"biggest breakthroughs; miit announcing; 2026h1; bci product; 九章 qc","https://x.com/tphuang/status/2079220515646951609","MIIT announcing China's major announcement from 2026H1. Biggest breakthroughs: LM-10B recovery, BYD Blade 2.0 battery & flash charging buildout, new material including T1200-grade CF production line, 九章-4 QC breaking record, World's 1st BCI product being approved/launched, 10B","MIIT announcing China's major announcement from 2026H1. Biggest breakthroughs: LM-10B recovery, BYD Blade 2.0 battery & flash charging buildout, new material including T1200-grade CF production line, 九章-4 QC breaking record, World's 1st BCI product being approved/launched, 10B"
2026-07-20T23:02:56.000+08:00,1863,10,2,1,yes,"tech mfg; ic export; h1","https://x.com/tphuang/status/2079220518633312447","It also reported on major growth areas in H1: 177% YoY in smart computing capacity to 2185 EFLOPS IC export grew by 88.7% YoY 3D printing, Li Battery & industrial robot production by 48.5%, 39.3% & 28% YoY high tech mfg grew by 13.3% YoY Industrial growth 5.4% 5.66% gross margin","It also reported on major growth areas in H1: 177% YoY in smart computing capacity to 2185 EFLOPS IC export grew by 88.7% YoY 3D printing, Li Battery & industrial robot production by 48.5%, 39.3% & 28% YoY high tech mfg grew by 13.3% YoY Industrial growth 5.4% 5.66% gross margin"
2026-07-20T19:03:35.000+08:00,7607,98,8,9,yes,"node; ai accelerator; memory; k3 supernodes; running kimi; ai accelerators; 6tb memory; node v900","https://x.com/tphuang/status/2079160283528843474","Moonshot advises running Kimi K3 on SuperNodes of at least 64 AI accelerators. That's was everywhere in WAIC 2026.  Alibaba 64-node M890 SuperNode can run K3 comfortably @ FP16.  128-node V900 SuperNode would have 27.6TB memory. Perfect for 10T model. That's where we are going.","Moonshot advises running Kimi K3 on SuperNodes of at least 64 AI accelerators. That's was everywhere in WAIC 2026.  Alibaba 64-node M890 SuperNode can run K3 comfortably @ FP16.  128-node V900 SuperNode would have 27.6TB memory. Perfect for 10T model. That's where we are going."
2026-07-20T18:28:12.000+08:00,2831,41,6,3,yes,"qin max; byd flash; fastest box; today fcb","https://x.com/tphuang/status/2079151378895663283","BYD news from today: FCB Tai-7 delivery has reached 200k - fastest box type SUV to do so Qin Max EV has now been announced by Dynasty series head, indicating it is going to be on sale soon. Sinopec showing 1st BYD Flash Charging station installed in small Anhui town. Its wide","BYD news from today: FCB Tai-7 delivery has reached 200k - fastest box type SUV to do so Qin Max EV has now been announced by Dynasty series head, indicating it is going to be on sale soon. Sinopec showing 1st BYD Flash Charging station installed in small Anhui town. Its wide"
2026-07-20T07:37:29.000+08:00,4846,69,12,3,yes,"chip; gpu; cpu; matepad pro; satcom support; compared t92; 5g modem; max using","https://x.com/tphuang/status/2078987623784149347","HW's new Pad MatePad Pro Max will be using T93 SoC (K9030 Pro w/o 5G modem), but has NearLink & satcom support.  Compared to T92, this one has 25% improved CPU, 40% improved GPU & 70% improved NPU.  HW/SMIC advanced chip production is very comfortable now.","HW's new Pad MatePad Pro Max will be using T93 SoC (K9030 Pro w/o 5G modem), but has NearLink & satcom support.  Compared to T92, this one has 25% improved CPU, 40% improved GPU & 70% improved NPU.  HW/SMIC advanced chip production is very comfortable now."
2026-07-20T07:34:31.000+08:00,3742,67,15,3,yes,"renewable projects; china different; 9gw","https://x.com/tphuang/status/2078986874715045998","China's different local govts have so many planned renewable projects.  Even a small/poor province like Shanxi put 19745 MW in bids in 2026H1. Over 10GW in wind & almost 9GW in solar.","China's different local govts have so many planned renewable projects.  Even a small/poor province like Shanxi put 19745 MW in bids in 2026H1. Over 10GW in wind & almost 9GW in solar."
2026-07-20T07:32:11.000+08:00,3679,48,5,5,yes,"byd denza; largish sedans; flagship mkt; 56e going; nev options","https://x.com/tphuang/status/2078986288309457254","More photos of BYD's Denza Z9S & Da Han. These 2 largish sedans will be (both 3m+ wheelbase) huge part of BYD's lineup in this flagship mkt.  I think 56E are going to be in huge trouble this yr. Too many great NEV options.","More photos of BYD's Denza Z9S & Da Han. These 2 largish sedans will be (both 3m+ wheelbase) huge part of BYD's lineup in this flagship mkt.  I think 56E are going to be in huge trouble this yr. Too many great NEV options."
2026-07-20T07:24:46.000+08:00,3216,35,1,10,no,"dominated messi; mediocre argentina; wonderful moments; best b4; watch game","https://x.com/tphuang/status/2078984422003728414","What a great World Cup. Was lucky to go watch a game live. So many wonderful moments.  The team that I thought was the best b4 the tournament won & just dominated.  Messi is the GOAT. Taking a mediocre Argentina team to the finals might be his greatest achievement. I hope this is","What a great World Cup. Was lucky to go watch a game live. So many wonderful moments.  The team that I thought was the best b4 the tournament won & just dominated.  Messi is the GOAT. Taking a mediocre Argentina team to the finals might be his greatest achievement. I hope this is"
2026-07-20T01:37:53.000+08:00,3446,49,10,1,yes,"exports; produced china; overall byd; right chery; 2026h1 nevs","https://x.com/tphuang/status/2078897125274824961","Auto Export in 2026H1 & NEVs on right side. While Chery leads BYD 931k to 769k overall, BYD is the big leader w/ 769k vs 290k for Chery & 275k for Geely in NEVs  Keep in mind that overseas assembly are counted as ""exports"" as long as > 40% value is produced in China.","Auto Export in 2026H1 & NEVs on right side. While Chery leads BYD 931k to 769k overall, BYD is the big leader w/ 769k vs 290k for Chery & 275k for Geely in NEVs  Keep in mind that overseas assembly are counted as ""exports"" as long as > 40% value is produced in China."
2026-07-20T00:36:43.000+08:00,4097,68,12,2,yes,"battery makers; china auto; catl leads","https://x.com/tphuang/status/2078881731839402446","China's Auto battery installation in the 1st half where CATL leads w/ 46% share followed by BYD at 17%.  Right chart compares smaller battery makers since 2025. CALB, Gotion, Eve, Volt, Sunwoda & Rept are compared there.","China's Auto battery installation in the 1st half where CATL leads w/ 46% share followed by BYD at 17%.  Right chart compares smaller battery makers since 2025. CALB, Gotion, Eve, Volt, Sunwoda & Rept are compared there."
2026-07-20T00:34:16.000+08:00,1223,9,,,yes,"samsung; alicloud samsung; ahead alibaba; online compute; qoder plan","https://x.com/tphuang/status/2078881115788472354","If we factor in Kimi K3 demand + what's ahead for Alibaba's own Qoder plan demand, it seems like Alicloud needs to rapidly bring online more compute.  T-Head & Alicloud will keep Samsung busy this year.","If we factor in Kimi K3 demand + what's ahead for Alibaba's own Qoder plan demand, it seems like Alicloud needs to rapidly bring online more compute.  T-Head & Alicloud will keep Samsung busy this year."
2026-07-19T21:31:13.000+08:00,5432,61,7,4,yes,"seagull noticeably; spec xingyuan; 番茄殿下 did; launch competition","https://x.com/tphuang/status/2078835048963584441","番茄殿下 did a nice comparison of what I talked about. Seagull got creamed in China mkt after Geely Xingyuan came out.  So BYD took its time to make Seagull noticeably higher spec than Xingyuan for probably a Q4 launch? Competition is alive & well in China.  New Seagull got more","番茄殿下 did a nice comparison of what I talked about. Seagull got creamed in China mkt after Geely Xingyuan came out.  So BYD took its time to make Seagull noticeably higher spec than Xingyuan for probably a Q4 launch? Competition is alive & well in China.  New Seagull got more"
2026-07-18T04:26:21.000+08:00,3253,25,2,1,yes,"node; oled; cooling 950; cm384 supernodes; 850e uses; designed vce; telecom finance","https://x.com/tphuang/status/2078214745153294740","I also showcased the wind cooled Atlas-850E, which uses self designed VCE for heat dissipation vs liquid cooling in 950. Can be expanded from 8 to 96 card for commercial use.  It said that CM384 SuperNodes has > 750 sales for Telecom, finance, education, medical, transport & mfg","I also showcased the wind cooled Atlas-850E, which uses self designed VCE for heat dissipation vs liquid cooling in 950. Can be expanded from 8 to 96 card for commercial use.  It said that CM384 SuperNodes has > 750 sales for Telecom, finance, education, medical, transport & mfg"
2026-07-18T04:26:21.000+08:00,2569,27,3,1,yes,"chip; data center; inference; training; sugon 8000; supercluster used; fp64 compute; uses hygon; supports int8","https://x.com/tphuang/status/2078214747745370190","We also saw Sugon showcase its Sugon-8000 SuperCluster used in Zhengzhou SCNet Data Center which supports INT8 to FP64 compute.  Used in science compute, model training, inference & industrial simulation. It uses Hygon & other domestic chips for compute & have > 100k in cluster.","We also saw Sugon showcase its Sugon-8000 SuperCluster used in Zhengzhou SCNet Data Center which supports INT8 to FP64 compute.  Used in science compute, model training, inference & industrial simulation. It uses Hygon & other domestic chips for compute & have > 100k in cluster."
2026-07-19T18:27:41.000+08:00,1689,14,1,2,yes,"model ali; minimax qwen; shareholder moonshot; building compute","https://x.com/tphuang/status/2078788864349503847","Kimi, Minimax & now Qwen team have all announced 2-3T sized ""max model"". Ali is building compute for 5-10T sized models. Remember, Ali is a major shareholder of Moonshot.","Kimi, Minimax & now Qwen team have all announced 2-3T sized ""max model"". Ali is building compute for 5-10T sized models. Remember, Ali is a major shareholder of Moonshot."
2026-07-19T18:59:05.000+08:00,2375,16,,1,yes,"chip; memory; improvement v900; just nvda; memory higher; 2028; higher interconnect","https://x.com/tphuang/status/2078796762630754491","Remember that T-Head team expects another 3x improvement in its V900 chip vs M890 chip when it launches a yr from now. w/ 50% more memory & higher interconnect.  J900 in 2028 will use a whole new architecture. So everything will continue to improve just as you see w/ NVDA.","Remember that T-Head team expects another 3x improvement in its V900 chip vs M890 chip when it launches a yr from now. w/ 50% more memory & higher interconnect.  J900 in 2028 will use a whole new architecture. So everything will continue to improve just as you see w/ NVDA."
2026-07-19T18:47:18.000+08:00,1694,4,,1,yes,"server; slowness actually; moonshot server; rsi step; model perfect","https://x.com/tphuang/status/2078793797157183954","Slowness is actually unknown since they've only been tested thru a very slammed Moonshot server.  Other issue is the frontier math weakness. I'm sure it's weak on several areas, but no model is perfect. The hard RSI step is already done, just need time.","Slowness is actually unknown since they've only been tested thru a very slammed Moonshot server.  Other issue is the frontier math weakness. I'm sure it's weak on several areas, but no model is perfect. The hard RSI step is already done, just need time."
2026-07-19T18:50:09.000+08:00,1154,7,,,yes,"inference; server; k3 release; largest; servers struggling","https://x.com/tphuang/status/2078794517604425805","Unsurprisingly, Moonshot reports largest ever single day increase in ARR on K3 release day. I was part of the reason for that lol  You could see their servers struggling to serve. They will now find more compute to make more money off inference.","Unsurprisingly, Moonshot reports largest ever single day increase in ARR on K3 release day. I was part of the reason for that lol  You could see their servers struggling to serve. They will now find more compute to make more money off inference."
2026-07-19T09:19:30.000+08:00,29791,125,27,8,yes,"node; inference; training; m890 supernode; ai infrastructure; vs zhenwu; waic; alibaba provide","https://x.com/tphuang/status/2078650906988384630","WAIC 2026 - Alibaba provide details on its AI Infrastructure. Zhenwu M890 SuperNode offers 800G interconnect w/ 64 card.  Supports FP8/FP4. Used in ADAS & embodied AI training, 3x gain vs Zhenwu-810E.  Each super node can do inference for 10T MoE model & installed in Ulanqab.","WAIC 2026 - Alibaba provide details on its AI Infrastructure. Zhenwu M890 SuperNode offers 800G interconnect w/ 64 card.  Supports FP8/FP4. Used in ADAS & embodied AI training, 3x gain vs Zhenwu-810E.  Each super node can do inference for 10T MoE model & installed in Ulanqab."
2026-07-19T09:19:30.000+08:00,3165,33,2,3,yes,"chip; inference; training; lingjun supercluster; card cluster; web ali; hpn training; produce zhenwu","https://x.com/tphuang/status/2078650909328834885","Details on Lingjun SuperCluster: Lagest cluster supports 130k mixed card cluster w/ HPN 8.0 training/inference net. Working toward 1m card cluster. 99.7% up time. Uses CIPU 2.0 front end web.  As Ali continues to produce more Zhenwu chips, it will get to that million card cluster","Details on Lingjun SuperCluster: Lagest cluster supports 130k mixed card cluster w/ HPN 8.0 training/inference net. Working toward 1m card cluster. 99.7% up time. Uses CIPU 2.0 front end web.  As Ali continues to produce more Zhenwu chips, it will get to that million card cluster"
2026-07-19T07:48:43.000+08:00,3821,46,7,5,yes,"cpca data; china mkt; export retail; 2026h1; 2nd chart","https://x.com/tphuang/status/2078628060736426448","CPCA data for 2026H1 in China: Mkt Share by brand nationality in Q2 was 69% Chinese, 10.8% Japanese, 13.2% German & 5.3% American.  2nd chart is production, wholesale, export & retail sales from Jan to June. Production & wholesale are down slightly YoY, retail down by ~20% &","CPCA data for 2026H1 in China: Mkt Share by brand nationality in Q2 was 69% Chinese, 10.8% Japanese, 13.2% German & 5.3% American.  2nd chart is production, wholesale, export & retail sales from Jan to June. Production & wholesale are down slightly YoY, retail down by ~20% &"
2026-07-19T07:45:10.000+08:00,3006,40,7,6,yes,"l2 adas; byd continues; km data; 176315 june","https://x.com/tphuang/status/2078627166862856548","BYD L2+ ADAS program have now been deployed on 3.33m vehicles including 176315 in June.  Accumulates 210m km of data every day. BYD continues to just have so much data to continue to rapidly improve its GodsEye software.","BYD L2+ ADAS program have now been deployed on 3.33m vehicles including 176315 in June.  Accumulates 210m km of data every day. BYD continues to just have so much data to continue to rapidly improve its GodsEye software."
2026-07-19T00:00:28.000+08:00,4096,49,6,5,yes,"denza z9s; wheelbase 3025; launching shanghai; byd","https://x.com/tphuang/status/2078510220691550276","BYD continue to launch & showcase more models: Denza Z9S was showcased this wk w/ dimension 5090/1980/1490mm wheelbase 3025 (smaller & likely cheaper than Z9GT)  Dynasty family launching Shanghai version of Da Tang @ 309.9k RMB. It also showcased new Tang 8 SUV w/ 800+ km range.","BYD continue to launch & showcase more models: Denza Z9S was showcased this wk w/ dimension 5090/1980/1490mm wheelbase 3025 (smaller & likely cheaper than Z9GT)  Dynasty family launching Shanghai version of Da Tang @ 309.9k RMB. It also showcased new Tang 8 SUV w/ 800+ km range."
2026-07-18T23:12:44.000+08:00,9765,93,10,6,yes,"v4ga coming; k3 better; glm; flash bpo","https://x.com/tphuang/status/2078498211367395358","Looks like V4GA is coming out soon. I expect K3 to be better, but pricing may be so compelling going fwd that everyone will transitions to V4.  After all, GLM-5.2 already covers all my programming needs.  A 5.2-Level V4 Flash would put BPO & s/w outsourcing  industry completely","Looks like V4GA is coming out soon. I expect K3 to be better, but pricing may be so compelling going fwd that everyone will transitions to V4.  After all, GLM-5.2 already covers all my programming needs.  A 5.2-Level V4 Flash would put BPO & s/w outsourcing  industry completely"
2026-07-18T19:39:46.000+08:00,4660,66,18,4,yes,"implanted bci; transition china; nmpa approval; hand motor; 1st prescription","https://x.com/tphuang/status/2078444613782659085","China's 1st prescription for implanted BCI hand motor function issued & implant surgery for this device was completed.  Device achieved NMPA approval in March & took just 4 month to clinical deployment. That's quite remarkable transition.  China is making huge investment in BCI","China's 1st prescription for implanted BCI hand motor function issued & implant surgery for this device was completed.  Device achieved NMPA approval in March & took just 4 month to clinical deployment. That's quite remarkable transition.  China is making huge investment in BCI"
2026-07-18T18:42:06.000+08:00,5803,68,5,5,yes,"c909 backlog; mkt 90; comac especially; regional jet; big deal","https://x.com/tphuang/status/2078430103579644363","Big deal for C909 & COMAC, especially as C909 backlog reduces due to limited mkt for 90-seat regional jet.","Big deal for C909 & COMAC, especially as C909 backlog reduces due to limited mkt for 90-seat regional jet."
2026-07-18T18:39:41.000+08:00,4601,71,11,5,yes,"byd brazil; camacari plant; production line; nevs seagull","https://x.com/tphuang/status/2078429494310760581","BYD Brazil Camacari plant has now seen 100k NEVs (Seagull) rolled off production line. It now employs 5500 workers locally & continues to build up local plant.  Full production w/ stamping, welding & painting to happen by 2026H2. BYD delivered 99029 in 2026H1 (including 21254 in","BYD Brazil Camacari plant has now seen 100k NEVs (Seagull) rolled off production line. It now employs 5500 workers locally & continues to build up local plant.  Full production w/ stamping, welding & painting to happen by 2026H2. BYD delivered 99029 in 2026H1 (including 21254 in"
2026-07-18T18:33:46.000+08:00,5640,97,20,27,yes,"data center; china telecom; ocs optical; eflops compute","https://x.com/tphuang/status/2078428005613834647","China Telecom says its 息壤 compute platform now manages > 100 EFLOPS of compute. It has > 900 data center w/ total power capacity approaching 8 GW.  It's currently exploring OCS all-optical networking inside compute clusters to support ultra-large scale cluster. Also investing","China Telecom says its 息壤 compute platform now manages > 100 EFLOPS of compute. It has > 900 data center w/ total power capacity approaching 8 GW.  It's currently exploring OCS all-optical networking inside compute clusters to support ultra-large scale cluster. Also investing"
2026-07-18T06:51:04.000+08:00,4462,50,7,2,yes,"indonesia sale; 港漂侃电车出海 byd; car exported; seagull produced; china count","https://x.com/tphuang/status/2078251163917726102","H/T 港漂侃电车出海 BYD Indonesia sale in June was 4215 (5.6% share) It's mostly selling M6 & Seagull that are produced in local plant from CKD assembly.  China count a car as exported unless 60% are produced in another country. BYD's current localizations are 54% in Thailand, 40%","H/T 港漂侃电车出海 BYD Indonesia sale in June was 4215 (5.6% share) It's mostly selling M6 & Seagull that are produced in local plant from CKD assembly.  China count a car as exported unless 60% are produced in another country. BYD's current localizations are 54% in Thailand, 40%"
2026-07-18T06:32:55.000+08:00,1363,9,,2,yes,"training; improvement k3; kernel design; strength imo; swe; current performance","https://x.com/tphuang/status/2078246597444379125","More charts: Again, important to consider what K3 does well in. Kernel design strength imo is quite important & same with SWE in general for self improvement.  K3 is very early in its cycle, plenty of juicy for post training. Look fwd, not just @ its current performance.","More charts: Again, important to consider what K3 does well in. Kernel design strength imo is quite important & same with SWE in general for self improvement.  K3 is very early in its cycle, plenty of juicy for post training. Look fwd, not just @ its current performance."
2026-07-17T03:27:34.000+08:00,796,14,1,1,yes,"inference; kda attention; native vision; moe sparsity; improves inference; residuals attnres","https://x.com/tphuang/status/2077837564304626042","K3 based on Kimi Delta Attention/KDA & Attention Residuals/AttnRes expanding MoE sparsity. 896 experts w/ 16 active ones (vs 8/384 in K2). ~2.5x scaling efficiency gain.  Native vision understanding from start. Really improves inference economics.","K3 based on Kimi Delta Attention/KDA & Attention Residuals/AttnRes expanding MoE sparsity. 896 experts w/ 16 active ones (vs 8/384 in K2). ~2.5x scaling efficiency gain.  Native vision understanding from start. Really improves inference economics."
2026-07-17T03:27:34.000+08:00,593,10,1,1,yes,"fab; gpu; llm; domestic gpu; kernel arena; llm improve; compute stack; fla triton","https://x.com/tphuang/status/2077837566481449468","Now, its long horizon agency work: GPU kernel arena 24h, unsupervised. 59.7% improved kernel over FLA Triton baseline beating Fable 5 (57.1%), GPT 5.5 (30.8%) & 5.6 Sol (17.3%) Include KDA kernels on unnamed domestic GPU Another example of LLM improve domestic compute stack","Now, its long horizon agency work: GPU kernel arena 24h, unsupervised. 59.7% improved kernel over FLA Triton baseline beating Fable 5 (57.1%), GPT 5.5 (30.8%) & 5.6 Sol (17.3%) Include KDA kernels on unnamed domestic GPU Another example of LLM improve domestic compute stack"
