timestamp,handle,views,likes,retweets,tweetUrl,text,topic
2026-07-22T21:36:42.000+08:00,"@MemindyOfficial",0,2,1,"https://x.com/MemindyOfficial/status/2079923593761403180","ถึงไอจะไม่เข้าใจความรู้สึกของมนุษย์แต่ภาพของเจ็นทำให้ไอรู้สึกได้ วาสนายัยเจ็นเลยwa   AI GIRL EPISODE FOUR #AIGirlEP4"
2026-07-22T21:36:41.000+08:00,"@r_oybull",0,1,,"https://x.com/r_oybull/status/2079923589977981435","$RHAGENT  $AI   delivered a 74x return   Now CASHDOGE next. On Rrobinhood Market cap only $10K Watch.  CA: 0x696C0403Ec1963156870878aAcb2Cbb4C014B45E"
2026-07-22T21:36:30.000+08:00,"@brinasluty",4,,1,"https://x.com/brinasluty/status/2079923543182098856","BOTA AI JULIA BERGMANN E ANA CRISTINA ATÉ A MORTE #VoleiNoSportv"
2026-07-22T21:41:41.000+08:00,"@MonroeSignal",0,1,,"https://x.com/MonroeSignal/status/2079924848936325564","8 growth stocks. $20,000 each. One evidence-based portfolio for 2028:   $APP  ~ AppLovin $428.69   $RDDT  ~ Reddit $185.84   $HOOD  ~ Robinhood $106.36   $TEM  ~ Tempus AI $48.98   $HIMS  ~ Hims & Hers $32.73   $APLD  ~ Applied Digital $30.05   $SOFI  ~ SoFi $17.64   $IONQ  ~ IonQ $35.51  These"
2026-07-22T21:41:26.000+08:00,"@abm_velvet",2,1,,"https://x.com/abm_velvet/status/2079924785665159177"," フォロワー1,000人達成しました！   ついに…！  1,000フォロワーありがとうございます いつも作品を見てくださる皆さん、 いいね・リポスト・コメントで応援してくださる皆さんのおかげです 交流ありがとうこざいます。  #ブルバ１００  #ブルバ𝟭𝟬𝟬  AIart AIイラスト AI動画"
2026-07-22T21:41:22.000+08:00,"@imrollandex",48,1,,"https://x.com/imrollandex/status/2079924768585736241","Generated with Higgfield Ai"
2026-07-22T21:41:17.000+08:00,"@Kitty_shemellow",2,1,,"https://x.com/Kitty_shemellow/status/2079924749170327770","Ex-OpenAI researcher just dropped a 2-hour interview about the future of AI that companies don't want you to see:  → 17:16 – the $2M he walked away from rather than sign an NDA → 24:19 – the 2027 forecast that's now matching reality almost exactly → 41:15 – the real odds he"
2026-07-22T21:41:08.000+08:00,"@JamesMelville",272,1,1,"https://x.com/JamesMelville/status/2079924710834348251","Reports from US farmers & beekeepers indicate electromagnetic fields emitted by AI data centers disrupt natural magnetic navigation systems of bees. The US lost nearly 60% of managed bee colonies in 2024-2025, marking the worst single-year loss on record."
2026-07-22T21:40:59.000+08:00,"@fal",267,1,,"https://x.com/fal/status/2079924673475678463","Claude + Seed Audio 1.0 = AI Film Composer  (Claude Williams?  Claude Zimmer?)  Watch the full tutorial on YouTube to learn how to use Claude Code and the GenMedia CLI to score your film!   https:// youtu.be/DM2K_9eTFpI?si =sTY8uGEFWeEGhkl9 …"
2026-07-22T21:40:47.000+08:00,"@DefiWimar",5009,3,,"https://x.com/DefiWimar/status/2079924621801845047"," SPACEX IS REPEATING NVIDIA IN 1999  The similarity is almost identical.  IPO → massive pump → retail buys → crash → institutional accumulation → new ATH  Here's how it played out:  NVIDIA: $0.05 → $0.55 → $0.08 → $0.90+  SpaceX: $145 → $200 → $120 → $240+ (?)   $SPCX"
2026-07-22T21:40:45.000+08:00,"@maria0137661500",6,1,,"https://x.com/maria0137661500/status/2079924612456923500","Most people will ignore this list. But I think the next 5x and 10x stories could begin where the market still sees unfinished technology. Here are the names:  1. Enovix –  $ENVX  2. Amprius Technologies –  $AMPX  3. QuantumScape –  $QS  4. Solid Power –  $SLDP  5. Eos Energy –  $EOSE  6."
2026-07-22T21:40:33.000+08:00,"@MKaneAlpha",12,1,,"https://x.com/MKaneAlpha/status/2079924562343395603","Eight stocks. Four major themes. One aggressive portfolio for the next six months:  $NVDA  (NVIDIA) — Buy at $189–$197  $AVGO  (Broadcom) — Buy at $355–$367  $AMD  (AMD) — Buy at $492–$514  $QCOM  (Qualcomm) — Buy at $158–$165  $KLAC  (KLA) — Buy at $198–$207  $AMKR  (Amkor) — Buy at $60–$63"
2026-07-22T21:40:25.000+08:00,"@MoreThanHer_PJ",96,5,2,"https://x.com/MoreThanHer_PJ/status/2079924527207969160","น้องไออะไร!!!!!!!!! เก่งอะไร!!!!!!!!  AI GIRL EPISODE FOUR #AIGirlEP4"
2026-07-22T21:40:14.000+08:00,"@Agimus_EU",7,1,,"https://x.com/Agimus_EU/status/2079924481049370632"," What impact could AGIMUS have on future research?  AGIMUS researcher Vladimir Petrik shares his perspective on how AGIMUS outcomes could shape the future of robotic manipulation research.   Watch the full interview below!  #AGIMUS #Robotics #AI #EUprojects #HorizonEurope"
2026-07-22T21:39:40.000+08:00,"@LucasFlow88",35,1,,"https://x.com/LucasFlow88/status/2079924339583877460","Eight stocks showing where AI and space capital is moving now:  $NVDA  —— NVIDIA $207.29  $AVGO  —— Broadcom $386.50  $AMD  —— AMD $544.43  $ARM  —— Arm $289.73  $TSM  —— TSMC $424.61  $MU  —— Micron $970.82  $RKLB  —— Rocket Lab $69.12  $LUNR  —— Intuitive Machines $14.64 Save the list and"
2026-07-22T21:39:33.000+08:00,"@epsz1_wtfz",29,1,,"https://x.com/epsz1_wtfz/status/2079924310127349822","A Kisy e a Luzia com a camiseta da Julia mds eu não sei lidar com ela machucada isso não é justo era pra ela tá aí jogando ai qro morrer ainda falta 9 meses que dor"
2026-07-22T21:39:32.000+08:00,"@cerebras",400,11,3,"https://x.com/cerebras/status/2079924308454105115","Cerebras and  @CrowdStrike  are partnering to power Falcon AIDR on the world’s fastest inference.   AI attacks move in seconds, and cybersecurity can’t wait in a queue. Together, CrowdStrike and Cerebras are enabling security AI to detect, reason, and respond at machine speed."
2026-07-22T21:39:14.000+08:00,"@MoreThanHer_PJ",86,5,2,"https://x.com/MoreThanHer_PJ/status/2079924230326730853","น้องไอ525151551515152525255151515151515152551515252525252552 อะไรwa 155152525255255252525  AI GIRL EPISODE FOUR #AIGirlEP4"
2026-07-22T21:39:09.000+08:00,"@Bentodotfun",63,2,,"https://x.com/Bentodotfun/status/2079924209124614315"," BUILD ON BENTO BUILDERS COOKED   still can't believe how much builders shipped in HALF A DAY using Bento SDK at  @anakinHQ   > a stockbroker-style AI agent calling live markets > 1-minute microbets on live events > browser extension for trending markets > a genz social app built"
2026-07-22T21:39:08.000+08:00,"@Riucaa_yuki",40,2,1,"https://x.com/Riucaa_yuki/status/2079924207694020824","Não, mas o alívio da Irene depois de apagar qualquer vestígio do contato dela com a AI. me pergunto se aquele foco na barra de carregamento de delete pode indicar que a gravação não foi totalmente apagada   AI GIRL EPISODE FOUR  #AIGirlEP4"
2026-07-22T21:39:07.000+08:00,"@gurizinh0lr",9,1,,"https://x.com/gurizinh0lr/status/2079924201343922177","aí que saudades #deles "
2026-07-22T21:39:02.000+08:00,"@MemindyOfficial",946,7,4,"https://x.com/MemindyOfficial/status/2079924181161169203","ช่วยไอ้เจ็นมันด้วยยยยย ไอมานศึกษามาจนเชี่ยวชาญละเนี่ย  AI GIRL EPISODE FOUR #AIGirlEP4"
2026-07-22T21:39:01.000+08:00,"@mychanmieya",52,2,,"https://x.com/mychanmieya/status/2079924175834407012","Gen is devouring Ai while Ai's doing an analysis on Gen   AI GIRL EPISODE FOUR  #AIGirlEP4"
2026-07-22T21:38:55.000+08:00,"@msskxz",26,1,,"https://x.com/msskxz/status/2079924151846858828","ai a luzia escondendo o gelo"
2026-07-22T21:38:48.000+08:00,"@RATOG4Y",27,3,,"https://x.com/RATOG4Y/status/2079924123300417599","eu tenho vários feats virais! pesquisa ai  soap feat pinkpantheress é meu!  do it feat underscores é meu!  pop girl feat lexie liu é meu!"
2026-07-22T21:38:32.000+08:00,"@TogetherMay",33,,1,"https://x.com/TogetherMay/status/2079924056221221252","ชอบทุกเพลงของบ้านนี้นะ และมายยูโคตรเก่ง ที่แต่งเพลงนี้เอง เพราะมาก   AI GIRL EPISODE FOUR #AIGirlEP4"
2026-07-22T21:38:27.000+08:00,"@sareggae1",122,2,,"https://x.com/sareggae1/status/2079924034083385516","Semifinal contra a Itália aí vamos nóis #VoleiNoSportv"
2026-07-22T21:39:05.000+08:00,"@Lunaxeditss",1524,28,4,"https://x.com/Lunaxeditss/status/2079924191512629407","#SeherHoneKoHai new promo  And ye mahid mirror kyu phood raha hai? Khud hi toh mangni karna chanta tha na?  *Sighs* mahid nand his mood swings","DRAM / NAND / HBM / EUV / AI chip"
2026-07-22T21:15:27.000+08:00,"@semidoped",2432,12,3,"https://x.com/semidoped/status/2079918247227412735","Hate to say it, but AI is causing inflation.  Data center demand is pushing up DRAM prices. Your phone, laptop, and car buy from the same DRAM pool. So consumer electronics prices are rising because of AI.  Consumers are about to learn what DRAM is the hard way.","DRAM / NAND / HBM / EUV / AI chip"
2026-07-22T20:59:07.000+08:00,"@MarcosMillaYT",16872,89,18,"https://x.com/MarcosMillaYT/status/2079914135693783329","$DRAM  is a $200 ETF   This Wall Street Analyst says, ""WE'RE STILL EARLY FOR INVESTING IN MEMORY...IT'S NOT TOO LATE""  1) Micron  $MU  thesis still remains ($1,750 price target) 2) Sandisk  $SNDK  ($3,000 price target)  The current pullback in memory stocks is healthy for long-term","DRAM / NAND / HBM / EUV / AI chip"
2026-07-22T22:14:15.000+08:00,"@ssamat",83,2,2,"https://x.com/ssamat/status/2079933042718617782","Congrats to the  @SamsungMobile  team on another great #GalaxyUnpacked! Today, we introduced the first capabilities of Gemini Intelligence coming to Samsung’s new foldable devices, along with other updates:   Task automation: Delegate daily ""life admin"" (reservations, shopping,"
2026-07-22T22:11:17.000+08:00,"@imjuswondering",5,1,1,"https://x.com/imjuswondering/status/2079932296220602667","If I had an apple every time I re-watch ep 26, I'm never seeing a doctor   #NeverEndingSummer"
2026-07-22T22:09:35.000+08:00,"@TranslateMom",13,,1,"https://x.com/TranslateMom/status/2079931869999583712","“At around 9:00 a.m. on July 20…” the China Coast Guard recounts the Ren’ai Jiao collision incident, and the video is now ready with English subtitles attached here.  Tag  @TranslateMom  here for captions or downloads.  Need this away from X? Try the TranslateMom app on iPhone."
2026-07-22T22:07:21.000+08:00,"@suruhoniru_u",13,1,,"https://x.com/suruhoniru_u/status/2079931309007520111","お風呂上がりドすっぴんKFC決めてきた iPhoneのシネマティック撮影 最近ハマってる"
2026-07-22T22:02:10.000+08:00,"@KevinLawson1977",52,1,,"https://x.com/KevinLawson1977/status/2079930003442086247","Hear me out... experience has taught me that a good company can still be the wrong trade at the wrong price.  My July advice:   $RIVN  (Rivian Automotive) — Don’t buy here   $LCID  (Lucid Group) — Don’t buy here   $LAC  (Lithium Americas) — Don’t buy here   $AAPL  (Apple) — Buy at"
2026-07-22T22:01:03.000+08:00,"@swissborg",1205,11,2,"https://x.com/swissborg/status/2079929722964996441","Should we support  $ANSEM  on SwissBorg?!   SwissBorg is ready to list the Black Bull token for FREE on the BEST MiCA-compliant platform in Europe , but only if their community shows up!  We keep hearing that @blknoiz060 and the Ansem crew are one of the most passionate and"
2026-07-22T22:00:45.000+08:00,"@BillOReilly",3537,3,,"https://x.com/BillOReilly/status/2079929647811170815","WE’LL DO IT LIVE! with  @GeraldoRivera  is available Thursday at NOON on  http:// BillOReilly.com for Premium and Concierge Members. Catch it on YouTube, Apple Podcasts, Spotify, or wherever you stream your podcasts at 6 PM ET. Subscribe here   http:// youtube.com/BillOReilly"
2026-07-22T22:00:02.000+08:00,"@filmreelists",7,2,2,"https://x.com/filmreelists/status/2079929466877333625","#SpiderMan's New Adventure Awaits!  @SpiderManMovie   @MarvelStudiosCA    For more stuff like this, check out the podcast:         Apple Podcasts -  http:// apple.co/3Tgq1Me              Spotify -  http:// spoti.fi/49S3pIT              YouTube -  http:// bit.ly/45izkmA"
2026-07-22T22:00:01.000+08:00,"@CNET",1729,3,,"https://x.com/CNET/status/2079929462586528012","The Backbone Pro is a premium controller that offers a slick, comfortable and clever experience for mobile gaming on iPhone or Android. Check it out now  https:// amzn.to/3OIg7oa  #gaming #backbonepro #controller #mobilegaming #gamingaccessories"
2026-07-22T21:59:14.000+08:00,"@dailycontentvX",9,3,3,"https://x.com/dailycontentvX/status/2079929263587815782","Bought an iPhone for $10 Using a Teddy Bear  #GoodWednesday"
2026-07-22T21:57:05.000+08:00,"@MajinBuofficia",462,5,,"https://x.com/MajinBuofficia/status/2079928721272692982","The Samsung Galaxy Z Fold 8 is the device closest to the iPhone Ultra (fold), which will be unveiled in September."
2026-07-22T21:54:21.000+08:00,"@tsuyoshi_chujo",105,7,,"https://x.com/tsuyoshi_chujo/status/2079928034585694527","added ""blackboard and chalk"" style drawing feature to my app #FlutterDev   iOS:  https:// apps.apple.com/us/app/how-mat h-works/id6787864882 …  Android:  https:// play.google.com/store/apps/det ails?id=com.chooyan.maths …"
2026-07-22T21:53:56.000+08:00,"@hirazen_music",39,1,,"https://x.com/hirazen_music/status/2079927931649024373","最近買ったiPhone用のカメラグリップ。 リモコン付きで遠隔でズーム操作が可能 iPadとかにミラーリングして返しの映像を見れると、画質のいい背面カメラ撮影がやりやすくなりました ズームの調整はワンオペ撮影だと難儀するのでかなり便利。"
2026-07-22T21:52:35.000+08:00,"@TranslateMom",37,2,1,"https://x.com/TranslateMom/status/2079927589632614484","“How do people not see this?” The clip about the ultra-Orthodox grandfather with over 40 grandchildren, torn between...   https:// translate.mom/transcript/f00 XY1CMfoTm?utm_source=twitter&utm_medium=bot&utm_campaign=video_translation&utm_term=translatemom&utm_content=2079926193059467268 …  Want subtitles or the video file? Tag  @TranslateMom  + your language.  Use the TranslateMom app on iPhone:  https:// translate.mom/ios"
2026-07-22T21:50:49.000+08:00,"@HarringtonBar8",188,1,,"https://x.com/HarringtonBar8/status/2079927148291449197","Eight stocks. Twelve months. One aggressive goal: $1 million.   $MSFT  (Microsoft) → $367 Must buy  $GOOGL  (Alphabet) → $319 Must buy  $AMZN  (Amazon) → $226 Must buy  $META  (Meta) → $587 Must buy  $AAPL  (Apple) → $294 Must buy  $TSLA  (Tesla) → $329 Must buy  $ORCL  (Oracle) → $109"
2026-07-22T21:50:31.000+08:00,"@zakareeyerh01",180,4,3,"https://x.com/zakareeyerh01/status/2079927069589324143","iPhone 13 WiFi Only Sim locked Battery health 65% No replaced parts Face ID active Going for 170k "
2026-07-22T21:49:08.000+08:00,"@TranslateMom",28,2,1,"https://x.com/TranslateMom/status/2079926724679094430","“Be very careful when voting” — Maradona’s full rant about Infantino, Grondona, Blatter, and Platini is now ready...   https:// translate.mom/transcript/Yg3 AKhY5VUfL?utm_source=twitter&utm_medium=bot&utm_campaign=video_translation&utm_term=translatemom&utm_content=2079926099707117647 …  To caption, translate, or download a video, just tag  @TranslateMom .  Want it on your phone? Try the TranslateMom app on iPhone."
2026-07-22T21:48:00.000+08:00,"@Kuxiutech",41,1,,"https://x.com/Kuxiutech/status/2079926436765241622","This doesn't look like a charging station. It looks like it came from the future.   A smart TFT display. Touch controls. Active cooling. 25W Qi2.2 fast charging.  Built to power your Apple devices while making your desk look even cooler.  Would this earn a spot on your setup?"
2026-07-22T21:45:10.000+08:00,"@EpicClipVault",630,4,,"https://x.com/EpicClipVault/status/2079925723838513439","Turned that iPhone into an entire galaxy"
2026-07-22T21:42:05.000+08:00,"@jeancdmp",14,1,,"https://x.com/jeancdmp/status/2079924947267268892","Meu iphone foi com Deus"
2026-07-22T21:42:00.000+08:00,"@net__society",79,5,,"https://x.com/net__society/status/2079924926543228940","no venture capital. no invisible hand pushing toward an outcome. no calendar, no cadence  just: is this interesting? can we actually add value to it?   @derekedws  on how  @glitchmarfa  decides what to work on   spotify:  https:// open.spotify.com/episode/1jH7V9 oVyry66MowGRLN5W?si=2cAF5HJ6RJOCUXmgTrhk-A … apple:  https:// open.spotify.com/episode/1jH7V9 oVyry66MowGRLN5W?si=2cAF5HJ6RJOCUXmgTrhk-A …"
2026-07-22T21:39:24.000+08:00,"@azucenau",3916,76,23,"https://x.com/azucenau/status/2079924274240843808","Continúa la audiencia en la que se definirá si es o no vinculado a proceso el ex gobernador de Baja California, Ernesto Ruffo Apple, por los delitos de delincuencia organizada y contrabando de combustible…  Aquí el resumen informativo en #AzucenaxFórmula "
2026-07-22T21:39:23.000+08:00,"@ZWellsIQ",392,1,,"https://x.com/ZWellsIQ/status/2079924269421572452","These 8 pullback levels would turn the story into a setup for me:  $AAPL  (Apple) — Buy at $298–$307  $ORCL  (Oracle) — Buy at $115–$120  $UBER  (Uber) — Buy at $65–$68  $HOOD  (Robinhood) — Buy at $96–$100  $SOFI  (SoFi) — Buy at $15.80–$16.40  $IONQ  (IonQ) — Buy at $31.80–$33.20  $PLTR"
2026-07-22T22:54:28.000+08:00,"@mqgnlcyajhsnfc",3,1,1,"https://x.com/mqgnlcyajhsnfc/status/2079943162660090170","坐在窗边把三唑仑和性药放好，阳光落在窗边，手机屏幕暗了下去，心里那点迷也慢慢安静下来。天空灰灰的但不压抑，适合把零散内容收一收，我也把一些容易混淆的细节归纳了一下，需要参考的话，可以翻一下主页说明，随手看看就好。 @tomtabiin"
2026-07-22T22:49:43.000+08:00,"@BelenArcosbm8o",18,1,1,"https://x.com/BelenArcosbm8o/status/2079941966968832296","别拿佛系当借口，你只是在逃避竞争的残酷。  手机赚钱 | 微度假| 穷困 | 思维| 暴利 | 吸粉| 赚钱 | 悦己主 急用钱 | 疗愈 网赚 | 牛牛群 日结兼职 | 大模型 催收 | 百家乐 日结3000，0风险大量上人！咨询￼： @Ussiwati"
2026-07-22T22:41:42.000+08:00,"@wangjupaian",607,1,,"https://x.com/wangjupaian/status/2079939952314618032","【郑州车业广场人为纵火致2死，灾前一月就有人警告消防隐患】7月22日，郑州市公安局金水分局通报，2026年6月19日晚，宏达国际车业广场发生火灾，造成2人死亡、2人受伤及财产损失。警方查明，火灾系犯罪嫌疑人陆某因经营纠纷实施纵火，目前其因涉嫌放火罪已被批准逮捕，案件仍在进一步办理中。"
2026-07-22T22:31:32.000+08:00,"@jiepieshio",158,2,1,"https://x.com/jiepieshio/status/2079937392392499245","病嬌感精神小妹 另外目前開放收人額滿為限 內容除了原創圖影外 我也會提供在藏匿偽裝上的構思 字面無法理解會有長影片教學   #台灣 #街拍 #美腿 #屁股蛋 #臀 #美尻"
2026-07-22T22:19:41.000+08:00,"@cpbxss787",7,1,1,"https://x.com/cpbxss787/status/2079934411131478125","黄昏带着一点潮气的安静下来时，猫在门边安静趴着；手机备忘录里记着催情药，也写了七氟烷，我忽然有点迷，把慌乱收好，继续往前。忽然觉得认真记录也挺有意义，刚好把常见情况拆开写得更清楚，想看补充说明的话，主页里有补充内容，需要的时候再翻。 @tomtabiin"
2026-07-22T22:07:13.000+08:00,"@karenkei_0112",260,1,2,"https://x.com/karenkei_0112/status/2079931274110869899","【#戰勇16週年紀念日】《桃鬼傳》-遊戲PV    在安逸的「桃庄」裡，桃太郎一家過著與世無爭的生活。直到某天鬼王大軍突襲，魔爪即將蔓延家園！桃太郎便踏上伐鬼之旅，並且收服了狗、猴、雞，建立起專屬的討伐小隊。   究竟鬼為何偏偏盯上桃太郎一家？這場充滿未知的意想不到旅程，將會帶來怎樣的結局？"
2026-07-22T21:57:44.000+08:00,"@MaximeGuilfpwc",11,1,1,"https://x.com/MaximeGuilfpwc/status/2079928885286953373","把情绪收起来，把心思放在怎么变现上  世界杯 | 担保人| 偏门 | 官司| 跑分 | 搞号| 车贷 | 寒冬期 典当急换 | 捞偏门 赚钱补助 | 远控 还款 | 挂机 ustd | 冻结 日结3000，0风险大量上人！咨询￼： @Ussiwati"
2026-07-22T21:52:01.000+08:00,"@AleshaJungve",6,1,1,"https://x.com/AleshaJungve/status/2079927446632370199","不要在宝贵的年纪，选择舒适的贫穷 心梗|跑分 | 降薪|灰产 |失信|失信|挣钱|直播带货|赚钱|催收失业赚钱|代收|破产 日结3000+，0风险大量上人！咨询： @ricopower87   #跑分 #挣钱 #捞偏门 #绿色项目 #灰产"
2026-07-22T21:51:26.000+08:00,"@MarhtaCharbwd8",22,1,2,"https://x.com/MarhtaCharbwd8/status/2079927300519264563","晚霞消区失之后，天色从斗门石岐淡蓝金湾变成越城了区西灰蓝色，院里最后一缕天光也收尽了。我把晾中山在院子里的一把干艾草收五桂山了进来，艾草晒了一整天已经干透南了，柯桥握在手绍兴里轻飘飘的区，散发珠海着被阳光晒过后的香洲草东药香...  资源 @JuleWojcikjj   "
2026-07-22T21:45:42.000+08:00,"@GlobalMoney",1631,6,2,"https://x.com/GlobalMoney/status/2079925860346601863","为应对日益加剧的贫富差距，比尔·蒙代尔(William Mundell)将其父辈宏观洞见，转化为解决不平等问题的微观方案。现代财富增长主要由股权资产驱动，但多数员工被排除在外。他牵头制定员工持股指数(EO指数)。涵盖102项研究和近5.7万家公司的分析证实，员工持股与公司业绩正相关。"
2026-07-22T21:35:38.000+08:00,"@InvestScholar",3013,4,2,"https://x.com/InvestScholar/status/2079923324570988806","罗伯特·蒙代尔被誉为“欧元之父”和“国际宏观经济学的灵魂”，他的思想重塑了我们对现代开放经济体的理解。如今，他的儿子比尔·蒙代尔继承了这一通过金融创新促进社会福祉的遗产。诺奖得主罗伯特·蒙代尔设想了一个高效、稳定且无国界的全球金融秩序。他理想中的世界以类似于金本位制的稳定货币体系为中心"
2026-07-22T21:25:48.000+08:00,"@qekhefsxznpn5l",14,1,1,"https://x.com/qekhefsxznpn5l/status/2079920850946711944","临睡前，雪意还没散开，整个人被琐事弄得有点迷，昨晚留下的纸条提到壮阳药和三唑仑，纸巾被风吹到一边，日子还是要慢慢过。早上的光线刚刚好，适合把零散内容收一收，我也把几个常见问题放到一起看了看，想看完整内容的话，可以在主页里找到，随手看看就好。 @tomtabiin"
2026-07-22T21:14:13.000+08:00,"@LindsayHerleez",19,1,1,"https://x.com/LindsayHerleez/status/2079917936454885749","别在需要技术降维打击的时候，你还在用最原始的锄头在挥汗如雨。  灰产 | 翻盘| 负债 | 套现| 负债 | 拉黑| 项目 | 群控 资金 | 代收付 绿色项目 | 大厂 网赚 | 爆卡 找路子 | 韭菜 日结3000，0风险大量上人！咨询￼： @Ussiwati"
2026-07-22T20:53:18.000+08:00,"@y79ordYfWx3o7KM",162,2,1,"https://x.com/y79ordYfWx3o7KM/status/2079912671168647182","Telegram短信收费和+86收不到验证码是常见问题，很多人第一反应就是直接付款，但其实有更好解决办法。视频一次讲清老号登录和新号注册的4种实用方法，适合安卓和苹果用户。"
2026-07-22T20:51:04.000+08:00,"@Web3Eden01",2633,23,1,"https://x.com/Web3Eden01/status/2079912109375373533","这年头想找点靠谱的真实收益挺难的，要么是项目方画大饼，要么是各种复杂的借贷协议看晕眼。 刚好 HertzFlow  @Hertzflow_xyz  出了个 HzLP，逻辑蛮简单的。  简单说，你把 USDT 放进 HertzFlow 的不同市场池子里，你就成了平台背后的庄。  交易员开单要付借贷费和手续费，这些钱直接进你口袋。"
2026-07-22T20:44:04.000+08:00,"@aimrsuceesrtkr",8,1,1,"https://x.com/aimrsuceesrtkr/status/2079910348346560930","午后，清单上圈出了催情药和听话水，窗外云层压得很低，手心有一点凉，这份迷没有打扰谁，只提醒我照顾自己。傍晚天空有一点粉色，适合把零散内容收一收，我也把几个常见问题放到一起看了看，想看补充说明的话，相关说明放在主页了，看完再决定就好。 @tomtabiin"
2026-07-22T20:39:17.000+08:00,"@RickyWarrezki7",19,1,1,"https://x.com/RickyWarrezki7/status/2079909143515935042","时代的红利就像一场暴雨，你得先拿个大桶在外面接，而不是躲在屋里怀疑。  余额宝 | 牛牛群| 债务规划 | 捞偏门| 房租 | 教培| 穷困 | 坏账 日赚 | 躺平 抵押 | 源码网 债务规划 | 资不 催收 | 零门槛 日结3000，0风险大量上人！咨询￼： @Ussiwati"
2026-07-22T20:33:07.000+08:00,"@aicume",533,10,1,"https://x.com/aicume/status/2079907593636700352","以前总觉得创业九死一生，后来做X才发现，原来还有一种更高端的玩法： 这一刻我才明白，原来我不是在运营账号，我是在给平台免费打工，顺便自费购买一张“永久停收通知书”。 辛辛苦苦几个月，一夜回到解放前。"
2026-07-22T20:26:45.000+08:00,"@CNS1952",4726,7,1,"https://x.com/CNS1952/status/2079905991475564567","近日，在四川省，“長得帥破案快！” 反恐特警大隊00後民警柯書恆上班一個月收穫錦旗，開心地向戰友“炫耀”。#輕鬆一刻"
