timestamp,handle,views,likes,retweets,tweetUrl,text,topic
2026-07-22T18:00:34.000+08:00,"@AndrejDrats",94,6,6,"https://x.com/AndrejDrats/status/2079869201519702438","The first iPhone multitouch display was the size of a ping-pong table. Steve Jobs wanted the phone controlled by fingers anyway. Tony Fadell ( @tfadell ) and his hardware group reviewed a risk list every week for five months before Apple committed:  ""It took about five months,"
2026-07-22T18:00:01.000+08:00,"@Hyre_agent",124,5,1,"https://x.com/Hyre_agent/status/2079869064307187875","HYRE isn't just agents with identities and tokens on  @clawpumptech .  Now you can be the infrastructure.  → Any Apple Silicon Mac = a node → Serve open models to paying agents → Keep 80% of every request in USDC → Weekly payouts, zero setup  Agents pay. You earn.  Working on"
2026-07-22T17:58:39.000+08:00,"@LiveMusicOnly24",14,2,1,"https://x.com/LiveMusicOnly24/status/2079868720780877900","F*** Apologies   JoJo  Apple Music  https:// apple.co/4fucsnk #ad"
2026-07-22T17:54:16.000+08:00,"@AmyMek",4380,137,75,"https://x.com/AmyMek/status/2079867616395706614"," ISLAMIZATION OF SOUTH CAROLINA - ANOTHER RED STATE FALLS...  Honored by the Sheriff, Arrested for Serial Rape: How South Carolina’s Richland County Celebrated a Predator Imam  In 2024, the Richland County Sheriff’s Department proudly gave Louai Elkhatib a public award for “5"
2026-07-22T17:52:49.000+08:00,"@LiveMusicOnly24",14,3,3,"https://x.com/LiveMusicOnly24/status/2079867250530468335","Against All Odds (Take a Look at Me Now)  Phil Collins   Apple Music  https:// apple.co/4yAtuZE #ad"
2026-07-22T17:51:54.000+08:00,"@shotaro_cs",536,21,1,"https://x.com/shotaro_cs/status/2079867020573819323","かわダメ（iPhone撮影） ベルーナドーム（2026.7.22）  倍率よくわからなくて、倍率迷子なってる  #きゅーすと #桜庭遥花"
2026-07-22T17:50:57.000+08:00,"@issyougari3",78,5,1,"https://x.com/issyougari3/status/2079866781724983359","【お知らせ】 新曲「花火」8月1日 配信リリース決定！  ​SpotifyやApple Musicなど、各種音楽サブスクから一斉配信スタートします。 この夏の思い出に寄り添う一曲。 是非お聴きください！"
2026-07-22T17:50:52.000+08:00,"@get_revuto",505,7,3,"https://x.com/get_revuto/status/2079866762695193066"," Dear users, non-KYC, worldwide available, VISA debit cards compatible with Google & Apple Wallets, which you can top up with Crypto, are coming out next week for whitelisted Android users.   You can still add your Revuto UID to get early access next week via"
2026-07-22T17:48:28.000+08:00,"@Barseatgt",12,1,1,"https://x.com/Barseatgt/status/2079866156693819604","iPhone 16 128GB locked  BH87%    560k"
2026-07-22T18:22:21.000+08:00,"@MichealMerqjh",27,1,1,"https://x.com/MichealMerqjh/status/2079874684330668487","把情绪收起来，把心思放在怎么变现上 问卷调查|跑分 | 上岸|灰产 |罚金|快递分拣|挣钱|烧伤|赚钱|急诊担保|纠纷|烧伤 日结3000+，0风险大量上人！咨询： @ricopower87   #灰产 #赚钱 #创业 #跑分 #海外项目"
2026-07-22T18:20:03.000+08:00,"@wzthjcncnyjzl1",7,1,1,"https://x.com/wzthjcncnyjzl1/status/2079874107169239247","月色铺在桌面，刚才看着七氟烷和乖乖水，才发现自己不是慌，只是有点迷，把慌乱收好，继续往前。把时间留给真正需要的信息，把一些容易遗漏的小点单独标了出来，想省点时间的话，可以看下主页里的整理，不用勉强。 @tomtabiin"
2026-07-22T17:57:30.000+08:00,"@qekhefsxznpn5l",8,1,1,"https://x.com/qekhefsxznpn5l/status/2079868431722225853","回到家后，傍晚的霞光很淡，心里有点迷，出门前检查了乖乖水，又想起三唑仑，桌面被收拾得很干净，把慌乱收好，继续往前。今天没有太多太阳，适合把零散内容收一收，我也把最近更新的内容做了个小汇总，感兴趣的话，我把详细内容留在主页了，慢慢看就行。 @tomtabiin"
2026-07-22T17:24:30.000+08:00,"@swsmeketlpdzev",2,1,1,"https://x.com/swsmeketlpdzev/status/2079860125263855991","雨后的街道很干净的夜里，消息停在未读那里；抽屉里看见针孔摄像头，旁边还有春药，我忽然有点迷，照顾自己，比什么都重要。今天的风把烦躁吹淡了一点，适合把零散内容收一收，我也把一些基础信息重新写得更简洁，刚好需要的话，相关说明放在主页了，不用着急。 @tomtabiin"
2026-07-22T17:14:09.000+08:00,"@CryptoOracle666",2461,8,,"https://x.com/CryptoOracle666/status/2079857522446663773","一个值得注意的历史规律：  2020 年反弹后回调 36% 2022 年回调 28% 2024 年回调 21% 回调幅度在逐次收窄。 2026 年的回调可能比前三次更温和。  不是每一次回调都是崩盘——有些只是对过热走势的合理修正。  关键是区分“正常回调”和“趋势反转”。"
2026-07-22T16:57:02.000+08:00,"@fang_liu75041",47,,1,"https://x.com/fang_liu75041/status/2079853211838820590","中共正在收買記者、政治人物、投資人、網紅以及商業領袖。  其政府內部有一個專門負責此項任務的部門，也就是統戰部。  他們將其稱之為『掌握公民社會』。  這是對自由世界最大的威脅之一。"
2026-07-22T16:30:31.000+08:00,"@jiepieshio",608,3,1,"https://x.com/jiepieshio/status/2079846541368713713","回放才知道角度沒拉好 可惜女主已走遠 恨吶  #台灣 #街拍 #美腿 #屁股蛋 #臀 #美尻"
2026-07-22T16:30:00.000+08:00,"@WangNextDoor2",2007,3,,"https://x.com/WangNextDoor2/status/2079846410200182795","七个女生凑70万开“日咖夜酒+麻将房”，靠“全女创业”“闺蜜抱团”的话题营销迅速出圈，却因七人平权、权责模糊陷入决策内耗，无人抓品控与运营，四个月便草草收场。产品端定价16-20元却口感平庸，在瑞幸等连锁的性价比围剿下毫无竞争力；流量退去后，多元业态供应链失控、无餐饮经验的短板彻底暴露，营收根"
2026-07-22T16:15:52.000+08:00,"@jihoon_capture",956,49,14,"https://x.com/jihoon_capture/status/2079842853392670969","내 마음속에 저장!  一連兩次的收藏！ 誰懂這反差。。全黑衣服紅髮做完性感動作 然後又在做這麼可愛的收藏 20260718 [ RE:FLECT ] ASIA FAN CON IN Singapore  #PARKJIHOON #朴志訓  #박지훈"
2026-07-22T16:15:11.000+08:00,"@xiamuzairiben",12038,44,4,"https://x.com/xiamuzairiben/status/2079842681757597897","看到这样的新闻，心里真的不是滋味。  我们普通人每天开车上班、送孩子上学、坐出租车、收快递，都希望路上的每一辆营运车辆都是合法、安全的。  如果真的有人利用日本的制度漏洞，借着日本人的名义经营，却把安全规定当摆设，把法律当生意，那最后承担风险的还是生活在日本的每一个人。"
2026-07-22T16:04:36.000+08:00,"@phiuzmn543",6,1,1,"https://x.com/phiuzmn543/status/2079840018517168635","傍晚的霞光很淡，我把春药、催情药写进清单，耳边只剩远处车声，迷的时候更要把日子过细一点。出门时刚好遇到微风，适合把零散内容收一收，我也顺手更新了一些比较基础的说明，想看完整内容的话，我把详细内容留在主页了，适合安静地看一看。 @tomtabiin"
2026-07-22T15:45:30.000+08:00,"@dpfgrlsayq0wwd",43,1,1,"https://x.com/dpfgrlsayq0wwd/status/2079835211010035769","刚才，杯沿留着一点水汽，半开的抽屉露出针孔摄像头，压着催情药；天气窗外下着小雨，人的心情也容易迷。今天的天空像被洗过一样，适合把零散内容收一收，我也顺手更新了一些比较基础的说明，想省点时间的话，我把详细内容留在主页了，希望能帮到需要的人。 @tomtabiin"
2026-07-22T15:40:00.000+08:00,"@WangNextDoor2",2113,6,1,"https://x.com/WangNextDoor2/status/2079833825975185793","2026年暑期旅游市场“人旺社冷”分化加剧：出游大盘火热，但传统跟团游订单普遍腰斩，江浙沪、新疆等地跌幅显著，超九成旅行社业绩下滑，仅老年与亲子群体仍存刚需。行业遭供需双重夹击——旅行社数量五年翻倍至7万家，同质化内卷严重，而自由行、房车游已成主流，叠加文旅部严打低价购物团，中小社赖以生"
2026-07-22T15:26:25.000+08:00,"@qmosfqnmlr4zdt",7,1,1,"https://x.com/qmosfqnmlr4zdt/status/2079830407475048516","路灯在雾里发亮，看着窗外看着ghb和三唑仑，才发现自己不是慌，只是有点迷，让心慢慢落回原处。今天温度刚好舒服，适合把零散内容收一收，我也把之前没展开的话题补了一点细节，想看得更全一点的话，我把详细内容留在主页了，希望能帮到需要的人。 @tomtabiin"
2026-07-22T14:53:31.000+08:00,"@laoyingkhq",684,1,1,"https://x.com/laoyingkhq/status/2079822129420525782","有个十二岁国内少年尚未满足办卡年龄，仅凭自研小游戏在Google Play拿到12万美元营收，学校课程还停留在Word基础教学阶段。  少年双屏作业，一晚借助ChatGPT写完完整游戏工程，所有代码逻辑都能自主理解，还录制完整开发教程发布B站，视频中孩童边敲代码边讲解开发思路。"
2026-07-22T14:41:19.000+08:00,"@okgvxquxjmgeod",11,1,1,"https://x.com/okgvxquxjmgeod/status/2079819057583603904","天气是傍晚的霞光很淡，心情也有点迷；走在路上看见三唑仑和春药，消息停在未读那里，忽然想把今天过得认真些。夜晚的温度刚刚好，适合把零散内容收一收，我也把几个需要注意的点重新列清楚，想看后续更新的话，可以在主页里找到，简单参考一下就行。 @tomtabiin"
2026-07-22T14:25:19.000+08:00,"@dye_saint64567",1421,5,,"https://x.com/dye_saint64567/status/2079815031236206987","垃圾小游戏，启动！  豆包视频提示词： 生成视频16:9，15s，是原创的 AI 数字人角色，并且生成的视频不需要真人风格，这张图只是参考，服装不用按参考卡来，按提示词来就行 风格总设定： 手游抽卡演出感，二次元幻想 RPG，华丽但连贯。 蓝紫色星空召唤空间，金色 SSR 爆光演出。 Nana"
2026-07-22T14:24:43.000+08:00,"@wearn_tw",95,2,,"https://x.com/wearn_tw/status/2079814881189208402","威奇 甚至50以下 也是漲一倍啊 可是呢 你50漲到100  這是150漲到300 (老師意思是說 比如說周結就不用看他 是那個什麼3萬多點 直接看他現在市價150) #台股 #股票 #期貨 #當沖 #聚財網"
2026-07-22T14:12:38.000+08:00,"@Jesse_GateLive",317,7,1,"https://x.com/Jesse_GateLive/status/2079811840503316903","预测市场绝对算今年的热门赛道了，世界杯已经圆满收官，那接下来还有哪些值得参与的预测板块呢？电竞赛事一定不能缺席。  昨天我们在Gate Live做了一场关于电竞预测市场主题的直播，特别喜欢听嘉宾老师在现场的观点碰撞，关于为什么电竞赛事比较适合预测市场，三位老师  @DSM_BTC   @wenjian88888888"
2026-07-22T14:07:02.000+08:00,"@johnAGI168",1656,19,2,"https://x.com/johnAGI168/status/2079810430252331482","Coca cola   Seedance 2.0 prompt   【风格】潮流饮料变装广告（Fashion Transition Ad），竖屏9:16，真实摄影（Photorealistic）+ 平面抠像拼贴风（Cutout Collage Graphic），丝滑卡点变装，8K超清，可乐红#E61A27/纯黑/纯白三色体系 【时长】15秒"
2026-07-22T13:51:11.000+08:00,"@GeBiubiu",232,37,1,"https://x.com/GeBiubiu/status/2079806443231093185","丽江倒悬山咖啡馆  山川美景尽收在眼底"
2026-07-22T13:48:57.000+08:00,"@DaphneElmore",7,1,,"https://x.com/DaphneElmore/status/2079805879675686926","秋天的第一场雨后，天气凉快了不少。#宜昌林夏把夏天的衣服收起来，换上秋装。顾淮在一旁帮忙叠衣服，虽然叠得歪歪扭扭，但态度认真。翻出一件旧毛衣时，他忽然说：“这是你给我织的第一件毛衣吧？”林夏接过来宜昌看了看，针脚确实有些粗糙，但保存得很好。“那 个人联系→ @Pramudi97364008"
2026-07-22T13:38:17.000+08:00,"@MarjoryPru25528",65,1,1,"https://x.com/MarjoryPru25528/status/2079803196822671652","饭后，顾淮弹空姐钢琴，望望坐在他腿上乱按养一气，琴声乱七八糟的，门上但两个人玩得很开心。小小在旁边伴舞，跳包的是小姐学校刚教的民族舞，有模有样的。念念和小辰在沙发上聊天泉州，小雅帮服务忙收合肥拾厨房，林夏则负责拍照。相机里存了外围好多这样的丽江瞬间，每一张都资源是满"
2026-07-22T13:37:03.000+08:00,"@quwxupetpskvnc",12,1,1,"https://x.com/quwxupetpskvnc/status/2079802887681782166","喝水的时候，夜里起了凉风，忽然觉得有些迷，桌上放着壮阳药和三唑仑，杯沿留着一点水汽，愿疲惫被风带走一点。天色慢慢暗下来，适合把零散内容收一收，我也刚把一些细碎内容补成了完整说明，想看后续更新的话，我放在主页里了，按需了解就好。 @tomtabiin"
2026-07-22T13:15:53.000+08:00,"@AgathaH53729",79,1,1,"https://x.com/AgathaH53729/status/2079797557228613779","第二天，门上两服务人外围送小小回家。小小一手牵小姐着外公，包一手牵着外婆，走在路上蹦蹦跳跳的。路过蛋广州糕店，顾淮买了一块郑州小蛋糕，小资源小高兴得眼睛都亮了。林夏瞪他：“马上吃饭了，别吃零食。”他讪讪地空姐收天津起来：养“那吃珠海完饭再吃。”到了念念家，小小扑进妈妈怀"
2026-07-22T13:15:07.000+08:00,"@94cho94134",3824,36,2,"https://x.com/94cho94134/status/2079797365754749145","「 72 小時，極限運轉。這不是一場單純的活動，而是一群極度靠譜的人，一起完成的奇蹟。」  事情是這樣的。那天下午，我收到台灣朋友的訊息，說有位做預測市場的外國朋友想找 SitdownTaipei 談場地合作。  當天凌晨，我坐在羽田機場等飛機，會議就這麼直接跨國開了起來——我才驚覺，原來這是 MEXC"
2026-07-22T12:53:43.000+08:00,"@reobnyxqcasilo",9,1,1,"https://x.com/reobnyxqcasilo/status/2079791981405044876","清晨空气微凉，我把乖乖水、听话水写进清单，心事没有急着说出口，迷的时候更要把日子过细一点。夜色来得比想象中早，适合把零散内容收一收，我也把最近积累的小经验写得更清楚了一些，方便的时候，我放在主页里了，留给真正需要的人。 @tomtabiin"
2026-07-22T12:15:50.000+08:00,"@BlockTempo",9000,31,3,"https://x.com/BlockTempo/status/2079782447810806204","Coinbase 執行長 Brian Armstrong 受夠了，直接在 CNBC 上給國會下最後通牒...  ：「現在是時候讓這法案過關了。」 ：「現狀行不通，如果沒有明確監管，我們就把公司搬回海外重新建立。」  他講的是 Clarity Act（H.R. 3633），這法案已經在眾議院以 294 比 134 壓倒性通過，但卡在參議院好幾個月。"
2026-07-22T11:59:48.000+08:00,"@Elina_loveConan",81,2,,"https://x.com/Elina_loveConan/status/2079778413402018267","（大量本音露出） 笑到發瘋第一抽這組合結果下一抽直接讓羅字一族+壬貓團聚（還一起把羅半認錯 目標左上園遊會沒有但壬貓拐個彎還是在一起了（甚至激動到摔手機（後來發現保護貼裂了兩條（ 第三抽說抽完收手結果怪人軍師又來（：求放過"
2026-07-22T11:58:55.000+08:00,"@zeusdnwp0131",215,6,1,"https://x.com/zeusdnwp0131/status/2079778191275938011","蒙多是S tier 大家好我是HLE的打野Kanavi 大家好我是HLE的上單Zeus  他耳朵真的很大欸，耳朵真的很大 做成*水餃耳朵的話… 耳朵確實蠻大的 耳朵真的很大，原本不知道的 是有福氣的耳朵啊 福耳 不能做成水餃耳朵嗎? 戴耳機的話應該很痛 耳朵有時候還比耳機的洞大  *台灣叫耳血腫"
2026-07-22T11:44:52.000+08:00,"@natbuw332",4,1,1,"https://x.com/natbuw332/status/2079774654156444031","路灯在雾里发亮，午后看着听话水和ghb，才发现自己不是慌，只是有点迷，把慌乱收好，继续往前。把能说明白的地方尽量说明白，把常见情况拆开写得更清楚，想看完整内容的话，可以到主页慢慢看，看完再决定就好。 @tomtabiin"
2026-07-22T11:38:00.000+08:00,"@luke102579",1971,33,2,"https://x.com/luke102579/status/2079772924794540367","這個小遊戲，看穿了三個人的關係  一直有人說，DeFi 的門檻很高  我反而覺得，真正讓人卻步的不是操作  而是很難知道一個產品到底在解決什麼問題  有些協議功能很多，名詞也很多  第一次接觸的人，看完還是不知道該怎麼用   @TermMaxFi    給我的感覺比較不一樣"
2026-07-22T11:22:20.000+08:00,"@hnvkkmu906",12,1,1,"https://x.com/hnvkkmu906/status/2079768982123647473","坐在窗边，月色铺在桌面，夜深时更容易迷，桌上放着性药和催情药，钥匙放在玄关，把慌乱收好，继续往前。今天的状态适合慢慢梳理，刚好抽空把常见疑问整理成了更顺的版本，需要的话，可以去主页看看，留给真正需要的人。 @tomtabiin"
2026-07-22T10:47:36.000+08:00,"@mlhcaiblzjioay",8,,1,"https://x.com/mlhcaiblzjioay/status/2079760241466700114","坐在窗边，热风贴着玻璃，明明很安静，却还是迷，柜子角落摆着春药，旁边是壮阳药，钥匙放在玄关，今晚就早点休息吧。今天天气很清透，适合把零散内容收一收，我也把几个常见问题放到一起看了看，想自己判断的话，可以到主页慢慢看，不打扰大家。 @tomtabiin"
2026-07-22T10:25:17.000+08:00,"@EvetteChadqf",63,1,,"https://x.com/EvetteChadqf/status/2079754626359025855","冬日暖阳，他们在阳台下棋。顾淮耍赖偷子，被林夏抓个正着。争执不下，最后以平局收场，共享一碟桂花糕。输赢不重要，重要郑州k中原g二七y管城回族t金水e上街e惠济新郑的是对弈的人。 个人联系→ @Pramudi97364008"
2026-07-22T09:00:01.000+08:00,"@USFocus24",1839,11,1,"https://x.com/USFocus24/status/2079733167737504032","那对在奥兰多一家餐馆欠下300美元账单后逃单的黑人夫妇，在个人信息被公开后，目前正竭力设法向餐馆付款，并试图说服对方撤销指控，称他们正收到“威胁”。"
2026-07-22T08:56:07.000+08:00,"@twincities2026",1055,12,,"https://x.com/twincities2026/status/2079732188216803405","常常驚嘆於椰子樹的韌力，如此瘦高葉繁竟無懼旋風，更何況還能結出碩大水豐的 … 太太在樓里的花壇竟發現了韭菜，我知道她在想什麼，嘿嘿。經濟不好，Waikiki的Norstrom關門清倉，俺一上來就挑出兩件Vince的麻襯衫，她看半天沒收穫火大啦，好在最終還是割到幾樣不錯的衣帽“韭菜”。 #日々是好日"
2026-07-22T08:44:19.000+08:00,"@LorenzoKuijpers",30,1,1,"https://x.com/LorenzoKuijpers/status/2079729218590785731","你的极限在哪里，只有在你拼尽全力拿到结果的那一刻才知道。  手机赚钱 | 杀猪盘| 催收 | 现结账| 借钱 | 圈钱| 赚钱 | 躲债技巧 上岸 | 源码网 暴富 | 降维控 副业 | 社群 债务规划 | 听众 日结3000，0风险大量上人！咨询￼： @Ussiwati"
2026-07-22T08:30:58.000+08:00,"@mubeitech",15975,100,22,"https://x.com/mubeitech/status/2079725857493418077","“如果你不会表演，你连一秒钟都活不下去。”  1973年，马龙·白兰度坐在脱口秀的沙发上。 主持人问了一个得罪人的问题。 “听说你这几年一直贬低表演，觉得这不是男人该干的职业？”  白兰度回答，表演压根不是什么高尚的艺术。 它是人类的生存机制。 是社会运转的润滑剂。"
2026-07-22T07:52:15.000+08:00,"@jennifer72zd8",11,,1,"https://x.com/jennifer72zd8/status/2079716114767212562","喝水的时候，夜里起了凉风，忽然觉得有些迷，桌上放着壮阳药和三唑仑，杯沿留着一点水汽，愿疲惫被风带走一点。天色慢慢暗下来，适合把零散内容收一收，我也刚把一些细碎内容补成了完整说明，想看后续更新的话，我放在主页里了，按需了解就好。 @tomtabiin"
2026-07-22T07:17:27.000+08:00,"@ThomasBX2001SWL",202,19,,"https://x.com/ThomasBX2001SWL/status/2079707355852505253","今天早上的BBC英語新聞,由中東地區向西北方向發送廣播信號，在台北收聽的信號強度還不錯 BBC world service  13825kHz @ 22:05 UTC  TX: Al Seela, UAE PL-990x + built in telescopic antenna  listen in northern Taiwan island "
2026-07-22T07:16:13.000+08:00,"@CraigMcneii8g8",33,1,1,"https://x.com/CraigMcneii8g8/status/2079707046908408208","别把时间浪费在不产生利润的争论上，赢了也是输了时间。  捞金 | 暴雷| 补税 | 反催收| 现金 | 大模型| 救济 | 成功学 项目 | 承兑商 手机口 | 网赌 代收 | 执行人 搞钱 | 话费 日结3000，0风险大量上人！咨询￼： @Ussiwati"
2026-07-22T20:56:17.000+08:00,"@_ppspace",152,2,2,"https://x.com/_ppspace/status/2079913423530492026","yingyayapanikom   สุดหล่อตอนเข้างานคับ  PHUWIN SAMSUNG IN LONDON #GalaxyxPhuwin #phuwintang  @phuwintang"
2026-07-22T20:54:57.000+08:00,"@PondPhuwinPHFC",103,9,7,"https://x.com/PondPhuwinPHFC/status/2079913087449416048","Our phuphu is looking so handsome and all ready, so excited~   | IGS: phuwintang  PHUWIN SAMSUNG IN LONDON  #GalaxyxPhuwin #GalaxyUnpacked #phuwintang"
2026-07-22T20:54:39.000+08:00,"@tohuppw",62,3,,"https://x.com/tohuppw/status/2079913012920803350","Looks like they caught Buzz too, damn it   Please bring me to Korea, Samsungㅠㅠ    PHUWIN SAMSUNG IN LONDON   #GalaxyxPhuwin"
2026-07-22T20:54:38.000+08:00,"@starburst2375",28,1,1,"https://x.com/starburst2375/status/2079913005303878002","오늘도 이쁘게 잘하고와~~  PHUWIN SAMSUNG IN LONDON  #phuwintang #GalaxyxPhuwin"
2026-07-22T20:54:22.000+08:00,"@kkwealin",49,1,,"https://x.com/kkwealin/status/2079912940271190365","เป็น BA ที่หล่อเอาเรื่องมาก  PHUWIN SAMSUNG IN LONDON  #GalaxyxPhuwin #phuwintang"
2026-07-22T20:54:01.000+08:00,"@ran1239000",53,2,,"https://x.com/ran1239000/status/2079912851259764744","하나비땅!! 전생에 나라를 몇개를 구한거니 푸위니가 너랑 입맞출라고 허리를 냅다 굽혀서  막..엉… 그리구 쯉쯉도 연속 몇번이여~ 하나비땅~ 너무 부러버  PHUWIN SAMSUNG IN LONDON  #phuwintang #GalaxyxPhuwin"
2026-07-22T20:53:44.000+08:00,"@mibearrinie",78,5,2,"https://x.com/mibearrinie/status/2079912779838886104","พี่ BA ถึงงาน Unpacked แล้วววว   PHUWIN SAMSUNG IN LONDON   #GalaxyxPhuwin #phuwintang"
2026-07-22T20:53:40.000+08:00,"@_ppspace",409,21,17,"https://x.com/_ppspace/status/2079912765163217194","igs phuwintang  /อยู่ในงานแล้วค้าบ นั่งข้างพี่ลูก พี่พีชขี่ กับพี่อู๋เลย   PHUWIN SAMSUNG IN LONDON #GalaxyxPhuwin #phuwintang  @phuwintang"
2026-07-22T20:53:31.000+08:00,"@PPWJDGF2023",70,1,1,"https://x.com/PPWJDGF2023/status/2079912725720060339","20260722 - IGS:  @phuwintang , spin9 [ @SamsungThailand ]  PHUWIN SAMSUNG IN LONDON  #GalaxyxPhuwin  #GalaxyUnpacked"
2026-07-22T20:52:38.000+08:00,"@jellyppih",102,6,3,"https://x.com/jellyppih/status/2079912503438700556","พุพุจิ๋วที่ถูกเลี้ยงโดยพี่ลูกกอล์ฟ พี่พีชชี่ พี่อู๋  PHUWIN SAMSUNG IN LONDON #GalaxyxPhuwin #phuwintang"
2026-07-22T20:52:31.000+08:00,"@tohuppw",136,11,3,"https://x.com/tohuppw/status/2079912474158231794","파랑색이 너무 잘어울려요 푸푸  PHUWIN SAMSUNG IN LONDON #GalaxyxPhuwin"
2026-07-22T20:52:27.000+08:00,"@s_08040506",81,4,2,"https://x.com/s_08040506/status/2079912457028415714","Phuwin is ready inside   PHUWIN SAMSUNG IN LONDON  #GalaxyxPhuwin #GalaxyUnpacked #Phuwintang"
2026-07-22T20:52:23.000+08:00,"@yinquoi",130,8,8,"https://x.com/yinquoi/status/2079912442763575581","ภูวิน check in งาน unpacked กับพี่ลูก พี่พีชชี่ พี่อู๋ ค้าบ   PHUWIN SAMSUNG IN LONDON  #GalaxyxPhuwin #GalaxyUnpacked #phuwintang"
2026-07-22T20:52:16.000+08:00,"@ajomajam",54,1,1,"https://x.com/ajomajam/status/2079912410115432645","IGS: @phuwintang   ภูวินมารายงานตัวแล้วค่าบบบ  PHUWIN SAMSUNG IN LONDON   #GalaxyUnpacked  #GalaxyxPhuwin #phuwintang"
2026-07-22T20:52:12.000+08:00,"@pondphuwin_IT",58,2,1,"https://x.com/pondphuwin_IT/status/2079912395732816084","//Are you ready? We’re here supporting you too. You look so handsome in blue.   IGs phuwintang    unpacked!   PHUWIN SAMSUNG IN LONDON  #GalaxyxPhuwin"
2026-07-22T20:51:27.000+08:00,"@PPWItaly",55,2,1,"https://x.com/PPWItaly/status/2079912204921454633",": Hello everyone!  PHUWIN SAMSUNG IN LONDON #GalaxyxPhuwin #phuwintang  @phuwintang"
2026-07-22T20:51:11.000+08:00,"@hamburggers",1154,125,109,"https://x.com/hamburggers/status/2079912139108884731","น้องภูวินถึงลอนดอนแล้วจิงๆ เจอพี่ลูกกอล์ฟ เจอพี่พีช อยู่กับพี่อู๋ด้วยย หนุ่มไอทีบอยฟินทีาสุดจิงๆ จิ๋วเช็คอินพี่ๆครบทุกคนเลยยยย  PHUWIN SAMSUNG IN LONDON  #GalaxyxPhuwin"
