timestamp,handle,views,likes,retweets,tweetUrl,text,topic
2026-07-23T07:57:42.000+08:00,"@StockWhaleMkt",129,,,"https://x.com/StockWhaleMkt/status/2080079872806785180","$MU   $SNDK  and  $DRAM   Don't let the next opportunity pass you by. I am still bullish on memory stocks for the future.   All my buy and sell signals in Discord @  http:// stockwhale.vip.","DRAM / NAND / HBM / EUV / AI chip"
2026-07-23T07:56:34.000+08:00,"@StockWhaleMkt",103,1,,"https://x.com/StockWhaleMkt/status/2080079589540315466","$MU   $SNDK  and  $DRAM   It's time to buy soon","DRAM / NAND / HBM / EUV / AI chip"
2026-07-23T07:38:55.000+08:00,"@S_NewsRoomCOM",82,,,"https://x.com/S_NewsRoomCOM/status/2080075145897484583","$MU  Micron Technology is getting treated like a utility with a foundry multiple. The real trade is whether HBM stays scarce long enough for the market to forget memory is usually a knife fight.  https:// stocknewsroom.com/micron-technol ogy-stock-split-100b/ … 2/2","DRAM / NAND / HBM / EUV / AI chip"
2026-07-23T07:09:43.000+08:00,"@dudette1508",22,1,,"https://x.com/dudette1508/status/2080067796508021012","Why cheap Chinese AI models (like Kimi K3) aren't the end of the AI chip trade.  Jevons paradox says cheaper models = higher usage = more data centers.  Data security concerns guarantee infrastructure remains in the West. ","DRAM / NAND / HBM / EUV / AI chip"
2026-07-23T06:52:06.000+08:00,"@COWhiskeyGuy",44,2,,"https://x.com/COWhiskeyGuy/status/2080063363955208665","Your Daily Dram of Colorado Whiskey   Molly Brown Spirits has a few bottles left of Milliken Jailbreak Single Barrel Select Bourbon.  It's a Cask Strength Bourbon finished in Amaretto Casks.  Have you heard of Molly Brown Spirits?","DRAM / NAND / HBM / EUV / AI chip"
2026-07-23T06:48:07.000+08:00,"@Hhhongmii",1979,11,1,"https://x.com/Hhhongmii/status/2080062363982815407","07/22/2026 美股盘后总结：美股仍处于困难模式  - 美元指数与石油仍强势，对市场有一定压制  - 大盘主要指数今日均收跌，且近期成交量较之前明显下降，成交量降低通常是好事，但目前没有在一些成长板块内看到任何亮眼的突破。  - 半导体  $SMH","DRAM / NAND / HBM / EUV / AI chip"
2026-07-23T06:36:10.000+08:00,"@XFreeze",6916,196,38,"https://x.com/XFreeze/status/2080059354347389171","Elon Musk said Tesla will soon reveal the location and full plans for Terafab and the announcement will get its own dedicated spotlight:  “Terafab is going to be an amazing initiative and a necessary one  Without it, we will be constrained in our ability to scale Optimus","DRAM / NAND / HBM / EUV / AI chip"
2026-07-23T05:43:44.000+08:00,"@midgecelight",60,3,1,"https://x.com/midgecelight/status/2080046157963657233","Ne kadar heyecanlanmıştık bu fragman geldiğinde....Sahte sevgililikte gram ilerleme göremedik. aras leylayi kullandi resmen Bu uyumu harcıyorsunuz. Cıvıl cıvıl, soft hissettiren bir çifti sürekli böyle dram dolu yazmayın ARTIK YETER","DRAM / NAND / HBM / EUV / AI chip"
2026-07-23T05:24:05.000+08:00,"@gaymerwaxman",13,,,"https://x.com/gaymerwaxman/status/2080041215278678189","おはようございます いい朝ですね！  よーくボールを見てください。見逃し厳禁ですよ。","DRAM / NAND / HBM / EUV / AI chip"
2026-07-23T04:48:26.000+08:00,"@hvoltzy",294,15,6,"https://x.com/hvoltzy/status/2080032242173419959","$DRAM  is a $200 ETF  This Wall Street Analyst says, ""WE'RE STILL EARLY FOR INVESTING IN MEMORY...IT'S NOT TOO LATE""  Micron  $MU  thesis still remains ($1,750 price target) Sandisk  $SNDK  ($3,000 price target)  The current pullback in memory stocks is healthy for long-term upside...","DRAM / NAND / HBM / EUV / AI chip"
2026-07-23T04:20:13.000+08:00,"@SeekingAlpha",3404,4,,"https://x.com/SeekingAlpha/status/2080025143443906695","AMD  $AMD  has teamed up with Anthropic on a massive multi-billion dollar AI chip and investment deal!  THE DEAL: AMD is investing $5B in Anthropic while locking in a huge 2GW order for its next-gen MI450 AI accelerators.  AI-DESIGNED CHIPS: AMD will also integrate Anthropic's","DRAM / NAND / HBM / EUV / AI chip"
2026-07-23T04:02:44.000+08:00,"@BillBrooklyn10",11884,31,3,"https://x.com/BillBrooklyn10/status/2080020743136407600","The AI industry chain remains a core market theme in July 2026. Here are 6 key stocks worth watching:   $NVDA : Absolute leader in AI computing power. Blackwell and Rubin ramping strongly, with data center demand staying extremely robust.   $AMD : Strongest challenger. Server CPU","DRAM / NAND / HBM / EUV / AI chip"
2026-07-23T03:58:40.000+08:00,"@mahperii_b",1291,103,8,"https://x.com/mahperii_b/status/2080019718644084905","esmeye kök soktürecek hala gazan mübarek olsuncok yanlış kişiye bulaştın Allah hepinize merhamet etsin çünkü o etmeyecek","DRAM / NAND / HBM / EUV / AI chip"
2026-07-23T03:53:42.000+08:00,"@luvianegra",156,15,,"https://x.com/luvianegra/status/2080018468900921834","gucenmem derken bile dram kasiyo gebertme ya seytan tuyu var resmen xihe bile kiyamiyosa..","DRAM / NAND / HBM / EUV / AI chip"
2026-07-23T02:47:19.000+08:00,"@PigsAndPlans",7121,129,14,"https://x.com/PigsAndPlans/status/2080001762300219688","Noname dropped her new track ""Squatter"" ft. DRAM ( @DRAMsaid ), the second single from her forthcoming mixtape 'Cartoon Radio.'   The track tells a story from her last tour, when a squatter moved into her house while she was abroad and she had to call in friends to get them out.","DRAM / NAND / HBM / EUV / AI chip"
2026-07-23T02:36:05.000+08:00,"@MTSlive",4767,35,5,"https://x.com/MTSlive/status/2079998934752399530","SITUATION EXPLAINED: Michael Kratsios published a major science policy report modeled on Vannevar Bush's 1945 ""Science: The Endless Frontier.""  • ""Science: A New Golden Age"" is explicitly framed as a successor to Vannevar Bush's 1945 report • Bush ran the WWII-era Office of","DRAM / NAND / HBM / EUV / AI chip"
2026-07-23T02:30:09.000+08:00,"@JoeTegtmeyer",11002,286,28,"https://x.com/JoeTegtmeyer/status/2079997443182321921","How does the Advanced Technology Chip fab (joint venture between  @Tesla  and  @SpaceX ) look today? Most of the progress is on the main foundation which for now appears rectangular, GeoPiers are at work on the part of the foundation that has had gravel mix placed on the top soil and","DRAM / NAND / HBM / EUV / AI chip"
2026-07-23T02:29:20.000+08:00,"@hostingnewsnow",20,,,"https://x.com/hostingnewsnow/status/2079997236696514763","AI is making more than GPUs expensive — OVHcloud says it's paying 6x more for RAM than last year, while DRAM prices nearly doubled in Q1 2026 as manufacturers shifted toward AI memory production.  Here's what it means for hosting providers and how they can prepare.  Read more:","DRAM / NAND / HBM / EUV / AI chip"
2026-07-23T02:04:49.000+08:00,"@NandRam420250",1,,,"https://x.com/NandRam420250/status/2079991068523921643","","DRAM / NAND / HBM / EUV / AI chip"
2026-07-23T01:56:34.000+08:00,"@NandRam420250",3,,,"https://x.com/NandRam420250/status/2079988989260620030","","DRAM / NAND / HBM / EUV / AI chip"
2026-07-23T01:49:45.000+08:00,"@herkesekubra",3305,360,34,"https://x.com/herkesekubra/status/2079987274003923408","YEAH LOOK AT THE TRANSITIONS QUICK","DRAM / NAND / HBM / EUV / AI chip"
2026-07-23T01:35:12.000+08:00,"@ElonClipsX",15227,311,63,"https://x.com/ElonClipsX/status/2079983612447818034","Here's Elon Musk explaining why the economy is about to go supernova.  “Once you have physical robots, then you essentially have unlimited capability. Physical robots.  I call Optimus the infinite money glitch.  Humanoid robots will improve by basically three things that are","DRAM / NAND / HBM / EUV / AI chip"
2026-07-23T01:25:45.000+08:00,"@askmiiiiiiii",2159,88,4,"https://x.com/askmiiiiiiii/status/2079981234764022016","“This heart will stop, this body will go into the ground, but I won't give up on you..” PERIOD Exactly, darling, he'll cheat   Come on, no need to think more, we'll think about it at the start of the season now.","DRAM / NAND / HBM / EUV / AI chip"
2026-07-23T01:21:58.000+08:00,"@nandyriani",9,,,"https://x.com/nandyriani/status/2079980283034743132","Gramed matraman&museum stamp book (akhhh gasabar ambil punyaku krn punyaku ada di depokk wkwk).","DRAM / NAND / HBM / EUV / AI chip"
2026-07-23T00:36:16.000+08:00,"@SchwabNetwork",1564,5,1,"https://x.com/SchwabNetwork/status/2079968784912146710",". @TomWhite_S  on  $AMD  and Anthropic signing a major AI chip and investment deal: It's more confirmation that the company is a competitor to  $NVDA  in the high-end GPU chip business.   For more market news, tune in at:  http:// SchwabNetwork.com/?CID=SM:Twitte M:Twitter:Organic:2026-7-22 …","DRAM / NAND / HBM / EUV / AI chip"
2026-07-23T00:31:46.000+08:00,"@Shrenikcc",14,,,"https://x.com/Shrenikcc/status/2079967649782501886","THIS GUY BUILT 100% LOCAL AI IMAGE EDITING INTO FINDER SO YOUR PHOTOS NEVER LEAVE YOUR MAC  the big cloud tools make you upload private photos and pay monthly, while your mac's neural engine sits unused. he flipped that  what it does:  > upscale images and remove backgrounds or","DRAM / NAND / HBM / EUV / AI chip"
2026-07-23T00:02:41.000+08:00,"@HBMNigeria",266,6,1,"https://x.com/HBMNigeria/status/2079960333280596144","Follow HBM Nigeria on LinkedIn now and be the first people to know about our latest updates, performance, stories, opportunities and more!  Click the link below and follow us right away!   https:// lnkd.in/e9BECD2i  #FollowHBMNigeria #Buildingthefuture","DRAM / NAND / HBM / EUV / AI chip"
2026-07-22T23:53:53.000+08:00,"@Aysu_su_Aysu",81,14,5,"https://x.com/Aysu_su_Aysu/status/2079958116448235780","Gazze'de yaşanan açlık ve insani dram, dünyanın vicdanına yöneltilmiş en ağır sorulardan biri olmaya devam ediyor.","DRAM / NAND / HBM / EUV / AI chip"
2026-07-22T23:51:50.000+08:00,"@NandRam420250",3,,,"https://x.com/NandRam420250/status/2079957602340118738","","DRAM / NAND / HBM / EUV / AI chip"
2026-07-22T23:45:27.000+08:00,"@semidoped",3911,32,2,"https://x.com/semidoped/status/2079955996546343049","AMD came in late to Nvidia's Hopper era and made one bet: more HBM per chip. Result? Some workloads that took 16 Nvidia GPUs ran on 8 Instinct.  Being late doesn't matter if you pick a vector nobody else did.  The question for Qualcomm inference aspirations: what's their vector?","DRAM / NAND / HBM / EUV / AI chip"
2026-07-22T23:43:20.000+08:00,"@BhanuNand",993,107,29,"https://x.com/BhanuNand/status/2079955461412155431","The current state of the country today has a huge contribution from the Godi media. The Godi media has never questioned those in power. It has only indulged in sycophancy, nothing else.","DRAM / NAND / HBM / EUV / AI chip"
2026-07-22T23:42:09.000+08:00,"@NandRam420250",2,,,"https://x.com/NandRam420250/status/2079955165160104437","","DRAM / NAND / HBM / EUV / AI chip"
2026-07-22T23:35:21.000+08:00,"@Nand859912661",34,,,"https://x.com/Nand859912661/status/2079953452600533172","मोहाली फेज 8बी बहुत बुरा हाल  #mcmohali  @MCMohaliSBM    @BhagwantMann   @McMohali22809","DRAM / NAND / HBM / EUV / AI chip"
2026-07-22T23:26:32.000+08:00,"@NandRam420250",4,,,"https://x.com/NandRam420250/status/2079951232463237485","","DRAM / NAND / HBM / EUV / AI chip"
2026-07-22T23:24:13.000+08:00,"@theallinpod",27536,182,23,"https://x.com/theallinpod/status/2079950649903529985","Former Intel CEO explains what broke the company: We let the bean counters push out the technologists   @Jason :  “You spent a long time at Intel, 34 years. Probably one of the greatest American companies ever, and then absolutely went off the rails. What were the mistakes?”  Pat","DRAM / NAND / HBM / EUV / AI chip"
2026-07-22T23:05:45.000+08:00,"@NandRam420250",2,,,"https://x.com/NandRam420250/status/2079946005831897577","","DRAM / NAND / HBM / EUV / AI chip"
2026-07-22T22:56:37.000+08:00,"@NandRam420250",2,,,"https://x.com/NandRam420250/status/2079943706506117425","","DRAM / NAND / HBM / EUV / AI chip"
2026-07-22T22:53:28.000+08:00,"@BhanuNand",2212,138,45,"https://x.com/BhanuNand/status/2079942911907795310","Today, in Bihar's capital Patna too, the situation was like Jantar Mantar—water cannons were used on students, tear gas shells were fired.  Protests against the government are happening everywhere.  But the government is refusing to accept Dharmendra Pradhan's resignation.","DRAM / NAND / HBM / EUV / AI chip"
2026-07-22T22:51:31.000+08:00,"@NandRam420250",3,,,"https://x.com/NandRam420250/status/2079942420695748838","","DRAM / NAND / HBM / EUV / AI chip"
2026-07-22T22:34:19.000+08:00,"@milkroaddaily",15215,13,4,"https://x.com/milkroaddaily/status/2079938091662688482","Kevin Warsh thinks AI chip demand is a temporary supply shock.  Other Fed governors think it's more extended inflation...  Novogratz: ""The bigger question in my mind is - do we really get the productivity dividend that drives down prices?""  ""I think we're literally in the first","DRAM / NAND / HBM / EUV / AI chip"
2026-07-22T22:07:16.000+08:00,"@BhanuNand",1028,111,32,"https://x.com/BhanuNand/status/2079931284474728892","The situation in the country is turning like 1857, with the public protesting everywhere  This picture is from Patna, the capital of Bihar","DRAM / NAND / HBM / EUV / AI chip"
2026-07-22T21:45:59.000+08:00,"@DeshondaBrough1",267,,,"https://x.com/DeshondaBrough1/status/2079925928655044939","It's decision-mode time soon for memory stocks like  $MU  ,  $SNDK , and  $DRAM .    In either case, I will be a constant buyer for the future every month rain or shine.","DRAM / NAND / HBM / EUV / AI chip"
2026-07-22T21:45:34.000+08:00,"@HTX_Live",290,1,,"https://x.com/HTX_Live/status/2079925826179727449","半导体一涨，手就容易痒？ 问题是，这根阳线不是全市场一起抬！ 等权标普只涨0.16%，更像资金抱团存储芯片和空头回补 美光、闪迪确实有HBM订单支撑  $MU   $SNDK  但联储鹰派、油价91美元、日元跌破163还在压风险偏好！ 今晚9分钟，聊清这波芯片行情能不能追，  $BTC  还能不能冲68,000","DRAM / NAND / HBM / EUV / AI chip"
2026-07-22T21:45:00.000+08:00,"@chrismadden_",101,1,,"https://x.com/chrismadden_/status/2079925681471787436","One machine. One company. Zero competitors.   @ASMLcompany 's High-NA EUV costs $400M, runs 40x hotter than the sun, and every AI chip on earth depends on it.   @intel  just became the first to ship commercial chips built with one. China is banned from buying it.  The most powerful","DRAM / NAND / HBM / EUV / AI chip"
2026-07-22T21:40:07.000+08:00,"@ximgjoqzltzpdz",157,,,"https://x.com/ximgjoqzltzpdz/status/2079924453778370657","Memory stocks are entering decision mode.  $MU   $SNDK   $DRAM  Could be volatility ahead. Could be opportunity. Either way, I’m staying consistent: Buying every month. Bull market or bear market. The future is built with patience. #Stocks #Investing #Semiconductors #AI #StockMarket","DRAM / NAND / HBM / EUV / AI chip"
2026-07-22T21:38:42.000+08:00,"@StaresAtCandles",176,1,,"https://x.com/StaresAtCandles/status/2079924098034028915","$DRAM   $SMH    My vibe this morning   Search and Destroy by The Stooges","DRAM / NAND / HBM / EUV / AI chip"
2026-07-22T21:29:00.000+08:00,"@Chaturinand11",37,,,"https://x.com/Chaturinand11/status/2079921657544921253","प्रदेश कांग्रेस कमेटी के निर्देशानुसार आज जिला कांग्रेस कमेटी महासमुंद द्वारा जिला अध्यक्ष एवं खल्लारी विधायक श्री द्वारिकाधीश यादव जी के नेतृत्व में आयोजित विरोध-प्रदर्शन में शामिल हुई।","DRAM / NAND / HBM / EUV / AI chip"
2026-07-22T21:25:52.000+08:00,"@CyrenaGuyot",214,,,"https://x.com/CyrenaGuyot/status/2079920867384201378","Recent reports suggest  $Apple may consider acquiring AI chip companies to strengthen its artificial intelligence strategy.  Currently, $Microsoft,  $META  ,  $AMZN  , and  $GOOG  have already made large scale investments in AI infrastructure.  If $Apple joins the M&A race, it could","DRAM / NAND / HBM / EUV / AI chip"
2026-07-22T21:21:54.000+08:00,"@BARTUTUNAN",46,,,"https://x.com/BARTUTUNAN/status/2079919870221635668","Bazı filmler eğlendirmez, hissettirir. Manchester by the Sea, kayıp, pişmanlık ve yaşamla yüzleşmeyi en gerçek haliyle anlatan unutulmaz bir dram.  #diziadam #manchesterbyethesea","DRAM / NAND / HBM / EUV / AI chip"
2026-07-22T21:19:13.000+08:00,"@BillBrooklyn10",15726,26,9,"https://x.com/BillBrooklyn10/status/2079919193202335927","Recent reports suggest $Apple may consider acquiring AI chip companies to strengthen its artificial intelligence strategy.   Currently, $Microsoft,  $META ,  $AMZN , and  $GOOG  have already made large scale investments in AI infrastructure.   If $Apple joins the M&A race, it could","DRAM / NAND / HBM / EUV / AI chip"
2026-07-22T20:47:56.000+08:00,"@alphaticaio",3381,19,2,"https://x.com/alphaticaio/status/2079911321424846943","AMD and Anthropic just announced a deal that reshapes the AI chip landscape.  Anthropic will purchase up to 2 gigawatts worth of AMD's latest generation AI chips. AMD will invest up to $5 billion in Anthropic.  Two gigawatts. To put that in perspective, a single large data center","DRAM / NAND / HBM / EUV / AI chip"
2026-07-22T19:35:32.000+08:00,"@BhanuNand",1854,196,54,"https://x.com/BhanuNand/status/2079893101712478605","In a democracy, questions will be asked, but only those questions will be asked that Leader Ji likes.","DRAM / NAND / HBM / EUV / AI chip"
2026-07-22T19:29:01.000+08:00,"@Kenjatina_og",192,4,1,"https://x.com/Kenjatina_og/status/2079891459696648536","Steve Hou, Head of Research at Silicon Data and a former Bloomberg strategist, says the GPU market is tightening again  Long-term rental prices are moving higher, older GPUs are still seeing strong demand, and the forward curves show that meaningful supply relief has yet to","DRAM / NAND / HBM / EUV / AI chip"
2026-07-22T19:00:18.000+08:00,"@da_c24",46,,,"https://x.com/da_c24/status/2079884233946832968","time’daki dram nand yarı iletken cart curt analizlerinin yoğunluk","DRAM / NAND / HBM / EUV / AI chip"
2026-07-22T18:57:03.000+08:00,"@mo_shawki2",74,,,"https://x.com/mo_shawki2/status/2079883415197753623","Left wing populism : he can't do anything about it but let's create a dram that I am about to do something about it.","DRAM / NAND / HBM / EUV / AI chip"
2026-07-22T18:09:50.000+08:00,"@rybar_america",47,1,,"https://x.com/rybar_america/status/2079871533581729918","Donald Trump has quickly softened his tone toward China after recently accusing Beijing of election interference and stealing voter data. He now says the incident happened long ago, that today’s China is different, and that the US also does similar things.  No sanctions or","DRAM / NAND / HBM / EUV / AI chip"
2026-07-23T09:45:32.000+08:00,"@lyncvia",0,,,"https://x.com/lyncvia/status/2080107010545033473","ai levei um tiro vou ter que beijar o namorado da minha melhor amiga","ai / 台積電 / memory / spacex"
2026-07-23T09:45:30.000+08:00,"@ProdByWalkz",0,,,"https://x.com/ProdByWalkz/status/2080107003003724209","Ai Milly on a Chappa Riddim is something I didn't know we needed slime4kt45","ai / 台積電 / memory / spacex"
2026-07-23T09:45:28.000+08:00,"@Ariana_Rivera_0",0,,,"https://x.com/Ariana_Rivera_0/status/2080106993885302818","Watch the future come to life!  This smart AI-powered robot is changing the game with incredible technology and innovation. Would you try one? ","ai / 台積電 / memory / spacex"
2026-07-23T09:45:22.000+08:00,"@TweetTVJP",0,,,"https://x.com/TweetTVJP/status/2080106968644235371","おっ、ｍRNAワクチンなどの遺伝子治療薬を使った「改造人間」研究まで踏み込むのか  https:// goto-medical.com/covid/mRNA.html AIを作り出した大富豪のショッカー創設者 【学研の図鑑】仮面ライダーの「改造人間」を研究する図鑑が予約開始。「改造人間のつくりかた」まで網羅…  https:// news.denfaminicogamer.jp/news/2607213b","ai / 台積電 / memory / spacex"
2026-07-23T09:45:18.000+08:00,"@Ariana_Rivera_0",0,,,"https://x.com/Ariana_Rivera_0/status/2080106951925776665","Watch the future come to life!  This smart AI-powered robot is changing the game with incredible technology and innovation. Would you try one? ","ai / 台積電 / memory / spacex"
2026-07-23T09:45:15.000+08:00,"@dioximetanfetam",1,,,"https://x.com/dioximetanfetam/status/2080106939707429197","eu e minha mae que estávamos analisando hospedagens no airbnb com o chatgpt ai mh mae falou assim “Pergunta ai a IAra”","ai / 台積電 / memory / spacex"
2026-07-23T09:45:13.000+08:00,"@JooSamuelSilva1",0,,,"https://x.com/JooSamuelSilva1/status/2080106931524399609","Complicado isso aí cara","ai / 台積電 / memory / spacex"
2026-07-23T09:45:12.000+08:00,"@SidneyMbre04",0,,,"https://x.com/SidneyMbre04/status/2080106925081895126","Individual vs. LLC: The AI Legal Trap #LLC #AILegal #Lawsuit #RealEstate #viralvideo #fypシ゚viral #cryptocurrency #fypシ゚viralシfypシ゚ #LLC #invest #fyop","ai / 台積電 / memory / spacex"
2026-07-23T09:45:00.000+08:00,"@a0610346",2,,,"https://x.com/a0610346/status/2080106875132236249","See the Real Returns of AI On-Chain Computing Power  Single Investment of $25,000, Net Profit of $9,602.5 in 23 Days  AI Robot Intelligent Mining + Bitcoin Asset Track, Decentralized Secure Contracts   Click 【Start Now】","ai / 台積電 / memory / spacex"
2026-07-23T09:45:00.000+08:00,"@RoundtableSpace",1156,,,"https://x.com/RoundtableSpace/status/2080106875089993810","A multi-model AI workflow combining Fable 5, GPT-5.6, and Grok 4.5 built a procedural planet generator that places terrain and vegetation dynamically.","ai / 台積電 / memory / spacex"
2026-07-23T09:44:48.000+08:00,"@ChiakiAkagi",0,,,"https://x.com/ChiakiAkagi/status/2080106824565760006","久しぶりのMidjourneyです カニと少女 #Midjourney #AIart","ai / 台積電 / memory / spacex"
2026-07-23T09:44:42.000+08:00,"@yguchis",2,,,"https://x.com/yguchis/status/2080106800850862307","então sou paciente  vc tá aprendendo  Eu finjo que não ta machucando  Ai porra Eles dizem que é uma virtude nao deixar um bom amor ir escapar Entao sou de boa e esqueço que eu aceito o que voce ta me dando Nada parece suficiente qndo eu sei implorei p isso","ai / 台積電 / memory / spacex"
2026-07-23T09:44:41.000+08:00,"@sabshart",8,,,"https://x.com/sabshart/status/2080106798745264167","tava zoando as minhas amigas ai chegou na minha vez de ser zoada e elas falaram q eu tenho cara de quem fala epa nenem dps de rir","ai / 台積電 / memory / spacex"
2026-07-23T09:44:41.000+08:00,"@beomgyuvidoca",2,,,"https://x.com/beomgyuvidoca/status/2080106797138919767","ai que episódio diabólico mesmo fiquei deprimidíssima também","ai / 台積電 / memory / spacex"
2026-07-23T09:44:41.000+08:00,"@l_lilitus2",2,,,"https://x.com/l_lilitus2/status/2080106796287451338","tatua aí pra mim esse vídeo da Sabrina frame por frame por favor","ai / 台積電 / memory / spacex"
2026-07-23T09:44:41.000+08:00,"@Yunmao1988",2,,,"https://x.com/Yunmao1988/status/2080106795759263925","王祖贤首部AI授权短片，真的美爆了！","ai / 台積電 / memory / spacex"
2026-07-23T09:44:39.000+08:00,"@mminmmin106",1,,,"https://x.com/mminmmin106/status/2080106788725342231","はじめまして！ 映像制作を行っているみなとです。 もしよろしければ担当させてください！ 納期は約2~3週間です。 参考動画を添付致します。 参考動画の為イラストは AIを使用しております 参考になれば幸いです。 よろしくお願い致します","ai / 台積電 / memory / spacex"
2026-07-23T09:44:31.000+08:00,"@aachan0115_",34,1,,"https://x.com/aachan0115_/status/2080106754508263697","今、注目の日本株8選  AI投資の拡大で、 半導体・データセンター関連に資金集中。 注目銘柄  ⑧ 住友電工（5802）  ⑦ 日立（6501）  ⑥ フジクラ（5803）  ⑤ JX金属（5016）  ④ 三菱重工（7011）   キオクシア（285A）   アドバンテスト（6857）   東京エレクトロン（8035）","ai / 台積電 / memory / spacex"
2026-07-23T09:44:20.000+08:00,"@RJROGERJ",0,,,"https://x.com/RJROGERJ/status/2080106710128009327","Aí idiotas ","ai / 台積電 / memory / spacex"
2026-07-23T09:44:14.000+08:00,"@mistyhymn",1,,,"https://x.com/mistyhymn/status/2080106683792064761","tava 0 interessada naquela série da elle aí descobri que tem uma personagem negra que vira o interesse romântico da que é lésbica masc e fiquei com vontade de assistir","ai / 台積電 / memory / spacex"
2026-07-23T09:44:10.000+08:00,"@MahoMahiro",28,1,,"https://x.com/MahoMahiro/status/2080106666574692546","一度だけ言っておく。 200株でいい。 準備金：30,000円 現値：65円 → 予測最高値：5,709円。 次の「キオクシア」となる可能性を秘めています！ （ジャパンディスプレイ＋225＋村田製作所） によるAIデータセンター向け需要の拡大が期待されています。","ai / 台積電 / memory / spacex"
2026-07-23T09:44:05.000+08:00,"@tmborim",2,,,"https://x.com/tmborim/status/2080106646630478021","Ai","ai / 台積電 / memory / spacex"
