timestamp,handle,displayName,followers,accountType,region,country,sentiment,sentimentScore,likes,retweets,replies,tweetUrl,text
2026-06-30T01:17:14.000Z,"@dnystedt","Dan Nystedt","51.5K","amplifier","Taiwan","Taiwan",positive,2.96,7,,,"https://x.com/dnystedt/status/2071764968685572411","TSMC share price targets are on the rise by foreign Investment banks ahead of its 2nd quarter conference July 16, media report: Firm         Rating     Price Target (12-month) Aletheia Buy          NT$3,500 UBS        Buy           NT$3,400 Macquarie Outperform   NT$3,380 CLSA"
2026-06-30T01:13:39.000Z,"@dnystedt","Dan Nystedt","51.5K","amplifier","Taiwan","Taiwan",negative,-4.215,5,,,"https://x.com/dnystedt/status/2071764067350659552","Supply chain signals have been disrupted and are causing anxiety about the peak season 3rd quarter media report, noting this year seems “volatile and treacherous” due to price hikes, shortages of key components – including memory, demand for early delivery by end clients"
2026-06-30T01:12:11.000Z,"@dnystedt","Dan Nystedt","51.5K","amplifier","Taiwan","Taiwan",neutral,0,1,,,"https://x.com/dnystedt/status/2071763696859423089","Links: Samsung:  https:// samsung.com/global/ir/repo rts-disclosures/public-disclosure-view.84685/ …  SK Hynix:  https:// news.skhynix.com/fact-05/  Reuters:  https:// reuters.com/business/media -telecom/key-facts-south-koreas-three-chip-ai-mega-projects-2026-06-29/ …"
2026-06-30T01:11:51.000Z,"@dnystedt","Dan Nystedt","51.5K","amplifier","Taiwan","Taiwan",positive,8.779,9,1,1,"https://x.com/dnystedt/status/2071763614718165241","South Korea Semiconductor Mega Projects:  Samsung will invest ₩2,100 trillion won (US$1.36 trillion) to boost semiconductors in South Korea through 2040.  SK Hynix plans long-term ₩1,100 trillion won chip spend, SK Group another ₩1,000 trillion for AI data centers.  SK Hynix:"
2026-06-30T01:10:57.000Z,"@aleabitoreddit","Serenity","881.1K","amplifier","International","International",positive,1.441,434,14,141,"https://x.com/aleabitoreddit/status/2071763387948859506","I've reached 900k followers, thank you everyone!  Just some reflection, it's actually a nightmare at higher counts...  Which is new to me, since I started at almost nothing earlier this year.  1. Threats of safety, which I don't enjoy.  - Random new accounts sending personal"
2026-06-30T01:07:13.000Z,"@jukan05","Jukan @ICML","155.3K","amplifier","South Korea","South Korea",positive,2.732,27,1,4,"https://x.com/jukan05/status/2071762447304995212","•v8: MTK’s v8t to start volume earlier than that of v8i •v9: MTK’s Humufish/Triggerfish is by now the only 2nm project  •v10: MTK’s Icefish to be solid, while others uncertain  Interesting. Didn’t North American sell-side / buy-side say that MediaTek’s v8t was progressing more"
2026-06-30T01:02:01.000Z,"@jukan05","Jukan @ICML","155.3K","amplifier","South Korea","South Korea",neutral,0,5,,1,"https://x.com/jukan05/status/2071761137767735720","https:// thebell.co.kr/front/newsview .asp?click=F&key=202606251503188200102732 …"
2026-06-30T01:02:00.000Z,"@jukan05","Jukan @ICML","155.3K","amplifier","South Korea","South Korea",neutral,0,60,7,6,"https://x.com/jukan05/status/2071761135980937521","Samsung Begins Full Scale Advance Development of ""1.4 Nanometer"" Process  Samsung Electronics is restarting its push toward commercializing the 1.4nm foundry process (SF1.4). The 1.4nm process, which was originally targeted for mass production in 2027, has had its schedule"
2026-06-30T00:13:56.000Z,"@bubbleboi","bubble boi","88.2K","amplifier","International","International",neutral,0,56,4,5,"https://x.com/bubbleboi/status/2071749036223435079","“Allegedly”"
2026-06-30T00:10:17.000Z,"@QQ_Timmy","駿HaYaO","28.6K","amplifier","Asia","Asia",neutral,0,19,1,,"https://x.com/QQ_Timmy/status/2071748120917266741","早安！6/30 外電綜合整理  - 2330台積電: 美系升目標 美系大行最新調研顯示近期台積電將其 3 奈米晶圓廠（Fab 18 P10/ 11/ 12） 的規劃改為 2 奈米（F2 P7/ 8/ 9），代表目前 2 奈米需求比一年前的規劃高出約 60kwpm。  換言之，到2028 年底，台積電 2 奈米＋3 奈米總產能 可能達 40 萬片/月，是 Intel"
2026-06-30T00:05:06.000Z,"@bubbleboi","bubble boi","88.2K","amplifier","International","International",negative,-4.767,10,,1,"https://x.com/bubbleboi/status/2071746816673231236","I’m wrong for a long time then boom all at once."
2026-06-30T01:30:30.000Z,"@HyperTechInvest","Daniel Romero","41.1K","amplifier","United States","United States",positive,4.926,,,,"https://x.com/HyperTechInvest/status/2071768306575344085","Thanks!"
2026-06-30T01:30:20.000Z,"@damnang2","Damnang2","35.4K","amplifier","United States","United States",neutral,0,,,1,"https://x.com/damnang2/status/2071768265366597732","How does X Money work? I’ve been searching everywhere, but I still can’t find out how to use it"
2026-06-30T01:30:01.000Z,"@damnang2","Damnang2","35.4K","amplifier","United States","United States",positive,8.58,1,,3,"https://x.com/damnang2/status/2071768183305031867","Super Congrats!!!!"
2026-06-30T01:24:36.000Z,"@sssjeffpu","Jeff Pu","33.7K","amplifier","Asia","Asia",negative,-0.516,10,,1,"https://x.com/sssjeffpu/status/2071766821292945497","Good comments From NVDA perspective, due to the limited area of compute tray, it is reasonable to chose 2-die instead of 4-die, as whatever the package is, a compute tray can only do 8 dies. As said, due to different design, MI550, assuming no further change, is expected to be"
2026-06-30T01:21:19.000Z,"@damnang2","Damnang2","35.4K","amplifier","United States","United States",neutral,0,,,,"https://x.com/damnang2/status/2071765993400291542","Hmm, I'm on premium+ too, but it's not showing up for me either."
2026-06-30T01:04:36.000Z,"@sssjeffpu","Jeff Pu","33.7K","amplifier","Asia","Asia",neutral,0,24,3,,"https://x.com/sssjeffpu/status/2071761786588778593","Abstract of MediaTek (2454 TT) Triggerfish Implications:    Triggerfish Implications: 1Higher ASPs — ~$18k vs Humufish $13k or Zebrafish $5.5k 2v9 Mix — Triggerfish to account for 50% of v9 (incl. Humufish)  3Content — 4x companion compute cores with large SRAM (~250MB x4), one"
2026-06-30T00:26:41.000Z,"@zephyr_z9","Zephyr","156.4K","amplifier","South Korea","South Korea",neutral,0,6,,,"https://x.com/zephyr_z9/status/2071752247160246551","Volume just doubled"
2026-06-30T00:14:38.000Z,"@HyperTechInvest","Daniel Romero","41.1K","amplifier","United States","United States",positive,3.626,2,,1,"https://x.com/HyperTechInvest/status/2071749212652359896","Much less mature industry than data centers"
2026-06-30T00:04:38.000Z,"@HyperTechInvest","Daniel Romero","41.1K","amplifier","United States","United States",positive,8.647,34,1,4,"https://x.com/HyperTechInvest/status/2071746697131102520","Why keep pushing FUD narratives with these hit pieces after Jensen endorsed them at the last GTC?  I can’t understand what they gain from this.  $NVDA  is the best partner you can hope for"
2026-06-30T01:27:18.000Z,"@SemiAnalysis_","SemiAnalysis","111.4K","competitor","International","International",positive,5.267,1,,1,"https://x.com/SemiAnalysis_/status/2071767500472115298","For comprehensive data on CXMT and leading memory players, please reach out to sales@semianlaysis.com and check out our Memory Model here: (6/6)"
2026-06-30T01:27:17.000Z,"@SemiAnalysis_","SemiAnalysis","111.4K","competitor","International","International",negative,-8.016,7,2,1,"https://x.com/SemiAnalysis_/status/2071767497489981676","What Does This Mean for the Memory Supercycle?  Some investors may misread our recent research on CXMT as a purely negative signal for the memory market. We think that interpretation misses the central point of this cycle: significant shortage.  Even as CXMT continues to add"
2026-06-30T01:27:17.000Z,"@SemiAnalysis_","SemiAnalysis","111.4K","competitor","International","International",negative,-0.699,4,1,1,"https://x.com/SemiAnalysis_/status/2071767495392805003","Market: Most of CXMT’s presence remains concentrated in China. Even where the company has begun qualifying or penetrating foreign PC, mobile, and consumer brands, its global share remains very very limited. Over time, broader international adoption will depend not only on pricing"
2026-06-30T01:27:16.000Z,"@SemiAnalysis_","SemiAnalysis","111.4K","competitor","International","International",positive,4.735,5,1,1,"https://x.com/SemiAnalysis_/status/2071767493069152367","Technology: CXMT still trails the incumbents by several generations in DRAM process technology, even as its existing nodes continue to improve and the company pushes forward with further innovation. The gap in HBM is even larger.  This challenge is likely to become more difficult"
2026-06-30T01:27:15.000Z,"@SemiAnalysis_","SemiAnalysis","111.4K","competitor","International","International",positive,4.588,5,2,1,"https://x.com/SemiAnalysis_/status/2071767490309308575","Equipment: The company continues to face export controls across a wide range of advanced semiconductor equipment required for both DRAM and HBM production, including EUV lithography, advanced etch tools, and TSV-related equipment. These restrictions remain a major constraint on"
2026-06-30T01:27:15.000Z,"@SemiAnalysis_","SemiAnalysis","111.4K","competitor","International","International",positive,5.574,21,3,1,"https://x.com/SemiAnalysis_/status/2071767487662768547","CXMT is now clearly the No. 4 DRAM player globally, and it aims to exert increasing pressure on leading memory suppliers such as SK Hynix, Samsung, and Micron. While the company has been expanding capacity, with further additions likely supported by significant cash flow"
2026-06-30T01:00:25.000Z,"@SemiAnalysis_","SemiAnalysis","111.4K","competitor","International","International",neutral,0,37,3,7,"https://x.com/SemiAnalysis_/status/2071760733897904631","What would the current state of AI be if non-competes were allowed in California?"
2026-06-30T00:16:38.000Z,"@dylan522p","Dylan Patel","140K","competitor","International","International",neutral,0,,,2,"https://x.com/dylan522p/status/2071749718124941519","We posted factual things."
2026-06-30T01:33:42.000Z,"@pequityresearch","P Equity Research ","8,899","amplifier","International","International",positive,5.719,1,,,"https://x.com/pequityresearch/status/2071769112515105236","This really gives you a perspective of how much Samsung is investing.   ""Did you know that if you spent a million dollars every single day since the year 1 AD, you still wouldn't even be close to spending 2.45 quadrillion won? That is exactly the staggering amount - W2,450"
2026-06-30T01:32:48.000Z,"@pequityresearch","P Equity Research ","8,899","amplifier","International","International",positive,7.506,,,,"https://x.com/pequityresearch/status/2071768884856656108","how is this even possible...soda is like 99% water lmao"
2026-06-30T01:27:55.000Z,"@pequityresearch","P Equity Research ","8,899","amplifier","International","International",neutral,0,1,,1,"https://x.com/pequityresearch/status/2071767656143724572","Its old news from march. it doesnt really do anything"
2026-06-30T01:25:51.000Z,"@qinbafrank","qinbafrank","145.9K","amplifier","International","International",neutral,0,9,,4,"https://x.com/qinbafrank/status/2071767138109415720","月末的卖压渐竭、市场承接力也在变大。昨晚的市场开盘一路走低，之后一路走高盘中算是一个深V反。能看出来开盘的卖压大，但市场能买回来，说明承接很强。  从产业角度上来看： 1）三星/海力士的十年资本开支计划带动了市场对于半导体设备、材料及测试环节的热情； 2）谷歌因Gemini"
2026-06-30T01:25:41.000Z,"@pequityresearch","P Equity Research ","8,899","amplifier","International","International",neutral,0,,,,"https://x.com/pequityresearch/status/2071767092290810002","but how long can this last sir?"
2026-06-30T01:24:30.000Z,"@vikramskr","Vikram Sekar","19.5K","amplifier","International","International",negative,-6.908,7,,,"https://x.com/vikramskr/status/2071766796877922800","NVIDIA canceling the 4-die Rubin Ultra version, and reverting to 2-die shows the limitations of CoWoS.  This has been known, and the way forward is to switch to glass cores which offers:  much lower warpage much lower loss large panel sizes  I've explained this before in a post"
2026-06-30T01:21:55.000Z,"@semivision_tw","SemiVision  ","11.7K","competitor","Taiwan","Taiwan",neutral,0,,,,"https://x.com/semivision_tw/status/2071766146060300493","3 Months ago…"
2026-06-30T01:21:13.000Z,"@pequityresearch","P Equity Research ","8,899","amplifier","International","International",positive,5.707,3,,4,"https://x.com/pequityresearch/status/2071765971698585988","congrats. big accomplishment!"
2026-06-30T01:17:40.000Z,"@pequityresearch","P Equity Research ","8,899","amplifier","International","International",positive,1.779,1,,1,"https://x.com/pequityresearch/status/2071765075585560829","yes, and the demand profile is entirely different. AI is catered for consumers and enterprise. humanoids arent going to capture any consumer demand."
2026-06-30T01:15:07.000Z,"@semivision_tw","SemiVision  ","11.7K","competitor","Taiwan","Taiwan",positive,5.859,5,1,1,"https://x.com/semivision_tw/status/2071764433764794368","Foundry, ASIC, and Advanced Packaging Are the Real Bet Beyond 2028 Beyond the earnings report itself, another area being rapidly repriced by the market is the long-term potential of Intel Foundry.  Yield progress on 18A is running ahead of internal expectations, and management"
2026-06-30T01:12:56.000Z,"@pequityresearch","P Equity Research ","8,899","amplifier","International","International",positive,6.597,3,,1,"https://x.com/pequityresearch/status/2071763883715362824","i agree, the high quality names are limited. also, its unlikely this ever becomes the largest investment spree in human history like AI has become. AI spending has the ability to proliferate into many different names, even niche names because thats how much spend is occuring. I"
2026-06-30T01:11:14.000Z,"@pequityresearch","P Equity Research ","8,899","amplifier","International","International",positive,2.96,,,1,"https://x.com/pequityresearch/status/2071763459604086812","what is their market share? if you know"
2026-06-30T01:10:53.000Z,"@pequityresearch","P Equity Research ","8,899","amplifier","International","International",neutral,0,2,,,"https://x.com/pequityresearch/status/2071763367987986865",""
2026-06-30T00:41:10.000Z,"@pequityresearch","P Equity Research ","8,899","amplifier","International","International",positive,4.215,2,,,"https://x.com/pequityresearch/status/2071755890139566301","nice"
2026-06-30T00:33:58.000Z,"@pequityresearch","P Equity Research ","8,899","amplifier","International","International",positive,2.422,24,4,,"https://x.com/pequityresearch/status/2071754077776593060","William Blair: Total Recall  > Over the last two decades, processor performance (FLOPS) has scaled at 3x every two years, while DRAM bandwidth has only improved by 1.6x every two years. This has created a compute-to-memory bandwidth performance gap exceeding a 600:1 ratio.  >"
2026-06-30T00:33:07.000Z,"@pequityresearch","P Equity Research ","8,899","amplifier","International","International",negative,-2.146,,,,"https://x.com/pequityresearch/status/2071753866576609393","i have no strong opinion but probably not. dell, hpe, and hon hai. only those 3"
2026-06-30T00:29:11.000Z,"@pequityresearch","P Equity Research ","8,899","amplifier","International","International",negative,-3.612,4,,,"https://x.com/pequityresearch/status/2071752875655450837","so tsmc's cowos = sucks"
2026-06-30T00:28:54.000Z,"@semivision_tw","SemiVision  ","11.7K","competitor","Taiwan","Taiwan",positive,4.404,,,,"https://x.com/semivision_tw/status/2071752803450761347","Good info"
2026-06-30T00:25:09.000Z,"@semivision_tw","SemiVision  ","11.7K","competitor","Taiwan","Taiwan",neutral,0,,,,"https://x.com/semivision_tw/status/2071751859220734008","Need diamonds"
2026-06-30T00:24:44.000Z,"@semivision_tw","SemiVision  ","11.7K","competitor","Taiwan","Taiwan",positive,4.404,1,,,"https://x.com/semivision_tw/status/2071751756648964272","Funny"
2026-06-30T00:15:39.000Z,"@pequityresearch","P Equity Research ","8,899","amplifier","International","International",neutral,0,,,,"https://x.com/pequityresearch/status/2071749468710453248",""
2026-06-30T00:13:34.000Z,"@semivision_tw","SemiVision  ","11.7K","competitor","Taiwan","Taiwan",neutral,0,1,,,"https://x.com/semivision_tw/status/2071748945018241036",""
2026-06-30T23:57:47.000Z,"@dnystedt","Dan Nystedt","51.5K","amplifier","Taiwan","Taiwan",positive,8.452,7,1,2,"https://x.com/dnystedt/status/2072107360185901536","Great to hear this from a small chip designer. TSMC has gotten so big, you always wonder if it still offers the same level of customer service - no matter the size of the client - that made it great."
2026-06-30T23:54:49.000Z,"@QQ_Timmy","駿HaYaO","28.6K","amplifier","Asia","Asia",neutral,0,22,4,,"https://x.com/QQ_Timmy/status/2072106614933561693","先進封裝中的玻璃基板 玻璃面板在半導體產業具備巨大潛力，尤其隨著先進封裝尺寸持續增大。其主要優勢包括：大尺寸時成本較低、優異的電氣性能（訊號損失低）、與矽晶圓熱膨脹係數匹配（可減少翹曲）、以及優越的機械強度。 高性能運算領域的實際應用，預計要到2028/2029年才會出現。  群創 $3481.TW："
2026-06-30T23:53:26.000Z,"@dnystedt","Dan Nystedt","51.5K","amplifier","Taiwan","Taiwan",positive,5.719,15,1,,"https://x.com/dnystedt/status/2072106266806386946","Qualcomm is expected to unveil its new 5G flagship chip, the Snapdragon 8 Elite Gen 6 series at the 2026 Snapdragon Summit, Sept. 22-24, media report, while analysts also hope to hear updates on 6G pre-commercial equipment. MediaTek is expected to unveil its next-gen 5G flagship"
2026-06-30T23:51:57.000Z,"@dnystedt","Dan Nystedt","51.5K","amplifier","Taiwan","Taiwan",negative,-7.047,13,1,1,"https://x.com/dnystedt/status/2072105893198762135","Smartphone consumers may feel more pain in 2027 as AI chips continue to outbid all others for chip production, media report, noting Qualcomm, MediaTek turned to 2nm to avoid 3nm, which is crowded with AI chips this year. But Big Cloud firms are aggressively moving to 2nm in 2027,"
2026-06-30T23:50:30.000Z,"@dnystedt","Dan Nystedt","51.5K","amplifier","Taiwan","Taiwan",negative,-7.764,22,5,,"https://x.com/dnystedt/status/2072105527388332165","GigaDevice, the China NOR Flash memory chip giant, warned that price quotes for its memory chip products are at an all-time-high and could face considerable downside risk which would negatively impact gross margins and profitability, media report, adding it also makes SLC NAND,"
2026-06-30T23:45:19.000Z,"@bubbleboi","bubble boi","88.2K","amplifier","International","International",positive,5.994,22,,3,"https://x.com/bubbleboi/status/2072104223672787396","TSMC just invested in them. So I assume TSMC lmao."
2026-06-30T23:42:42.000Z,"@bubbleboi","bubble boi","88.2K","amplifier","International","International",positive,7.645,309,13,13,"https://x.com/bubbleboi/status/2072103565087351003","Looks like TSMC took a stake in etched. First time I ever heard of them taking a stake in any chip company lol.   The low voltage inference looks to be hugely valuable."
2026-06-30T23:19:31.000Z,"@jukan05","Jukan @ICML","155.3K","amplifier","South Korea","South Korea",neutral,0,8,,2,"https://x.com/jukan05/status/2072097732601466933",""
2026-06-30T23:19:31.000Z,"@jukan05","Jukan @ICML","155.3K","amplifier","South Korea","South Korea",positive,3.612,80,13,9,"https://x.com/jukan05/status/2072097730722455674","• Taiwan’s leading passive components company, Yageo, has implemented price increases across its full capacitor solutions portfolio, including MLCCs, aluminum, tantalum, polymer, film, and supercapacitors. This marks one of the broadest price hikes the company has carried out in"
2026-06-30T23:19:13.000Z,"@dnystedt","Dan Nystedt","51.5K","amplifier","Taiwan","Taiwan",positive,2.732,15,1,,"https://x.com/dnystedt/status/2072097656038674452","Semiconductor packaging/testing firms have locked in orders through 2027 and hiked prices as Big Cloud seek long term agreements (LTAs) amid tight capacity, media report, adding price hikes also cover rising costs: Leadframe, substrates, probe cards, electricity (for testing),"
2026-06-30T23:06:08.000Z,"@jukan05","Jukan @ICML","155.3K","amplifier","South Korea","South Korea",neutral,0,3,,,"https://x.com/jukan05/status/2072094361383506394",""
2026-06-30T23:05:33.000Z,"@jukan05","Jukan @ICML","155.3K","amplifier","South Korea","South Korea",neutral,0,11,,1,"https://x.com/jukan05/status/2072094216176673252",""
2026-06-30T23:05:32.000Z,"@jukan05","Jukan @ICML","155.3K","amplifier","South Korea","South Korea",positive,4.019,167,14,20,"https://x.com/jukan05/status/2072094213483983268","Interesting. China is reportedly finally shipping T-Glass.  Nikkei: Guangyuan New Material has recently started shipping T-Glass."
2026-06-30T22:58:50.000Z,"@dnystedt","Dan Nystedt","51.5K","amplifier","Taiwan","Taiwan",positive,7.003,20,,1,"https://x.com/dnystedt/status/2072092525486363117","This is good. LTAs in past cycles have been thrown away during downturns. Pre-payments and co-payments for fabs/equipment are good ideas."
2026-06-30T22:54:35.000Z,"@dnystedt","Dan Nystedt","51.5K","amplifier","Taiwan","Taiwan",negative,-8.206,18,1,,"https://x.com/dnystedt/status/2072091456647709148","Something to keep an eye on. It's been an ongoing problem firms have to manage - not sure when/if it reaches crisis level. Everyone knows there are bottlenecks."
2026-06-30T22:50:26.000Z,"@dnystedt","Dan Nystedt","51.5K","amplifier","Taiwan","Taiwan",negative,-2.247,41,4,1,"https://x.com/dnystedt/status/2072090412387647962","Nomura: TSMC  $TSM  has turned highly aggressive, targeting CoWoS capacity of 2,000kpcs in 2027F (up from 1,100kpcs in 2026F) to defend against competing packaging technologies."
2026-06-30T22:48:59.000Z,"@dnystedt","Dan Nystedt","51.5K","amplifier","Taiwan","Taiwan",positive,6.808,25,3,3,"https://x.com/dnystedt/status/2072090049328644263","“TSMC's customer service is way better than I've seen at any company in any industry."" – Gavin Uberti, CEO of AI chip startup, Etched. Interesting company."
2026-06-30T22:46:47.000Z,"@dnystedt","Dan Nystedt","51.5K","amplifier","Taiwan","Taiwan",positive,2.96,44,5,,"https://x.com/dnystedt/status/2072089495504355418","SK Hynix filed for its US share listing under $SKHY"
2026-06-30T22:45:19.000Z,"@dnystedt","Dan Nystedt","51.5K","amplifier","Taiwan","Taiwan",positive,4.376,27,2,1,"https://x.com/dnystedt/status/2072089124232962262","Intel back in Silicon Valley, very cool!"
2026-06-30T22:07:45.000Z,"@bubbleboi","bubble boi","88.2K","amplifier","International","International",positive,4.215,3,,,"https://x.com/bubbleboi/status/2072079671043469783","lol his idea not mine"
2026-06-30T21:59:32.000Z,"@bubbleboi","bubble boi","88.2K","amplifier","International","International",neutral,0,106,9,7,"https://x.com/bubbleboi/status/2072077602534388184","Feynman on EMIB confirmed. "
2026-06-30T21:35:50.000Z,"@bubbleboi","bubble boi","88.2K","amplifier","International","International",neutral,0,15,,3,"https://x.com/bubbleboi/status/2072071637038698815","I have a hot guy instead."
2026-06-30T21:10:57.000Z,"@bubbleboi","bubble boi","88.2K","amplifier","International","International",neutral,0,78,1,5,"https://x.com/bubbleboi/status/2072065374921842771","I think I have a stalker."
2026-06-30T18:25:42.000Z,"@bubbleboi","bubble boi","88.2K","amplifier","International","International",positive,6.908,6,,1,"https://x.com/bubbleboi/status/2072023790301987246","Beast, congrats on the launch and I’m sure more to come."
2026-06-30T18:16:40.000Z,"@bubbleboi","bubble boi","88.2K","amplifier","International","International",positive,5.267,4,,,"https://x.com/bubbleboi/status/2072021514954875300","Congrats. Much more to come."
2026-06-30T17:24:41.000Z,"@aleabitoreddit","Serenity","881.1K","amplifier","International","International",negative,-2.263,97,1,5,"https://x.com/aleabitoreddit/status/2072008436292948376","Yeah I got Swedish to US conversion rates wrong. Will just make the correction in this comment"
2026-06-30T17:21:44.000Z,"@aleabitoreddit","Serenity","881.1K","amplifier","International","International",positive,3.182,1.3K,88,197,"https://x.com/aleabitoreddit/status/2072007692684837039","$SIVE is raising ~$61M (600M SEK) to expand manufacturing capacity for InP lasers and optical amplifiers.  Sivers operates as a fab-lite model so this is likely hinting at foundry allocation/scaling for CW DFB laser ramp across Jabil, and their other partners.    It could also"
2026-06-30T17:17:14.000Z,"@bubbleboi","bubble boi","88.2K","amplifier","International","International",neutral,0,7,,,"https://x.com/bubbleboi/status/2072006558788276461","It was literally the ultimate cheesing strategy "
2026-06-30T17:13:55.000Z,"@QQ_Timmy","駿HaYaO","28.6K","amplifier","Asia","Asia",neutral,0,25,1,,"https://x.com/QQ_Timmy/status/2072005724734181759","William Blair：Total Recall 過去二十年來，處理器效能（FLOPS）每兩年成長 3 倍，而 DRAM 頻寬每兩年僅提升 1.6 倍。這導致運算與記憶體頻寬之間的效能差距已超過 600:1。 大型語言模型（LLM）需要搬運大量資料（模型參數、上下文以及 KV cache），但資料重用率相對較低。當記憶體頻寬不足時，昂貴的"
