timestamp,handle,displayName,followers,accountType,region,country,sentiment,sentimentScore,likes,retweets,replies,tweetUrl,text
2026-07-20T17:28:20.000+08:00,"@wallstengine","Wall St Engine","159.1K","amplifier","International","International",negative,-4.215,144,20,6,"https://x.com/wallstengine/status/2079136312398172584","Morgan Stanley Comments on  $AAPL  AI Chips  Analyst comments: ""Last week, The Information reported that the performance of Apple's M2 Ultra AI server chip was 'struggling' and that Apple is on the lookout for chip acquisitions. Apple will rely on these M-series AI server chips to"
2026-07-20T17:20:53.000+08:00,"@wallstengine","Wall St Engine","159.1K","amplifier","International","International",positive,6.705,30,3,1,"https://x.com/wallstengine/status/2079134440148865025","Goldman Sachs Upgrades  $URBN  to Buy from Neutral, Raises PT to $93 from $76  Analyst comments: ""We upgrade shares of URBN to Buy from Neutral with a 12-month price target of $93. With Anthropologie brand execution risk now well appreciated, we believe management actions to reset"
2026-07-20T17:19:07.000+08:00,"@wallstengine","Wall St Engine","159.1K","amplifier","International","International",positive,5.994,41,3,1,"https://x.com/wallstengine/status/2079133996102062220","Goldman Sachs Upgrades  $YETI  to Buy from Neutral, Raises PT to $63 from $46  Analyst comments: ""Our latest channel checks and brand momentum work increase our conviction that YETI’s growth outlook is becoming more durable. Retailer feedback remained broadly constructive through"
2026-07-20T17:18:08.000+08:00,"@wallstengine","Wall St Engine","159.1K","amplifier","International","International",negative,-6.124,31,7,1,"https://x.com/wallstengine/status/2079133748784943135","Morgan Stanley Upgrades  $GPN  to Overweight from Equalweight, Raises PT to $100 from $65  Analyst comments: ""We are upgrading GPN to Overweight, as we think the setup has become increasingly asymmetric to the upside. First, checks on both Genius and Worldpay are turning more"
2026-07-20T17:17:14.000+08:00,"@wallstengine","Wall St Engine","159.1K","amplifier","International","International",positive,4.019,25,6,1,"https://x.com/wallstengine/status/2079133519654342684","Jefferies Upgrades  $FRVO  to Buy from Hold, Lowers PT to $34 from $41  Analyst comments: ""We upgrade FRVO to Buy after a ~40% pullback from May IPO highs, creating an improved risk-reward skew. Notably, EGS's risk profile has not changed since we initiated coverage—only investors'"
