timestamp,handle,displayName,followers,accountType,region,country,sentiment,sentimentScore,likes,retweets,replies,tweetUrl,text
2026-07-08T10:24:59.000+08:00,"@qinbafrank","qinbafrank","145.9K","amplifier","International","International",neutral,0,34,4,13,"https://x.com/qinbafrank/status/2074681121686900839","在腾讯里躲调整，6月23号让大家高看腾讯一眼，基本上call在最底部，两周过去15%左右，如果再看半导体跌的，当时挪了部分仓位那还是能对冲不少的。腾讯走强核心逻辑三点： 1、首先自然是微信Agent测试的驱动，"
2026-07-08T10:23:19.000+08:00,"@pequityresearch","P Equity Research ","8,899","amplifier","International","International",negative,-4.019,4,,1,"https://x.com/pequityresearch/status/2074680701073363331","damn look at that hair"
2026-07-08T10:18:10.000+08:00,"@pequityresearch","P Equity Research ","8,899","amplifier","International","International",positive,7.65,14,,,"https://x.com/pequityresearch/status/2074679403020226741","Mirae Asset Securities: Samsung Electro-Mechanics   > Estimate 2Q26 revenue at W3.3tr (+19% YoY) and operating profit at W414.3bn (+95% YoY), with the latter exceeding the consensus (W385.6bn) by 7.4%.  > Book-to-bill ratios at leading global MLCC players have already risen to"
2026-07-08T16:34:32.000+08:00,"@jukan05","Jukan @ ICML","155.3K","amplifier","South Korea","South Korea",positive,5.267,28,3,9,"https://x.com/jukan05/status/2074774120324276615","Morgan Stanley noted in its report that competition from Intel’s EMIB could push TSMC to accelerate CoPoS adoption to 2028, potentially with Feynman.  Interestingly, Morgan Stanley also estimated that Feynman will use D2W for GPU stacking and adopt a SiC carrier.   $TSM   $INTC"
2026-07-08T16:05:17.000+08:00,"@jukan05","Jukan @ ICML","155.3K","amplifier","South Korea","South Korea",neutral,0,4,,3,"https://x.com/jukan05/status/2074766759694147755","What I mean is that they may have built new chip design tools based on their own LLMs."
2026-07-08T15:59:13.000+08:00,"@jukan05","Jukan @ ICML","155.3K","amplifier","South Korea","South Korea",negative,-2.64,157,26,33,"https://x.com/jukan05/status/2074765232124408119","Some thoughts I’ve been having recently:  Could DeepSeek and Zhipu considering their own chips imply that China’s HBM self-sufficiency has already reached a certain level, or is at least on track to get there?  Also, is the EDA moat already starting to collapse? OpenAI reportedly"
2026-07-08T15:33:51.000+08:00,"@bubbleboi","bubble boi","88.2K","amplifier","International","International",neutral,0,1,,,"https://x.com/bubbleboi/status/2074758850058809717","I have a gf otherwise I would"
2026-07-08T14:46:34.000+08:00,"@bubbleboi","bubble boi","88.2K","amplifier","International","International",neutral,0,175,5,8,"https://x.com/bubbleboi/status/2074746949564285391","Wait until they figure out who’s buying the nand from them lmaoooooo"
2026-07-08T14:36:45.000+08:00,"@bubbleboi","bubble boi","88.2K","amplifier","International","International",neutral,0,1,,,"https://x.com/bubbleboi/status/2074744477747744895","Someone I used to work with"
2026-07-08T14:36:07.000+08:00,"@bubbleboi","bubble boi","88.2K","amplifier","International","International",positive,8.225,1,,1,"https://x.com/bubbleboi/status/2074744321694437522","Lmao yeah he’s like 53"
2026-07-08T13:54:53.000+08:00,"@QQ_Timmy","駿HaYaO","28.6K","amplifier","Asia","Asia",neutral,0,22,2,,"https://x.com/QQ_Timmy/status/2074733945158295654","在目前產能受限的環境下，業界最不需要的就是因堆疊良率降低而導致每座晶圓廠的位元產出減少。Kioxia 與三星皆在 VLSI 2026 發表了多陣列混合鍵合（hybrid bonded）NAND 架構，作為邁向 1000+ 層以實現最高密度的途徑。  Kioxia 的多堆疊單元陣列（Multi-Stacked cell"
2026-07-08T13:53:41.000+08:00,"@jukan05","Jukan @ ICML","155.3K","amplifier","South Korea","South Korea",neutral,0,25,,1,"https://x.com/jukan05/status/2074733641029280204",""
2026-07-08T13:44:28.000+08:00,"@jukan05","Jukan @ ICML","155.3K","amplifier","South Korea","South Korea",neutral,0,9,,1,"https://x.com/jukan05/status/2074731320182501555",""
2026-07-08T13:44:26.000+08:00,"@jukan05","Jukan @ ICML","155.3K","amplifier","South Korea","South Korea",neutral,0,151,18,28,"https://x.com/jukan05/status/2074731315052822880","@alexeheath 's latest reporting on Meta AI:  “He expects to surpass Opus-level performance this year with the big frontier model Meta is training, codenamed Watermelon.”   $META"
2026-07-08T13:40:52.000+08:00,"@bubbleboi","bubble boi","88.2K","amplifier","International","International",neutral,0,10,1,2,"https://x.com/bubbleboi/status/2074730418025492741","Big dogs move in silence"
2026-07-08T13:34:13.000+08:00,"@jukan05","Jukan @ ICML","155.3K","amplifier","South Korea","South Korea",negative,-2.5,157,11,19,"https://x.com/jukan05/status/2074728741679546535","""2027 capes est: US$73bn (below consensus $80-85bn), likely capped by EUV supply""  EUV shortage "
2026-07-08T13:28:46.000+08:00,"@QQ_Timmy","駿HaYaO","28.6K","amplifier","Asia","Asia",neutral,0,21,4,,"https://x.com/QQ_Timmy/status/2074727370737758697","英國《金融時報》7月8日報導，知情人士透露，蘋果公司已啟動長鑫存儲（CXMT）Dram芯片的測試，用於中國市場銷售的iPhone及其他設備。這是蘋果首次大規模測試中國本土Dram產品。"
2026-07-08T13:17:41.000+08:00,"@QQ_Timmy","駿HaYaO","28.6K","amplifier","Asia","Asia",neutral,0,25,,,"https://x.com/QQ_Timmy/status/2074724582339318214","台積電（2330 TT）財報前瞻摘要  AI 驅動前景穩健，短期略偏正面 財報前瞻 •  2026 年第 2 季營收：季增 11%（相較指導中值約 10%） •  2026 年第 2 季毛利率：約 68%（相較指導範圍 65.5-67.5%，彭博共識 67%，市場傳聞 69-70%） •  2026 年第 3 季營收：季增 13%（相較共識預期 +9%） •"
2026-07-08T16:40:45.000+08:00,"@zephyr_z9","Zephyr","156.4K","amplifier","South Korea","South Korea",neutral,0,5,,,"https://x.com/zephyr_z9/status/2074775685357535295","BRUH"
2026-07-08T16:08:58.000+08:00,"@zephyr_z9","Zephyr","156.4K","amplifier","South Korea","South Korea",neutral,0,5,,,"https://x.com/zephyr_z9/status/2074767686157139977","I think they may be working with versilicon or one of the new AI GPU companies (Biren/Enflame etc) in China Zhipu/Whale provides the specifications and the contractor designs it based on that"
2026-07-08T15:26:07.000+08:00,"@zephyr_z9","Zephyr","156.4K","amplifier","South Korea","South Korea",neutral,0,8,,,"https://x.com/zephyr_z9/status/2074756901297078778",""
2026-07-08T15:22:02.000+08:00,"@zephyr_z9","Zephyr","156.4K","amplifier","South Korea","South Korea",neutral,0,13,,1,"https://x.com/zephyr_z9/status/2074755877488546234","API tokens"
2026-07-08T15:20:33.000+08:00,"@zephyr_z9","Zephyr","156.4K","amplifier","South Korea","South Korea",neutral,0,157,17,12,"https://x.com/zephyr_z9/status/2074755502878470238","Semianalysis is forecasting that Anthropic is processing 5Q tokens per month in June, which will grow to 13Q tokens by December"
2026-07-08T14:35:36.000+08:00,"@zephyr_z9","Zephyr","156.4K","amplifier","South Korea","South Korea",negative,-3.4,140,12,9,"https://x.com/zephyr_z9/status/2074744191075365039","Crazy forecast"
2026-07-08T14:24:22.000+08:00,"@zephyr_z9","Zephyr","156.4K","amplifier","South Korea","South Korea",neutral,0,1,,,"https://x.com/zephyr_z9/status/2074741361425920468","The bar is much higher and it still gets mogged by OpenAI and ByteDance"
2026-07-08T14:23:35.000+08:00,"@HyperTechInvest","Daniel Romero","41.1K","amplifier","United States","United States",positive,8.519,241,43,16,"https://x.com/HyperTechInvest/status/2074741165912416573","SEMIANALYSIS: Anthropic To Reach $1B in Operating Profit in Q3  This is extremely bullish for the AI supercycle if true  Would be the first solid confirmation that investing in AI compute can, in fact, be profitable"
2026-07-08T14:14:07.000+08:00,"@HyperTechInvest","Daniel Romero","41.1K","amplifier","United States","United States",positive,2.023,174,14,20,"https://x.com/HyperTechInvest/status/2074738783312892255","BofA on memory  BofA reiterates its $1550  $MU  price target, with Micron as its top memory pick  Memory now represents 35–40% of cloud AI capex, 2–3x historical levels, yet memory stocks still trade at sub-10x forward P/E  BofA believes the market is underestimating the transition"
2026-07-08T14:12:56.000+08:00,"@HyperTechInvest","Daniel Romero","41.1K","amplifier","United States","United States",positive,2.023,26,4,16,"https://x.com/HyperTechInvest/status/2074738485882216805","BofA believes cheaper Chinese open-weight models are bullish for semis  By lowering the cost of intelligence, they expand usage and broaden deployment, increasing demand for compute, memory, networking, and power infrastructure  The bigger risk is to model economics, not"
2026-07-08T14:11:42.000+08:00,"@zephyr_z9","Zephyr","156.4K","amplifier","South Korea","South Korea",negative,-2.96,100,1,3,"https://x.com/zephyr_z9/status/2074738175050919966","No Mythos from Meta"
2026-07-08T14:10:51.000+08:00,"@zephyr_z9","Zephyr","156.4K","amplifier","South Korea","South Korea",neutral,0,1,,1,"https://x.com/zephyr_z9/status/2074737962982744396","Production for this year is 1.4M Ascends. HBM is the bottleneck for China. If they can hit 200k WPM of HBM capacity by 28, then they can produce 1.2M/month at 144GBe per chip"
2026-07-08T14:10:22.000+08:00,"@HyperTechInvest","Daniel Romero","41.1K","amplifier","United States","United States",neutral,0.258,45,9,12,"https://x.com/HyperTechInvest/status/2074737839728636159","BofA expects global AI infrastructure capex to reach $1.5T by 2027, up 30–50% YoY  Analyst Vivek Arya expects renewed momentum in 2H26 from memory ($MU), compute ($AMD,  $INTC ), and semicap ($AMAT,  $LRCX ,  $KLAC ,  $TER ), optics ($MTSI) and networking ($CRDO,  $MRVL )"
2026-07-08T14:07:16.000+08:00,"@HyperTechInvest","Daniel Romero","41.1K","amplifier","United States","United States",positive,4.939,14,1,12,"https://x.com/HyperTechInvest/status/2074737060540190925","BofA’s Vivek Arya says the current pullback is a healthy reset, not a structural change in AI demand  Near term, he favors lower-beta names such as  $NVDA ,  $TXN ,  $ADI ,  $CDNS , and  $SNPS    However, BofA expects renewed momentum after a period of consolidation"
2026-07-08T13:57:18.000+08:00,"@HyperTechInvest","Daniel Romero","41.1K","amplifier","United States","United States",positive,4.404,31,6,15,"https://x.com/HyperTechInvest/status/2074734552199610451","Hyperscaler capex is expected to hit 50% of revenue this year  Capex rising faster than revenue is not sustainable indefinitely, which means there are two possible scenarios:  - Revenue starts rising on a relative basis once hyperscalers achieve good ROI on capex  - Hyperscalers"
2026-07-08T13:56:09.000+08:00,"@zephyr_z9","Zephyr","156.4K","amplifier","South Korea","South Korea",positive,2.732,3,,,"https://x.com/zephyr_z9/status/2074734261152907355","well, they haven't implemented Dspark on it"
2026-07-08T13:52:59.000+08:00,"@zephyr_z9","Zephyr","156.4K","amplifier","South Korea","South Korea",positive,5.106,25,,1,"https://x.com/zephyr_z9/status/2074733465359249914","Impressive"
2026-07-08T13:18:16.000+08:00,"@zephyr_z9","Zephyr","156.4K","amplifier","South Korea","South Korea",neutral,0,4,,,"https://x.com/zephyr_z9/status/2074724729592983807","link??"
2026-07-08T16:13:43.000+08:00,"@ChipsandWafers","Chips & Wafers","8,593","competitor","International","International",neutral,0,1,1,,"https://x.com/ChipsandWafers/status/2074768883601346863","Taiwanese ABF revs at ATH in June and surpassed previous 2022 peak levels, but it's still early."
2026-07-08T16:40:31.000+08:00,"@qinbafrank","qinbafrank","145.9K","amplifier","International","International",neutral,0,,,,"https://x.com/qinbafrank/status/2074775628390494713","多谢iamai兄，token消耗应该会持续增加、只是不一定都到前沿闭源大模型了，如果Ai工程化之后单个企业ai支出成本能下降、但也能带动更多的企业加快采用AI的进程、总盘子是更大了的。"
2026-07-08T16:35:21.000+08:00,"@semivision_tw","SemiVision  ","11.7K","competitor","Taiwan","Taiwan",positive,3.182,1,,,"https://x.com/semivision_tw/status/2074774326356959384","Huge Typhoon is coming…."
2026-07-08T16:34:56.000+08:00,"@semivision_tw","SemiVision  ","11.7K","competitor","Taiwan","Taiwan",positive,3.182,2,,1,"https://x.com/semivision_tw/status/2074774219456750025","Pray"
2026-07-08T15:53:45.000+08:00,"@qinbafrank","qinbafrank","145.9K","amplifier","International","International",neutral,0,,,,"https://x.com/qinbafrank/status/2074763858619875328","多谢john"
2026-07-08T15:17:41.000+08:00,"@qinbafrank","qinbafrank","145.9K","amplifier","International","International",neutral,0,26,11,10,"https://x.com/qinbafrank/status/2074754779755295164","之前看AI商业化只盯着Authropic/OpenAIdeARR，未来超大CSP的业绩表现将会衡量AI商业化更重要的指标。为什么这么说？说说我的理解： 1、闭源大模型ARR这些数字极其重要，因为它们直接反映用户愿意为模型能力付费。但情况在发生变化："
2026-07-08T14:58:49.000+08:00,"@pequityresearch","P Equity Research ","8,899","amplifier","International","International",positive,4.588,52,14,4,"https://x.com/pequityresearch/status/2074750033816170954","SemiAnalysis has just come out with a report stating Anthropic's 3Q26 profit to reach over $1B."
2026-07-08T14:45:13.000+08:00,"@pequityresearch","P Equity Research ","8,899","amplifier","International","International",positive,4.497,,,,"https://x.com/pequityresearch/status/2074746609053716535","Good luck, and maybe you are right. But the rally it had was unjustified."
2026-07-08T14:40:27.000+08:00,"@pequityresearch","P Equity Research ","8,899","amplifier","International","International",positive,6.249,,,,"https://x.com/pequityresearch/status/2074745408731943367","Yes and no. Sivers is a high beta stock, so far more volatile but at the same time it went up like 1000% since late March up to its peak in mid June. Stocks that do that typically get hit harder."
2026-07-08T14:38:23.000+08:00,"@pequityresearch","P Equity Research ","8,899","amplifier","International","International",neutral,0,,,,"https://x.com/pequityresearch/status/2074744890508956145","I dont invest in small caps, I find most of them to be hype tbh"
2026-07-08T14:37:27.000+08:00,"@pequityresearch","P Equity Research ","8,899","amplifier","International","International",negative,-4.915,1,,,"https://x.com/pequityresearch/status/2074744657506979886","Thats fair. Im not saying he dumped, but the stock is moving like a pump and dump. Regardless of what people say, -60% drop this quick is not natural."
2026-07-08T14:32:19.000+08:00,"@pequityresearch","P Equity Research ","8,899","amplifier","International","International",neutral,0,1,,,"https://x.com/pequityresearch/status/2074743365552202215",""
2026-07-08T14:27:27.000+08:00,"@pequityresearch","P Equity Research ","8,899","amplifier","International","International",positive,9.001,3,,1,"https://x.com/pequityresearch/status/2074742137476813059","I vouch. Hes a great friend of mine and has excellent info"
2026-07-08T14:04:36.000+08:00,"@dmjk001","快讯","24.6K","amplifier","China","China",neutral,0,11,,1,"https://x.com/dmjk001/status/2074736388134818017",""
2026-07-08T14:01:17.000+08:00,"@pequityresearch","P Equity Research ","8,899","amplifier","International","International",neutral,0,1,,1,"https://x.com/pequityresearch/status/2074735553476497480",""
2026-07-08T13:45:59.000+08:00,"@pequityresearch","P Equity Research ","8,899","amplifier","International","International",neutral,0,1,,1,"https://x.com/pequityresearch/status/2074731705026412720","$ASML   @ariaradnia"
2026-07-08T13:31:54.000+08:00,"@pequityresearch","P Equity Research ","8,899","amplifier","International","International",neutral,0,2,,,"https://x.com/pequityresearch/status/2074728159497388080"," "
2026-07-08T12:57:00.000+08:00,"@dmjk001","快讯","24.6K","amplifier","China","China",neutral,0,4,,1,"https://x.com/dmjk001/status/2074719375417094234",""
2026-07-08T12:55:10.000+08:00,"@pequityresearch","P Equity Research ","8,899","amplifier","International","International",positive,4.215,1,,,"https://x.com/pequityresearch/status/2074718915905601707","nice"
2026-07-08T16:40:17.000+08:00,"@wallstengine","Wall St Engine","159.1K","amplifier","International","International",negative,-4.019,5,4,,"https://x.com/wallstengine/status/2074775569250824545","Apple lost its EU  General Court challenge over DMA rules applying to the App Store and iOS.  The court upheld Apple’s gatekeeper designation for both services and dismissed its iMessage claim.    $AAPL  is separately fighting a €500M App Store fine."
2026-07-08T16:32:37.000+08:00,"@wallstengine","Wall St Engine","159.1K","amplifier","International","International",neutral,0,29,5,2,"https://x.com/wallstengine/status/2074773638855938354","OIL IS SPIKING AFTER TRUMP SAID HE THINKS THE IRAN CEASEFIRE IS OVER."
2026-07-08T16:19:43.000+08:00,"@wallstengine","Wall St Engine","159.1K","amplifier","International","International",negative,-4.215,40,6,2,"https://x.com/wallstengine/status/2074770393253175555","TRUMP: AS FAR AS I'M CONCERNED, WASTE OF TIME DEALING WITH IRAN"
2026-07-08T16:18:15.000+08:00,"@wallstengine","Wall St Engine","159.1K","amplifier","International","International",neutral,0,55,31,4,"https://x.com/wallstengine/status/2074770021289701447","TRUMP: IRAN CEASEFIRE AND MOU ARE OVER I THINK"
2026-07-08T16:10:44.000+08:00,"@wallstengine","Wall St Engine","159.1K","amplifier","International","International",negative,-6.728,28,6,1,"https://x.com/wallstengine/status/2074768133425094793","TRUMP: SPAIN  IS A WASTED CAUSE, DON'T WANT TO DO TRADE... CUT OFF ALL TRADE WITH SPAIN, INCLUDING VISITS."
2026-07-08T16:10:02.000+08:00,"@wallstengine","Wall St Engine","159.1K","amplifier","International","International",negative,-7.096,33,4,1,"https://x.com/wallstengine/status/2074767955397865773","Trump: Iran are dirty players, they are 'scum'... We attacked Iran very powerfully last night... We hit them back after they shot rockets at ships in Strait"
2026-07-08T16:09:56.000+08:00,"@wallstengine","Wall St Engine","159.1K","amplifier","International","International",positive,3.818,12,3,,"https://x.com/wallstengine/status/2074767931263619262","Today's Key Events (All EST) — 07/08/2026  04:00: Trump to speak at Ankara NATO Summit 07:00: US MBA Mortgage Applications 10:00: US Wholesale Inventories MoM Revised 13:00: US 10-Year Note Auction 14:00: FOMC Meeting Minutes 15:00: US Consumer Credit  Before Open  06:45: Helen"
2026-07-08T23:37:24.000+08:00,"@QQ_Timmy","駿HaYaO","28.6K","amplifier","Asia","Asia",neutral,0,25,1,,"https://x.com/QQ_Timmy/status/2074880537710497946","國情咨文：辯論開放原始碼的顛覆性、記憶體的耐用性  產業概覽夏季調整、秋季反彈或可提供更佳機會"
2026-07-08T23:34:06.000+08:00,"@QQ_Timmy","駿HaYaO","28.6K","amplifier","Asia","Asia",neutral,0,33,3,1,"https://x.com/QQ_Timmy/status/2074879706252693643","美林證券：三星電機（Samsung Electro-Mechanics）  預估2026年第二季營收達3.3兆韓元（年增19%），營業利益為4,143億韓元（年增95%），後者較市場共識（3,856億韓元）高出7.4%。"
2026-07-08T23:30:58.000+08:00,"@QQ_Timmy","駿HaYaO","28.6K","amplifier","Asia","Asia",neutral,0,20,1,,"https://x.com/QQ_Timmy/status/2074878917920596450","儘管存在關鍵疑慮，仍具獨特成長特許權 儘管對英偉達股票存在一些關鍵疑慮（相較於 3 年期目標價上漲 79% 對比 S&P 500 上漲 82%），在此回應 4 個主要投資人疑慮： 1) 來自更高記憶體成本的毛利率壓力； 2) 自訂 ASIC 競爭； 3) 擁擠的投資人持股； 4) 現金的非生產性使用。"
2026-07-08T23:16:41.000+08:00,"@bubbleboi","bubble boi","88.2K","amplifier","International","International",positive,4.404,52,,1,"https://x.com/bubbleboi/status/2074875323653755267"," good point where are all the hacks now?"
2026-07-08T23:08:48.000+08:00,"@jukan05","Jukan @ ICML","155.3K","amplifier","South Korea","South Korea",negative,-5.423,66,2,3,"https://x.com/jukan05/status/2074873340146376728","My bad, that was a typo.  HAS APPROVED->IS SET TO SOON APPROVE"
2026-07-08T23:03:12.000+08:00,"@jukan05","Jukan @ ICML","155.3K","amplifier","South Korea","South Korea",neutral,0,26,1,3,"https://x.com/jukan05/status/2074871931724349680",""
2026-07-08T23:02:17.000+08:00,"@jukan05","Jukan @ ICML","155.3K","amplifier","South Korea","South Korea",positive,5.473,1.2K,228,71,"https://x.com/jukan05/status/2074871701616329193","CHINA’S GOVERNMENT HAS APPROVED PURCHASES OF 200,000 NVIDIA H200 CHIPS BY DEEPSEEK, BYTEDANCE, ALIBABA AND OTHERS FOR TRAINING PURPOSES."
2026-07-08T23:01:03.000+08:00,"@jukan05","Jukan @ ICML","155.3K","amplifier","South Korea","South Korea",neutral,-0.258,491,36,33,"https://x.com/jukan05/status/2074871392206754296","CHINA PLANS TO LET TOP AI FIRMS BUY LIMITED AMOUNT OF NVIDIA H200 CHIPS- THE INFORMATION"
2026-07-08T22:35:31.000+08:00,"@jukan05","Jukan @ ICML","155.3K","amplifier","South Korea","South Korea",neutral,0,330,8,3,"https://x.com/jukan05/status/2074864965551526121",""
2026-07-08T22:29:20.000+08:00,"@tculpan","Tim Culpan","18.5K","amplifier","Taiwan","Taiwan",neutral,0,2,,,"https://x.com/tculpan/status/2074863410035179861","Oh mate, I’ve been covering this sector a lot longer than you."
2026-07-08T21:42:06.000+08:00,"@QQ_Timmy","駿HaYaO","28.6K","amplifier","Asia","Asia",neutral,0,13,1,7,"https://x.com/QQ_Timmy/status/2074851522442113517","更好的 HY3，成長中的 WorkBuddy  - 騰訊 旗艦模型混元 3（Hunyuan 3，簡稱 HY3）已於 7 月 6 日正式推出，此前曾在 4 月 22 日進行預覽發布。最新版本在模型能力與成本效率上均帶來顯著提升，基準測試結果顯示其性能與同參數規模的其他領先模型大致處於同一水準。此外，WorkBuddy 持續獲得關注，據"
2026-07-08T21:38:54.000+08:00,"@tculpan","Tim Culpan","18.5K","amplifier","Taiwan","Taiwan",positive,4.501,1,,1,"https://x.com/tculpan/status/2074850718503293195","Same could be said for Nvidia’s claim.  I’m sure you’re calling them out on it too, right? Right?!"
2026-07-08T21:36:00.000+08:00,"@QQ_Timmy","駿HaYaO","28.6K","amplifier","Asia","Asia",neutral,0,78,7,6,"https://x.com/QQ_Timmy/status/2074849986337231150","ABF 基板 - 更強勁且提早到來的循環： 基板價格循環比原先預期更強勁且更早到來。在產能緊俏與強勁需求驅動下，產業整體毛利率正在擴張。  - 供應短缺持續擴大： 更新後的自下而上供需模型顯示，到 2030 年供應缺口將達到 25%（先前估計約 22%），這大幅提升了長期價格與毛利率上檔空間的信心。  -"
2026-07-08T21:22:26.000+08:00,"@aleabitoreddit","Serenity","881.1K","amplifier","International","International",positive,7.003,137,2,9,"https://x.com/aleabitoreddit/status/2074846572752539766","Let's say you have a avocado farm that's valued at $45.  The avocado farm next to you gets bought for $130. And the avocado farm leader is valued at $2000.  It's just a signal that your avocado farm might be relatively undervalued or where the avocado farm might be priced in the"
2026-07-08T21:12:01.000+08:00,"@jukan05","Jukan @ ICML","155.3K","amplifier","South Korea","South Korea",positive,4.019,31,,3,"https://x.com/jukan05/status/2074843949941113148","Western financial media clearly have an agenda to manipulate the market."
2026-07-08T21:11:04.000+08:00,"@aleabitoreddit","Serenity","881.1K","amplifier","International","International",positive,7.184,75,1,15,"https://x.com/aleabitoreddit/status/2074843710806978606","idk Spacemob hasn't been doing too well over the past year compared to bottleneck bros.   I think it's mainly just opportunity cost, even if I like  $ASTS  long term."
2026-07-08T21:05:56.000+08:00,"@aleabitoreddit","Serenity","881.1K","amplifier","International","International",positive,4.404,253,28,17,"https://x.com/aleabitoreddit/status/2074842421620527157","For this type of mapping with $SIVE, it's a good idea look at their partners and their timelines.  -  $JBL  confirmed via JPM fireside chat they have a relatively dramatic moat with their 1.6T LRO and are getting qualified done over next 1-4 months (2 months ago). So should be"
2026-07-08T20:49:57.000+08:00,"@aleabitoreddit","Serenity","881.1K","amplifier","International","International",positive,7.783,1.3K,117,285,"https://x.com/aleabitoreddit/status/2074838397341065516","Blue Origin reportedly raising $10B at a $130B valuation per NYT.  Seems pretty positive for  $RKLB ,  $ASTS , and other space names in terms of relative valuation anchoring.   If SpaceX and Blue Origin is able to set such high valuations."
2026-07-08T20:34:10.000+08:00,"@QQ_Timmy","駿HaYaO","28.6K","amplifier","Asia","Asia",neutral,0,30,,,"https://x.com/QQ_Timmy/status/2074834427889500525","三菱化學・日本製鋼所　次世代功率半導體材料生產能力增5成  兩家公司共同開發的氮化鎵（GaN）基板及種晶，生產能力將大幅提升。  目前客戶評估中的4吋基板需求正增加，同時也將加速推進6吋及8吋大尺寸基板的開發。   https:// nikkei.com/article/DGXZQO UC221UN0S6A620C2000000/ …"
