timestamp,handle,displayName,followers,accountType,region,country,sentiment,sentimentScore,likes,retweets,replies,tweetUrl,text
2026-07-20T03:25:47.000+08:00,"@bubbleboi","bubble boi","88.2K","amplifier","International","International",neutral,0,24,1,2,"https://x.com/bubbleboi/status/2078924278095860045","Let’s go Spain"
2026-07-20T02:54:49.000+08:00,"@bubbleboi","bubble boi","88.2K","amplifier","International","International",neutral,0,39,2,8,"https://x.com/bubbleboi/status/2078916486974849209","Tf does Tom Cruise know about fũtbol?"
2026-07-20T02:46:43.000+08:00,"@aleabitoreddit","Serenity","881.1K","amplifier","International","International",negative,-4.266,1.3K,85,162,"https://x.com/aleabitoreddit/status/2078914447180263438","There’s nothing quite like the scent of more AI capex on a Sunday.  Probably some ways to go if leading frontier models are out of capacity from too much demand."
2026-07-20T01:10:38.000+08:00,"@bubbleboi","bubble boi","88.2K","amplifier","International","International",neutral,0,133,1,21,"https://x.com/bubbleboi/status/2078890266442801281","Qwen is going to mogg Kimi"
2026-07-20T04:47:31.000+08:00,"@damnang2","Damnang","35.4K","amplifier","United States","United States",neutral,0,1,,1,"https://x.com/damnang2/status/2078944848003109290","True…"
2026-07-20T04:29:37.000+08:00,"@damnang2","Damnang","35.4K","amplifier","United States","United States",positive,5.08,,,,"https://x.com/damnang2/status/2078940342532059193","Yes!! "
2026-07-20T04:28:15.000+08:00,"@damnang2","Damnang","35.4K","amplifier","United States","United States",neutral,0,,,,"https://x.com/damnang2/status/2078940001258344695",""
2026-07-20T04:25:58.000+08:00,"@zephyr_z9","Zephyr","156.4K","amplifier","South Korea","South Korea",positive,5.04,88,3,7,"https://x.com/zephyr_z9/status/2078939425581711444","Why would they create cheaper alternatives?? It reduces the revenue generated per MW As u can see from this Semianalysis revenue model, 80% of Ant's revenue is coming from their top model"
2026-07-20T04:20:16.000+08:00,"@damnang2","Damnang","35.4K","amplifier","United States","United States",positive,7.43,,,,"https://x.com/damnang2/status/2078937990928412808","Thanks for your kind words "
2026-07-20T03:34:52.000+08:00,"@damnang2","Damnang","35.4K","amplifier","United States","United States",positive,1.779,26,3,3,"https://x.com/damnang2/status/2078926567762514173","In this article, I examine how the growing adoption of open models could affect hyperscaler investment in compute and memory.  The key questions are how much revenue could shift as workloads move toward open models and what level of reinvestment would be needed to offset that"
2026-07-20T03:23:11.000+08:00,"@zephyr_z9","Zephyr","156.4K","amplifier","South Korea","South Korea",neutral,0,213,8,4,"https://x.com/zephyr_z9/status/2078923625613422968","They don't need a blank check and considering how leading-edge capacity is coming in the next 4 years (even logic isn't a bottleneck) The real bottleneck is HBM and DRAM capacity"
2026-07-20T03:12:13.000+08:00,"@damnang2","Damnang","35.4K","amplifier","United States","United States",negative,-1.28,20,2,6,"https://x.com/damnang2/status/2078920866042438115","The arrival of Kimi K3 has brought open models back to the center of the AI debate. That attention is now leading to a much broader question. Will hyperscalers increasingly shift toward open models, and if they do, what will happen to semiconductor demand?  Has the market really"
2026-07-20T03:05:15.000+08:00,"@damnang2","Damnang","35.4K","amplifier","United States","United States",positive,6.124,,,1,"https://x.com/damnang2/status/2078919114438160883","One thing is for sure. It’s definitely hot right now...."
2026-07-20T03:03:57.000+08:00,"@damnang2","Damnang","35.4K","amplifier","United States","United States",neutral,0,12,1,3,"https://x.com/damnang2/status/2078918783926927362",""
2026-07-20T02:53:51.000+08:00,"@damnang2","Damnang","35.4K","amplifier","United States","United States",positive,2.755,,,,"https://x.com/damnang2/status/2078916241675432222","Not difficult"
2026-07-20T02:03:51.000+08:00,"@zephyr_z9","Zephyr","156.4K","amplifier","South Korea","South Korea",positive,7.269,102,3,5,"https://x.com/zephyr_z9/status/2078903660466303319","Pretty good"
2026-07-20T01:48:59.000+08:00,"@zephyr_z9","Zephyr","156.4K","amplifier","South Korea","South Korea",neutral,0,154,13,,"https://x.com/zephyr_z9/status/2078899918132167024","Bro.."
2026-07-20T01:45:08.000+08:00,"@damnang2","Damnang","35.4K","amplifier","United States","United States",neutral,0,1,,,"https://x.com/damnang2/status/2078898949138809163",""
2026-07-20T01:42:04.000+08:00,"@zephyr_z9","Zephyr","156.4K","amplifier","South Korea","South Korea",positive,8.143,134,7,9,"https://x.com/zephyr_z9/status/2078898180230635616",""".This does make me wonder whether Chinese regulators are weighing the decision behind closed doors"" LOL They are actually giving time to SgLang and vLLM and their inference partners, like TogetherAI, Baseten, to prepare the infra"
2026-07-20T01:33:04.000+08:00,"@HyperTechInvest","Daniel Romero","41.1K","amplifier","United States","United States",positive,3.818,50,3,9,"https://x.com/HyperTechInvest/status/2078895914593440201","You don’t get 30%+ drawdowns in AI companies during a bubble  It just doesn’t happen  > Either you think the bubble has already peaked and we’re experiencing the pop,  > Or you simply have to accept that we aren’t in one"
2026-07-20T01:28:58.000+08:00,"@HyperTechInvest","Daniel Romero","41.1K","amplifier","United States","United States",negative,-4.012,16,,,"https://x.com/HyperTechInvest/status/2078894883977486404","YTD returns are still at +73% following the recent drawdown  >  You get more criticism for being up 73% after having been up 140% than you do for posting a steady 20% return  Makes no sense to me, but volatility isn’t for everybody"
2026-07-20T01:26:53.000+08:00,"@damnang2","Damnang","35.4K","amplifier","United States","United States",positive,2.732,,,1,"https://x.com/damnang2/status/2078894357965611212","Agreed "
2026-07-20T01:18:06.000+08:00,"@HyperTechInvest","Daniel Romero","41.1K","amplifier","United States","United States",negative,-1.335,155,11,19,"https://x.com/HyperTechInvest/status/2078892147999465847","> Moonshot doesn’t have enough compute > OpenAI doesn’t have enough compute > Anthropic doesn’t have enough compute  The market: Let’s liquidate semis, neoclouds, and data center stocks  There are so many attractive valuations right now  This drawdown is retarded"
2026-07-20T01:11:56.000+08:00,"@zephyr_z9","Zephyr","156.4K","amplifier","South Korea","South Korea",negative,-1.779,85,,6,"https://x.com/zephyr_z9/status/2078890597193241051","nah tested it Post training is meh"
2026-07-20T09:20:24.000+08:00,"@bubbleboi","bubble boi","88.2K","amplifier","International","International",negative,-5.719,,,,"https://x.com/bubbleboi/status/2079013521942061179","I suggest you don’t draw comparisons and instead form an argument. There’s ~180 MB of state matrices you need to access for 3/4th of the layers and that needs to be fast.  The bottleneck isn’t kv retrieval it’s state manipulation."
2026-07-20T09:18:22.000+08:00,"@bubbleboi","bubble boi","88.2K","amplifier","International","International",neutral,0,,,,"https://x.com/bubbleboi/status/2079013011616919618","Ight man I’ll just prove that offloading the state vector to an ssd tomorrow is cooked."
2026-07-20T09:15:15.000+08:00,"@jukan05","Jukan","155.3K","amplifier","South Korea","South Korea",positive,5.994,6,,1,"https://x.com/jukan05/status/2079012227487789254","LMAO"
2026-07-20T09:11:01.000+08:00,"@dnystedt","Dan Nystedt","51.5K","amplifier","Taiwan","Taiwan",positive,5.423,1,,,"https://x.com/dnystedt/status/2079011160029106630","Last week, reports said Intel took back some production to its own fabs from TSMC, due to yield improvements, which also frees capacity for AMD to use..."
2026-07-20T09:06:14.000+08:00,"@jukan05","Jukan","155.3K","amplifier","South Korea","South Korea",negative,-1.28,10,,3,"https://x.com/jukan05/status/2079009955592695915","This guy just steals other people’s posts and reposts them lol."
2026-07-20T09:01:35.000+08:00,"@bubbleboi","bubble boi","88.2K","amplifier","International","International",neutral,0,2,,2,"https://x.com/bubbleboi/status/2079008787344531895","Until you guys inference it you won’t know. The checkpoints for state are the bulk of token throughput now."
2026-07-20T09:00:21.000+08:00,"@bubbleboi","bubble boi","88.2K","amplifier","International","International",neutral,0,3,,,"https://x.com/bubbleboi/status/2079008476903199072","Let’s find out"
2026-07-20T08:55:42.000+08:00,"@dnystedt","Dan Nystedt","51.5K","amplifier","Taiwan","Taiwan",positive,6.808,2,2,2,"https://x.com/dnystedt/status/2079007304033390889","AEMC (Advanced Echem), a specialty chemical maker and key TSMC supplier, will invest NT$4.52 billion (US$140M) on a new chemical plant and R&D lab in the Longtan Science Park in north Taiwan due to strong demand, media report. AEMC’s top products are used in 2nm production and"
2026-07-20T08:54:31.000+08:00,"@dnystedt","Dan Nystedt","51.5K","amplifier","Taiwan","Taiwan",neutral,0,11,3,3,"https://x.com/dnystedt/status/2079007008183980286","AMD’s latest chips made using TSMC’s 2nm production will debut this week at AMD Advancing AI 2026 conference (July 22-23), media report: Venice: 2nm server CPU Instinct MI450, MI455: 2nm AI accelerators to compete with Nvidia Rubin Instinct MI550 (rumored 4-compute-die design,"
2026-07-20T08:39:00.000+08:00,"@QQ_Timmy","駿HaYaO","28.6K","amplifier","Asia","Asia",neutral,0,19,1,1,"https://x.com/QQ_Timmy/status/2079003102196179162","摩根士丹利對味之素 ABF 的看法： 「對於 ABF，我們預期其出貨量與ASP同步提升，以加速成長。全年新廠貢獻（去年 10 月已投產）加上高規格 ABF 在 AI 等應用上的銷售比重提高，將帶動成長。隨著 CPU 與 GPU 朝向更大尺寸、更高層數的 ABF 產品發展，ABF 的銷售量與 ASP 均持續上升。  在 Flip Chip"
2026-07-20T08:36:00.000+08:00,"@QQ_Timmy","駿HaYaO","28.6K","amplifier","Asia","Asia",neutral,0,6,1,1,"https://x.com/QQ_Timmy/status/2079002347108463012","SK證券認為，半導體高點爭議源自於對LTA的誤讀。  LTA並非壓低價格的機制，而是客戶與供應商互相綁定的供應鎖定合約。 每份合約的確切數量、期限、預付款等條件各不相同，價格區間也不同，因此無法僅憑部分合約就判斷整體。"
2026-07-20T07:56:25.000+08:00,"@tculpan","Tim Culpan","18.5K","amplifier","Taiwan","Taiwan",positive,9.231,,,1,"https://x.com/tculpan/status/2078992386634772841","The beautiful game uses old tech and old chips in its fancy ball.  And that’s perfectly okay.   An important lesson on the virtues of being trailing edge."
2026-07-20T07:46:25.000+08:00,"@dnystedt","Dan Nystedt","51.5K","amplifier","Taiwan","Taiwan",positive,2.732,19,4,6,"https://x.com/dnystedt/status/2078989869918142970","TSMC and other high energy users may soon see costs rise: Taiwan lawmakers will on Wednesday (7/22) review a proposal to require major electricity consumers (TSMC is the biggest) to install their own power supply for 5MW or more power contracts, media report, noting around 400"
2026-07-20T07:45:46.000+08:00,"@dnystedt","Dan Nystedt","51.5K","amplifier","Taiwan","Taiwan",positive,8.519,25,9,3,"https://x.com/dnystedt/status/2078989708449980671","UMC, Taiwan’s 2nd biggest chip foundry, is looking to expand a fab in south Taiwan due to an overflow of advanced packaging and specialty AI-related orders (silicon interposers, DTC) from Qualcomm, Intel and SanDisk, media report, noting new plans for UMC’s Fab 12A P7 near"
2026-07-20T07:42:04.000+08:00,"@dnystedt","Dan Nystedt","51.5K","amplifier","Taiwan","Taiwan",positive,2.263,93,15,4,"https://x.com/dnystedt/status/2078988776983114124","SpaceX has placed its first orders for Nvidia GB300-based AI servers to Taiwan’s Foxconn, amid plans by Elon Musk’s company to buy 13,000 of them in all, worth an estimated US$52 billion, ($4M each), media report, citing unnamed industry sources. It’s the first time SpaceX has"
2026-07-20T07:07:15.000+08:00,"@dnystedt","Dan Nystedt","51.5K","amplifier","Taiwan","Taiwan",positive,7.766,18,1,3,"https://x.com/dnystedt/status/2078980013291184554","Interesting note: ""...in the end, open-weight models deter further AI capex.""  ""I am personally surprised the Chinese state continues to allow the open sourcing of models this good, given potential risks.""   ""One probable outcome of an open-weight-model-dominant world is full AI"
2026-07-20T06:59:03.000+08:00,"@jukan05","Jukan","155.3K","amplifier","South Korea","South Korea",neutral,0,16,,,"https://x.com/jukan05/status/2078977949374853203",""
2026-07-20T06:59:02.000+08:00,"@jukan05","Jukan","155.3K","amplifier","South Korea","South Korea",positive,2.96,527,38,19,"https://x.com/jukan05/status/2078977947457966417","FOXCONN HAS BROKEN DELL AND SUPERMICRO’S DUOPOLY BY WINNING ITS FIRST CONTRACT TO MANUFACTURE SPACEX’S NEXT-GENERATION AI SERVERS POWERED BY NVIDIA’S GB300.  - The project is reportedly worth approximately $52 billion, making it a massive deal.  - This order was not included in"
2026-07-20T08:26:31.000+08:00,"@damnang2","Damnang","35.4K","amplifier","United States","United States",neutral,0,1,,,"https://x.com/damnang2/status/2078999963066126400",""
2026-07-20T08:26:21.000+08:00,"@damnang2","Damnang","35.4K","amplifier","United States","United States",positive,3.4,,,,"https://x.com/damnang2/status/2078999918606438770","I think that’s certainly possible."
2026-07-20T00:53:49.000+08:00,"@zephyr_z9","Zephyr","156.4K","amplifier","South Korea","South Korea",positive,7.184,27,,2,"https://x.com/zephyr_z9/status/2078886036697190614","I'm talking about just the API (no free tokens or subscriptions), and GLM's gross margin would have improved significantly as they have adopted a modified DSA with the GLM-5 series  Active parameters are in the 60B-70B range, and K3 uses Kimi Linear Their Mooncake inference"
2026-07-20T00:42:08.000+08:00,"@damnang2","Damnang","35.4K","amplifier","United States","United States",positive,3.4,96,7,7,"https://x.com/damnang2/status/2078883096074817654","Jensen is basically giving us the answer key.  An open-book exam."
2026-07-20T00:35:46.000+08:00,"@damnang2","Damnang","35.4K","amplifier","United States","United States",neutral,0,264,7,12,"https://x.com/damnang2/status/2078881492848251149","GPU go! Memory go!"
2026-07-20T09:04:26.000+08:00,"@SemiAnalysis_","SemiAnalysis","111.4K","competitor","International","International",positive,3.612,15,,1,"https://x.com/SemiAnalysis_/status/2079009504960909330","Seems like you're more than an hour late"
2026-07-20T06:49:02.000+08:00,"@SemiAnalysis_","SemiAnalysis","111.4K","competitor","International","International",neutral,0,27,1,,"https://x.com/SemiAnalysis_/status/2078975429948346435","One general concern from the ML community is that, at the Kubernetes orchestration layer, AMD has yet to implement sufficient automated CI testing for its first-party Pollara NIC. Kubernetes is the layer used by most inference deployments worldwide. This isn’t because engineering"
2026-07-20T06:49:02.000+08:00,"@SemiAnalysis_","SemiAnalysis","111.4K","competitor","International","International",positive,4.588,36,1,1,"https://x.com/SemiAnalysis_/status/2078975428547506615","Note that Anthropic is still in the evaluation phase, and if AMD doesn’t announce Anthropic at its upcoming Advancing AI conference, that means  @AnushElangovan ’s FDE team has yet to address all of Anthropic’s concerns regarding software quality, and further improvement will be"
2026-07-20T06:49:01.000+08:00,"@SemiAnalysis_","SemiAnalysis","111.4K","competitor","International","International",positive,4.019,69,3,3,"https://x.com/SemiAnalysis_/status/2078975426358026661","In the AMD senior director’s public GitHub, the YAML code file lists Anthropic as a “customer” that is probably currently in the evaluation/testing phase. It shows that Anthropic has received the maximum 30 “priority boost points,” putting it in the same tier as existing"
2026-07-20T06:49:01.000+08:00,"@SemiAnalysis_","SemiAnalysis","111.4K","competitor","International","International",neutral,0,533,49,20,"https://x.com/SemiAnalysis_/status/2078975424709677359","ANTHROPIC WILL BE AN AMD CUSTOMER, ACCORDING TO THE PUBLIC GITHUB OF AMD’S SENIOR DIRECTOR OF AI    We explain the GitHub code and nuances below  1/4"
2026-07-20T08:57:19.000+08:00,"@pequityresearch","P Equity Research ","8,899","amplifier","International","International",positive,3.182,11,1,1,"https://x.com/pequityresearch/status/2079007711161647253","Morgan Stanley: GB200 and GB300 NVL72 Rack Shipments in June  Industry Overview  > June 2026 Performance: Total estimated GB200/300 rack output for June was approximately 8.0K units, representing a 5% month-over-month increase.    > Full-Year Forecast: The forecast remains at"
2026-07-20T08:56:24.000+08:00,"@dmjk001","快讯","24.6K","amplifier","China","China",neutral,0,6,,1,"https://x.com/dmjk001/status/2079007482584998396","周末利好汇总： 1、国家队增持 2、证监会今天开会 3、上市公司增持、券商增持 4、新易盛、天孚通信业绩超预期 5、茅台提价 6、美国正式终止了2020年那个针对港股的行政令，外资可以放开买港股了"
2026-07-20T08:34:20.000+08:00,"@semivision_tw","SemiVision  ","11.7K","competitor","Taiwan","Taiwan",neutral,0,1,1,,"https://x.com/semivision_tw/status/2079001928261148829","⋯⋯⋯"
2026-07-20T07:20:00.000+08:00,"@pequityresearch","P Equity Research ","8,899","amplifier","International","International",positive,3.818,34,7,2,"https://x.com/pequityresearch/status/2078983221417529603","Morgan Stanley on Ajinomoto ABF:  ""For ABF, we look for increases in volume & ASP to accelerate growth, with a full year new plant contribution (onstream last October) and higher sales weighting of high spec ABF for applications such as AI. A shift to larger and higher layer"
2026-07-20T07:19:56.000+08:00,"@dmjk001","快讯","24.6K","amplifier","China","China",neutral,0,14,,3,"https://x.com/dmjk001/status/2078983204485390359","鸿海首度夺下SpaceX AI伺服器代工订单。据悉，SpaceX执行长马斯克规划新建逾1.3万柜搭载辉达GB300的AI伺服器，以一柜单价400万美元估算，规模高达520亿美元（近新台币1.7兆元），且第一次委由鸿海操刀"
2026-07-20T04:54:58.000+08:00,"@pequityresearch","P Equity Research ","8,899","amplifier","International","International",neutral,0,20,1,1,"https://x.com/pequityresearch/status/2078946724870037693","Morgan Stanley: MLCC Supply Chain"
2026-07-20T03:10:48.000+08:00,"@pequityresearch","P Equity Research ","8,899","amplifier","International","International",positive,7.245,73,8,2,"https://x.com/pequityresearch/status/2078920510436409618","Jensen wins again.  ""Researchers need open source, developers need open source, companies around the world need open source. Open source models are really really important.""    $NVDA"
2026-07-20T02:42:36.000+08:00,"@pequityresearch","P Equity Research ","8,899","amplifier","International","International",positive,7.096,76,13,4,"https://x.com/pequityresearch/status/2078913413917372517","Morgan Stanley: Semiconductor Production Equipment  Market Dynamics by Application  > Segment Dominance: Logic/Foundry is the largest segment of the Wafer Fab Equipment (WFE) market. Within this segment, TSMC accounts for approximately 30–50% of the market.  > Industry"
2026-07-20T02:36:24.000+08:00,"@insane_analyst","Irrational Analysis","40.8K","amplifier","International","International",positive,3.515,309,17,34,"https://x.com/insane_analyst/status/2078911852520829300","Everyone in the ecosystem cant sustain 80%+ gross margins.   Market has been betting Nvidia gives up their share. Maybe they keep it.  Use brain to figure out who loses due to cheap open source models. It's not Mr. Leather Jacket."
2026-07-20T02:13:01.000+08:00,"@insane_analyst","Irrational Analysis","40.8K","amplifier","International","International",positive,3.182,13,,1,"https://x.com/insane_analyst/status/2078905965429297468","Buddy calm down."
2026-07-20T02:06:26.000+08:00,"@pequityresearch","P Equity Research ","8,899","amplifier","International","International",negative,-2.755,2,,,"https://x.com/pequityresearch/status/2078904310054736027","I dont like them"
2026-07-20T01:31:09.000+08:00,"@pequityresearch","P Equity Research ","8,899","amplifier","International","International",positive,1.513,48,7,1,"https://x.com/pequityresearch/status/2078895430293672197","Deutsche Bank: Chip Blip  > Leading-Edge Logic (<=2nm): This sector faces the most significant supply constraints. All categories (Accelerator, CPU, and Smartphone chipset) remain well below 100% throughout the entire forecast period. The lowest point is observed in 2027, with"
2026-07-20T01:16:09.000+08:00,"@pequityresearch","P Equity Research ","8,899","amplifier","International","International",neutral,0.258,17,,1,"https://x.com/pequityresearch/status/2078891656925892846","Compute is everything, and yes, expensive compute is part of the reason why OpenAI and Anthropic's models are expensive but this kind of competition ends up increasing overall compute demand. Compute will remain tight for several more years."
2026-07-20T01:09:01.000+08:00,"@pequityresearch","P Equity Research ","8,899","amplifier","International","International",neutral,0,,,,"https://x.com/pequityresearch/status/2078889859293266169",""
2026-07-20T00:39:12.000+08:00,"@pequityresearch","P Equity Research ","8,899","amplifier","International","International",positive,3.182,113,15,3,"https://x.com/pequityresearch/status/2078882359181557816","Cool short vid on  $ASML  EUV "
2026-07-20T00:30:59.000+08:00,"@pequityresearch","P Equity Research ","8,899","amplifier","International","International",positive,3.4,,,,"https://x.com/pequityresearch/status/2078880289879630037","They are successful because their products are addictive but they are harmful"
2026-07-20T00:23:24.000+08:00,"@insane_analyst","Irrational Analysis","40.8K","amplifier","International","International",neutral,0,159,15,9,"https://x.com/insane_analyst/status/2078878379428995256",""
2026-07-20T00:12:18.000+08:00,"@semivision_tw","SemiVision  ","11.7K","competitor","Taiwan","Taiwan",negative,-3.612,10,1,4,"https://x.com/semivision_tw/status/2078875587981295950","AI’s Moment of Disruption in Semiconductors Has Arrived Much Earlier Than Expected  Chinese AI startup Moonshot AI announced on July 17 that its latest foundation model, Kimi K3, autonomously completed the design of a functional semiconductor chip in just 48 hours using only"
2026-07-20T00:09:17.000+08:00,"@pequityresearch","P Equity Research ","8,899","amplifier","International","International",neutral,0,1,,,"https://x.com/pequityresearch/status/2078874828732338597",""
2026-07-20T00:09:09.000+08:00,"@pequityresearch","P Equity Research ","8,899","amplifier","International","International",neutral,0,220,6,19,"https://x.com/pequityresearch/status/2078874795312021968","Don't worry...very bearish for compute!"
2026-07-20T00:07:49.000+08:00,"@semivision_tw","SemiVision  ","11.7K","competitor","Taiwan","Taiwan",neutral,0,11,,1,"https://x.com/semivision_tw/status/2078874460741140955","Core EUV System Suppliers   https:// open.substack.com/pub/tspasemico nductor/p/asml-raises-its-2026-outlook-ais?r=4hpdhj&utm_medium=ios …"
2026-07-20T00:06:54.000+08:00,"@pequityresearch","P Equity Research ","8,899","amplifier","International","International",neutral,0,1,,2,"https://x.com/pequityresearch/status/2078874229143908436","I am. I am also thinking of adding more"
2026-07-20T00:05:18.000+08:00,"@pequityresearch","P Equity Research ","8,899","amplifier","International","International",positive,2.96,1,,1,"https://x.com/pequityresearch/status/2078873824892801118","Yep"
2026-07-20T09:02:37.000+08:00,"@wallstengine","Wall St Engine","159.1K","amplifier","International","International",neutral,0,1,,,"https://x.com/wallstengine/status/2079009044833173813",""
2026-07-20T09:02:08.000+08:00,"@wallstengine","Wall St Engine","159.1K","amplifier","International","International",neutral,0,2,,,"https://x.com/wallstengine/status/2079008925861699697",""
2026-07-20T08:37:50.000+08:00,"@wallstengine","Wall St Engine","159.1K","amplifier","International","International",neutral,0,55,4,14,"https://x.com/wallstengine/status/2079002809614451180","Moonshot AI, the company behind Kimi, is reportedly preparing for a Hong Kong IPO in as soon as 6 months after raising at a $30B+ valuation.  Note: Alibaba  $BABA  previously disclosed an approximately 36% stake in Moonshot, though later rounds may dilute that."
2026-07-20T08:31:29.000+08:00,"@wallstengine","Wall St Engine","159.1K","amplifier","International","International",positive,2.263,34,5,17,"https://x.com/wallstengine/status/2079001211794313646","Alibaba  $BABA  launched a preview of Qwen3.8 Max, a 2.4T-parameter flagship AI model, per Bloomberg.  Alibaba says the model rivals frontier AI systems and is second only to Anthropic’s Fable 5.  Developers can access it through Alibaba coding platforms including Qoder, with"
2026-07-20T08:31:10.000+08:00,"@wallstengine","Wall St Engine","159.1K","amplifier","International","International",neutral,0,31,5,8,"https://x.com/wallstengine/status/2079001130265407494","Tempus  $TEM  highlighted real-world NHS results for Paige Prostate AI, published in Nature Digital Medicine.  Across 1,000+ prostate biopsy patients, AI-assisted review led to an updated diagnosis or Grade Group in 5% of cases, with 1.3% potentially changing clinical management."
