timestamp,handle,displayName,followers,accountType,region,country,sentiment,sentimentScore,likes,retweets,replies,tweetUrl,text
2026-07-14T06:58:38.000+08:00,"@SemiAnalysis_","SemiAnalysis","111.4K","competitor","International","International",positive,6.808,2,,,"https://x.com/SemiAnalysis_/status/2076803516690038866","It's hilarious that you think it's unfair to say vLLM maintainers have dropped AMD support in their RL framework because AMD shifted engineers away from vLLM towards ATOM. Good one, buddy.  Community vLLM maintainers want to help AMD, and we want to help AMD too, but as the"
2026-07-14T05:52:40.000+08:00,"@SemiAnalysis_","SemiAnalysis","111.4K","competitor","International","International",positive,3.313,5,,1,"https://x.com/SemiAnalysis_/status/2076786918663098728","What are u talking about? tpu-inference is literally in the vllm-project org & endorsed by community vLLM maintainers?"
2026-07-14T05:00:38.000+08:00,"@SemiAnalysis_","SemiAnalysis","111.4K","competitor","International","International",neutral,0,38,2,1,"https://x.com/SemiAnalysis_/status/2076773821428703307","This is why we built ChipBook: our internal OSINT machine for the semiconductor supply chain. Trade flows, inventory, production — tracked continuously, from WFE to PCBs, so the signal shows up before the change in narrative does. (10/10)"
2026-07-14T05:00:37.000+08:00,"@SemiAnalysis_","SemiAnalysis","111.4K","competitor","International","International",positive,8.074,24,1,1,"https://x.com/SemiAnalysis_/status/2076773819906142462","OSINT never gives you the full picture — it gives you the puzzle pieces. It won't tell you the date of the strike or the exact quarter the cycle turns.  But it generates signals — early, verifiable, and yes, at times a little rough — that give you an intelligent edge over"
2026-07-14T05:00:37.000+08:00,"@SemiAnalysis_","SemiAnalysis","111.4K","competitor","International","International",positive,3.612,15,1,1,"https://x.com/SemiAnalysis_/status/2076773818241056830","Here we are 12 months later, and everyone caught up.  The signals were public months before the move. Trade data and inventory levels don't require a terminal or human asset on the ground — they require attention. (8/10)"
2026-07-14T05:00:37.000+08:00,"@SemiAnalysis_","SemiAnalysis","111.4K","competitor","International","International",neutral,0,15,,1,"https://x.com/SemiAnalysis_/status/2076773816919859566"," Signal #2: memory IC exports from the non-HBM countries — Taiwan and China — started rising fast.  HBM drove Korean memory exports through 2023–2024, while China and Taiwan were merely recovering from the post-COVID glut. But in H2 2025, their exports began rising materially —"
2026-07-14T05:00:36.000+08:00,"@SemiAnalysis_","SemiAnalysis","111.4K","competitor","International","International",neutral,0,25,1,1,"https://x.com/SemiAnalysis_/status/2076773815527342471"," Signal #1: Taiwanese mainstream DRAM inventory — bloated for years — recorded its first sequential decline after peak levels.  When commodity DRAM inventory turns after a multi-year build, something structural might be changing downstream. (6/10)"
2026-07-14T05:00:36.000+08:00,"@SemiAnalysis_","SemiAnalysis","111.4K","competitor","International","International",positive,1.531,55,3,1,"https://x.com/SemiAnalysis_/status/2076773814101332320","A year ago, memory was the most uninteresting layer of the AI supply chain.  All attention was on accelerators, DC construction, and power. Non-HBM DRAM, NAND, SSDs etc.  were a sleepy, cyclical commodities nobody wanted to touch.  We decided to be careful observers, and tried to"
2026-07-14T05:00:36.000+08:00,"@SemiAnalysis_","SemiAnalysis","111.4K","competitor","International","International",positive,8.75,18,1,1,"https://x.com/SemiAnalysis_/status/2076773812582928720","None of this data was secret. Flight trackers, port logs, satellite imagery — all open source and freely shared on X.  So even though it was hard to determine on which day Trump would pull the trigger, it was pretty easy to establish that there aren’t many reasons to bring"
2026-07-14T05:00:35.000+08:00,"@SemiAnalysis_","SemiAnalysis","111.4K","competitor","International","International",negative,-1.28,22,,2,"https://x.com/SemiAnalysis_/status/2076773811094012369","Additionally, here one could see how U.S. F-22 Raptor stealth fighters were amassing at the Israeli Uvda Air Base, with Patriot missile components being set up on site, and new tarmacs being constructed. (3/10)"
2026-07-14T05:00:35.000+08:00,"@SemiAnalysis_","SemiAnalysis","111.4K","competitor","International","International",negative,-1.28,30,,2,"https://x.com/SemiAnalysis_/status/2076773810020257937","Before the first strike ever came down on Tehran, OSINT accounts right here on this platform were tracking the military buildup in the Middle East in near real time.  Here for example one could see how leading up to the 28th, 333 (at a minimum) C-5 and C-17 transport aircraft"
2026-07-14T05:00:35.000+08:00,"@SemiAnalysis_","SemiAnalysis","111.4K","competitor","International","International",positive,6.073,228,16,6,"https://x.com/SemiAnalysis_/status/2076773808027980271","On Feb 28th 2026, the United States launched Operation “Epic Fury” against Iran.   Markets and media were caught off guard, but careful and diligent observers were hardly surprised.   The signals sat in plain sight for weeks, you just had to know where to look. A thread on OSINT"
2026-07-14T04:30:55.000+08:00,"@SemiAnalysis_","SemiAnalysis","111.4K","competitor","International","International",positive,5.163,17,,1,"https://x.com/SemiAnalysis_/status/2076766344222310552","Why are you shifting engineers away from vLLM so much that community vLLM maintainers removed ROCm support from vLLM RL engines?  Nice work to the ATOM team, but the tweet is about community-driven engines like  @vllm_project , not proprietary engines like ATOM,  AI labs & the"
2026-07-14T12:38:34.000+08:00,"@pequityresearch","P Equity Research ","8,899","amplifier","International","International",positive,6.369,,,,"https://x.com/pequityresearch/status/2076889063487856980","thank you for the support "
2026-07-14T12:34:24.000+08:00,"@pequityresearch","P Equity Research ","8,899","amplifier","International","International",negative,-5.859,,,,"https://x.com/pequityresearch/status/2076888017076211841"," the betrayal"
2026-07-14T12:31:57.000+08:00,"@vikramskr","Vikram Sekar","19.5K","amplifier","International","International",positive,2.382,9,,2,"https://x.com/vikramskr/status/2076887401579135216","Its all over for  @semidoped ...  @austinsemis  has found a much better co-host.   The old guy tried to have the same long hair, but it didn't work."
2026-07-14T12:29:10.000+08:00,"@qinbafrank","qinbafrank","145.9K","amplifier","International","International",neutral,0,,,,"https://x.com/qinbafrank/status/2076886698332680646","我看美股上也有一个relx，是这个么？"
2026-07-14T12:28:31.000+08:00,"@qinbafrank","qinbafrank","145.9K","amplifier","International","International",neutral,0,,,,"https://x.com/qinbafrank/status/2076886537300836596","AI部署层也有机会"
2026-07-14T12:25:54.000+08:00,"@pequityresearch","P Equity Research ","8,899","amplifier","International","International",positive,7.65,11,3,,"https://x.com/pequityresearch/status/2076885876827681070","Morgan Stanley: Broadcom  $AVGO    > Projected Dominance: Morgan Stanley expects Broadcom to retain a ~80% majority share of Google TPUs over time, backed by its advantages in High Bandwidth Memory (HBM) supply, advanced packaging execution, and sheer platform scale.  > AI Revenue"
2026-07-14T12:18:38.000+08:00,"@semivision_tw","SemiVision  ","11.7K","competitor","Taiwan","Taiwan",positive,8.316,2,,1,"https://x.com/semivision_tw/status/2076884048870519188","Using spare money, investing for the long term, and building a well-diversified portfolio—that’s investing.  Borrowing money, using leverage, trading on margin, chasing quick gains, and staring at the market every day hoping to get rich overnight—that’s gambling."
2026-07-14T12:15:57.000+08:00,"@semivision_tw","SemiVision  ","11.7K","competitor","Taiwan","Taiwan",neutral,0,,,,"https://x.com/semivision_tw/status/2076883372107039084","Grok?"
2026-07-14T12:09:38.000+08:00,"@qinbafrank","qinbafrank","145.9K","amplifier","International","International",neutral,0,22,2,8,"https://x.com/qinbafrank/status/2076881784537776475","一张图详细了解今年走势最好的一个板块：安全软件，昨晚美股大跌还能逆势走强。安全软件走强的逻辑在于：AI Agent替代的是一部分“软件执行席位”，安全软件掌握的却是“身份、权限、数据、流量、运行行为和恢复能力”。Agent越自主，控制层越重要。    所以，安全saas控股是三件事在同时发生： 1）AI"
2026-07-14T12:05:23.000+08:00,"@pequityresearch","P Equity Research ","8,899","amplifier","International","International",negative,-2.273,1,,1,"https://x.com/pequityresearch/status/2076880716181221396","No link. Idk why it ends at may. For the other data, it ends in june. I guess the data collection just takes time?"
2026-07-14T11:55:03.000+08:00,"@semivision_tw","SemiVision  ","11.7K","competitor","Taiwan","Taiwan",negative,-4.019,1,,,"https://x.com/semivision_tw/status/2076878113187692897","Even though SK hynix holds a leading position in the HBM market and has become a critical memory supplier to AI ecosystems involving Nvidia, Google, and other major customers, its valuation in the domestic market remains constrained by the cyclical nature of the memory industry,"
2026-07-14T11:54:33.000+08:00,"@semivision_tw","SemiVision  ","11.7K","competitor","Taiwan","Taiwan",neutral,0,1,,,"https://x.com/semivision_tw/status/2076877988050911430","@ 賴清德 "
2026-07-14T11:54:11.000+08:00,"@semivision_tw","SemiVision  ","11.7K","competitor","Taiwan","Taiwan",positive,2.263,4,,1,"https://x.com/semivision_tw/status/2076877893934911564","The AI semiconductor boom is no longer simply a contest to buy more GPUs. It is becoming a competition for access to advanced logic, HBM, packaging, interconnect, thermal engineering, power delivery—and, above all, manufacturing certainty. TSMC’s June 2026 revenue matters for"
2026-07-14T11:39:19.000+08:00,"@semivision_tw","SemiVision  ","11.7K","competitor","Taiwan","Taiwan",neutral,0,,,,"https://x.com/semivision_tw/status/2076874156269023593","Sad…"
2026-07-14T11:30:59.000+08:00,"@dmjk001","快讯","24.6K","amplifier","China","China",neutral,0,1,,1,"https://x.com/dmjk001/status/2076872057623908489","英国金融时报：英伟达因中国芯片限令将亚洲买家名单减半 英伟达（Nvidia）在创建了一份新的“白名单”后，将获准购买其人工智能芯片的亚洲客户数量削减了一半以上，这些公司通过了旨在防止产品流入中国的更严格的合规审查。"
2026-07-14T11:24:13.000+08:00,"@qinbafrank","qinbafrank","145.9K","amplifier","International","International",neutral,0,20,,12,"https://x.com/qinbafrank/status/2076870354212175872","川普说要对 经霍尔木兹海峡运输的货物收取20%的“安全费用”，伊朗说要收一起收但你收20%太黑了。这是给伊朗一个助攻么？之前聊到美伊冲突再起，这次核心还是霍尔木兹海峡的控制权。"
2026-07-14T11:23:18.000+08:00,"@pequityresearch","P Equity Research ","8,899","amplifier","International","International",positive,6.133,32,6,3,"https://x.com/pequityresearch/status/2076870124397641880","BofA: AI Wars  > Global Market Share: Google's global search market share marginally increased by 171 basis points y/y to 91.3%. Meanwhile, Bing's share stood at 4.7% (+72bps y/y).    > US Market Share: Google captured 86.7% of the US total search market (+6bps y/y and +86bps"
2026-07-14T11:16:49.000+08:00,"@pequityresearch","P Equity Research ","8,899","amplifier","International","International",positive,2.057,,,,"https://x.com/pequityresearch/status/2076868493010493736","im not spreading fud, its stating SK's capacity coming online in 2028 will only be 1/6th of what was planned."
2026-07-14T10:38:51.000+08:00,"@pequityresearch","P Equity Research ","8,899","amplifier","International","International",positive,6.249,1,,,"https://x.com/pequityresearch/status/2076858938545332574","@intelfabs   @sean_________   @knockouttrader   @Jadzo1_  all provide great info"
2026-07-14T10:37:43.000+08:00,"@pequityresearch","P Equity Research ","8,899","amplifier","International","International",neutral,0,51,3,1,"https://x.com/pequityresearch/status/2076858653793988747","KOSPIthe leveraged investors are learning a rough lesson"
2026-07-14T10:32:20.000+08:00,"@dmjk001","快讯","24.6K","amplifier","China","China",neutral,0,11,,4,"https://x.com/dmjk001/status/2076857297322848461","彭博：韩国杠杆芯片押注惨遭反噬，最大 ETF 暴跌 45%"
2026-07-14T09:28:35.000+08:00,"@pequityresearch","P Equity Research ","8,899","amplifier","International","International",positive,3.384,44,6,2,"https://x.com/pequityresearch/status/2076841255384879317","Morgan Stanley: Nvidia  $NVDA  Road Show Feedback  > Accelerating Near-Term Revenue: There was almost no pushback regarding NVIDIA's short-term trajectory. Strong near-term business is universally expected, with revenue forecasted to accelerate even further beyond current high"
2026-07-14T09:21:49.000+08:00,"@qinbafrank","qinbafrank","145.9K","amplifier","International","International",neutral,0,25,7,5,"https://x.com/qinbafrank/status/2076839550119444702",""
2026-07-14T09:15:04.000+08:00,"@semivision_tw","SemiVision  ","11.7K","competitor","Taiwan","Taiwan",positive,8.523,1,,2,"https://x.com/semivision_tw/status/2076837853116448960","Some traditional industries may appear to have returned to positive year-over-year export growth. But this does not necessarily mean they have genuinely recovered. If last year’s comparison base was very low, even a modest rebound can produce a positive growth rate. Yet when"
2026-07-14T08:57:14.000+08:00,"@dmjk001","快讯","24.6K","amplifier","China","China",neutral,0,11,3,7,"https://x.com/dmjk001/status/2076833364338942303","宽基单日净流入近440亿，为2025年4月对等关税以来单日最高——东方财富策略ETF跟踪20260713"
2026-07-14T08:56:42.000+08:00,"@dmjk001","快讯","24.6K","amplifier","China","China",neutral,0,5,,4,"https://x.com/dmjk001/status/2076833231312494949","彭博：中国经济增长预计将放缓至官方目标区间下限 根据彭博社调查的预测中值，经济学家预计政府周三将公布第二季度国内生产总值增长 4.5%。这将低于今年前三个月 5%的同比增幅，并使增长处于2026 年 4.5%至 5%目标区间的下限。"
2026-07-14T08:45:59.000+08:00,"@semivision_tw","SemiVision  ","11.7K","competitor","Taiwan","Taiwan",positive,6.908,7,,1,"https://x.com/semivision_tw/status/2076830534739882244","In 2025, UMC completed Phase 3 of its Singapore Fab 12i expansion, adding 12-inch capacity to support 22 nm / 28 nm nodes and specialty processes. Management noted that the Singapore capacity ramp will begin in 2H26 and continue into 2027, lifting overall company capacity by"
2026-07-14T08:29:55.000+08:00,"@pequityresearch","P Equity Research ","8,899","amplifier","International","International",neutral,0,2,1,,"https://x.com/pequityresearch/status/2076826490063180016","Source:"
2026-07-14T08:29:33.000+08:00,"@pequityresearch","P Equity Research ","8,899","amplifier","International","International",positive,8.07,1,,,"https://x.com/pequityresearch/status/2076826399105519926","Awesome! Thanks"
2026-07-14T08:28:10.000+08:00,"@pequityresearch","P Equity Research ","8,899","amplifier","International","International",negative,-5.96,2,,,"https://x.com/pequityresearch/status/2076826051380965613","How is this negativity? "
2026-07-14T08:22:14.000+08:00,"@pequityresearch","P Equity Research ","8,899","amplifier","International","International",positive,6.666,,,,"https://x.com/pequityresearch/status/2076824556363219289","Can you elaborate more? Im just sharing the report he shared."
2026-07-14T08:06:48.000+08:00,"@pequityresearch","P Equity Research ","8,899","amplifier","International","International",neutral,0,94,12,9,"https://x.com/pequityresearch/status/2076820673834504470","According to this report, memory supply coming in 2028 is greatly overestimated.   ""Recent supply chain reports suggest that SK Hynix’s actual new memory production capacity in 2028 may be only one-sixth of the amount initially planned.""   $DRAM   $EWY"
2026-07-14T08:06:05.000+08:00,"@semivision_tw","SemiVision  ","11.7K","competitor","Taiwan","Taiwan",neutral,0,,,,"https://x.com/semivision_tw/status/2076820490774294672","最近生意好"
2026-07-14T08:05:42.000+08:00,"@semivision_tw","SemiVision  ","11.7K","competitor","Taiwan","Taiwan",neutral,0,,,,"https://x.com/semivision_tw/status/2076820397350396368","檢測Micro crack"
2026-07-14T08:05:14.000+08:00,"@pequityresearch","P Equity Research ","8,899","amplifier","International","International",neutral,0,,,1,"https://x.com/pequityresearch/status/2076820277556556142","in the 50s"
2026-07-14T08:02:22.000+08:00,"@pequityresearch","P Equity Research ","8,899","amplifier","International","International",negative,-5.466,,,1,"https://x.com/pequityresearch/status/2076819558568951954","Hard to project because they have so many SCAs, no one knows what the price floor on it is. But wouldnt be crazy to assume 60-75% gross margins 5 years from now. ASSUMING, nothing changes in the CapEx cycle."
2026-07-14T07:58:55.000+08:00,"@semivision_tw","SemiVision  ","11.7K","competitor","Taiwan","Taiwan",positive,7.964,2,2,1,"https://x.com/semivision_tw/status/2076818690570625221","Tomocube’s new HT-T1D tool is a small but interesting signal from the advanced-packaging supply chain. Glass substrates are attractive because they promise better dimensional stability and routing density for future AI packages, but inspection is a gating problem. If defects"
2026-07-14T07:52:56.000+08:00,"@semivision_tw","SemiVision  ","11.7K","competitor","Taiwan","Taiwan",positive,2.732,2,2,1,"https://x.com/semivision_tw/status/2076817183825637850","Intel’s reported multibillion-euro investment in Ireland matters less as a single capex headline and more as a signal: advanced manufacturing is still being regionalized around AI, servers, and strategic supply security. Europe has struggled to convert semiconductor ambition into"
2026-07-14T07:50:54.000+08:00,"@pequityresearch","P Equity Research ","8,899","amplifier","International","International",neutral,0,4,,1,"https://x.com/pequityresearch/status/2076816670174171386","interesting...where is this from?"
2026-07-14T07:50:01.000+08:00,"@pequityresearch","P Equity Research ","8,899","amplifier","International","International",negative,-2.411,1,,2,"https://x.com/pequityresearch/status/2076816450283614544","Not sure how I can verify...i am not familiar with Korea financial supervisory service."
2026-07-14T07:38:08.000+08:00,"@dmjk001","快讯","24.6K","amplifier","China","China",neutral,0,6,,2,"https://x.com/dmjk001/status/2076813459883540809","The Information：谷歌 TPU 地面战揭秘，如何吸引英伟达最忠实的客户 今年之前，谷歌的张量处理单元几乎全部部署在谷歌自家设施中，只能通过谷歌云租用。如今，谷歌正试图将这些 TPU 出售给新兴云服务商 谷歌已探讨为新型云服务商可能想要开发的 TPU"
2026-07-14T07:21:53.000+08:00,"@pequityresearch","P Equity Research ","8,899","amplifier","International","International",positive,5.106,3,2,,"https://x.com/pequityresearch/status/2076809369820316141","Check out my free article on memory."
2026-07-14T07:21:07.000+08:00,"@pequityresearch","P Equity Research ","8,899","amplifier","International","International",positive,5.267,119,18,4,"https://x.com/pequityresearch/status/2076809176487973238","J.P. Morgan: Memory  > Memory at the Center of AI Debate: Memory has become a focal point for investors tracking Cloud Service Provider (CSP) hardware capital expenditure (capex).  > Surging Capex Share: Memory's share of CSP capex is projected to skyrocket to 52% in 2026 and"
2026-07-14T07:14:19.000+08:00,"@pequityresearch","P Equity Research ","8,899","amplifier","International","International",neutral,0,1,,,"https://x.com/pequityresearch/status/2076807466717753379","margins will continue going up for now but they obviously will peak eventually."
2026-07-14T07:12:42.000+08:00,"@pequityresearch","P Equity Research ","8,899","amplifier","International","International",negative,-3.818,8,,,"https://x.com/pequityresearch/status/2076807057668256189","No need to pay. Drawdowns are part of the game."
2026-07-14T07:12:08.000+08:00,"@pequityresearch","P Equity Research ","8,899","amplifier","International","International",neutral,0,3,,1,"https://x.com/pequityresearch/status/2076806914902519861",""
2026-07-14T07:09:45.000+08:00,"@dmjk001","快讯","24.6K","amplifier","China","China",neutral,0,12,,2,"https://x.com/dmjk001/status/2076806314999832944",""
2026-07-14T06:06:55.000+08:00,"@pequityresearch","P Equity Research ","8,899","amplifier","International","International",neutral,0,,,,"https://x.com/pequityresearch/status/2076790502247080090","People are becoming used to drawdowns"
2026-07-14T06:06:32.000+08:00,"@pequityresearch","P Equity Research ","8,899","amplifier","International","International",neutral,0,4,,,"https://x.com/pequityresearch/status/2076790408634331403",""
2026-07-14T05:51:18.000+08:00,"@pequityresearch","P Equity Research ","8,899","amplifier","International","International",negative,-6.808,150,29,4,"https://x.com/pequityresearch/status/2076786574017372483","BofA: Memory  > Investor Concerns: Recent sharp corrections in Korean and Japanese memory stocks were driven by fears of weaker-than-expected Q2 DRAM average selling prices (ASPs), potential earnings misses in the second half of the year, limited pricing impact from new HBM4"
2026-07-14T05:44:30.000+08:00,"@pequityresearch","P Equity Research ","8,899","amplifier","International","International",neutral,0,,,,"https://x.com/pequityresearch/status/2076784862430691552",""
2026-07-14T05:41:18.000+08:00,"@pequityresearch","P Equity Research ","8,899","amplifier","International","International",positive,6.369,2,,1,"https://x.com/pequityresearch/status/2076784056792977804","Inside Memory's New Playbook: SCAs, Equity Stakes, and the End of the 'Boom-Bust' Cycle  @mzuhair123, one of the best researchers, and I did a collaborative article  We talked about these aspects:     - The Current Industry State: Micron Earnings, SK Hynix ADR & Frontier Lab  x.com/mzuhair123/sta…"
2026-07-14T05:41:00.000+08:00,"@pequityresearch","P Equity Research ","8,899","amplifier","International","International",positive,5.563,9,1,,"https://x.com/pequityresearch/status/2076783979106054505","I suggest anyone reading this to check out this article. entirely free."
2026-07-14T05:21:12.000+08:00,"@pequityresearch","P Equity Research ","8,899","amplifier","International","International",positive,4.926,1,,,"https://x.com/pequityresearch/status/2076778996440699116","thanks deepak!"
2026-07-14T05:11:04.000+08:00,"@pequityresearch","P Equity Research ","8,899","amplifier","International","International",neutral,0,,,,"https://x.com/pequityresearch/status/2076776447058866577",""
2026-07-14T05:02:59.000+08:00,"@pequityresearch","P Equity Research ","8,899","amplifier","International","International",positive,4.215,9,,,"https://x.com/pequityresearch/status/2076774413291192361","true..."
2026-07-14T04:39:35.000+08:00,"@pequityresearch","P Equity Research ","8,899","amplifier","International","International",positive,5.719,1,,,"https://x.com/pequityresearch/status/2076768525356499404","Wonderful to work with you "
2026-07-14T04:38:44.000+08:00,"@pequityresearch","P Equity Research ","8,899","amplifier","International","International",neutral,0,,,,"https://x.com/pequityresearch/status/2076768312181100800","likewise "
2026-07-14T04:36:13.000+08:00,"@pequityresearch","P Equity Research ","8,899","amplifier","International","International",neutral,0,6,,,"https://x.com/pequityresearch/status/2076767679373873171","https:// open.substack.com/pub/pequityres earch/p/inside-memorys-new-playbook-scas?r=30c82o&utm_campaign=post-expanded-share&utm_medium=web …"
2026-07-14T04:35:57.000+08:00,"@pequityresearch","P Equity Research ","8,899","amplifier","International","International",positive,6.369,28,5,3,"https://x.com/pequityresearch/status/2076767610889441508","Inside Memory's New Playbook: SCAs, Equity Stakes, and the End of the 'Boom-Bust' Cycle   @mzuhair123 , one of the best researchers, and I did a collaborative article  We talked about these aspects:     - The Current Industry State: Micron Earnings, SK Hynix ADR & Frontier Lab"
2026-07-14T03:36:42.000+08:00,"@pequityresearch","P Equity Research ","8,899","amplifier","International","International",negative,-2.617,,,,"https://x.com/pequityresearch/status/2076752700067164542","chatgpt is wrong btw, but the report is real. see my reply to him."
2026-07-14T03:27:11.000+08:00,"@pequityresearch","P Equity Research ","8,899","amplifier","International","International",neutral,0,4,1,,"https://x.com/pequityresearch/status/2076750303920079122",""
2026-07-14T03:26:56.000+08:00,"@pequityresearch","P Equity Research ","8,899","amplifier","International","International",neutral,0,4,,,"https://x.com/pequityresearch/status/2076750243857592665","MS"
2026-07-14T03:26:36.000+08:00,"@pequityresearch","P Equity Research ","8,899","amplifier","International","International",positive,3.724,2,,,"https://x.com/pequityresearch/status/2076750156708368851","not fake."
