timestamp,handle,displayName,followers,accountType,region,country,sentiment,sentimentScore,likes,retweets,replies,tweetUrl,text
2026-07-08T20:32:10.000+08:00,"@QQ_Timmy","駿HaYaO","28.6K","amplifier","Asia","Asia",neutral,0,28,,1,"https://x.com/QQ_Timmy/status/2074833924417851696","- 三星記憶體業務表現：2026 年第二季估計達到 80% 營業利益率，主要受惠於 AI 需求。  - AI 需求擴散：原本從高頻寬記憶體（HBM）開始的 AI 需求，已擴大至一般 DRAM 與 NAND，形成全產業的繁榮。  - 價格趨勢：過去兩個季度記憶體價格上漲近 50%，本月已再出現 20% 的跳漲。  -"
2026-07-08T20:29:53.000+08:00,"@tculpan","Tim Culpan","18.5K","amplifier","Taiwan","Taiwan",positive,2.263,3,,,"https://x.com/tculpan/status/2074833349345177617","Its US footprint is negligible, it has been slow to expand, and its China ties would be hard to break.  I dug deep into the data on  @SKhynix  in this piece for  @culpium"
2026-07-08T20:27:44.000+08:00,"@tculpan","Tim Culpan","18.5K","amplifier","Taiwan","Taiwan",neutral,0,5,5,2,"https://x.com/tculpan/status/2074832808187671012","A $28 billion capital raise introduces  @SKhynix  to US investors. But not all the details are in its F-1 filing."
2026-07-08T20:23:22.000+08:00,"@QQ_Timmy","駿HaYaO","28.6K","amplifier","Asia","Asia",neutral,0,49,4,2,"https://x.com/QQ_Timmy/status/2074831708315378034","市場傳出，受AI需求強勁及上游原料價格大漲影響，兩岸電源供應器龍頭同步啟動漲價。  台達電（2308）已展開第二波漲價，幅度約5%~20%，將依產品線與客戶逐一議價，無統一時間表。公司昨日不評論傳聞。中國電源大廠麥格米特（MEGMEET）也向客戶發出漲價通知，全產品線漲幅約10%~20%，同屬輝達供應鏈。"
2026-07-08T18:26:34.000+08:00,"@aleabitoreddit","Serenity","881.1K","amplifier","International","International",negative,-2.732,208,2,16,"https://x.com/aleabitoreddit/status/2074802313324384645","My prediction is we’re going to cut off trade with Belgium next.   There goes all the chocolates."
2026-07-08T18:21:58.000+08:00,"@aleabitoreddit","Serenity","881.1K","amplifier","International","International",neutral,0,202,5,27,"https://x.com/aleabitoreddit/status/2074801157365780888","Spain has lithium, tungsten, and other rare earths America needs.  That China happens to be export controlling…The US needs all the partners it can keep."
2026-07-08T18:14:45.000+08:00,"@aleabitoreddit","Serenity","881.1K","amplifier","International","International",negative,-4.922,1.1K,45,204,"https://x.com/aleabitoreddit/status/2074799339680202869","Trump: “Spain is a terrible partner in NATO.   They don't participate. They don't pay.   Cut off all trade with Spain”  Tbh no clue what’s going on anymore…"
2026-07-08T17:49:53.000+08:00,"@aleabitoreddit","Serenity","881.1K","amplifier","International","International",positive,7.579,138,5,8,"https://x.com/aleabitoreddit/status/2074793083137556545","I mean I’m pretty confident memory and AI names recover just cause of the whopping amount of operating profit/growth they have.  I don’t think there’s anything fundamentally wrong, especially after the Samsung earnings.  Just a pretty wild deleveraging/margin cascade right now"
2026-07-08T17:06:01.000+08:00,"@aleabitoreddit","Serenity","881.1K","amplifier","International","International",neutral,0,283,9,18,"https://x.com/aleabitoreddit/status/2074782041909195014","Koreans already fully liquidated a week in."
2026-07-08T16:42:26.000+08:00,"@aleabitoreddit","Serenity","881.1K","amplifier","International","International",positive,1.027,926,53,163,"https://x.com/aleabitoreddit/status/2074776109074583565","Trump: Memorandum of Understanding with Iran “is over”  “It’s a waste of time dealing with them,” Trump said at the NATO summit.  Always an exciting time with markets."
2026-07-08T23:58:50.000+08:00,"@zephyr_z9","Zephyr","156.4K","amplifier","South Korea","South Korea",neutral,0,3,,1,"https://x.com/zephyr_z9/status/2074885930692034912","3 CXMT, 3 YMTC, 1 JHICC"
2026-07-08T23:51:13.000+08:00,"@zephyr_z9","Zephyr","156.4K","amplifier","South Korea","South Korea",neutral,0,125,14,9,"https://x.com/zephyr_z9/status/2074884013853204602","YTMC, CXMT, JHICC will bring around 7 cleanrooms (100k WPM each) online in 26 & 27"
2026-07-08T23:42:19.000+08:00,"@zephyr_z9","Zephyr","156.4K","amplifier","South Korea","South Korea",neutral,0,119,10,7,"https://x.com/zephyr_z9/status/2074881777282502695","""CXMT is targeting HBM3 mass production by the end of 2026, reportedly still in qual with yield concerns"" Really??"
2026-07-08T23:38:19.000+08:00,"@zephyr_z9","Zephyr","156.4K","amplifier","South Korea","South Korea",neutral,0,218,11,14,"https://x.com/zephyr_z9/status/2074880770292994068","AI surpasses humanity at programming"
2026-07-08T23:20:41.000+08:00,"@LinQingV","Macro_Lin ｜ 市场观察员","51.6K","amplifier","China","China",neutral,0,,,,"https://x.com/LinQingV/status/2074876331440083355","今年AI相关的票涨幅还是挺可以的"
2026-07-08T23:12:56.000+08:00,"@zephyr_z9","Zephyr","156.4K","amplifier","South Korea","South Korea",positive,5.473,237,7,20,"https://x.com/zephyr_z9/status/2074874382946894175","LOL Only 200k H200s"
2026-07-08T23:03:48.000+08:00,"@LinQingV","Macro_Lin ｜ 市场观察员","51.6K","amplifier","China","China",neutral,0,,,,"https://x.com/LinQingV/status/2074872081406480389","离7000就五个多点啊"
2026-07-08T22:59:17.000+08:00,"@LinQingV","Macro_Lin ｜ 市场观察员","51.6K","amplifier","China","China",neutral,0,16,,26,"https://x.com/LinQingV/status/2074870947992285377","各位，你们觉得这轮调整美股标普500指数会下破7000吗？"
2026-07-08T22:46:16.000+08:00,"@zephyr_z9","Zephyr","156.4K","amplifier","South Korea","South Korea",neutral,0,197,11,11,"https://x.com/zephyr_z9/status/2074867668520460721","InP from ""very tight"" to ""tight"" in CY27  More Chinese supply coming online "
2026-07-08T22:35:19.000+08:00,"@zephyr_z9","Zephyr","156.4K","amplifier","South Korea","South Korea",positive,4.215,524,13,17,"https://x.com/zephyr_z9/status/2074864915970773215","Cramer saved the memory trade"
2026-07-08T21:43:44.000+08:00,"@damnang2","Damnang","35.4K","amplifier","United States","United States",positive,4.199,1,,,"https://x.com/damnang2/status/2074851933681238470","Thank you!"
2026-07-08T21:24:27.000+08:00,"@damnang2","Damnang","35.4K","amplifier","United States","United States",positive,8.122,1,,1,"https://x.com/damnang2/status/2074847081253241125","I'm curious too... I guess I'll have to look into it. Thanks for letting me know about something good!"
2026-07-08T20:12:27.000+08:00,"@zephyr_z9","Zephyr","156.4K","amplifier","South Korea","South Korea",positive,4.019,168,5,4,"https://x.com/zephyr_z9/status/2074828960572248418","That's a lot of money to support model development"
2026-07-08T18:28:02.000+08:00,"@zephyr_z9","Zephyr","156.4K","amplifier","South Korea","South Korea",neutral,0,395,16,10,"https://x.com/zephyr_z9/status/2074802683807174707","Big boi from Minimax Fable territory"
2026-07-08T18:21:35.000+08:00,"@zephyr_z9","Zephyr","156.4K","amplifier","South Korea","South Korea",negative,-5.423,273,4,11,"https://x.com/zephyr_z9/status/2074801062297682304","Bad behavior from Anthropic"
2026-07-08T16:57:12.000+08:00,"@zephyr_z9","Zephyr","156.4K","amplifier","South Korea","South Korea",negative,-5.563,106,2,6,"https://x.com/zephyr_z9/status/2074779824384881128","More pain in July"
2026-07-08T22:30:40.000+08:00,"@SemiAnalysis_","SemiAnalysis","111.4K","competitor","International","International",negative,-7.504,14,,,"https://x.com/SemiAnalysis_/status/2074863743616295310","After last months surprise 172K gain a reversal is the base case, but even with the consensus calling for +110K it would put negative pressure on the unemployment rate and keep the Fed on the sidelines despite consumer panic. (6/6)"
2026-07-08T22:30:39.000+08:00,"@SemiAnalysis_","SemiAnalysis","111.4K","competitor","International","International",negative,-7.902,12,,1,"https://x.com/SemiAnalysis_/status/2074863742261563715","For Thursday's Non-farm payroll report the low quits and poor confidence are not welcome signs, but with Baby Boomers retiring, and immigration no longer boosting labor force growth, the level of hiring needed to keep the unemployment rate unchanged at 4.3% is likely around 55K."
2026-07-08T22:30:39.000+08:00,"@SemiAnalysis_","SemiAnalysis","111.4K","competitor","International","International",negative,-5.106,11,,1,"https://x.com/SemiAnalysis_/status/2074863740634198067","If consumers are fearful of job-losses they will negotiate smaller raises and spend less. The economy will continue to tilt from consumption towards investment as the engine of growth even without large scale AI job losses. (4/6)"
2026-07-08T22:30:39.000+08:00,"@SemiAnalysis_","SemiAnalysis","111.4K","competitor","International","International",negative,-8.225,15,,1,"https://x.com/SemiAnalysis_/status/2074863738805452853","So far the big drops in openings are just in information services. The impact of AI has hit the ungated segments of the economy the hardest and fastest. Fear of AI displacement has run much faster than actual pressure and fear can be self reinforcing. (3/6)"
2026-07-08T22:30:38.000+08:00,"@SemiAnalysis_","SemiAnalysis","111.4K","competitor","International","International",negative,-6.59,13,,1,"https://x.com/SemiAnalysis_/status/2074863736876064837","The Conference Board's consumer sentiment figure tracks closely with quits while the more pessimistic University of Michigan number has a weaker correlation. The industrial, manufacturing, imports sectors are all showing increases in job openings over the past six months. (2/6)"
2026-07-08T22:30:38.000+08:00,"@SemiAnalysis_","SemiAnalysis","111.4K","competitor","International","International",positive,6.249,79,4,6,"https://x.com/SemiAnalysis_/status/2074863735127032207","Quits are probably the best measure of consumer confidence and very few people are quitting. Now they are measuring a consumer terror that doesn't exist yet in the labor market, and can't be chalked up to just the price of oil. (1/6)"
2026-07-08T18:39:40.000+08:00,"@dylan522p","Dylan Patel","140K","competitor","International","International",positive,1.531,7,,2,"https://x.com/dylan522p/status/2074805611213250690","Last year we wrote about debt raises for hyperscalers and how much capacity there is in the market and we have profitability for them too just buy the models :p"
2026-07-08T18:33:29.000+08:00,"@ChipsandWafers","Chips & Wafers","8,593","competitor","International","International",neutral,0,10,1,3,"https://x.com/ChipsandWafers/status/2074804054140530696","What's going on in Texas? Hmmm"
2026-07-08T18:30:41.000+08:00,"@SemiAnalysis_","SemiAnalysis","111.4K","competitor","International","International",positive,4.588,325,51,25,"https://x.com/SemiAnalysis_/status/2074803351728869865","Anthropic 3Q26 Profit Over $1B:  The Anthropic IPO Financials Sneak Peak Anthropic’s Opportunity is Theirs to Lose"
2026-07-08T18:20:26.000+08:00,"@ChipsandWafers","Chips & Wafers","8,593","competitor","International","International",positive,4.019,4,,1,"https://x.com/ChipsandWafers/status/2074800771363750155","Interesting to note which companies in specific are outperforming.  *Hint: it's the ones ties to expensive AI GPU's and large AI accelerator packages."
2026-07-08T18:20:25.000+08:00,"@ChipsandWafers","Chips & Wafers","8,593","competitor","International","International",neutral,0,22,2,1,"https://x.com/ChipsandWafers/status/2074800768150888550","Taiwan test consumables are roofing it."
2026-07-08T17:11:19.000+08:00,"@antiAIvo","纳米AI","15K","amplifier","China","China",neutral,0,50,,31,"https://x.com/antiAIvo/status/2074783375706169487","7月到现在  感觉再出什么炸裂财报都没用了？  该跌停还是得跌停 "
2026-07-08T17:00:35.000+08:00,"@SemiAnalysis_","SemiAnalysis","111.4K","competitor","International","International",neutral,0,14,1,1,"https://x.com/SemiAnalysis_/status/2074780676335817107","Watch Now:"
2026-07-08T17:00:35.000+08:00,"@SemiAnalysis_","SemiAnalysis","111.4K","competitor","International","International",positive,0.516,46,2,8,"https://x.com/SemiAnalysis_/status/2074780675262046511","If vLLM vs SGLang can compute to one conclusion, it's gotta be that competition is beneficial.  @noslawextratost  explains why InferenceX showcases in isolation."
2026-07-08T23:34:21.000+08:00,"@pequityresearch","P Equity Research ","8,899","amplifier","International","International",positive,6.908,5,,,"https://x.com/pequityresearch/status/2074879771356389507","thank you my friend"
2026-07-08T23:34:13.000+08:00,"@pequityresearch","P Equity Research ","8,899","amplifier","International","International",positive,1.531,206,38,2,"https://x.com/pequityresearch/status/2074879736979828857","BofA: Nvidia   > Investors are overestimating High Bandwidth Memory (HBM) cost pressures and underestimating NVIDIA's massive pricing power and supply-chain scale (backed by $119 billion in prepurchase commitments).  > While HBM content per rack might increase by ~$0.2–0.3"
2026-07-08T23:30:04.000+08:00,"@pequityresearch","P Equity Research ","8,899","amplifier","International","International",positive,5.859,2,,,"https://x.com/pequityresearch/status/2074878693487394888","Wow"
2026-07-08T23:08:18.000+08:00,"@pequityresearch","P Equity Research ","8,899","amplifier","International","International",neutral,0,,,,"https://x.com/pequityresearch/status/2074873216057676244","Lets go "
2026-07-08T23:05:32.000+08:00,"@dmjk001","快讯","24.6K","amplifier","China","China",neutral,0,33,6,9,"https://x.com/dmjk001/status/2074872519119839554","The Information：中国计划允许国内部分头部人工智能企业采购少量英伟达 H200 芯片，两位直接知情人士透露了这一消息。此次芯片采购审批将缓解因人工智能芯片需求激增导致的供应短缺。 近几周已告知阿里巴巴、 字节跳动和深度求索等企业，它们可能很快获准采购部分 H200"
2026-07-08T22:01:00.000+08:00,"@pequityresearch","P Equity Research ","8,899","amplifier","International","International",neutral,0,422,117,15,"https://x.com/pequityresearch/status/2074856279072207328","Goldman Sachs: June 2026 Update Supply/Demand  Compared to their May report, they have updated:  > NAND and DRAM from ""tight"" to ""very tight"" supply in Q1-Q2 of 2027.  > InP from ""very tight"" to ""tight"" in CY27  > T-Glass from ""balanced"" to ""tight"" in CY27.   Highlights:  > DRAM"
2026-07-08T21:09:18.000+08:00,"@qinbafrank","qinbafrank","145.9K","amplifier","International","International",neutral,0,4,1,2,"https://x.com/qinbafrank/status/2074843267469107346",""
2026-07-08T21:09:13.000+08:00,"@qinbafrank","qinbafrank","145.9K","amplifier","International","International",neutral,0,113,15,10,"https://x.com/qinbafrank/status/2074843248095629631","Sk海力士ADR发行路演资料中文版"
2026-07-08T20:41:36.000+08:00,"@dmjk001","快讯","24.6K","amplifier","China","China",neutral,0,11,2,9,"https://x.com/dmjk001/status/2074836296598794257","各种今天的传闻更新一下#建投电新  一跌各种以讹传讹的信息层出不穷，我们更新一下了解的信息  传闻宁德业绩不好，从230下修到220。公司从来不给数据指引的，#三周前就说了二季度尤其5月开票确认没那么多，是节奏问题，不是需求不好(官方)。  我们仍然坚持昨天给的Q2"
2026-07-08T20:31:38.000+08:00,"@qinbafrank","qinbafrank","145.9K","amplifier","International","International",neutral,0,,,,"https://x.com/qinbafrank/status/2074833786915926322","我应该没有这么大的号召力吧"
2026-07-08T20:24:57.000+08:00,"@qinbafrank","qinbafrank","145.9K","amplifier","International","International",neutral,0,1,,,"https://x.com/qinbafrank/status/2074832108904915345","你这么说迪拉姆稳定币还是很有空间的呐"
2026-07-08T20:00:03.000+08:00,"@pequityresearch","P Equity Research ","8,899","amplifier","International","International",positive,2.732,19,,6,"https://x.com/pequityresearch/status/2074825839095525761","Impressive...really shows you how fast AI is advancing. Remember when Will Smith was eating spaghetti and how that looked? I can't image how video creation ends up looking in another 2 years."
2026-07-08T19:59:28.000+08:00,"@semivision_tw","SemiVision  ","11.7K","competitor","Taiwan","Taiwan",neutral,0,,,,"https://x.com/semivision_tw/status/2074825692538372241",""
2026-07-08T19:21:02.000+08:00,"@semivision_tw","SemiVision  ","11.7K","competitor","Taiwan","Taiwan",positive,6.705,13,,2,"https://x.com/semivision_tw/status/2074816022662791459","At a dinner gathering, people were introducing what they do for a living.  When it was my turn, I said, “I do semiconductor analysis.”  One person immediately laughed and replied:  “These days, every time I hear the word analysis, my fists start clenching.”   Looks like"
2026-07-08T19:19:07.000+08:00,"@qinbafrank","qinbafrank","145.9K","amplifier","International","International",neutral,0,22,,23,"https://x.com/qinbafrank/status/2074815540766679074","4月初FIFA国际足联宣布指定ADI PredictStreet（ADI Chain生态应用）成为其在预测市场类的首个全球合作伙伴。最近又去看了看ADI Chain的近期动态，发现动作很多进展也不小，而且还是几条线同时在往前走。  1）主权与稳定币层：UAE 第一款央行授权的迪拉姆稳定币 DDSC（1:1 AED），只在 ADI Chain"
2026-07-08T18:11:53.000+08:00,"@dmjk001","快讯","24.6K","amplifier","China","China",neutral,0,12,3,5,"https://x.com/dmjk001/status/2074798618390012085","彭博：亚马逊新债券遇冷，AI 债务涌入市场 据知情人士透露，在周二定价消息：亚马逊 250 亿美元债券分八部分发行的需求达到峰值 620 亿美元后，随着负责此次交易的银行压缩了向投资者提供的最终利差，订单缩减至约 410 亿美元。这意味着最终需求为发行规模的 1.6 倍。"
2026-07-08T17:40:18.000+08:00,"@qinbafrank","qinbafrank","145.9K","amplifier","International","International",neutral,0,1,,1,"https://x.com/qinbafrank/status/2074790673421889948","嗅觉敏锐呐"
2026-07-08T17:30:17.000+08:00,"@qinbafrank","qinbafrank","145.9K","amplifier","International","International",neutral,0,60,2,40,"https://x.com/qinbafrank/status/2074788149973434596","川普表态美伊此前达成的停火协议已经作废，让本就煎熬的市场雪上加霜。这次看看双方多久会重归于好。基准判断今天美伊再起摩擦冲突还是短期扰动制造波动，并不是持续升级的系统性风险。"
2026-07-08T23:59:59.000+08:00,"@oguzerkan","Oguz Erkan","121.2K","amplifier","United States","United States",positive,0.772,47,2,19,"https://x.com/oguzerkan/status/2074886223076766016","Terry Smith made ROCE his North Star and ignored the real amount of capital that businesses actually deploy.  This left him with bunch of high ROCE and low-growth stocks as they lacked opportunities to deploy incremental capital.  Always check the actual capital being deployed."
2026-07-08T23:59:44.000+08:00,"@wallstengine","Wall St Engine","159.1K","amplifier","International","International",neutral,0,47,5,12,"https://x.com/wallstengine/status/2074886159449391396","Polymarket odds of a Fed rate hike this year are now at 60%"
2026-07-08T23:38:31.000+08:00,"@wallstengine","Wall St Engine","159.1K","amplifier","International","International",positive,7.506,70,8,14,"https://x.com/wallstengine/status/2074880819731345722","Amazon  $AMZN  is working on an Alexa AI project codenamed Moonraker to handle multistep requests like booking a ride and texting a friend.  Internal docs project $100M+ in GPU costs in 2026, making it Alexa+’s highest-cost new initiative.  Source: Business Insider"
2026-07-08T23:27:22.000+08:00,"@wallstengine","Wall St Engine","159.1K","amplifier","International","International",neutral,0,66,10,9,"https://x.com/wallstengine/status/2074878013792301306","Bloomberg: Mistral AI released Robostral Navigate, a robotics model that lets robots navigate complex environments using one camera and basic language prompts."
2026-07-08T23:26:40.000+08:00,"@wallstengine","Wall St Engine","159.1K","amplifier","International","International",positive,2.263,39,2,6,"https://x.com/wallstengine/status/2074877838407373186","Leverage Shares plans to launch SK Hynix single-stock ETFs Monday:   $SKHX for 2x long daily exposure & $SKHZ for 1x short daily exposure.  Disclaimer: Both list a 0.75% management fee. Leveraged ETFs carry significant risk & are built for short-term trading. Read the prospectus."
2026-07-08T22:59:45.000+08:00,"@wallstengine","Wall St Engine","159.1K","amplifier","International","International",negative,-4.019,156,38,18,"https://x.com/wallstengine/status/2074871062878446012","China plans to let top AI firms including Alibaba, ByteDance and DeepSeek buy limited Nvidia H200 chips, potentially under 200,000 total.  The  $NVDA  chips would be restricted to training on public data, with domestic processors prioritized for inference.  Source: The Information"
2026-07-08T22:29:08.000+08:00,"@wallstengine","Wall St Engine","159.1K","amplifier","International","International",positive,3.182,203,27,14,"https://x.com/wallstengine/status/2074863360454299937","TRUMP: MAYBE WE'LL DO SOME THINGS THAT COULD INCREASE OIL PRICE"
2026-07-08T22:23:22.000+08:00,"@wallstengine","Wall St Engine","159.1K","amplifier","International","International",neutral,0,46,4,4,"https://x.com/wallstengine/status/2074861906863820975","Alphabet-owned Waymo is rolling out fully autonomous operations in Denver, Las Vegas, San Diego and Tampa."
2026-07-08T21:43:12.000+08:00,"@wallstengine","Wall St Engine","159.1K","amplifier","International","International",neutral,0,9,1,,"https://x.com/wallstengine/status/2074851798033289265",""
2026-07-08T21:41:52.000+08:00,"@wallstengine","Wall St Engine","159.1K","amplifier","International","International",positive,3.612,64,11,12,"https://x.com/wallstengine/status/2074851462434406885","OpenAI Deployment Company agreed to acquire applied AI firm Northslope, its second enterprise AI acquisition after Tomoro.  The deal expands its team to hundreds of forward deployed engineers working with customers to build AI systems. Terms weren’t disclosed.  Source: Axios"
2026-07-08T21:27:13.000+08:00,"@wallstengine","Wall St Engine","159.1K","amplifier","International","International",positive,3.818,67,8,6,"https://x.com/wallstengine/status/2074847778870890809","BOFA HANDS $520M CREDIT LINE TO OPENAI IN BID FOR IPO SPOT"
2026-07-08T20:58:51.000+08:00,"@wallstengine","Wall St Engine","159.1K","amplifier","International","International",negative,-5.106,120,13,13,"https://x.com/wallstengine/status/2074840639322378495","Trump: Will Probably Hit Iran Again Tonight... We Hit Iran Hard Last Night... It's Not About Regime Change, It's About Nuclear Weapons"
2026-07-08T20:45:46.000+08:00,"@wallstengine","Wall St Engine","159.1K","amplifier","International","International",positive,9.001,50,8,14,"https://x.com/wallstengine/status/2074837346458186046","Target shares are trading higher after Oppenheimer cited clean stores, strong inventory and Target’s first Threshold shop-in-shop.  Gordon Haskett said June foot traffic rose 2.6% YoY, while Target prepares to convert 600 former Ulta spaces into Target Beauty Studios."
2026-07-08T20:25:11.000+08:00,"@wallstengine","Wall St Engine","159.1K","amplifier","International","International",positive,7.096,64,4,10,"https://x.com/wallstengine/status/2074832166631219336","Cloudflare  $NET  and OpenAI launched a research pilot using Cloudflare signals like content freshness, traffic quality and page changes to improve OpenAI search crawling and indexing, including ChatGPT answers. Cloudflare says 20%+ of the web sits behind its network."
2026-07-08T20:04:29.000+08:00,"@wallstengine","Wall St Engine","159.1K","amplifier","International","International",neutral,0,99,16,5,"https://x.com/wallstengine/status/2074826954973594027","NYT DealBook: Blue Origin is raising outside capital for the first time, seeking $10B at a $130B valuation excluding new funds. Coatue is expected to lead with $4B, while Jeff Bezos is set to add another $2B."
2026-07-08T19:47:34.000+08:00,"@wallstengine","Wall St Engine","159.1K","amplifier","International","International",positive,3.412,114,22,12,"https://x.com/wallstengine/status/2074822699751559171","A source familiar with the NATO summit talks reportedly said Trump did not restate that the interim Iran deal had been terminated and did not repeat his criticism of Spain during the leaders’ meeting. - Reuters"
2026-07-08T19:27:20.000+08:00,"@wallstengine","Wall St Engine","159.1K","amplifier","International","International",positive,5.719,52,2,5,"https://x.com/wallstengine/status/2074817606884995341","Airbus forecasts passenger air traffic will more than double by 2045 to about 10B passengers a year, with 3.9% annual growth.  Its 2026-2045 outlook sees demand for 42,060 new aircraft, including 19,820 replacements and 22,240 for growth."
2026-07-08T19:22:54.000+08:00,"@wallstengine","Wall St Engine","159.1K","amplifier","International","International",negative,-1.28,24,2,3,"https://x.com/wallstengine/status/2074816493293023301","Kodiak Gas Services  $KGS  and Baker Hughes signed a multi-year deal for up to 1.8GW of U.S. power generation capacity.  Initial equipment covers ~1GW for delivery by 2030, targeting behind-the-meter power demand, especially from data centers."
