timestamp,handle,displayName,followers,accountType,region,country,sentiment,sentimentScore,likes,retweets,replies,tweetUrl,text
2026-06-30T17:10:45.000Z,"@QQ_Timmy","駿HaYaO","28.6K","amplifier","Asia","Asia",neutral,0,36,2,,"https://x.com/QQ_Timmy/status/2072004929171120633","SemiAnalysis正在看到Nvidia今年下半年出現巨大的成長拉升。SemiAnalysis的Accelerator Model估計，Nvidia資料中心運算營收較市場共識預期高出20%（針對FY2027下半年）。Rubin原本因早期HBM4問題而延後推出，如今問題已解決，前端晶圓供應也已建立起來，因此將迎來大幅拉升。"
2026-06-30T17:09:28.000Z,"@QQ_Timmy","駿HaYaO","28.6K","amplifier","Asia","Asia",neutral,0,28,2,,"https://x.com/QQ_Timmy/status/2072004603445678310","三星電機(Samsung Electro) 公司週二表示，已與一家美國客戶簽署一份價值4540億韓元（約2.93億美元）的合約，將為其人工智慧（AI）伺服器供應多層陶瓷電容器（MLCC）。  這家三星電子旗下的電子元件部門表示，合約期限自2027年1月起至2027年12月止，為期一年。該公司以保密協議為由，未公開客戶身分。"
2026-06-30T17:07:18.000Z,"@bubbleboi","bubble boi","88.2K","amplifier","International","International",neutral,0,2,,,"https://x.com/bubbleboi/status/2072004057930371506","Not at all."
2026-06-30T17:06:37.000Z,"@QQ_Timmy","駿HaYaO","28.6K","amplifier","Asia","Asia",neutral,0,18,1,,"https://x.com/QQ_Timmy/status/2072003887956148226","https:// futureelectronics.com/resources/mark et-conditions-report …"
2026-06-30T17:03:48.000Z,"@QQ_Timmy","駿HaYaO","28.6K","amplifier","Asia","Asia",neutral,0,47,2,1,"https://x.com/QQ_Timmy/status/2072003177336242273","全新光電科技股份有限公司 產品價格調整通知書 (Price Adjustment Notification) 親愛的合作夥伴您好： 首先，衷心感謝貴司長年以來對 VPEC 的鼎力支持，作為您供應鏈中值得信賴的夥伴，我們始終致力於透過技術革新與製程優化，為您提供卓越的產品品質與服務價值。"
2026-06-30T17:03:41.000Z,"@bubbleboi","bubble boi","88.2K","amplifier","International","International",negative,-5.574,86,,,"https://x.com/bubbleboi/status/2072003147669901561","Holy shit"
2026-06-30T17:02:28.000Z,"@bubbleboi","bubble boi","88.2K","amplifier","International","International",negative,-0.516,47,,1,"https://x.com/bubbleboi/status/2072002842005741796","Yeah bro higher frequencies are coming this is crazy."
2026-06-30T17:00:28.000Z,"@QQ_Timmy","駿HaYaO","28.6K","amplifier","Asia","Asia",neutral,0,16,,,"https://x.com/QQ_Timmy/status/2072002338601177458","芯聯集成電路製造股份有限公司 價格調整通知函 致尊敬的合作夥伴： 衷心感謝貴司長期以來對我司的信任與支持！ 2026年以來，全球半導體產業鏈持續迎來結構性成本上漲。與此同時，AI、新能源等需求爆發，帶來產能持續緊張。"
2026-06-30T16:58:43.000Z,"@QQ_Timmy","駿HaYaO","28.6K","amplifier","Asia","Asia",neutral,0,23,,,"https://x.com/QQ_Timmy/status/2072001900833276191","杭州士蘭微電子股份有限公司 價格調整通知函 尊敬的客戶及合作夥伴： 您好！"
2026-06-30T16:53:29.000Z,"@QQ_Timmy","駿HaYaO","28.6K","amplifier","Asia","Asia",neutral,0,28,3,,"https://x.com/QQ_Timmy/status/2072000584195178583","MediaTek（2454 TT）Triggerfish 摘要：  - Triggerfish 影響： 1. 更高 ASP — 約 $18k，相比 Humufish 的 $13k 或 Zebrafish 的 $5.5k 2. v9 產品組合 — Triggerfish 將占 v9（含 Humufish）約 50% 比重 3. 內部配置 — 搭載 4 個伴隨運算核心（companion compute cores），各配備大型 SRAM（約 250MB"
2026-06-30T16:49:25.000Z,"@QQ_Timmy","駿HaYaO","28.6K","amplifier","Asia","Asia",neutral,0,34,2,,"https://x.com/QQ_Timmy/status/2071999561057657216","NVIDIA 在 GTC 大會上公布了從 Feynman 平台開始採用 3D 堆疊的計畫。目前，AMD 是 TSMC SoIC 技術的領先採用者（從 MI300 系列開始），而在最新的 MI450 中，報告認為 AMD 將四顆頂部晶片（四個 XCD）堆疊在兩個全光罩尺寸的主動中介層（I/O dies）上，其中每個頂部晶片尺寸約為全光罩的 1/3。"
2026-06-30T16:40:25.000Z,"@QQ_Timmy","駿HaYaO","28.6K","amplifier","Asia","Asia",neutral,0,2,,,"https://x.com/QQ_Timmy/status/2071997292757012752",""
2026-06-30T16:40:07.000Z,"@QQ_Timmy","駿HaYaO","28.6K","amplifier","Asia","Asia",neutral,0,28,2,1,"https://x.com/QQ_Timmy/status/2071997217658098083","TrendForce: AI零組件產能排擠、大廠減產加劇，預估晶圓代工成熟製程漲價效應延伸至2027年  根據TrendForce最新調查，AI Server、通用型伺服器及Edge AI周邊需求強勁，晶圓代工產能大幅向AI相關產品傾斜，加速改變成熟製程供需結構。八吋與十二吋成熟製程因AI"
2026-06-30T16:34:58.000Z,"@aleabitoreddit","Serenity","881.1K","amplifier","International","International",positive,8.268,1.3K,161,153,"https://x.com/aleabitoreddit/status/2071995924172394695","Yep! Agility Robotics is currently my favorite humanoid/robotics position.  They're set to be listed on NASDAQ via  $CCXI  as early as September (per Digitimes).  Just for informational purposes: Their V4 humanoid robot is already operating in sites like Amazon. And have V5 slated"
2026-06-30T16:26:14.000Z,"@bubbleboi","bubble boi","88.2K","amplifier","International","International",neutral,0,482,6,20,"https://x.com/bubbleboi/status/2071993725908308333","> $1B + in customer contracts  I’ve been saying it was undervalued, would be 100B market cap company if public right now."
2026-06-30T16:18:47.000Z,"@bubbleboi","bubble boi","88.2K","amplifier","International","International",negative,-2.732,1.5K,45,26,"https://x.com/bubbleboi/status/2071991848449757677","Power is proportional to voltage squared, so by halving the voltage they cut power consumption by 75%….  Incredible what they pulled off here."
2026-06-30T15:57:10.000Z,"@aleabitoreddit","Serenity","881.1K","amplifier","International","International",neutral,0,55,3,15,"https://x.com/aleabitoreddit/status/2071986411461546148","Found this online, looks AI made but it might be a whole new industry...   Just putting it out there."
2026-06-30T15:20:39.000Z,"@aleabitoreddit","Serenity","881.1K","amplifier","International","International",positive,5.267,1.2K,64,310,"https://x.com/aleabitoreddit/status/2071977219002613768","I wonder if humanoids is going to spark a new bottleneck/industry for robot cosmetics.  Like a skin bottleneck. Or Aespa KPOP robot makeover as a service.  So if  $TSLA  Optimus makes tens of millions of humanoids:  Who’s going to make them all look hot?"
2026-06-30T14:17:18.000Z,"@aleabitoreddit","Serenity","881.1K","amplifier","International","International",positive,5.994,531,38,159,"https://x.com/aleabitoreddit/status/2071961279380791729","There was a pretty funny anecdotal complaint from the Machine Learning  $RDDT  subreddit.  On  $CBRS  + OpenAI:  - Needs 1-2K tokens/sec so tries to use Cerebras.  - Claims OpenAI reserved all capacity, making waitlist infinite for everyone else not a hyperscaler.  - Stated"
2026-06-30T12:30:12.000Z,"@jukan05","Jukan @ICML","155.3K","amplifier","South Korea","South Korea",neutral,0,8,,1,"https://x.com/jukan05/status/2071934326296776976","Meituan does not design its own ASICs."
2026-06-30T10:45:09.000Z,"@jukan05","Jukan @ICML","155.3K","amplifier","South Korea","South Korea",neutral,0,28,1,1,"https://x.com/jukan05/status/2071907887178490305",""
2026-06-30T10:45:08.000Z,"@jukan05","Jukan @ICML","155.3K","amplifier","South Korea","South Korea",positive,2.5,259,29,11,"https://x.com/jukan05/status/2071907884737482807","Samsung Electronics Pushes Next Generation HBM Structural Change… Files Novel Patent for High Stack Response  Samsung Electronics has been confirmed to have filed a new patent aimed at solving the reliability problems of high bandwidth memory (HBM) packages. As the high stack"
2026-06-30T10:27:55.000Z,"@aleabitoreddit","Serenity","881.1K","amplifier","International","International",positive,3.4,925,78,188,"https://x.com/aleabitoreddit/status/2071903552608362500","Hard to see a world where US AI hyperscaler capex drops dramatically from  $GOOGL  to  $META .  When China entities like 360 go and claim:  They now have a ""AI cyber nuclear weapon"" that can hack Western companies and governments.  (Zhou claimed Mythos was like an AI era cyber"
2026-06-30T10:26:40.000Z,"@jukan05","Jukan @ICML","155.3K","amplifier","South Korea","South Korea",negative,-3.182,5,,,"https://x.com/jukan05/status/2071903235330453913","I’ve always been critical of DigiTimes."
2026-06-30T10:04:01.000Z,"@bubbleboi","bubble boi","88.2K","amplifier","International","International",positive,5.75,7,,1,"https://x.com/bubbleboi/status/2071897538299662547","I talked to them, they want to stay as a contract manufacturer instead of competing with the customers.   Lots of talk about not being exposed to NAND prices to keep higher margin yada yada. Reliance on a OEMs has stifled their ability to innovate where it matters."
2026-06-30T09:56:15.000Z,"@bubbleboi","bubble boi","88.2K","amplifier","International","International",positive,5.423,138,5,8,"https://x.com/bubbleboi/status/2071895582646603936","Been saying this. Glad many are coming to similar conclusions."
2026-06-30T09:55:09.000Z,"@bubbleboi","bubble boi","88.2K","amplifier","International","International",positive,8.36,941,65,42,"https://x.com/bubbleboi/status/2071895306783105362","I like the Chinese model of making intelligence free and open for everyone to use."
2026-06-30T09:52:15.000Z,"@bubbleboi","bubble boi","88.2K","amplifier","International","International",positive,3.182,1,,1,"https://x.com/bubbleboi/status/2071894574243733699","Sure"
2026-06-30T09:50:10.000Z,"@bubbleboi","bubble boi","88.2K","amplifier","International","International",neutral,0,59,1,1,"https://x.com/bubbleboi/status/2071894053436989921","That’s fucking based."
2026-06-30T08:47:31.000Z,"@jukan05","Jukan @ICML","155.3K","amplifier","South Korea","South Korea",neutral,0,13,,1,"https://x.com/jukan05/status/2071878286784049464",""
2026-06-30T08:47:31.000Z,"@jukan05","Jukan @ICML","155.3K","amplifier","South Korea","South Korea",neutral,0,169,18,16,"https://x.com/jukan05/status/2071878284154212859","LG Electronics Begins ASIC Design Service Based on TSMC Processes  LG Electronics is entering the application specific integrated circuit (ASIC) design service market, leveraging its independent system semiconductor design capabilities. LG Electronics has designed system on chip"
2026-06-30T08:35:26.000Z,"@jukan05","Jukan @ICML","155.3K","amplifier","South Korea","South Korea",positive,3.818,442,55,14,"https://x.com/jukan05/status/2071875242365157763","TrendForce:  3Q26 PC DRAM contract price growth has been revised up from the previous forecast of +8–13% QoQ to +15–20% QoQ. The 4Q26 forecast was also revised up from +0–5% to +3–8%.  3Q26 server DRAM contract prices are expected to rise by 13–18% QoQ.   $DRAM   $MU"
2026-06-30T08:25:34.000Z,"@bubbleboi","bubble boi","88.2K","amplifier","International","International",neutral,0,15,,1,"https://x.com/bubbleboi/status/2071872762378088549","look into what kioxia is doing w/ nvidia"
2026-06-30T08:25:13.000Z,"@bubbleboi","bubble boi","88.2K","amplifier","International","International",neutral,0,15,,1,"https://x.com/bubbleboi/status/2071872673022660624","i dont think so anymore"
2026-06-30T07:37:53.000Z,"@dnystedt","Dan Nystedt","51.5K","amplifier","Taiwan","Taiwan",positive,8.519,6,,,"https://x.com/dnystedt/status/2071860761861955916","Interesting talk. Qualcomm's foundry partner, TSMC, is working with memory maker Winbond on wafer-on-wafer (WoW) technology - maybe for HBC? As you say, heat seems like a challenge."
2026-06-30T07:07:34.000Z,"@dnystedt","Dan Nystedt","51.5K","amplifier","Taiwan","Taiwan",negative,-8.1,2,,2,"https://x.com/dnystedt/status/2071853129956720715","It surprises the heck out of me that this is not general knowledge.   The CCP is at war with you. You can ignore that, but when the punch lands, it's going to hurt a lot more."
2026-06-30T07:04:43.000Z,"@dnystedt","Dan Nystedt","51.5K","amplifier","Taiwan","Taiwan",positive,6.249,1,,1,"https://x.com/dnystedt/status/2071852414249132179","It's a very different thing to take the word of a reputable company over - any firm from China. The CCP has done a great disservice to its people."
2026-06-30T07:00:35.000Z,"@aleabitoreddit","Serenity","881.1K","amplifier","International","International",positive,9.499,109,,8,"https://x.com/aleabitoreddit/status/2071851376246989079","Good times, wasn’t too long ago back at 3K followers!   Discussion on  $NBIS  was fun back when there was a lot of debate on Neoclouds and it was still really early.   Thanks for the support, fun to see your account grow as well"
2026-06-30T07:00:16.000Z,"@dnystedt","Dan Nystedt","51.5K","amplifier","Taiwan","Taiwan",neutral,-0.129,25,4,1,"https://x.com/dnystedt/status/2071851293950587195","Japan: Overlooked haven for AI data centers? Post-Fukushima (2011), all 54 nuclear reactors shut down. Only 15 have restarted – another 18 remain operable (but not all will come back online)."
2026-06-30T06:55:36.000Z,"@aleabitoreddit","Serenity","881.1K","amplifier","International","International",positive,6.696,122,,11,"https://x.com/aleabitoreddit/status/2071850120745013623","I’ll be on the lookout for anyone who’s 10x leverage Samsung and Murata!  Yeah dynamics change a lot as follower counts grow unfortunately. Maybe smurfing would be fun."
2026-06-30T06:43:02.000Z,"@dnystedt","Dan Nystedt","51.5K","amplifier","Taiwan","Taiwan",positive,0.516,157,10,13,"https://x.com/dnystedt/status/2071846956159398035","Just when you wonder if rumors of Broadcom losing custom ASIC orders are true..."
2026-06-30T06:39:54.000Z,"@dnystedt","Dan Nystedt","51.5K","amplifier","Taiwan","Taiwan",negative,-5.803,9,,1,"https://x.com/dnystedt/status/2071846168271994906","How do you know for sure? DeepSeek lied, used plenty of Nvidia GPUs. Smuggling ops getting plenty of Nvidia GPUs in. Are you just taking their word for it? ..."
2026-06-30T06:06:47.000Z,"@jukan05","Jukan @ICML","155.3K","amplifier","South Korea","South Korea",positive,5.023,12,1,1,"https://x.com/jukan05/status/2071837834416390430","FCBGA capa's are always increasing... but that seems like just processing old equipment."
2026-06-30T05:54:49.000Z,"@jukan05","Jukan @ICML","155.3K","amplifier","South Korea","South Korea",neutral,0,6,,1,"https://x.com/jukan05/status/2071834824239952300",""
2026-06-30T05:44:17.000Z,"@QQ_Timmy","駿HaYaO","28.6K","amplifier","Asia","Asia",neutral,0,97,6,7,"https://x.com/QQ_Timmy/status/2071832173578256809","富喬工業股份有限公司 FULLTECH FIBER GLASS CORP.  玻璃纖維布價格調整通知 敬啟者： 首先感謝貴公司長期以來的支持與愛護。"
2026-06-30T05:35:05.000Z,"@jukan05","Jukan @ICML","155.3K","amplifier","South Korea","South Korea",neutral,0,4,,,"https://x.com/jukan05/status/2071829858683158642","icefish I/Odie The rumor doesn't seem to be about Sampa..."
2026-06-30T05:33:57.000Z,"@bubbleboi","bubble boi","88.2K","amplifier","International","International",positive,7.901,159,1,6,"https://x.com/bubbleboi/status/2071829573264892020","Thank you  @GavinSBaker   @plaffont  . Will come with my best pitches & sharpest questions!"
2026-06-30T05:32:53.000Z,"@bubbleboi","bubble boi","88.2K","amplifier","International","International",neutral,0,45,1,2,"https://x.com/bubbleboi/status/2071829303105581391","Heading to TomorrowX Summit 2026 in Austin, Nov 17-18. Two days with the CEOs, investors, and operators moving TMT.  @TomorrowXSummit  #tomorrowXsummit2026"
2026-06-30T05:32:26.000Z,"@jukan05","Jukan @ICML","155.3K","amplifier","South Korea","South Korea",neutral,0,403,54,18,"https://x.com/jukan05/status/2071829189905506305","TPU V10ax will be manufactured by Samsung Foundry. "
2026-06-30T05:22:44.000Z,"@jukan05","Jukan @ICML","155.3K","amplifier","South Korea","South Korea",neutral,0,21,,1,"https://x.com/jukan05/status/2071826750116626546",""
2026-06-30T05:22:43.000Z,"@jukan05","Jukan @ICML","155.3K","amplifier","South Korea","South Korea",negative,-7.264,447,92,25,"https://x.com/jukan05/status/2071826747327463477","Nikkei Asia reported that Chinese smartphone brands such as Xiaomi, OPPO, and vivo have cut their shipment targets for this year by as much as 30%.  “Even planning for new product launches next year has become extremely difficult, because we have no idea how we can actually"
2026-06-30T05:16:50.000Z,"@jukan05","Jukan @ICML","155.3K","amplifier","South Korea","South Korea",positive,7.96,1.3K,101,33,"https://x.com/jukan05/status/2071825263596638518","I was really impressed by Nomura’s excellent report.  I learned a lot from it."
2026-06-30T04:24:30.000Z,"@jukan05","Jukan @ICML","155.3K","amplifier","South Korea","South Korea",neutral,0,20,1,1,"https://x.com/jukan05/status/2071812095986081946",""
2026-06-30T04:24:30.000Z,"@jukan05","Jukan @ICML","155.3K","amplifier","South Korea","South Korea",negative,-7.378,305,32,20,"https://x.com/jukan05/status/2071812092907446560","DigiTimes is spreading FUD again…  As always, whenever something looks like it could pose a threat to TSMC, they start making up all kinds of ridiculous narratives."
2026-06-30T03:26:14.000Z,"@jukan05","Jukan @ICML","155.3K","amplifier","South Korea","South Korea",positive,5.574,4,,2,"https://x.com/jukan05/status/2071797430782398583","hahaha"
2026-06-30T02:49:11.000Z,"@jukan05","Jukan @ICML","155.3K","amplifier","South Korea","South Korea",positive,8.625,330,6,15,"https://x.com/jukan05/status/2071788107477987571","I’m truly honored to be participating in the TomorrowX Summit. It’ll be my first time visiting Texas.  Hope to see many of you there.  @TomorrowXSummit"
2026-06-30T02:27:21.000Z,"@jukan05","Jukan @ICML","155.3K","amplifier","South Korea","South Korea",positive,1.511,165,,14,"https://x.com/jukan05/status/2071782611371143372","So I made an alt account that nobody knows about!  Once you get a lot of followers, you can’t really say what you want anymore…"
2026-06-30T02:17:06.000Z,"@jukan05","Jukan @ICML","155.3K","amplifier","South Korea","South Korea",neutral,0,402,40,9,"https://x.com/jukan05/status/2071780035116364134","According to Korean media reports, Samsung will start using High-NA EUV from its 1.4nm node.   $ASML"
2026-06-30T02:12:57.000Z,"@dnystedt","Dan Nystedt","51.5K","amplifier","Taiwan","Taiwan",positive,5.719,1,,,"https://x.com/dnystedt/status/2071778988310290659","The Gamers Nexus report is excellent:  https:// gamersnexus.net/gpus-deep-dive -news/nvidia-ai-gpu-black-market-investigating-smuggling-corruption-governments …"
2026-06-30T22:32:21.000Z,"@zephyr_z9","Zephyr","156.4K","amplifier","South Korea","South Korea",positive,5.859,145,,,"https://x.com/zephyr_z9/status/2072085859688718346","WOW"
2026-06-30T22:31:20.000Z,"@HyperTechInvest","Daniel Romero","41.1K","amplifier","United States","United States",neutral,0,348,9,9,"https://x.com/HyperTechInvest/status/2072085604867662244","Jensen watching every semi company 10x while  $NVDA  is still below its October 2025 highs"
2026-06-30T22:00:55.000Z,"@zephyr_z9","Zephyr","156.4K","amplifier","South Korea","South Korea",neutral,0,6,,1,"https://x.com/zephyr_z9/status/2072077950208688179","Nope"
2026-06-30T21:57:34.000Z,"@zephyr_z9","Zephyr","156.4K","amplifier","South Korea","South Korea",negative,-2.263,176,7,13,"https://x.com/zephyr_z9/status/2072077107065450944","Feynman delayed to 2029"
2026-06-30T21:51:06.000Z,"@zephyr_z9","Zephyr","156.4K","amplifier","South Korea","South Korea",neutral,0,3,,1,"https://x.com/zephyr_z9/status/2072075480849928691","Is it actually nerfed??"
2026-06-30T21:27:07.000Z,"@zephyr_z9","Zephyr","156.4K","amplifier","South Korea","South Korea",neutral,0,90,1,4,"https://x.com/zephyr_z9/status/2072069444806095084",""
2026-06-30T21:23:24.000Z,"@HyperTechInvest","Daniel Romero","41.1K","amplifier","United States","United States",positive,5.574,218,25,8,"https://x.com/HyperTechInvest/status/2072068508310200514","Dylan Patel on the growth of inference:  “The scale of inference deployments will be humongous. By 2030, OpenAI and Anthropic alone will have over 100 gigawatts combined.   Once you add Meta and Google to the mix, the sheer volume of compute dedicated to inference becomes"
2026-06-30T21:04:20.000Z,"@zephyr_z9","Zephyr","156.4K","amplifier","South Korea","South Korea",neutral,0,9,,2,"https://x.com/zephyr_z9/status/2072063712538820814","Bruh Can't u see the flyover cables all over the place??"
2026-06-30T17:49:03.000Z,"@HyperTechInvest","Daniel Romero","41.1K","amplifier","United States","United States",negative,-3.818,38,8,7,"https://x.com/HyperTechInvest/status/2072014565538213991","MLCC prices are rising so fast Chinese traders are updating quotes every 30 minutes  TrendForce reports that in Shenzhen’s Huaqiangbei market, traders are reportedly updating MLCC quotes every 30 minutes as demand from AI servers, AI ASICs and EVs collides with tight high-end"
2026-06-30T16:54:12.000Z,"@zephyr_z9","Zephyr","156.4K","amplifier","South Korea","South Korea",negative,-1.01,7,,,"https://x.com/zephyr_z9/status/2072000763161960654","Very cool design but mass production will be an extremely tough job"
2026-06-30T16:50:38.000Z,"@mingchikuo","郭明錤｜Ming-Chi Kuo","243.1K","watch-only","Asia","Asia",positive,9.245,8,,,"https://x.com/mingchikuo/status/2071999863617913040","Thanks for flagging this. I really appreciate you looking out. I’m aware of it and will follow up appropriately. Grateful to have readers who care about original work."
2026-06-30T16:32:20.000Z,"@zephyr_z9","Zephyr","156.4K","amplifier","South Korea","South Korea",positive,2.975,918,30,37,"https://x.com/zephyr_z9/status/2071995258599280973","Rather than routing data thru PCB, they are using lots of dedicated flyover cables to achieve ultra fast memory access Manufacturing this in volume will be an extremely tough job"
2026-06-30T16:17:13.000Z,"@HyperTechInvest","Daniel Romero","41.1K","amplifier","United States","United States",negative,-1.761,371,38,21,"https://x.com/HyperTechInvest/status/2071991455657202066","Dylan Patel on why  $NVDA  supports Neoclouds and Neolabs  ""Jensen absolutely hates a world where the hyperscalers have all the power. A world where OpenAI, Anthropic, and Google are the only models, and the hyperscalers are the only ones building compute, is one in which Nvidia is"
2026-06-30T15:43:48.000Z,"@zephyr_z9","Zephyr","156.4K","amplifier","South Korea","South Korea",positive,2.862,278,5,10,"https://x.com/zephyr_z9/status/2071983044479848473","This is very cool if true Bad boi will be a monster at prefill"
2026-06-30T12:38:27.000Z,"@zephyr_z9","Zephyr","156.4K","amplifier","South Korea","South Korea",negative,-0.685,33,2,1,"https://x.com/zephyr_z9/status/2071936402691158026","Well, Chinese hardware is 2x-3x less efficient on a FLOPS basis So unless the chips are 3x cheap (which they are not) The 10% advantage goes away"
2026-06-30T12:34:51.000Z,"@zephyr_z9","Zephyr","156.4K","amplifier","South Korea","South Korea",neutral,0,6,,,"https://x.com/zephyr_z9/status/2071935493500190983","Huawei 910Cs in CM384s"
2026-06-30T12:30:54.000Z,"@zephyr_z9","Zephyr","156.4K","amplifier","South Korea","South Korea",neutral,0,20,,1,"https://x.com/zephyr_z9/status/2071934500935004639","Where do u think the Chinese CSPs getting the compute & memory from??"
2026-06-30T12:19:26.000Z,"@zephyr_z9","Zephyr","156.4K","amplifier","South Korea","South Korea",negative,-1.877,387,30,18,"https://x.com/zephyr_z9/status/2071931617212612975","Memory+Compute+Networking is 80% of total CAPEX (China has no advantage here) The rest 20% is power+cooling+shell Assuming China is 50% cheaper compared to US The max net savings is 10%"
2026-06-30T12:06:52.000Z,"@zephyr_z9","Zephyr","156.4K","amplifier","South Korea","South Korea",neutral,0,141,5,5,"https://x.com/zephyr_z9/status/2071928453822324769","Nvidia Dynamo exists because of the whale"
2026-06-30T09:32:44.000Z,"@zephyr_z9","Zephyr","156.4K","amplifier","South Korea","South Korea",negative,-5.574,167,6,7,"https://x.com/zephyr_z9/status/2071889665289077117","DSpark will see crazy adoption  The Whale reduced the compute pressure on Chinese AI infra"
2026-06-30T09:10:28.000Z,"@LinQingV","Macro_Lin ｜ 市场观察员","51.6K","amplifier","China","China",neutral,0,5,,,"https://x.com/LinQingV/status/2071884061489168661","1z is a step up from 1y, but HBM4e targets 1b/1c, that’s still two full nodes away."
2026-06-30T08:59:24.000Z,"@LinQingV","Macro_Lin ｜ 市场观察员","51.6K","amplifier","China","China",neutral,0,5,,,"https://x.com/LinQingV/status/2071881275032715475","HBM2E stockpiled from Samsung and SK Hynix before the Dec 2024 controls kicked in."
2026-06-30T08:58:10.000Z,"@zephyr_z9","Zephyr","156.4K","amplifier","South Korea","South Korea",positive,5.859,71,1,6,"https://x.com/zephyr_z9/status/2071880966021496882","WOW"
2026-06-30T08:56:49.000Z,"@LinQingV","Macro_Lin ｜ 市场观察员","51.6K","amplifier","China","China",neutral,0,163,12,20,"https://x.com/LinQingV/status/2071880626081599874","这里边有个小问题，就是三星海力士不可能买长鑫的DRAM die回去造HBM4e。这样做是行不通的。原因是：  1）制程代差。HBM4e需要1b/1c nm节点，长鑫量产在1x/1y nm，差一到两代，电气特性和热设计根本不达标。  2）Die架构完全不同。HBM die从设计阶段就是为TSV做的1024-bit宽总线、pad"
2026-06-30T08:51:29.000Z,"@damnang2","Damnang2","35.4K","amplifier","United States","United States",neutral,0,22,1,2,"https://x.com/damnang2/status/2071879283338010668",""
