timestamp,handle,displayName,followers,accountType,region,country,sentiment,sentimentScore,likes,retweets,replies,tweetUrl,text
2026-07-08T07:09:36.000+08:00,"@pequityresearch","P Equity Research ","8,899","amplifier","International","International",positive,5.106,96,19,4,"https://x.com/pequityresearch/status/2074631948958396727","Gene Munster on AI CapEx spend for 2027:   ""Street is looking for 23% CapEx growth for next year, few weeks ago it was 17%. If we take what CNBC is reporting this year on the $25B raise from Amazon and the recent comments from Google on their capital raise, that probably suggests"
2026-07-08T07:03:26.000+08:00,"@pequityresearch","P Equity Research ","8,899","amplifier","International","International",positive,4.926,1,,,"https://x.com/pequityresearch/status/2074630398294773897","Thanks! "
2026-07-08T06:17:03.000+08:00,"@pequityresearch","P Equity Research ","8,899","amplifier","International","International",neutral,0,7,,,"https://x.com/pequityresearch/status/2074618727249645694","its ok, we know big boss is ur burner account "
2026-07-08T05:46:41.000+08:00,"@pequityresearch","P Equity Research ","8,899","amplifier","International","International",positive,1.779,1,,,"https://x.com/pequityresearch/status/2074611084657406083","Google and Amazon didnt raise this money just to spend for CY, this is for CY27"
2026-07-08T05:45:47.000+08:00,"@pequityresearch","P Equity Research ","8,899","amplifier","International","International",positive,4.404,1,,,"https://x.com/pequityresearch/status/2074610855589650501","thanks"
2026-07-08T05:34:05.000+08:00,"@pequityresearch","P Equity Research ","8,899","amplifier","International","International",negative,-2.057,,,1,"https://x.com/pequityresearch/status/2074607913079906601","wouldnt be surprising. do you have a clip of him saying that?"
2026-07-08T05:27:25.000+08:00,"@pequityresearch","P Equity Research ","8,899","amplifier","International","International",positive,6.369,2,,,"https://x.com/pequityresearch/status/2074606234049613856","haha yeah, happens sometimes"
2026-07-08T05:26:13.000+08:00,"@pequityresearch","P Equity Research ","8,899","amplifier","International","International",positive,1.449,,,,"https://x.com/pequityresearch/status/2074605931539677302","So pay 100x sales 2 years ahead of the time? Thats a wise investment choice?   #1. they offer zero guidance during earnings  #2. their pipeline isnt even a backlog, its just their fancy way of saying ""this is how much of the market we can service"" with no purchase orders.  #3."
2026-07-08T05:22:55.000+08:00,"@pequityresearch","P Equity Research ","8,899","amplifier","International","International",negative,-2.732,29,1,5,"https://x.com/pequityresearch/status/2074605102208254117","From $51.50 --> $17.68, -66% drop.  $MRAM"
2026-07-08T04:29:02.000+08:00,"@pequityresearch","P Equity Research ","8,899","amplifier","International","International",positive,8.271,3,,1,"https://x.com/pequityresearch/status/2074591542602269080","thanks for sharing :)"
2026-07-08T04:20:27.000+08:00,"@pequityresearch","P Equity Research ","8,899","amplifier","International","International",positive,3.818,69,9,4,"https://x.com/pequityresearch/status/2074589383056036304","UBS: TeraFab  > Vertical Integration: Elon Musk aims to build a vertically integrated semiconductor complex capable of producing terawatt-scale AI compute, mimicking Tesla's 2014 battery Gigafactory strategy.  > All Under One Roof: The Terafab targets the complete semiconductor"
2026-07-08T04:03:11.000+08:00,"@pequityresearch","P Equity Research ","8,899","amplifier","International","International",neutral,0,1,,1,"https://x.com/pequityresearch/status/2074585038264422707","nailed it"
2026-07-08T03:49:46.000+08:00,"@pequityresearch","P Equity Research ","8,899","amplifier","International","International",positive,1.779,,,,"https://x.com/pequityresearch/status/2074581660876583005","and logically put, in no world is higher costs a good thing."
2026-07-08T03:49:19.000+08:00,"@pequityresearch","P Equity Research ","8,899","amplifier","International","International",positive,5.106,,,1,"https://x.com/pequityresearch/status/2074581549043904520","I have an article coming up this week, I encourage you to read it. A section of it is addressing this."
2026-07-08T03:15:14.000+08:00,"@pequityresearch","P Equity Research ","8,899","amplifier","International","International",positive,4.483,1,,1,"https://x.com/pequityresearch/status/2074572969385369738","china not giving access to their models in the US is the only way that forces enterprises to adopt US models, so a benefit for Jensen if anything."
2026-07-08T03:14:21.000+08:00,"@pequityresearch","P Equity Research ","8,899","amplifier","International","International",positive,3.549,2,,1,"https://x.com/pequityresearch/status/2074572746097385735","Well its a joke and no im not raging. Higher prices are not a good thing for this AI spending cycle."
2026-07-08T02:39:48.000+08:00,"@pequityresearch","P Equity Research ","8,899","amplifier","International","International",positive,3.716,29,3,1,"https://x.com/pequityresearch/status/2074564052064342037","Great graph by SouthernValue, but to give you another perspective on the spending, here is one more bar: 2024 CapEx spending.   Google is on pace to spend more individually ($350B) than the entire CapEx spend in 2024 ($256B) by a conglomerate of companies. Gives you a perspective"
2026-07-08T02:30:23.000+08:00,"@pequityresearch","P Equity Research ","8,899","amplifier","International","International",negative,-2.96,1,,,"https://x.com/pequityresearch/status/2074561683880554635","No CapEx pause in 2027 coming"
2026-07-08T02:10:43.000+08:00,"@pequityresearch","P Equity Research ","8,899","amplifier","International","International",positive,6.3,5,,1,"https://x.com/pequityresearch/status/2074556733171585199","Lol ok. I guess we will know in a year how the business is doing. I just dont see enough clarity with the company. They dont offer any guidance, and their investors hinge on a pipeline number (which isnt a backlog). It doesnt make sense to invest on a ""trust me bro"" basis with"
2026-07-08T02:02:19.000+08:00,"@pequityresearch","P Equity Research ","8,899","amplifier","International","International",negative,-2.144,3,,3,"https://x.com/pequityresearch/status/2074554619485671764","This means nothing until we see revenue. Mapping them out in the supply chain is all good, but at the end of the day, what is the revenue? No one knows. Lets wait and see."
2026-07-08T01:45:22.000+08:00,"@pequityresearch","P Equity Research ","8,899","amplifier","International","International",positive,8.442,28,1,1,"https://x.com/pequityresearch/status/2074550356508279240","Mirae Asset Securities: Samsung  Rating & Target Price: Mirae Asset maintains a Buy rating and a target price of W550,000.  > Earnings Beat: SEC exceeded market expectations, reporting preliminary revenue of W171tr (+28% QoQ) and operating profit (OP) of W89.4tr (+56% QoQ).  >"
2026-07-08T01:41:43.000+08:00,"@pequityresearch","P Equity Research ","8,899","amplifier","International","International",neutral,0,1,,,"https://x.com/pequityresearch/status/2074549436613607509","watch it..."
2026-07-08T01:34:35.000+08:00,"@pequityresearch","P Equity Research ","8,899","amplifier","International","International",positive,4.215,5,,1,"https://x.com/pequityresearch/status/2074547639144587383","nice post"
2026-07-08T01:33:12.000+08:00,"@pequityresearch","P Equity Research ","8,899","amplifier","International","International",neutral,0,3,,,"https://x.com/pequityresearch/status/2074547293655568699","It always was. Going up doesnt mean validation of thesis, and someone meant."
2026-07-08T01:27:02.000+08:00,"@pequityresearch","P Equity Research ","8,899","amplifier","International","International",positive,2.96,,,,"https://x.com/pequityresearch/status/2074545740106400076","yeah"
2026-07-08T01:16:59.000+08:00,"@pequityresearch","P Equity Research ","8,899","amplifier","International","International",positive,8.412,66,7,7,"https://x.com/pequityresearch/status/2074543213776453748","I just noticed this but Amazon  $AMZN  is doing a bond sale of $25B to fund their CapEx spending on AI.   Didn't really take long...  More surprising the market isn't punishing them for this move. A lot more money to be made for semiconductor companies next year."
2026-07-08T01:11:07.000+08:00,"@pequityresearch","P Equity Research ","8,899","amplifier","International","International",positive,2.347,4,,1,"https://x.com/pequityresearch/status/2074541734474739734","if you made money, its good. but at the same time whoever bought at 100 SEK is stuck right now hoping it will rebound (and it could) but it losing 60% in just weeks is not natural and resonates as a typical pump/dump. Better photonics names to get into than them imo."
2026-07-08T01:05:31.000+08:00,"@pequityresearch","P Equity Research ","8,899","amplifier","International","International",neutral,0,47,1,1,"https://x.com/pequityresearch/status/2074540325972988196","Society if memory makers ate up only 25% of CapEx instead of 50%"
2026-07-08T00:51:46.000+08:00,"@pequityresearch","P Equity Research ","8,899","amplifier","International","International",positive,6.369,3,,,"https://x.com/pequityresearch/status/2074536864262889780","haha yeah"
2026-07-08T00:23:20.000+08:00,"@pequityresearch","P Equity Research ","8,899","amplifier","International","International",neutral,0,5,,,"https://x.com/pequityresearch/status/2074529709841424484","Same way here. I have one position in photonics named Himax, but its one of the cheaper names. Only 16x PE for fy27 and 2x P/S"
2026-07-08T00:21:19.000+08:00,"@pequityresearch","P Equity Research ","8,899","amplifier","International","International",neutral,0,2,,,"https://x.com/pequityresearch/status/2074529202087301323","Need more "
2026-07-08T00:19:25.000+08:00,"@pequityresearch","P Equity Research ","8,899","amplifier","International","International",neutral,0,5,,1,"https://x.com/pequityresearch/status/2074528723739574334","I forgot to mention it but the pipeline they have of $800M isnt even a backlog, its basically the amount they extrapolate they could address but doesnt assume POs."
2026-07-08T00:18:45.000+08:00,"@semivision_tw","SemiVision  ","11.7K","competitor","Taiwan","Taiwan",neutral,0,3,,,"https://x.com/semivision_tw/status/2074528557284663655","Foxconn…. Many Taiwan ODM have factories in Mexico"
2026-07-08T00:11:49.000+08:00,"@pequityresearch","P Equity Research ","8,899","amplifier","International","International",negative,-5.411,6,,1,"https://x.com/pequityresearch/status/2074526813657661919","You can be my bodyguard... ill pay you!"
2026-07-08T00:06:55.000+08:00,"@semivision_tw","SemiVision  ","11.7K","competitor","Taiwan","Taiwan",positive,4.019,17,3,1,"https://x.com/semivision_tw/status/2074525577172922671","Taiwan can help"
2026-07-08T00:02:09.000+08:00,"@pequityresearch","P Equity Research ","8,899","amplifier","International","International",negative,-7.109,130,4,19,"https://x.com/pequityresearch/status/2074524377652084867","Nothing against Serenity but I dont like how SIVE is bunched up in here with all the other names and then he says:   ""Probably doesn't have anything to do with individual fundamentals.""   I disagree. SIVE at its peak was trading ~100x P/S and their current hope lies on the"
2026-07-08T07:21:35.000+08:00,"@wallstengine","Wall St Engine","159.1K","amplifier","International","International",neutral,0,6,1,,"https://x.com/wallstengine/status/2074634966630302000","Here’s the announcement:"
2026-07-08T07:13:50.000+08:00,"@wallstengine","Wall St Engine","159.1K","amplifier","International","International",neutral,0,3,,1,"https://x.com/wallstengine/status/2074633014534176828","Saving time in this industry is a big deal"
2026-07-08T07:12:39.000+08:00,"@wallstengine","Wall St Engine","159.1K","amplifier","International","International",positive,4.404,2,,,"https://x.com/wallstengine/status/2074632719959831003","Doing a good work"
2026-07-08T06:40:21.000+08:00,"@wallstengine","Wall St Engine","159.1K","amplifier","International","International",neutral,0,2,,,"https://x.com/wallstengine/status/2074624591214088537",""
2026-07-08T06:36:01.000+08:00,"@wallstengine","Wall St Engine","159.1K","amplifier","International","International",positive,5.574,63,6,7,"https://x.com/wallstengine/status/2074623498958545206","$SHMD  received a repeat order worth over €37M from a Chinese customer for HDI-ML and mSAP production equipment.  The equipment will support capacity expansion for AI server boards and optical module applications.  Including this order, SCHMID’s 2026 order intake now stands at"
2026-07-08T06:35:37.000+08:00,"@wallstengine","Wall St Engine","159.1K","amplifier","International","International",positive,1.027,22,3,8,"https://x.com/wallstengine/status/2074623398614040986","> healthcare systems are under pressure  > clinicians are spending too much time on documentation and admin  > WHO estimates an 11M healthcare worker shortfall by 2030  > we are not training our way out of that fast enough  > Heidi helps clinicians complete notes, dictation, and"
2026-07-08T04:55:38.000+08:00,"@wallstengine","Wall St Engine","159.1K","amplifier","International","International",neutral,0,139,11,12,"https://x.com/wallstengine/status/2074598238276210983","SPACEXAI PLANS TO LAUNCH NEW MODEL WITH CURSOR AS SOON AS WEDNESDAY"
2026-07-08T04:13:50.000+08:00,"@wallstengine","Wall St Engine","159.1K","amplifier","International","International",neutral,0,88,,10,"https://x.com/wallstengine/status/2074587719611961755",""
2026-07-08T04:10:53.000+08:00,"@wallstengine","Wall St Engine","159.1K","amplifier","International","International",positive,5.106,147,24,15,"https://x.com/wallstengine/status/2074586974502224280","$PENG  | Penguin Solutions Q3 FY26 Earnings Highlights   Revenue: $478.7M vs $421.4M Est.    Adj EPS: $0.84 vs $0.56 Est.     Record quarterly net sales, up 48% YoY.  FY26 Outlook Raised:   Non-GAAP EPS: $2.60 ±$0.05 vs $2.28 Est.    Net sales growth now seen at"
2026-07-08T03:30:14.000+08:00,"@wallstengine","Wall St Engine","159.1K","amplifier","International","International",neutral,0,83,5,10,"https://x.com/wallstengine/status/2074576744397599185","Anthropic is extending Claude Fable 5 access for all paid plans through July 12, delaying a planned July 7 shift to token-based usage."
2026-07-08T03:12:12.000+08:00,"@wallstengine","Wall St Engine","159.1K","amplifier","International","International",neutral,0,44,4,7,"https://x.com/wallstengine/status/2074572208115224903","$USO  +4.5%"
2026-07-08T02:52:51.000+08:00,"@wallstengine","Wall St Engine","159.1K","amplifier","International","International",negative,-4.404,76,10,11,"https://x.com/wallstengine/status/2074567335600652668","The U.S. is revoking a general license that allowed Iranian oil sales after calling Iran’s actions in the Strait of Hormuz “wholly unacceptable.” The move follows tanker attacks near the strait, which carries about a fifth of global oil consumption."
2026-07-08T02:44:55.000+08:00,"@wallstengine","Wall St Engine","159.1K","amplifier","International","International",positive,3.4,1,,,"https://x.com/wallstengine/status/2074565342110900428","Excited to try this"
2026-07-08T02:31:33.000+08:00,"@wallstengine","Wall St Engine","159.1K","amplifier","International","International",negative,-3.818,52,6,7,"https://x.com/wallstengine/status/2074561975208784354","FT: Saudi bank transfers to UAE accounts have been blocked, delayed or returned since May, businesses report, raising trade concerns between the Gulf neighbors. Bilateral trade tops $20B a year. Saudi’s central bank denied country-specific restrictions."
2026-07-08T02:11:05.000+08:00,"@wallstengine","Wall St Engine","159.1K","amplifier","International","International",neutral,0,66,8,10,"https://x.com/wallstengine/status/2074556825052283144","FRANCE'S  LE PEN SAYS SHE'LL RUN IN 2027 PRESIDENTIAL ELECTION"
2026-07-08T02:09:45.000+08:00,"@wallstengine","Wall St Engine","159.1K","amplifier","International","International",neutral,0,29,1,,"https://x.com/wallstengine/status/2074556490380455970","More detail: The model, called Muse Image, is rolling out Tuesday inside the  $META  AI chatbot, the company said in a blog post. It will also be embedded in Meta’s various social apps, including Instagram and WhatsApp. People can use it to generate images based on text prompts or"
2026-07-08T02:04:37.000+08:00,"@wallstengine","Wall St Engine","159.1K","amplifier","International","International",positive,2.732,291,39,23,"https://x.com/wallstengine/status/2074555199365218310","$META  plans to release its first AI model for image creation, called Muse, and replace third-party image models with its own proprietary image technology."
2026-07-08T01:42:47.000+08:00,"@wallstengine","Wall St Engine","159.1K","amplifier","International","International",neutral,0,89,4,10,"https://x.com/wallstengine/status/2074549704873103761","$GOOGL  announced its Made by Google 2026 event for Aug. 12 in New York City, starting at 3 p.m. PT.   The company is expected to unveil the Pixel 11 lineup, including Pro, Pro XL and Pro Fold models, plus Pixel Watch 5."
2026-07-08T01:19:56.000+08:00,"@wallstengine","Wall St Engine","159.1K","amplifier","International","International",neutral,0,82,4,12,"https://x.com/wallstengine/status/2074543953635062050","Variety: Netflix  $NFLX  signed video licensing deals with PMX, BuzzFeed Studios, Condé Nast, Hearst, People Inc. and Tastemade. Starting Aug. 3, it will carry publisher videos ranging from 2 minutes to 20+ minutes in the U.S., Canada, U.K., Ireland, Australia and New Zealand."
2026-07-08T01:01:33.000+08:00,"@wallstengine","Wall St Engine","159.1K","amplifier","International","International",neutral,0,63,4,7,"https://x.com/wallstengine/status/2074539327041016292","US POWER USE TO BEAT RECORD HIGHS IN 2026 AND 2027: EIA"
2026-07-08T00:26:36.000+08:00,"@wallstengine","Wall St Engine","159.1K","amplifier","International","International",positive,6.249,250,24,14,"https://x.com/wallstengine/status/2074530530394353724","Bloomberg: Microsoft  $MSFT  is starting to use its own MAI models in some Excel and Outlook features, replacing OpenAI and Anthropic for certain tasks. Tens of thousands of AI prompts in those apps are now handled weekly by Microsoft’s internal models."
2026-07-08T00:13:29.000+08:00,"@wallstengine","Wall St Engine","159.1K","amplifier","International","International",neutral,0,256,12,28,"https://x.com/wallstengine/status/2074527231498760507","$NVDA  is now green on the day while  $QQQ  is down 1.6%"
2026-07-08T00:07:50.000+08:00,"@wallstengine","Wall St Engine","159.1K","amplifier","International","International",neutral,0,756,67,27,"https://x.com/wallstengine/status/2074525811550654947","SK HYNIX’S U.S. IPO IS REPORTEDLY MULTIPLE TIMES OVERSUBSCRIBED."
2026-07-08T00:05:56.000+08:00,"@oguzerkan","Oguz Erkan","121.2K","amplifier","United States","United States",positive,3.4,190,14,35,"https://x.com/oguzerkan/status/2074525333240369523","Once we get the next big leap in AI models and revenues jump, the sentiment will once again shift to “there is not enough compute.”   $CRWV  will easily re-rate $150 and  $NBIS  to $300."
2026-07-08T12:40:40.000+08:00,"@bubbleboi","bubble boi","88.2K","amplifier","International","International",negative,-2.006,6,1,,"https://x.com/bubbleboi/status/2074715264764228091","I will be there in a very offline way"
2026-07-08T12:36:59.000+08:00,"@bubbleboi","bubble boi","88.2K","amplifier","International","International",neutral,0,1,,,"https://x.com/bubbleboi/status/2074714338229903440","Lmaooooo drug trafficking"
2026-07-08T12:29:03.000+08:00,"@bubbleboi","bubble boi","88.2K","amplifier","International","International",neutral,0,1,,,"https://x.com/bubbleboi/status/2074712343305675257","I’ll move back"
2026-07-08T12:17:40.000+08:00,"@bubbleboi","bubble boi","88.2K","amplifier","International","International",neutral,0,7,,,"https://x.com/bubbleboi/status/2074709477312573743","Let’s do it"
2026-07-08T11:43:43.000+08:00,"@bubbleboi","bubble boi","88.2K","amplifier","International","International",positive,4.215,1,,,"https://x.com/bubbleboi/status/2074700932475232446","lol how do you know?"
2026-07-08T10:12:23.000+08:00,"@damnang2","Damnang","35.4K","amplifier","United States","United States",neutral,0,,,,"https://x.com/damnang2/status/2074677947689210345",""
2026-07-08T12:22:48.000+08:00,"@insane_analyst","Irrational Analysis","40.8K","amplifier","International","International",neutral,0,,,,"https://x.com/insane_analyst/status/2074710769376375262",""
2026-07-08T12:00:49.000+08:00,"@qinbafrank","qinbafrank","145.9K","amplifier","International","International",neutral,0,20,3,3,"https://x.com/qinbafrank/status/2074705237135298660","微软不仅部署开源模型，还开始自研模型来MAI。看彭博报道，微软正在Excel和Outlook等Microsoft 365应用中，逐步用自研的MAI（Microsoft AI）模型取代部分OpenAI和Anthropic的模型，以降低AI推理成本。"
2026-07-08T11:53:01.000+08:00,"@pequityresearch","P Equity Research ","8,899","amplifier","International","International",positive,4.588,23,3,1,"https://x.com/pequityresearch/status/2074703275824148987","Morgan Stanley: ABF Substrate  > Stronger & Earlier Cycle: The substrate pricing cycle is proving much stronger and arriving earlier than originally expected. Driven by capacity tightening and robust demand, gross margins are expanding across the industry.  > Widening Supply"
2026-07-08T11:46:03.000+08:00,"@dmjk001","快讯","24.6K","amplifier","China","China",neutral,0,18,,6,"https://x.com/dmjk001/status/2074701523058389354","刚刚市场有传言，旭创在HK基石路演途中说，二季度业绩有99亿。  实际情况是，投资人问二季度业绩如何，有没有100亿，旭创说，没有100亿。  于是市场传言：99亿。  目前看旭创二季度业绩预期在70-75亿左右。"
2026-07-08T11:35:43.000+08:00,"@semivision_tw","SemiVision  ","11.7K","competitor","Taiwan","Taiwan",positive,3.612,1,,,"https://x.com/semivision_tw/status/2074698920895431106","Thank you"
2026-07-08T11:13:02.000+08:00,"@semivision_tw","SemiVision  ","11.7K","competitor","Taiwan","Taiwan",negative,-5.267,12,2,1,"https://x.com/semivision_tw/status/2074693211331715127","Under this framework, GPUs are no longer just hardware devices. They are revenue machines. Data centers are no longer just infrastructure. They are factories with productive output. Every kilowatt-hour of electricity, every GPU, every NVLink connection, every optical module, and"
2026-07-08T11:07:59.000+08:00,"@dmjk001","快讯","24.6K","amplifier","China","China",neutral,0,9,,,"https://x.com/dmjk001/status/2074691939782611104","这个不合常理吧，谁家敢在路演透露未公告的业绩，不怕波及港股IPO吗"
2026-07-08T11:05:58.000+08:00,"@pequityresearch","P Equity Research ","8,899","amplifier","International","International",positive,7.906,2,,1,"https://x.com/pequityresearch/status/2074691436289679434","good  always great graphics made by you"
2026-07-08T11:05:25.000+08:00,"@dmjk001","快讯","24.6K","amplifier","China","China",neutral,0,16,1,2,"https://x.com/dmjk001/status/2074691296510546296","传：旭创HK基石路演透露Q2净利润99亿"
2026-07-08T11:00:33.000+08:00,"@pequityresearch","P Equity Research ","8,899","amplifier","International","International",negative,-6.705,28,1,3,"https://x.com/pequityresearch/status/2074690072629162088","There are a million good reasons at this point for hating on KOSPI. It's simply the worst."
2026-07-08T10:58:32.000+08:00,"@pequityresearch","P Equity Research ","8,899","amplifier","International","International",negative,-1.28,3,,1,"https://x.com/pequityresearch/status/2074689563059003549","CXMT and YMTC are not adding capacity fast enough. They will not be able to cause any kind of oversupply. Plus, they are more concerned with catering to domestic demand for DRAM and NAND."
2026-07-08T10:49:50.000+08:00,"@pequityresearch","P Equity Research ","8,899","amplifier","International","International",negative,-2.1,2,,1,"https://x.com/pequityresearch/status/2074687373225369833","Lol? ""China is aggressively scaling memory production and selling DRAM and NAND much cheaper than what  $MU  and  $SNDK  can offer."" this just isnt true"
2026-07-08T10:45:04.000+08:00,"@semivision_tw","SemiVision  ","11.7K","competitor","Taiwan","Taiwan",neutral,-0.294,18,1,4,"https://x.com/semivision_tw/status/2074686174375886891","The semiconductor market in 2026 is no longer well described by the old hierarchy in which CPUs and GPUs were the protagonists and memory was merely a supporting component. In the current AI infrastructure cycle, the real shift in industry power is coming from something more"
2026-07-08T10:36:48.000+08:00,"@pequityresearch","P Equity Research ","8,899","amplifier","International","International",negative,-5.023,2,,,"https://x.com/pequityresearch/status/2074684092969284011","Ive looked at SHMD before but financials are a mess so never looked back"
2026-07-08T10:28:50.000+08:00,"@pequityresearch","P Equity Research ","8,899","amplifier","International","International",positive,3.182,2,,,"https://x.com/pequityresearch/status/2074682088712728581","huge"
2026-07-08T10:26:31.000+08:00,"@dmjk001","快讯","24.6K","amplifier","China","China",neutral,0,11,1,,"https://x.com/dmjk001/status/2074681506291974266","EML&CW光源&OCS重大更新（0708）  EML供需：100G/200G EML仍紧缺，2027年产能基本被锁定，新订单排到2028年价格趋势：2027年100G EML上调至8美元，200G EML接近14美元，且大客户已同意涨价  CPO高功率光源：2027年产出预期上修至2000万-2500万颗"
