timestamp,handle,displayName,followers,accountType,region,country,sentiment,sentimentScore,likes,retweets,replies,tweetUrl,text
2026-06-26T01:32:46.000Z,"@dnystedt","Dan Nystedt","51.5K","amplifier","Taiwan","Taiwan",neutral,0,1,,,"https://x.com/dnystedt/status/2070319323894403261",""
2026-06-26T01:32:37.000Z,"@dnystedt","Dan Nystedt","51.5K","amplifier","Taiwan","Taiwan",positive,3.182,5,,2,"https://x.com/dnystedt/status/2070319287798267933","How are Intel Foundry and Samsung Foundry not selling out their 3nm production? Huge bottleneck."
2026-06-26T01:24:24.000Z,"@dnystedt","Dan Nystedt","51.5K","amplifier","Taiwan","Taiwan",positive,5.574,,,,"https://x.com/dnystedt/status/2070317221038178316","Agree 100%. Apple could have signed long term agreements years ago, when memory prices were underwater. They'd look genius today if they had."
2026-06-26T01:17:55.000Z,"@QQ_Timmy","駿HaYaO","28.6K","amplifier","Asia","Asia",negative,-2.5,4,,,"https://x.com/QQ_Timmy/status/2070315587239313442","#Daily Guide #20260626 #Economic Daily News  Micron's last quarter earnings comprehensively exceeded expectations, memory supply shortage continues OpenAI's self-developed chip ""Jalapeño"" completes design, TSMC 3nm foundry Foreign investors sold over NT$250 billion of Taiwan"
2026-06-26T01:17:08.000Z,"@dnystedt","Dan Nystedt","51.5K","amplifier","Taiwan","Taiwan",negative,-3.182,5,1,,"https://x.com/dnystedt/status/2070315391721914626","Note: Jalapeno2 is made up. For all I know, the next chip could be called Habanero, followed by Ghost Pepper, and Carolina Reaper."
2026-06-26T01:05:19.000Z,"@dnystedt","Dan Nystedt","51.5K","amplifier","Taiwan","Taiwan",negative,-6.956,,,1,"https://x.com/dnystedt/status/2070312415930224902","If you see something coming, but you're producing goods at a loss and have no money to invest, what do you do?"
2026-06-26T01:01:26.000Z,"@dnystedt","Dan Nystedt","51.5K","amplifier","Taiwan","Taiwan",positive,2.5,13,1,2,"https://x.com/dnystedt/status/2070311441832550812","TSMC is expected to manufacture Qualcomm’s Dragonfly C100 data center CPUs and AI300 AI accelerator chips on 3nm/2nm and use CoWoS or SoIC advanced packaging, media report.  $TSM   $QCOM  #semiconductor"
2026-06-26T01:01:06.000Z,"@dnystedt","Dan Nystedt","51.5K","amplifier","Taiwan","Taiwan",positive,4.588,4,1,1,"https://x.com/dnystedt/status/2070311357338226882","Qualcomm’s Dragonfly AI data center platform will benefit Taiwan’s 2nd biggest chip foundry, UMC, more than TSMC, media report, due to its expertise in power integration, including power management (PMIC) chips, on-wafer inductors, Deep Trench Capacitors (DTC), and interposers,"
2026-06-26T01:00:02.000Z,"@dnystedt","Dan Nystedt","51.5K","amplifier","Taiwan","Taiwan",neutral,0,10,,1,"https://x.com/dnystedt/status/2070311089141944737","TSMC Technology Symposium (Shanghai) Takeaways, media report: -6T SRAM breakthrough with 30% area reduction on nanosheet (GAA) -CoWoS 5.5x reticle size hit 98% yield in mass production -N2 wafer output in 1st year to beat N3’s 1st year output by 45% -N2/A16 capacity expected to"
2026-06-26T00:58:33.000Z,"@dnystedt","Dan Nystedt","51.5K","amplifier","Taiwan","Taiwan",positive,2.5,14,2,3,"https://x.com/dnystedt/status/2070310715555238111","Rumor: OpenAI’s new Jalapeno AI inference chip will be made by TSMC on 3nm, while the Jalapeno2 will use A16 and CoWoS advanced packaging, media report.  $TSM   $AVGO  #OpenAI #semiconductors"
2026-06-26T00:50:12.000Z,"@aleabitoreddit","Serenity","881.1K","amplifier","International","International",positive,3.182,73,2,6,"https://x.com/aleabitoreddit/status/2070308614829728045","Looks like photonics theme selloff combined with macro drop with  $AAOI .  I’m personally confident from  $AMD  CW LTA reports and next year’s $471M/month projections.   But of course people should make their own decisions, optical names tend to be more volatile."
2026-06-26T00:48:57.000Z,"@jukan05","Jukan @ICML","155.3K","amplifier","South Korea","South Korea",neutral,0,2,,1,"https://x.com/jukan05/status/2070308298541384047","Wouldn’t it naturally be after that?"
2026-06-26T00:41:46.000Z,"@jukan05","Jukan @ICML","155.3K","amplifier","South Korea","South Korea",negative,-2.96,21,,2,"https://x.com/jukan05/status/2070306489772986618","What are you talking about? NVIDIA sources HBM at much lower prices than other ASIC makers."
2026-06-26T00:41:31.000Z,"@bubbleboi","bubble boi","88.2K","amplifier","International","International",positive,5.719,11,,1,"https://x.com/bubbleboi/status/2070306428129259662","It’s possible. But only opens up an opportunity for a dog with a soda."
2026-06-26T00:40:46.000Z,"@bubbleboi","bubble boi","88.2K","amplifier","International","International",neutral,0,,,,"https://x.com/bubbleboi/status/2070306238550909190","Spending money"
2026-06-26T00:40:34.000Z,"@bubbleboi","bubble boi","88.2K","amplifier","International","International",neutral,0,1,,1,"https://x.com/bubbleboi/status/2070306190572360151","28"
2026-06-26T00:36:51.000Z,"@jukan05","Jukan @ICML","155.3K","amplifier","South Korea","South Korea",neutral,0,5,,,"https://x.com/jukan05/status/2070305252138782966","That’s Anthropic, not OpenAI."
2026-06-26T00:35:11.000Z,"@jukan05","Jukan @ICML","155.3K","amplifier","South Korea","South Korea",neutral,0,8,,2,"https://x.com/jukan05/status/2070304833446478150","Yipit"
2026-06-26T00:34:45.000Z,"@aleabitoreddit","Serenity","881.1K","amplifier","International","International",positive,5.859,375,33,120,"https://x.com/aleabitoreddit/status/2070304723262210194","Looks like Power Semis are already starting price hikes.  Which is bullish thematically for US power semi trade from  $AOSL  to  $POWI , before the 800V DC shift fully hits.  China's Yangjie Technology, announced a 2nd price increase this year, raising prices across its full product"
2026-06-26T00:34:28.000Z,"@QQ_Timmy","駿HaYaO","28.6K","amplifier","Asia","Asia",positive,7.263,12,,,"https://x.com/QQ_Timmy/status/2070304653284397108","Good morning! 6/26 Foreign Media Summary  - ABF: US Firms Raise Targets US brokerage firms have raised profit forecasts and price targets for 3037 Unimicron, 8046 Nanya PCB, and 3189 Shinko. Key updates include the ABF supply-demand gap for 2026-2028 further widening to"
2026-06-26T00:33:00.000Z,"@jukan05","Jukan @ICML","155.3K","amplifier","South Korea","South Korea",neutral,0,161,15,13,"https://x.com/jukan05/status/2070304285703946504","OpenAI’s ARR stood at $40bn as of June."
2026-06-26T00:32:15.000Z,"@bubbleboi","bubble boi","88.2K","amplifier","International","International",positive,3.291,26,,,"https://x.com/bubbleboi/status/2070304095454499072","I have chests & chests filled with alpha but I don’t show all my cards at once. I’m actively working on a solution to the problem now it’s just a race against time."
2026-06-26T00:30:22.000Z,"@bubbleboi","bubble boi","88.2K","amplifier","International","International",neutral,0,,,1,"https://x.com/bubbleboi/status/2070303622299279717","Again you don’t understand anything. I shorted the volatility not the stock, learn to use your brain."
2026-06-26T00:29:41.000Z,"@bubbleboi","bubble boi","88.2K","amplifier","International","International",positive,6.187,199,14,21,"https://x.com/bubbleboi/status/2070303450005741931","What we are seeing is the equivalent of your house being on fire and the fire fighters asking for a bribe to put it out. But also they actually lit the fire in the first place.   Dram cartel would rather engage in rent seeking behavior than add value. Won’t end good for them I’ll"
2026-06-26T01:10:21.000Z,"@antiAIvo","纳米AI","15K","amplifier","China","China",neutral,0,,,,"https://x.com/antiAIvo/status/2070313682995937700","pcb设备，也要做光纤了"
2026-06-26T00:34:28.000Z,"@dylan522p","Dylan Patel","140K","competitor","International","International",neutral,0,10,,1,"https://x.com/dylan522p/status/2070304653364146386","It's really not"
2026-06-26T00:30:07.000Z,"@SemiAnalysis_","SemiAnalysis","111.4K","competitor","International","International",positive,6.322,140,6,14,"https://x.com/SemiAnalysis_/status/2070303556964401637","""So you're saying that your SRAM supply is infinite?""  ""Yes""  ""But the logic wafers on which the SRAM is fabbed is supply constrained?""  ""Yes Dave that's right"""
2026-06-26T00:00:07.000Z,"@SemiAnalysis_","SemiAnalysis","111.4K","competitor","International","International",neutral,0,286,13,20,"https://x.com/SemiAnalysis_/status/2070296008106349024","BREAKING NEWS: OpenAI’s Technical Lead for Compute has returned to OpenAI after joining Meta in April 2026. What is going on at Meta that people are quitting after only a couple of months?  Did Anuj get reorged into a data-labeling role at Meta, and is that why he left?"
2026-06-26T01:38:00.000Z,"@insane_analyst","Irrational Analysis","40.8K","amplifier","International","International",positive,5.106,1,,2,"https://x.com/insane_analyst/status/2070320640671031519","Ok well nvidia price + 75% gm applied still > buy hbm and consign?"
2026-06-26T01:33:50.000Z,"@pequityresearch","P Equity Research ","8,899","amplifier","International","International",neutral,0,,,,"https://x.com/pequityresearch/status/2070319592392552527",""
2026-06-26T01:19:09.000Z,"@semivision_tw","SemiVision  ","11.7K","competitor","Taiwan","Taiwan",neutral,0,1,,,"https://x.com/semivision_tw/status/2070315897995264091","I think someone is trying to make a semivision digitwins "
2026-06-26T01:17:04.000Z,"@pequityresearch","P Equity Research ","8,899","amplifier","International","International",positive,1.027,1,,1,"https://x.com/pequityresearch/status/2070315373178536398","ok now that is strange "
2026-06-26T01:14:44.000Z,"@semivision_tw","SemiVision  ","11.7K","competitor","Taiwan","Taiwan",neutral,0,1,,1,"https://x.com/semivision_tw/status/2070314787184259221","Even food post… they did monitor too…"
2026-06-26T01:12:29.000Z,"@pequityresearch","P Equity Research ","8,899","amplifier","International","International",neutral,0,,,1,"https://x.com/pequityresearch/status/2070314222509023674"," "
2026-06-26T01:11:14.000Z,"@semivision_tw","SemiVision  ","11.7K","competitor","Taiwan","Taiwan",neutral,0,4,,1,"https://x.com/semivision_tw/status/2070313905503826428","I just found out that AI is scraping our posts and writing a daily memoir about us. I didn’t know I had an unauthorized biographer. "
2026-06-26T01:03:34.000Z,"@semivision_tw","SemiVision  ","11.7K","competitor","Taiwan","Taiwan",positive,8.201,1,,,"https://x.com/semivision_tw/status/2070311976119791627","AIM Photonics not only provides PDKs (Process Design Kits), testing, and fabrication platforms, but also actively promotes a complete workflow from design and wafer manufacturing to advanced packaging. Its core mission is to accelerate the adoption of photonic-electronic"
2026-06-26T00:56:51.000Z,"@dmjk001","kuaixun","24.6K","amplifier","China","China",positive,4.404,7,2,1,"https://x.com/dmjk001/status/2070310286050107823","Bloomberg: Chinese Hardware Tech Stocks Hope Earnings Will Sustain Upward Trend"
2026-06-26T00:43:34.000Z,"@pequityresearch","P Equity Research ","8,899","amplifier","International","International",neutral,0,1,,,"https://x.com/pequityresearch/status/2070306943533551901",""
2026-06-26T00:40:58.000Z,"@pequityresearch","P Equity Research ","8,899","amplifier","International","International",neutral,0,1,,1,"https://x.com/pequityresearch/status/2070306287535923447","How old?"
2026-06-26T00:40:50.000Z,"@pequityresearch","P Equity Research ","8,899","amplifier","International","International",neutral,0,1,,1,"https://x.com/pequityresearch/status/2070306256074494202",""
2026-06-26T00:40:39.000Z,"@pequityresearch","P Equity Research ","8,899","amplifier","International","International",neutral,0,1,,,"https://x.com/pequityresearch/status/2070306211568795752",""
2026-06-26T00:38:06.000Z,"@pequityresearch","P Equity Research ","8,899","amplifier","International","International",positive,2.96,2,,1,"https://x.com/pequityresearch/status/2070305568191918141","Yep "
2026-06-26T00:31:46.000Z,"@pequityresearch","P Equity Research ","8,899","amplifier","International","International",positive,1.901,1,,,"https://x.com/pequityresearch/status/2070303973832061177","This list above will never cover everything but yes,  $AEHR . This was compiled from Yole Group and sprinkled in some of my own names i believe it missed."
2026-06-26T00:22:59.000Z,"@pequityresearch","P Equity Research ","8,899","amplifier","International","International",neutral,0,,,,"https://x.com/pequityresearch/status/2070301763547041822",""
2026-06-26T00:22:17.000Z,"@pequityresearch","P Equity Research ","8,899","amplifier","International","International",neutral,0,2,,,"https://x.com/pequityresearch/status/2070301588258730381",""
2026-06-26T00:20:47.000Z,"@pequityresearch","P Equity Research ","8,899","amplifier","International","International",negative,-4.11,14,,2,"https://x.com/pequityresearch/status/2070301209215295775","everything besides semi equipment and memory is dead. theres nothing wrong with nvidia, its just how the money has been rotating the past month"
2026-06-26T00:08:37.000Z,"@pequityresearch","P Equity Research ","8,899","amplifier","International","International",neutral,0,1,,1,"https://x.com/pequityresearch/status/2070298149873172687","tysm "
2026-06-26T00:06:17.000Z,"@pequityresearch","P Equity Research ","8,899","amplifier","International","International",neutral,0,40,7,5,"https://x.com/pequityresearch/status/2070297560695058503","Wafer Fabrication Equipment   Lithography  ASML  $ASML   Veeco  $VECO   Tokyo Electron $8035.T  Canon $7751.T  Nikon $7731.T  Thin Film Deposition & ALD  Lam Research  $LRCX   Applied Materials  $AMAT   CVD Equipment  $CVV   Tokyo Electron $8035.T  Wonik IPS $240810.KQ  Eugene Technology"
2026-06-26T21:00:55.000Z,"@SemiAnalysis_","SemiAnalysis","111.4K","competitor","International","International",positive,4.215,42,1,1,"https://x.com/SemiAnalysis_/status/2070613301524877756","Shades of Raptor engine progress here from NVIDIA as they move towards a fanless design in their Rubin NVL8 HGX systems and simplify the system design. (3/3)"
2026-06-26T21:00:55.000Z,"@SemiAnalysis_","SemiAnalysis","111.4K","competitor","International","International",positive,7.096,41,2,3,"https://x.com/SemiAnalysis_/status/2070613299666817042","It is a nice contrast between this new modular design with integrated DLC coldplates and the 4u B300 design with a row of fans moving air on top of the coldplates, just to cool all the other systems components. (2/3)"
2026-06-26T21:00:54.000Z,"@SemiAnalysis_","SemiAnalysis","111.4K","competitor","International","International",positive,5.106,182,11,3,"https://x.com/SemiAnalysis_/status/2070613297318035897","At HPC Summit Asia this year we enjoyed checking out the new 2u DLC HGX R200 systems on display. (1/3)"
2026-06-26T20:19:55.000Z,"@fabknowledge","Fabricated Knowledge","32.2K","competitor","International","International",positive,1.531,1,,,"https://x.com/fabknowledge/status/2070602983365046704","How much context window? Unsure if it’s 1 tril to be clear"
2026-06-26T17:27:52.000Z,"@SemiAnalysis_","SemiAnalysis","111.4K","competitor","International","International",positive,0.772,5,,1,"https://x.com/SemiAnalysis_/status/2070559682423378110"," Icefish: A cold-water Antarctic fish famous for its pale or clear blood because many species lack hemoglobin. (6/6)"
2026-06-26T17:27:51.000Z,"@SemiAnalysis_","SemiAnalysis","111.4K","competitor","International","International",neutral,0,7,,2,"https://x.com/SemiAnalysis_/status/2070559680745587003"," Pumafish: “Pumafish” is not a widely recognized common fish name, but it could describe a sleek, fast, puma-like fictional fish. (5/6)"
2026-06-26T17:27:51.000Z,"@SemiAnalysis_","SemiAnalysis","111.4K","competitor","International","International",positive,5.106,5,,1,"https://x.com/SemiAnalysis_/status/2070559679508324384"," Triggerfish: A colorful tropical reef fish with strong jaws and a locking dorsal spine that gives it the name “triggerfish.” (4/6)"
2026-06-26T17:27:51.000Z,"@SemiAnalysis_","SemiAnalysis","111.4K","competitor","International","International",neutral,0,7,1,1,"https://x.com/SemiAnalysis_/status/2070559677935493417"," Humufish: The humuhumu or humuhumunukunukuāpuaʻa is Hawaii’s official state fish and is a reef triggerfish in the triggerfish family. (3/6)"
2026-06-26T17:27:50.000Z,"@SemiAnalysis_","SemiAnalysis","111.4K","competitor","International","International",neutral,0,11,,1,"https://x.com/SemiAnalysis_/status/2070559676509393314"," Zebrafish: A small freshwater fish with zebra-like stripes, commonly kept in aquariums and widely used in scientific research. (2/6)"
2026-06-26T17:27:50.000Z,"@SemiAnalysis_","SemiAnalysis","111.4K","competitor","International","International",positive,6.027,50,5,14,"https://x.com/SemiAnalysis_/status/2070559675125301314","SemiAnalysis Fish Study Crash Course  FYI only one of the 6 fishes is fictional! Also Humufish is in the Triggerfish family.   Sunfish: A large, flat-bodied fish, often referring to the ocean sunfish or mola, known for its rounded shape and gentle drifting in warm seas. (1/6)"
2026-06-26T16:40:23.000Z,"@fabknowledge","Fabricated Knowledge","32.2K","competitor","International","International",positive,4.215,12,,1,"https://x.com/fabknowledge/status/2070547735137452124","Think it’s a measurement issue lol of this specific index"
2026-06-26T14:01:32.000Z,"@SemiAnalysis_","SemiAnalysis","111.4K","competitor","International","International",positive,4.336,22,1,1,"https://x.com/SemiAnalysis_/status/2070507759208890494","We see Naura as the key driver: channel checks put it as the largest ICP etch share at CXMT, positioning it to capture more as CXMT expands capacity. Check out our ChipBook for detailed analysis. (3/3)"
2026-06-26T14:01:32.000Z,"@SemiAnalysis_","SemiAnalysis","111.4K","competitor","International","International",neutral,0,31,,4,"https://x.com/SemiAnalysis_/status/2070507757740949664","Global etch incumbents’ financials communicate the same message: AMAT’s China revenue fell 16% YoY in FY25, and TEL’s China revenue dropped 18% YoY in FY26. (2/3)"
2026-06-26T14:01:31.000Z,"@SemiAnalysis_","SemiAnalysis","111.4K","competitor","International","International",neutral,0,270,50,2,"https://x.com/SemiAnalysis_/status/2070507756205813957","We believe China’s etch localization is ramping faster than deposition. Front-end import data shows etch −18% YTD vs deposition +3% YTD. (1/3)"
2026-06-26T12:31:28.000Z,"@antiAIvo","纳米AI","15K","amplifier","China","China",neutral,0,,,1,"https://x.com/antiAIvo/status/2070485092833935835","tx？"
2026-06-26T06:54:35.000Z,"@antiAIvo","纳米AI","15K","amplifier","China","China",positive,5.859,11,1,8,"https://x.com/antiAIvo/status/2070400312033284389","Dongxin Shares turned red against the trend today   Intra-day surge exceeded 10% at one point    It's a design company focused on niche storage   Handles NAND, NOR, and niche DRAM all in one   Few mainland firms can cover all three    The logic behind the rise aligns with"
2026-06-26T03:00:27.000Z,"@SemiAnalysis_","SemiAnalysis","111.4K","competitor","International","International",positive,4.404,287,24,5,"https://x.com/SemiAnalysis_/status/2070341393675866517","The contract market is the one that better reflects where durable AI workloads are actually going and we track this in our GPU pricing index. (5/5)"
2026-06-26T03:00:27.000Z,"@SemiAnalysis_","SemiAnalysis","111.4K","competitor","International","International",positive,2.514,223,18,2,"https://x.com/SemiAnalysis_/status/2070341392711258311","Falling spot prices alongside rising contract prices are therefore not evidence of weaker demand. It is more likely a shift of opportunistic capacity usage toward committed production deployment. Serious buyers are locking in term capacity, and that is pushing contract pricing"
2026-06-26T03:00:27.000Z,"@SemiAnalysis_","SemiAnalysis","111.4K","competitor","International","International",positive,2.382,185,5,1,"https://x.com/SemiAnalysis_/status/2070341391318655022","Spot and on-demand markets are where buyers run POCs, one-off evaluations, burst workloads, and capacity overflow. They can be useful when taken as part of a dataset but are not reflective of where production economics are set. Contract pricing is where sustained workloads show"
2026-06-26T03:00:26.000Z,"@SemiAnalysis_","SemiAnalysis","111.4K","competitor","International","International",positive,2.023,319,21,5,"https://x.com/SemiAnalysis_/status/2070341389032857821","The important signal is that this is likely a spot price index not term pricing. Our neocloud survey for 1-year H100 contract prices have isntead climbed from a trough of roughly $1.70 per hour late last year to about $2.65 per hour today. (2/5)"
2026-06-26T03:00:26.000Z,"@SemiAnalysis_","SemiAnalysis","111.4K","competitor","International","International",negative,-2.732,1.3K,191,51,"https://x.com/SemiAnalysis_/status/2070341387283800179","H100 ornn index spot prices are falling, now at $2.42 per hour, roughly 40% below the May peak. The ecosystem is concerned that this is a sign that compute demand and by extension the appetite for AI is waning. (1/5)"
