timestamp,handle,displayName,followers,accountType,region,country,sentiment,sentimentScore,likes,retweets,replies,tweetUrl,text
2026-07-08T09:12:34.000+08:00,"@bubbleboi","bubble boi","88.2K","amplifier","International","International",negative,-4.215,,,,"https://x.com/bubbleboi/status/2074662895837990918","Sadly not man"
2026-07-08T08:56:01.000+08:00,"@dnystedt","Dan Nystedt","51.5K","amplifier","Taiwan","Taiwan",neutral,0,12,,1,"https://x.com/dnystedt/status/2074658730784997836","Rumor: Delta Electronics and China’s Megmeet have both raised prices of power supply products again due to higher costs of components & materials, media report: -Delta hiking prices 5%-20% -Megmeet hiking 10%-20%  Prices of a range of components, power chips, MOSFETs, copper,"
2026-07-08T08:54:38.000+08:00,"@dnystedt","Dan Nystedt","51.5K","amplifier","Taiwan","Taiwan",negative,-1.027,29,5,7,"https://x.com/dnystedt/status/2074658382599110872","TSMC production of Photonic Integrated Circuits (PIC), the key light chip in co-packaged optics (CPO), is ramping hard. Media reports note monthly capacity is climbing to 10,000 wafers-per-month (wpm) as of Q2, up from 500wpm earlier—boosting annualized PIC output to 78 million"
2026-07-08T08:50:33.000+08:00,"@dnystedt","Dan Nystedt","51.5K","amplifier","Taiwan","Taiwan",neutral,0,,,1,"https://x.com/dnystedt/status/2074657356487749739","Links:  https:// money.udn.com/money/story/11 162/9613542?from=edn_subcatelist_cate …   https:// money.udn.com/money/story/11 162/9613563?from=edn_subcatelist_cate …   https:// ctee.com.tw/news/202607087 00080-430502 …"
2026-07-08T08:50:11.000+08:00,"@dnystedt","Dan Nystedt","51.5K","amplifier","Taiwan","Taiwan",positive,2.023,28,4,3,"https://x.com/dnystedt/status/2074657262321443218","Nvidia Vera Rubin-based servers will enter mass production this quarter at Quanta, and are expected to lift the Taiwan giant’s full-year revenue to triple-digit-growth (100%+) year-on-year, media report, adding Quanta said visibility from top Cloud Service Providers (CSPs)"
2026-07-08T08:39:52.000+08:00,"@jukan05","Jukan @ ICML","155.3K","amplifier","South Korea","South Korea",neutral,0,490,81,49,"https://x.com/jukan05/status/2074654665682407763","APPLE HAS STARTED TESTING CXMT’S DRAM FOR APPLE DEVICES SOLD IN CHINA — FT"
2026-07-08T08:24:23.000+08:00,"@QQ_Timmy","駿HaYaO","28.6K","amplifier","Asia","Asia",positive,3.818,24,,3,"https://x.com/QQ_Timmy/status/2074650772399382978","TSMC 的護城河遠大於 PPA、EUV 或良率。它是圍繞晶圓廠的 EDA/IP 生態系統。  TSMC 的開放創新平台（Open Innovation Platform）已將 Synopsys、Cadence、Arm、Rambus、Alphawave 以及數十家 IP 供應商，轉變成一個預先驗證的 tape-out 網路。而這個護城河是可以量化的。  TSMC 認證的矽智財（Silicon"
2026-07-08T08:23:35.000+08:00,"@QQ_Timmy","駿HaYaO","28.6K","amplifier","Asia","Asia",neutral,0,5,,2,"https://x.com/QQ_Timmy/status/2074650570330386916","#每日導讀 #20260708 #經濟日報  台股開高走低大跌1,077點，失守月線收45,479點 新台幣重貶1.18角收32.143元創一年新低 6月CPI年增2.6%寫17個月新高，連二月踩2%警戒線   完整導讀 →  https:// reurl.cc/QNnzl2"
2026-07-08T08:14:45.000+08:00,"@QQ_Timmy","駿HaYaO","28.6K","amplifier","Asia","Asia",neutral,0,15,,,"https://x.com/QQ_Timmy/status/2074648347852612084","早安！7/8 外電綜合整理  - 3211順達: 美系初評正向 產業趨勢上，美系券商看到BBU滲透率逐年提高：去年為40-45%、今年60-65%，明年超過85%。單機價值也在提升中：在GB300 NVL72為1.5～1.6 萬美元、Rubin 世代提升至 1.7～1.8 萬美元、在Rubin Ultra 則超過3.3萬美元。券商同時觀察順達商業模式是與PSU"
2026-07-08T06:29:14.000+08:00,"@jukan05","Jukan @ ICML","155.3K","amplifier","South Korea","South Korea",neutral,0,10,,4,"https://x.com/jukan05/status/2074621793797857434",""
2026-07-08T06:29:06.000+08:00,"@jukan05","Jukan @ ICML","155.3K","amplifier","South Korea","South Korea",positive,1.779,646,49,51,"https://x.com/jukan05/status/2074621759891132710","The Information: SpaceX and Cursor are set to release their first jointly developed AI model as soon as Wednesday.  “It is expected to be competitive with Anthropic’s Opus 4.8 and OpenAI’s GPT-5.5 in some respects.”"
2026-07-08T05:58:15.000+08:00,"@bubbleboi","bubble boi","88.2K","amplifier","International","International",negative,-3.818,90,1,18,"https://x.com/bubbleboi/status/2074613996578349121","Im losing followers as big boss gains… "
2026-07-08T04:11:05.000+08:00,"@aleabitoreddit","Serenity","881.1K","amplifier","International","International",positive,7.211,67,4,4,"https://x.com/aleabitoreddit/status/2074587024959709419","Basically:  > major Chinese lidar player might be banned in West.  >  $OUST ,  $AEVA , and others benefit by filling in the vacuum  > optical players players that power western lidar players like Aeva also benefit from increased revenue  Not sure if this news really matters given"
2026-07-08T03:49:55.000+08:00,"@aleabitoreddit","Serenity","881.1K","amplifier","International","International",positive,3.4,572,35,168,"https://x.com/aleabitoreddit/status/2074581698604593367","Hesai Technology, a Chinese lidar maker faces US national scrutiny over its expanded partnership with  $NVDA  and lidar sensors.   For  $OUST ,  $AEVA , and Western lidar bros, this is generally positive if competitors get regulated out.  Since there were warnings that:   Sensors could"
2026-07-08T03:42:36.000+08:00,"@bubbleboi","bubble boi","88.2K","amplifier","International","International",negative,-4.898,32,,1,"https://x.com/bubbleboi/status/2074579858416619977","My friends at Marshall Taste killing it !!!"
2026-07-08T03:31:10.000+08:00,"@bubbleboi","bubble boi","88.2K","amplifier","International","International",neutral,0,2,,1,"https://x.com/bubbleboi/status/2074576978624290996","Who is that?"
2026-07-08T03:22:33.000+08:00,"@bubbleboi","bubble boi","88.2K","amplifier","International","International",positive,4.215,17,,,"https://x.com/bubbleboi/status/2074574811574239492","The last thing I would do is post how to take a cheap 7 nm node and beat Nvidia with it lol."
2026-07-08T03:19:14.000+08:00,"@bubbleboi","bubble boi","88.2K","amplifier","International","International",positive,4.404,178,1,11,"https://x.com/bubbleboi/status/2074573976085606772","I hope this isn’t why markets are selling off today…."
2026-07-08T03:17:34.000+08:00,"@bubbleboi","bubble boi","88.2K","amplifier","International","International",neutral,0,167,3,15,"https://x.com/bubbleboi/status/2074573557179596897","Everyone seems to be an index rebalancing expert today"
2026-07-08T03:10:27.000+08:00,"@aleabitoreddit","Serenity","881.1K","amplifier","International","International",neutral,0,85,3,10,"https://x.com/aleabitoreddit/status/2074571766186524811","This is not the first time Bloomberg crashed the markets"
2026-07-08T03:08:13.000+08:00,"@bubbleboi","bubble boi","88.2K","amplifier","International","International",neutral,0,83,1,14,"https://x.com/bubbleboi/status/2074571206607651122","I’m getting “flashbacks”"
2026-07-08T02:56:07.000+08:00,"@aleabitoreddit","Serenity","881.1K","amplifier","International","International",negative,-4.939,1K,109,171,"https://x.com/aleabitoreddit/status/2074568161299771394","Just Bloomberg and  $META  doing damage control after crashing the market with Meta Compute framing:  Spokesperson: ""Meta is still hungry for even more computing power.   It is still moving forward with plans for expensive new data centers and recently inked major computing deals"
2026-07-08T02:00:02.000+08:00,"@aleabitoreddit","Serenity","881.1K","amplifier","International","International",neutral,0,115,,13,"https://x.com/aleabitoreddit/status/2074554046325850160","Europe's too busy figuring out how to regulate air conditioners.  I don't think people considered them in the US/China humanoid race."
2026-07-08T01:52:09.000+08:00,"@aleabitoreddit","Serenity","881.1K","amplifier","International","International",positive,8.762,83,5,5,"https://x.com/aleabitoreddit/status/2074552062382338069","Literally just Elon.   - The guy +  $SPCX  is basically the only reason why US is in the lead with Space. -  $TSLA  led EV commercialization in US  He's sometimes off with timeframes, but right directionally, so pretty sure he can make US robotics #1 again.   I personally own  $CCXI"
2026-07-08T01:46:02.000+08:00,"@aleabitoreddit","Serenity","881.1K","amplifier","International","International",positive,3.818,64,,13,"https://x.com/aleabitoreddit/status/2074550520975679762","Yes? If it weren't, it wouldn't be a national security threat.  Cybersecurity Committee Dpt of. Homeland Security:   ""China's speed of advancement in humanoid robots is alarming, and the US government should formulate coordinated policies and strategies to counter Chinese firms'"
2026-07-08T01:39:23.000+08:00,"@aleabitoreddit","Serenity","881.1K","amplifier","International","International",neutral,0,818,63,186,"https://x.com/aleabitoreddit/status/2074548850996707412","How is the US so far behind?  Xinhua: China's output of humanoids are expected to hit 100,000+ this year.   Even Morgan Stanley originally projected 14,000 for 2026...   Really need Elon's  $TSLA ,  $CCXI  (Agility), Apptronik, and Figure to catchup. And for more US Gov. subsidies to"
2026-07-08T01:12:24.000+08:00,"@bubbleboi","bubble boi","88.2K","amplifier","International","International",negative,-2.96,139,1,4,"https://x.com/bubbleboi/status/2074542060401742117","Dude is hiding one of these"
2026-07-08T01:04:53.000+08:00,"@aleabitoreddit","Serenity","881.1K","amplifier","International","International",neutral,0,120,,9,"https://x.com/aleabitoreddit/status/2074540168674160931","Imagine every single time you post. You have a TA bro posting a chart about:   - b-but my  $IREN  ABC trend says it's going to $125 through the $6B ATM.  - or if something drops, someone quote posts you saying ""Should have listened to my $40 paywalled XYZ charts""  Or if I post a"
2026-07-08T00:54:16.000+08:00,"@bubbleboi","bubble boi","88.2K","amplifier","International","International",negative,-0.772,1,,,"https://x.com/bubbleboi/status/2074537496877387904","I’m sorry "
2026-07-08T00:52:14.000+08:00,"@aleabitoreddit","Serenity","881.1K","amplifier","International","International",positive,5.859,264,14,26,"https://x.com/aleabitoreddit/status/2074536982311743623","wow the mythical golden egg dragon candle was spotted over the $SIVEF chart.   Something big is coming..."
2026-07-08T00:50:42.000+08:00,"@bubbleboi","bubble boi","88.2K","amplifier","International","International",positive,2.96,153,2,3,"https://x.com/bubbleboi/status/2074536596276392369","Yes because index rebalancing is so much harder than curing cancer lmao."
2026-07-08T00:47:06.000+08:00,"@aleabitoreddit","Serenity","881.1K","amplifier","International","International",neutral,0,91,1,4,"https://x.com/aleabitoreddit/status/2074535692361937070","They could just trade on their own swiggly lines and make 10,000,000% returns if it were accurate."
2026-07-08T00:40:10.000+08:00,"@bubbleboi","bubble boi","88.2K","amplifier","International","International",positive,4.767,7,,,"https://x.com/bubbleboi/status/2074533945526595976","The option buyers are the winners now"
2026-07-08T00:39:39.000+08:00,"@bubbleboi","bubble boi","88.2K","amplifier","International","International",positive,5.499,7,,,"https://x.com/bubbleboi/status/2074533816035909920","Lmaoooo I didn’t realize that but that’s hilarious"
2026-07-08T00:38:39.000+08:00,"@aleabitoreddit","Serenity","881.1K","amplifier","International","International",positive,3.818,1.1K,72,205,"https://x.com/aleabitoreddit/status/2074533565505876218","This is the average visual TA bro, takes a 50% 50% coinflip:   If it goes the other way, they say ""ABC Pattern Invalidated"", should have known...   If they get the coinflip right, they promote their $40/month chart.   -> People drawing swiggly lines over KOSPI mean nothing where"
2026-07-08T00:35:18.000+08:00,"@bubbleboi","bubble boi","88.2K","amplifier","International","International",positive,5.267,6,,,"https://x.com/bubbleboi/status/2074532723352555836","Lmao u didn’t need to go this hard"
2026-07-08T00:33:06.000+08:00,"@bubbleboi","bubble boi","88.2K","amplifier","International","International",neutral,0,238,3,5,"https://x.com/bubbleboi/status/2074532170182561929","“We are not a car” he was right they were a fucking donkey."
2026-07-08T00:31:31.000+08:00,"@bubbleboi","bubble boi","88.2K","amplifier","International","International",neutral,0,4,,,"https://x.com/bubbleboi/status/2074531768296944048","What are thooooose"
2026-07-08T00:29:25.000+08:00,"@jukan05","Jukan @ ICML","155.3K","amplifier","South Korea","South Korea",neutral,0,26,,,"https://x.com/jukan05/status/2074531243249807852","potential"
2026-07-08T00:25:13.000+08:00,"@bubbleboi","bubble boi","88.2K","amplifier","International","International",positive,6.369,1,,,"https://x.com/bubbleboi/status/2074530185068847478","I love this song"
2026-07-08T00:24:56.000+08:00,"@jukan05","Jukan @ ICML","155.3K","amplifier","South Korea","South Korea",neutral,0,31,2,3,"https://x.com/jukan05/status/2074530111010025707","verisilicon"
2026-07-08T00:23:19.000+08:00,"@bubbleboi","bubble boi","88.2K","amplifier","International","International",neutral,0,56,2,7,"https://x.com/bubbleboi/status/2074529706318479456","Girls sliding thru my DM asking about  @thru_xyz"
2026-07-08T00:15:20.000+08:00,"@bubbleboi","bubble boi","88.2K","amplifier","International","International",positive,3.182,102,4,3,"https://x.com/bubbleboi/status/2074527695942320471","EE version of writing Harry Potter fan fic"
2026-07-08T00:12:31.000+08:00,"@bubbleboi","bubble boi","88.2K","amplifier","International","International",neutral,0,22,,2,"https://x.com/bubbleboi/status/2074526989625831823","Always hedge"
2026-07-08T00:05:12.000+08:00,"@aleabitoreddit","Serenity","881.1K","amplifier","International","International",positive,5.267,150,9,7,"https://x.com/aleabitoreddit/status/2074525146736738396","This might be news to you, but swiggly lines on a chart is not fundamentals.  And has nothing to do with operating income growth that Samsung/Sk Hynix make"
2026-07-08T00:04:05.000+08:00,"@bubbleboi","bubble boi","88.2K","amplifier","International","International",neutral,0,65,2,8,"https://x.com/bubbleboi/status/2074524864367743420","I’m the flash messiah"
2026-07-08T10:06:56.000+08:00,"@sssjeffpu","Jeff Pu","33.7K","amplifier","Asia","Asia",positive,6.003,6,,,"https://x.com/sssjeffpu/status/2074676577552765388","Abstract of TSMC (2330 TT) Earnings Preview   Solid AI-Driven Outlook, Slightly Positive Near Term  Earnings Preview  •2Q26 Revenue: +11% QoQ (vs guidance midpoint ~10%) •2Q26 GM: ~68% (vs guidance 65.5-67.5%, BBG 67%, Market Chatter 69-70%) •3Q26 Revenue: +13% QoQ (vs"
2026-07-08T10:01:42.000+08:00,"@HyperTechInvest","Daniel Romero","41.1K","amplifier","United States","United States",positive,6.249,4,1,5,"https://x.com/HyperTechInvest/status/2074675259962216684","Morgan Stanley sees a $600 bull case for  $SPCX , implying an $8T market cap  The bank’s analyst said this could be achieved by “balancing SpaceX’s unique ability to capture the expanding space and AI opportunity against material execution, funding, and technology risk.”  The bank"
2026-07-08T09:55:08.000+08:00,"@HyperTechInvest","Daniel Romero","41.1K","amplifier","United States","United States",negative,-4.019,8,,12,"https://x.com/HyperTechInvest/status/2074673607377031608","$SPCX  analyst price targets are a bit shocking  Morgan Stanley’s target implies a $4T market cap"
2026-07-08T08:28:24.000+08:00,"@LinQingV","Macro_Lin ｜ 市场观察员","51.6K","amplifier","China","China",neutral,0,,,,"https://x.com/LinQingV/status/2074651781687353437","这个时候归因可以找很多原因。叙事上来说今年更多是Agentic AI 下token需求驱动"
2026-07-08T04:59:38.000+08:00,"@HyperTechInvest","Daniel Romero","41.1K","amplifier","United States","United States",positive,5.106,39,7,23,"https://x.com/HyperTechInvest/status/2074599243247968310","$FCEL  is diluting shareholders by 13% to raise $200M  Just one month after saying, “We are comfortable with our current balance sheet.”"
2026-07-08T04:42:13.000+08:00,"@HyperTechInvest","Daniel Romero","41.1K","amplifier","United States","United States",positive,2.5,149,8,15,"https://x.com/HyperTechInvest/status/2074594862112927856","Morgan Stanley:  “We remain bullish long term, based on earnings growth of over 35–40% in 2027 and the ramp of agentic AI. However, in the near term, we are expecting some share price weakness ahead of earnings reporting.  Our stock preferences are where the money is being spent"
2026-07-08T04:41:44.000+08:00,"@damnang2","Damnang2","35.4K","amplifier","United States","United States",positive,6.24,23,6,1,"https://x.com/damnang2/status/2074594739148718322","If you are curious about what PCIe and CXL are, and how they could impact the memory market going forward, I highly recommend reading this article."
2026-07-08T04:04:26.000+08:00,"@HyperTechInvest","Daniel Romero","41.1K","amplifier","United States","United States",positive,3.4,43,2,19,"https://x.com/HyperTechInvest/status/2074585352212447641","$WULF  is now below where it was before signing the new Anthropic deal  The main reasons:  1) Overall neocloud weakness lately  2) The sale of its Abernathy stake  This deal had some of the best economics across WULF’s portfolio. The market is probably concerned about how WULF was"
2026-07-08T00:06:58.000+08:00,"@zephyr_z9","Zephyr","156.4K","amplifier","South Korea","South Korea",positive,2.373,4,,1,"https://x.com/zephyr_z9/status/2074525592926744692","There is no 4 die version now only 2 dies per gpu package  so 4 GPUs are 8 dies total"
2026-07-08T09:00:36.000+08:00,"@SemiAnalysis_","SemiAnalysis","111.4K","competitor","International","International",positive,6.597,36,2,6,"https://x.com/SemiAnalysis_/status/2074659884398739889","""you should subscribe to your tokenomics model so you can read bangers like this""  Tokenomics Subscribers got access to SemiAnalysis’ latest Hyperscaler and AI Lab Estimates today. Long story short, AI spend continues to accelerate and hyperscalers are benefitting. Contact"
2026-07-08T05:00:43.000+08:00,"@SemiAnalysis_","SemiAnalysis","111.4K","competitor","International","International",positive,5.859,141,10,6,"https://x.com/SemiAnalysis_/status/2074599515256918065","Shoutout to the NVIDIA, SGLang, and RadixArk folks for their amazing performance, delivering up to 3.7x faster interactivity than B300."
2026-07-08T01:01:53.000+08:00,"@SemiAnalysis_","SemiAnalysis","111.4K","competitor","International","International",neutral,0,10,,,"https://x.com/SemiAnalysis_/status/2074539412763902026","We discussed this and more in our EDA Market Primer recently. (8/8)"
2026-07-08T01:01:53.000+08:00,"@SemiAnalysis_","SemiAnalysis","111.4K","competitor","International","International",neutral,0,15,,2,"https://x.com/SemiAnalysis_/status/2074539411862122781","Samsung and Intel are not only chasing TSMC’s process roadmap. They are chasing the TSMC-EDA/IP feedback loop. (7/8)"
2026-07-08T01:01:53.000+08:00,"@SemiAnalysis_","SemiAnalysis","111.4K","competitor","International","International",neutral,0,12,,1,"https://x.com/SemiAnalysis_/status/2074539410754798000","And it works both ways. Foundries use EDA/IP ecosystems to deepen platform lock-in. EDA companies use foundry qualification to get a front-row seat with designers, then pull through tools, verification, and implementation software later in the design cycle. (6/8)"
2026-07-08T01:01:53.000+08:00,"@SemiAnalysis_","SemiAnalysis","111.4K","competitor","International","International",positive,2.023,13,,1,"https://x.com/SemiAnalysis_/status/2074539409790173346","Customers do not switch foundries just because a competitor claims better PPA. They switch only if the whole design risk stack moves with them. That is the foundry moat. (5/8)"
2026-07-08T01:01:52.000+08:00,"@SemiAnalysis_","SemiAnalysis","111.4K","competitor","International","International",negative,-6.249,13,1,2,"https://x.com/SemiAnalysis_/status/2074539408737398843","Every additional pre-qualified SerDes, HBM, PCIe, UCIe, memory, and chiplet interface block lowers tape-out risk at TSMC and raises the cost of moving a flagship ASIC to Samsung Foundry or Intel Foundry. (4/8)"
2026-07-08T01:01:52.000+08:00,"@SemiAnalysis_","SemiAnalysis","111.4K","competitor","International","International",positive,3.818,10,,1,"https://x.com/SemiAnalysis_/status/2074539407877489031","TSMC’s certified Silicon IP library grew from 3K items in 2010 to 93K in 2025. 31x growth. (3/8)"
2026-07-08T01:01:52.000+08:00,"@SemiAnalysis_","SemiAnalysis","111.4K","competitor","International","International",positive,3.818,16,,1,"https://x.com/SemiAnalysis_/status/2074539406766027025","TSMC’s Open Innovation Platform has turned Synopsys, Cadence, Arm, Rambus, Alphawave, and dozens of IP vendors into a pre-validated tape-out network. And that moat is measurable. (2/8)"
2026-07-08T01:01:51.000+08:00,"@SemiAnalysis_","SemiAnalysis","111.4K","competitor","International","International",positive,4.588,211,24,7,"https://x.com/SemiAnalysis_/status/2074539404454994333","TSMC’s moat is bigger than PPA, EUV, or yield. It is the EDA/IP ecosystem wrapped around the fab. (1/8)"
2026-07-08T09:43:02.000+08:00,"@semivision_tw","SemiVision  ","11.7K","competitor","Taiwan","Taiwan",positive,3.818,2,2,,"https://x.com/semivision_tw/status/2074670564287873155","As SerDes and optical links move from board edges into chip cores, Marvell stands among the few full-stack providers capable of integrating electrical, optical, packaging, and software domains. Marvell’s IP leadership and co-design capabilities position it at the forefront of"
2026-07-08T09:08:16.000+08:00,"@pequityresearch","P Equity Research ","8,899","amplifier","International","International",positive,2.714,2,,,"https://x.com/pequityresearch/status/2074661814021824669","haha  no cartoons!"
2026-07-08T08:56:18.000+08:00,"@dmjk001","快讯","24.6K","amplifier","China","China",neutral,0,4,1,1,"https://x.com/dmjk001/status/2074658801274515954","英国金融时报：知情人士透露， 苹果已开始测试长鑫存储用于在中国销售设备的 Dram 芯片 这家 iPhone 制造商正牵头在美国科技公司中开展游说活动 ，以促使美国政府允许更广泛地使用该公司的产品。"
2026-07-08T08:55:52.000+08:00,"@pequityresearch","P Equity Research ","8,899","amplifier","International","International",positive,4.019,3,,1,"https://x.com/pequityresearch/status/2074658691647770742","SHMD huh? Interesting..."
2026-07-08T08:49:52.000+08:00,"@pequityresearch","P Equity Research ","8,899","amplifier","International","International",positive,4.215,21,4,,"https://x.com/pequityresearch/status/2074657184638533951","FT: Apple interest thrusts China’s CXMT into memory chip spotlight  > Apple has begun testing the company’s DRAM chips for devices sold in China, according to two people familiar with the matter, as the iPhone maker leads a lobbying effort among US tech companies to get the US"
2026-07-08T08:43:02.000+08:00,"@pequityresearch","P Equity Research ","8,899","amplifier","International","International",positive,3.182,1,,1,"https://x.com/pequityresearch/status/2074655462922862824","huge"
2026-07-08T08:28:28.000+08:00,"@dmjk001","快讯","24.6K","amplifier","China","China",neutral,0,7,1,,"https://x.com/dmjk001/status/2074651799915786751","苹果已开始测试长鑫存储（CXMT）的内存芯片，用于在中国销售的设备。"
2026-07-08T08:25:31.000+08:00,"@dmjk001","快讯","24.6K","amplifier","China","China",neutral,0,3,,,"https://x.com/dmjk001/status/2074651056106254798","根据美国联邦通信委员会（FCC）官网的信披文件显示，SpaceX公司已在本周正式申请FCC批准其发射并运营一个由10万颗卫星组成的第三代（Gen3）卫星星座。第三代星座将由10万颗卫星组成，部署在两组薄层、紧密堆叠的运行轨道壳层中，标称高度分别位于323至327.5公里之间，以及473至477.5公里之间。当部署规"
2026-07-08T08:12:51.000+08:00,"@pequityresearch","P Equity Research ","8,899","amplifier","International","International",neutral,0,,,,"https://x.com/pequityresearch/status/2074647869835837638","correct, he spoke on it in this podcast"
2026-07-08T07:48:41.000+08:00,"@pequityresearch","P Equity Research ","8,899","amplifier","International","International",positive,1.779,55,16,4,"https://x.com/pequityresearch/status/2074641785767276748","Jefferies: AI Crescendo  > Massive Spending Forecasts: The four major US hyperscalers (Alphabet, Amazon, Meta, and Microsoft) are expected to spend roughly US$700bn in capex this year and over US$800bn next year.  > Macro Impact: If you include Oracle, Anthropic, OpenAI, and"
2026-07-08T07:32:33.000+08:00,"@pequityresearch","P Equity Research ","8,899","amplifier","International","International",positive,2.96,1,,,"https://x.com/pequityresearch/status/2074637726972866870","yeah..."
2026-07-08T07:25:50.000+08:00,"@pequityresearch","P Equity Research ","8,899","amplifier","International","International",positive,2.732,2,,,"https://x.com/pequityresearch/status/2074636034109780141","well..."
2026-07-08T07:25:37.000+08:00,"@pequityresearch","P Equity Research ","8,899","amplifier","International","International",positive,4.926,2,,,"https://x.com/pequityresearch/status/2074635982473724336","thanks!"
2026-07-08T07:24:51.000+08:00,"@dmjk001","快讯","24.6K","amplifier","China","China",neutral,0,1,,,"https://x.com/dmjk001/status/2074635788944642279","彭博市场综述"
