timestamp,handle,displayName,followers,accountType,region,country,sentiment,sentimentScore,likes,retweets,replies,tweetUrl,text
2026-07-14T00:01:57.000+08:00,"@bubbleboi","bubble boi","88.2K","amplifier","International","International",neutral,0,13,,,"https://x.com/bubbleboi/status/2076698658280771680","Let’s fucking do it"
2026-07-14T01:07:57.000+08:00,"@damnang2","Damnang","35.4K","amplifier","United States","United States",positive,4.019,,,,"https://x.com/damnang2/status/2076715265568743621","If there is AYAR, yes it will be"
2026-07-14T00:41:24.000+08:00,"@damnang2","Damnang","35.4K","amplifier","United States","United States",positive,7.906,11,,,"https://x.com/damnang2/status/2076708584143102364","Great insight thanks "
2026-07-14T00:32:42.000+08:00,"@damnang2","Damnang","35.4K","amplifier","United States","United States",neutral,0,1,,1,"https://x.com/damnang2/status/2076706395093901332","That’s another article topic I’m preparing"
2026-07-14T00:21:36.000+08:00,"@HyperTechInvest","Daniel Romero","41.1K","amplifier","United States","United States",positive,6.597,15,4,32,"https://x.com/HyperTechInvest/status/2076703602014351682","$IREN  sees Spain as the data center capital of Europe:  → Excess energy capacity  → 90% fiber penetration, compared with just 20% in Germany  → 35 submarine cable landing points, providing strong global connectivity  → Abundant land and water availability"
2026-07-14T00:03:50.000+08:00,"@damnang2","Damnang","35.4K","amplifier","United States","United States",neutral,0,13,1,2,"https://x.com/damnang2/status/2076699128588054732","In this article, I take a deeper look at custom memory.  I explain what CIM, PIM, and PNM are, why these custom memory concepts are drawing renewed attention today, and what we are currently hearing from across the industry.  In the final section, I use my own analytical model to"
2026-07-14T00:00:28.000+08:00,"@damnang2","Damnang","35.4K","amplifier","United States","United States",neutral,0,13,2,1,"https://x.com/damnang2/status/2076698284719219108",""
2026-07-14T01:01:39.000+08:00,"@SemiAnalysis_","SemiAnalysis","111.4K","competitor","International","International",positive,7.574,111,8,6,"https://x.com/SemiAnalysis_/status/2076713679341379760","Great work by NVIDIA on vLLM performance! AMD still has a lot of catching up to do on certain models for vLLM."
2026-07-14T00:12:04.000+08:00,"@SemiAnalysis_","SemiAnalysis","111.4K","competitor","International","International",positive,3.612,135,7,8,"https://x.com/SemiAnalysis_/status/2076701204063613030","I feel a great disturbance in Korean margin accounts"
2026-07-14T02:01:29.000+08:00,"@qinbafrank","qinbafrank","145.9K","amplifier","International","International",neutral,0,6,,4,"https://x.com/qinbafrank/status/2076728737991913542","美银这个报告里的情景推演，最大的意义就是梳理了未来潜在风险，不一定都会发生，但可以做到心中有数。"
2026-07-14T01:56:53.000+08:00,"@pequityresearch","P Equity Research ","8,899","amplifier","International","International",positive,5.859,,,,"https://x.com/pequityresearch/status/2076727578535031072","amazing "
2026-07-14T01:56:11.000+08:00,"@pequityresearch","P Equity Research ","8,899","amplifier","International","International",neutral,0,,,,"https://x.com/pequityresearch/status/2076727404941201450",""
2026-07-14T01:25:31.000+08:00,"@pequityresearch","P Equity Research ","8,899","amplifier","International","International",positive,0.772,1,,2,"https://x.com/pequityresearch/status/2076719688294261172","do you want proof its from today?"
2026-07-14T01:24:45.000+08:00,"@pequityresearch","P Equity Research ","8,899","amplifier","International","International",neutral,0,27,2,2,"https://x.com/pequityresearch/status/2076719495373066753","Morgan Stanley: CapEx  Major AI Infrastructure & Capex Surges  > $1.4 Trillion Capex Forecast: Morgan Stanley has raised its total hyperscaler capex forecast to $1.4 trillion by 2028 (up from ~$1.2 trillion in 2027), driven by an updated bottom-up cost model and rising forward"
2026-07-14T00:53:26.000+08:00,"@pequityresearch","P Equity Research ","8,899","amplifier","International","International",neutral,0,,,,"https://x.com/pequityresearch/status/2076711614040916346","is it? i have not verified"
2026-07-14T00:47:07.000+08:00,"@pequityresearch","P Equity Research ","8,899","amplifier","International","International",neutral,0,44,4,4,"https://x.com/pequityresearch/status/2076710023485407719","Here is some information on the gamblers in Korea:  ""Korea Financial Supervisory Service: As of July 13, the cumulative total of over 1.2 million leveraged retail accounts across the Korean market triggered margin calls, with approximately 320,000–360,000 accounts fully forcibly"
2026-07-14T00:39:21.000+08:00,"@pequityresearch","P Equity Research ","8,899","amplifier","International","International",negative,-4.023,,,,"https://x.com/pequityresearch/status/2076708068729962590","Margins will be ok, not strong. It is obvious that copper will be trending higher until 2028."
2026-07-14T00:25:32.000+08:00,"@pequityresearch","P Equity Research ","8,899","amplifier","International","International",positive,7.269,18,,1,"https://x.com/pequityresearch/status/2076704590343332297","Great poll. For reference, my picks were:  power semis, networking/interconnect, and advanced packaging equipment."
2026-07-14T00:07:24.000+08:00,"@pequityresearch","P Equity Research ","8,899","amplifier","International","International",negative,-0.516,2,,,"https://x.com/pequityresearch/status/2076700025845944420","losing share but still #1"
2026-07-14T00:04:40.000+08:00,"@pequityresearch","P Equity Research ","8,899","amplifier","International","International",neutral,0,25,,,"https://x.com/pequityresearch/status/2076699340014243920","today"
2026-07-14T00:02:21.000+08:00,"@insane_analyst","Irrational Analysis","40.8K","amplifier","International","International",positive,4.215,4,,,"https://x.com/insane_analyst/status/2076698757488619571","LOL"
2026-07-14T02:26:28.000+08:00,"@wallstengine","Wall St Engine","159.1K","amplifier","International","International",positive,5.423,,,,"https://x.com/wallstengine/status/2076735026348372178","moving the data efficiently is just as important"
2026-07-14T02:24:16.000+08:00,"@wallstengine","Wall St Engine","159.1K","amplifier","International","International",neutral,0,6,1,4,"https://x.com/wallstengine/status/2076734470254891302","US TO ENFORCE BLOCKADE OF IRANIAN PORTS FROM JULY 14, 4PM ET"
2026-07-14T02:01:07.000+08:00,"@wallstengine","Wall St Engine","159.1K","amplifier","International","International",negative,-4.019,22,2,8,"https://x.com/wallstengine/status/2076728645205574021","U.S. JUNE BUDGET DEFICIT AT $120.31B VS -$129.0B ESTIMATE"
2026-07-14T01:33:25.000+08:00,"@wallstengine","Wall St Engine","159.1K","amplifier","International","International",neutral,0,27,2,7,"https://x.com/wallstengine/status/2076721673538265315","Sunrun  $RUN  is piloting a program to turn rooftop solar and battery systems into distributed AI compute capacity, per Bloomberg.  Customers could host a small filing-cabinet-sized computer and earn “a couple hundred dollars to more than that” per month, CEO Mary Powell said."
2026-07-14T01:15:18.000+08:00,"@wallstengine","Wall St Engine","159.1K","amplifier","International","International",neutral,0,25,3,8,"https://x.com/wallstengine/status/2076717113360912710","FED WALLER: IT'S GOING TO TAKE US ANOTHER DECADE TO GET RID OF MBS"
2026-07-14T01:13:12.000+08:00,"@wallstengine","Wall St Engine","159.1K","amplifier","International","International",neutral,0,35,2,6,"https://x.com/wallstengine/status/2076716586405368029","FED WALLER:   I WOULD RELEASE THE DOTS A DAY AFTER THE MEETING; WOULD GET RID OF THE CALENDAR BASED DOT PLOT"
2026-07-14T01:11:21.000+08:00,"@wallstengine","Wall St Engine","159.1K","amplifier","International","International",neutral,0,6,,4,"https://x.com/wallstengine/status/2076716120674034027","WALLER: I WOULDN'T GO BEYOND 18 MONTHS"
2026-07-14T01:11:04.000+08:00,"@wallstengine","Wall St Engine","159.1K","amplifier","International","International",negative,-2.263,31,2,7,"https://x.com/wallstengine/status/2076716048959816036","FED WALLER: I HAVE BEEN A SKEPTIC OF THE DOTS FOR A LONG TIME, WOULD CHANGE THEM IN SOME KEY WAYS"
2026-07-14T01:05:15.000+08:00,"@wallstengine","Wall St Engine","159.1K","amplifier","International","International",positive,6.705,37,5,8,"https://x.com/wallstengine/status/2076714585458147575","Fed’s Waller comments:  On jobs: “We’ve gotten persistently better and stronger job reports.”  On AI: “AI may be affecting financial conditions.” He added that if AI were to “pop or pull back,” the Fed would see “pretty big changes in financial conditions.”  On reserves: “I see"
2026-07-14T00:52:10.000+08:00,"@wallstengine","Wall St Engine","159.1K","amplifier","International","International",negative,-1.28,29,4,6,"https://x.com/wallstengine/status/2076711293818675589","Volkswagen CEO Oliver Blume reportedly told staff that a 20% cost gap with rivals could require 50,000 additional job cuts worldwide, on top of 50,000 cuts already agreed in Germany through 2030.   VW said it is assessing options across all brands."
2026-07-14T00:39:15.000+08:00,"@wallstengine","Wall St Engine","159.1K","amplifier","International","International",positive,2.96,44,6,17,"https://x.com/wallstengine/status/2076708044193570878","SK Hynix $SKHY is already down about 11% from its highs since the U.S. listing began trading.  Tomorrow, options and the Leverage Shares ETFs are expected to begin trading:  $SKHX: 2x long $SKHZ: 1x short  More volatility coming?"
2026-07-14T00:27:46.000+08:00,"@wallstengine","Wall St Engine","159.1K","amplifier","International","International",neutral,0,44,7,8,"https://x.com/wallstengine/status/2076705153936494875","US10Y > 4.606%"
2026-07-14T00:15:38.000+08:00,"@wallstengine","Wall St Engine","159.1K","amplifier","International","International",negative,-7.096,42,5,11,"https://x.com/wallstengine/status/2076702099732410619","California and 11 other states are suing to block Paramount Skydance’s  $PSKY  proposed $110B acquisition of Warner Bros. Discovery.  The lawsuit says the deal would reduce competition in film distribution and basic cable licensing.  The combined company would control about 27% of"
2026-07-14T00:13:48.000+08:00,"@oguzerkan","Oguz Erkan","121.2K","amplifier","United States","United States",positive,4.588,87,6,40,"https://x.com/oguzerkan/status/2076701639109386243","Forward P/E ratios and growth estimates for Mag7 excluding  $TSLA .  Market is pricing some cyclicality for  $NVDA , which is understandable.   $META  and  $MSFT , however, make no sense at 20x forward earnings given their sizes, moats, and growth.  They’ll re-rate, especially  $MSFT ."
2026-07-14T12:26:17.000+08:00,"@dnystedt","Dan Nystedt","51.5K","amplifier","Taiwan","Taiwan",negative,-1.531,,,,"https://x.com/dnystedt/status/2076885973540245837","Nobody builds fabs faster than Taiwan's experienced engineering and construction companies. There's simply no choice right now. TSMC Arizona continues to build, but Taiwan is irreplaceable at the moment."
2026-07-14T12:25:09.000+08:00,"@jukan05","Jukan","155.3K","amplifier","South Korea","South Korea",neutral,0,6,,,"https://x.com/jukan05/status/2076885690726654408",""
2026-07-14T12:25:09.000+08:00,"@jukan05","Jukan","155.3K","amplifier","South Korea","South Korea",positive,4.588,64,8,12,"https://x.com/jukan05/status/2076885688600195183","SK hynix Accelerates Construction of Yongin “Y1” Fab, Begins Equipment Orders  SK hynix has begun full-scale preparations for the construction of its new memory production base in Yongin. The company is understood to have recently started placing orders with key suppliers for"
2026-07-14T11:57:35.000+08:00,"@bubbleboi","bubble boi","88.2K","amplifier","International","International",positive,4.404,1,,1,"https://x.com/bubbleboi/status/2076878750831271965","When you reach the top of your field, they’ll stop caring"
2026-07-14T11:29:37.000+08:00,"@jukan05","Jukan","155.3K","amplifier","South Korea","South Korea",neutral,0,8,,,"https://x.com/jukan05/status/2076871711459541168",""
2026-07-14T11:29:36.000+08:00,"@jukan05","Jukan","155.3K","amplifier","South Korea","South Korea",positive,5.33,212,26,42,"https://x.com/jukan05/status/2076871708984877077","FT: China’s domestic computing capacity is still insufficient to meet the country’s rapidly growing demand.  FT: Some Chinese technology companies are lobbying Beijing to allow sales of Nvidia’s H200 chips, but approval has not yet been granted, and the likelihood of large-scale"
2026-07-14T10:12:33.000+08:00,"@bubbleboi","bubble boi","88.2K","amplifier","International","International",neutral,0,4,,,"https://x.com/bubbleboi/status/2076852318432293082","Ofc boss"
2026-07-14T09:52:20.000+08:00,"@jukan05","Jukan","155.3K","amplifier","South Korea","South Korea",positive,8.885,385,37,58,"https://x.com/jukan05/status/2076847232801026508","Mirae Asset Securities Korea: SK hynix’s 2Q26 operating profit estimate cut by 12%  DRAM and NAND ASP assumptions were revised down by 8ppt and 5ppt, respectively. Mirae Asset estimates that around 50% of the company’s revenue is covered by long-term supply agreements (LTAs).  -"
2026-07-14T09:51:24.000+08:00,"@aleabitoreddit","Serenity","881.1K","amplifier","International","International",negative,-5.168,767,73,78,"https://x.com/aleabitoreddit/status/2076846994614792663","So Jensen himself went out to do damage control with  $NVDA  delays reports apparently:  1. Jensen Huang said no delays:   - 800V and rack-to-rack optical interconnects is progressing fully in line with the original plan with no material delay.   - Debunked the rumor that the"
2026-07-14T09:05:13.000+08:00,"@jukan05","Jukan","155.3K","amplifier","South Korea","South Korea",neutral,0,2,,1,"https://x.com/jukan05/status/2076835374341747187","I know, right? ㅠㅠ"
2026-07-14T08:53:37.000+08:00,"@dnystedt","Dan Nystedt","51.5K","amplifier","Taiwan","Taiwan",neutral,0,1,2,1,"https://x.com/dnystedt/status/2076832453512376497","Lite-On:  https:// liteon.com/zh-tw/news/pre ss-center/content/liteon-mckinney-investment …  English:  https:// liteon.com/en/news/press- center/content/liteon-mckinney-investment …"
2026-07-14T08:53:22.000+08:00,"@dnystedt","Dan Nystedt","51.5K","amplifier","Taiwan","Taiwan",neutral,0,27,5,1,"https://x.com/dnystedt/status/2076832389733748780","Taiwan’s Lite-On Technology will invest US$919 million in McKinney, Texas for a new manufacturing site, media report, noting it already operates a plant in Plano, Texas for Battery Backup Units (BBU) used in AI servers. Lite-On’s 2026 capex is expected to rise from NT$13 billion"
2026-07-14T08:51:53.000+08:00,"@dnystedt","Dan Nystedt","51.5K","amplifier","Taiwan","Taiwan",negative,-1.28,37,6,1,"https://x.com/dnystedt/status/2076832018130960877","MediaTek has lowered its full year smartphone shipment outlook again, media report, citing unnamed supply chain sources, who also said the amount of wafers TSMC can allocate MediaTek this year will be the key to its ASIC business.  $AVGO   $QCOM  #GUC #Alchip"
2026-07-14T08:51:08.000+08:00,"@dnystedt","Dan Nystedt","51.5K","amplifier","Taiwan","Taiwan",negative,-0.772,37,6,1,"https://x.com/dnystedt/status/2076831829873795507","Prices of silicon carbide wafers (SiC) are warming up as demand picks up for power semiconductors used in AI data centers and 800V DC electric vehicles, media report, noting distributors say any client asking for additional SiC wafers must pay a premium due to tight supplies."
2026-07-14T08:48:43.000+08:00,"@jukan05","Jukan","155.3K","amplifier","South Korea","South Korea",neutral,0,23,,1,"https://x.com/jukan05/status/2076831221565591752",""
2026-07-14T08:48:42.000+08:00,"@jukan05","Jukan","155.3K","amplifier","South Korea","South Korea",negative,-0.516,659,41,59,"https://x.com/jukan05/status/2076831218973426025","Jensen Huang is absolutely ruthless. He doesn’t leave even the slightest opening. (according to The Information)"
2026-07-14T08:17:36.000+08:00,"@QQ_Timmy","駿HaYaO","28.6K","amplifier","Asia","Asia",neutral,0,21,,,"https://x.com/QQ_Timmy/status/2076823388665036937","市場資本存在一個有趣的盲點：許多人曾認為 PTFE 相關設計會完全淘汰玻璃纖維布。然而現實情況是，我們看到越來越多新一代設計反而回歸到以織物為主的解決方案。  目前，高層數 AI 架構的致勝策略是「共存方案」：將 Q-glass 搭配 CH 樹脂 Prepregs（PP）一起使用。"
2026-07-14T08:16:18.000+08:00,"@QQ_Timmy","駿HaYaO","28.6K","amplifier","Asia","Asia",neutral,0,22,2,,"https://x.com/QQ_Timmy/status/2076823063061234111","早安！7/14 外電綜合整理  - 8046 南電：亞系升目標 亞系券商認為載板是記憶體後漲幅第二大的零組件，在目前的成本環境下，預估今年BT／ABF 載板價格漲幅將超過 70%／50%，且漲價趨勢仍持續擴大。尤其BT在主要亞洲競爭對手逐步退出後，對於像南電這樣願意深耕 BT 市場的載板廠形成重大利多。券商預期BT"
2026-07-14T07:59:57.000+08:00,"@jukan05","Jukan","155.3K","amplifier","South Korea","South Korea",positive,4.215,21,,2,"https://x.com/jukan05/status/2076818948742611104","Mitsubishi UFJ takes the No. 1 spot in market cap lol"
2026-07-14T07:17:46.000+08:00,"@aleabitoreddit","Serenity","881.1K","amplifier","International","International",neutral,0.498,569,34,105,"https://x.com/aleabitoreddit/status/2076808331453415674","TLDR of Innolight investor relations takeaways:  1. ""Overall, 1.6T market demand has not contracted; instead, 800G demand has increased significantly compared with previous expectations""  Prob most important takeaway as a whole was 800G demand revision (also longer tail demand)."
2026-07-14T07:06:54.000+08:00,"@bubbleboi","bubble boi","88.2K","amplifier","International","International",neutral,0,53,,6,"https://x.com/bubbleboi/status/2076805598604353564","BB x BB"
2026-07-14T06:58:50.000+08:00,"@jukan05","Jukan","155.3K","amplifier","South Korea","South Korea",neutral,0,277,10,34,"https://x.com/jukan05/status/2076803568175325554",""
2026-07-14T06:55:28.000+08:00,"@jukan05","Jukan","155.3K","amplifier","South Korea","South Korea",positive,4.404,751,47,79,"https://x.com/jukan05/status/2076802721529901362","I’m going all-in on leverage as soon as the market opens. Thanks,  @rwang07 ."
2026-07-14T04:33:55.000+08:00,"@aleabitoreddit","Serenity","881.1K","amplifier","International","International",positive,3.4,149,2,7,"https://x.com/aleabitoreddit/status/2076767097674514474","10 years from now, the flying spaghetti monster will descend from the heavens and bless every  $INTC  holder with a meatball.  Can someone prove me wrong?"
2026-07-14T04:18:58.000+08:00,"@aleabitoreddit","Serenity","881.1K","amplifier","International","International",positive,8.674,132,9,15,"https://x.com/aleabitoreddit/status/2076763334930812936","$AAOI  mainly gets revenue from pluggable, they’re developing/sampling related lasers but have no CPO design wins.  Others like  $MTSI  look like they fell off the map for some reason with cpo lasers.  CEO says “TBD” with commercial timing and it’s in reliability work right now. And"
2026-07-14T03:20:46.000+08:00,"@aleabitoreddit","Serenity","881.1K","amplifier","International","International",neutral,0,1.7K,158,285,"https://x.com/aleabitoreddit/status/2076748688559587338","Morgan Stanley note on CPO today. Key participants include:  - $SIVE,  $COHR , and  $LITE  in laser supply - Broadcom and Nvidia in switch platforms - Lightmatter, Ayar Labs, Marvell/Celestial, and POET in optical engines and photonics,  -  $TSM ,  $GFS , and  $TSEM  in silicon photonics"
2026-07-14T11:54:08.000+08:00,"@LinQingV","Macro_Lin｜市场观察","51.6K","amplifier","China","China",neutral,0,6,,,"https://x.com/LinQingV/status/2076877881721164218","你可以把我拉黑了。"
2026-07-14T11:30:31.000+08:00,"@LinQingV","Macro_Lin｜市场观察","51.6K","amplifier","China","China",neutral,0,47,5,11,"https://x.com/LinQingV/status/2076871938488905873","NEVER EVER USE LEVERAGE。如果在今后的人生里，谁跟你说可以用下杠杆，你直接拉黑他。从我在推上发内容起，一直跟大家讲的事情就是不要加杠杆，慢就快。投资如此，人生亦如此。"
2026-07-14T11:18:04.000+08:00,"@damnang2","Damnang","35.4K","amplifier","United States","United States",negative,-2.96,20,3,1,"https://x.com/damnang2/status/2076868807977771253","Memory is undeniably a cyclical business. Even so, I have often said, somewhat provocatively, that “memory is no longer the same cyclical business it once was.”    In the traditional commodity memory business, increases in production capacity were transmitted almost directly into"
2026-07-14T10:13:48.000+08:00,"@zephyr_z9","Zephyr","156.4K","amplifier","South Korea","South Korea",negative,-1.28,154,10,17,"https://x.com/zephyr_z9/status/2076852632166257107","My biggest takeaway: HBM demand determines the duration of the memory boom If it goes down then it's all over"
2026-07-14T09:41:20.000+08:00,"@zephyr_z9","Zephyr","156.4K","amplifier","South Korea","South Korea",positive,3.612,493,11,34,"https://x.com/zephyr_z9/status/2076844460894515548","Korean brothers ready to go all in"
2026-07-14T08:51:21.000+08:00,"@HyperTechInvest","Daniel Romero","41.1K","amplifier","United States","United States",positive,4.404,1,,,"https://x.com/HyperTechInvest/status/2076831885955874962","I’ll read it. Thanks"
2026-07-14T08:29:15.000+08:00,"@HyperTechInvest","Daniel Romero","41.1K","amplifier","United States","United States",neutral,0,2,1,1,"https://x.com/HyperTechInvest/status/2076826320445616141",""
2026-07-14T08:28:58.000+08:00,"@HyperTechInvest","Daniel Romero","41.1K","amplifier","United States","United States",neutral,0,1,,,"https://x.com/HyperTechInvest/status/2076826249817657632","2 days ago"
2026-07-14T08:28:20.000+08:00,"@HyperTechInvest","Daniel Romero","41.1K","amplifier","United States","United States",positive,5.267,,,1,"https://x.com/HyperTechInvest/status/2076826092548002276","If you have a post to share, just share it. You're not adding much here"
2026-07-14T08:26:27.000+08:00,"@HyperTechInvest","Daniel Romero","41.1K","amplifier","United States","United States",positive,5.865,2,,1,"https://x.com/HyperTechInvest/status/2076825615810867498","It’s not my report or his. I said “may,” and I’m just sharing what other analysts are saying  It’s also a bit rich to say “you’re both very wrong” without sharing anything to back that up"
2026-07-14T08:24:29.000+08:00,"@HyperTechInvest","Daniel Romero","41.1K","amplifier","United States","United States",positive,6.908,12,3,25,"https://x.com/HyperTechInvest/status/2076825124833989001","$TSM  released June revenue  > Monthly revenue reached a record NT$442.7 billion, up 6.2% MoM and 67.9% YoY  > First-half revenue reached NT$2.4 trillion, up 35.6% YoY  > Sequential growth accelerated throughout Q2  Analysts expect H2 2026 to outperform H1, supported by Nvidia"
2026-07-14T08:16:23.000+08:00,"@HyperTechInvest","Daniel Romero","41.1K","amplifier","United States","United States",negative,-5.106,19,1,26,"https://x.com/HyperTechInvest/status/2076823085949325312","What could drive memory prices lower?  Some industry insiders believe it's a change in product specifications  “Wu Jinrong, general manager of MicroDrive Technology, warned that supply-and-demand distortions leading end customers to adjust product specifications are more likely"
2026-07-14T07:39:18.000+08:00,"@HyperTechInvest","Daniel Romero","41.1K","amplifier","United States","United States",positive,4.019,53,9,31,"https://x.com/HyperTechInvest/status/2076813753882910984","Interesting  The market may be greatly overestimating how much new memory supply is coming  “Recent supply chain reports suggest that SK Hynix’s actual new memory production capacity in 2028 may be only one-sixth of the amount initially planned.”"
2026-07-14T04:06:23.000+08:00,"@zephyr_z9","Zephyr","156.4K","amplifier","South Korea","South Korea",positive,3.612,58,,13,"https://x.com/zephyr_z9/status/2076760171825824179","Looks like AMEC delivered its first 90:1 cryo etch tool"
2026-07-14T03:55:23.000+08:00,"@HyperTechInvest","Daniel Romero","41.1K","amplifier","United States","United States",negative,-4.404,,,,"https://x.com/HyperTechInvest/status/2076757401748041905","Doesn’t happen** bloody autocorrect"
2026-07-14T02:52:52.000+08:00,"@zephyr_z9","Zephyr","156.4K","amplifier","South Korea","South Korea",neutral,0,6,,,"https://x.com/zephyr_z9/status/2076741669270204738","DM"
2026-07-14T01:56:31.000+08:00,"@damnang2","Damnang","35.4K","amplifier","United States","United States",neutral,0,55,4,4,"https://x.com/damnang2/status/2076727489385394397","Anthropic could become AMD’s largest AI customer.  If that happens, it would be a major milestone for AMD’s AI business."
2026-07-14T10:19:08.000+08:00,"@SemiAnalysis_","SemiAnalysis","111.4K","competitor","International","International",neutral,0,245,10,21,"https://x.com/SemiAnalysis_/status/2076853976876597495","State of AI Models"
2026-07-14T09:00:28.000+08:00,"@SemiAnalysis_","SemiAnalysis","111.4K","competitor","International","International",negative,-1.68,115,4,11,"https://x.com/SemiAnalysis_/status/2076834176909590577","When will Muse Spark be open-sourced? Is Zuck trying to pull a fast one and stop open-sourcing models altogether?"
